    1  2011-04-07 19:44:19.518440 IP6 fe80::68d3:1235:d068:1f9e.6697 > ff02::1:6.6697: babel 2 (8) hello
    2  2011-04-07 19:44:30.528850 IP6 fe80::3428:af91:251:d626.6697 > ff02::1:6.6697: babel 2 (8) hello
    3  2011-04-07 19:44:34.648170 IP6 fe80::68d3:1235:d068:1f9e.6697 > ff02::1:6.6697: babel 2 (110) update/prefix/id nh update update/prefix/id update update
    4  2011-04-07 19:44:39.419154 IP6 fe80::68d3:1235:d068:1f9e.6697 > ff02::1:6.6697: babel 2 (24) hello ihu
    5  2011-04-07 19:44:51.916853 IP6 fe80::3428:af91:251:d626.6697 > ff02::1:6.6697: babel 2 (8) hello
    6  2011-04-07 19:45:00.318823 IP6 fe80::68d3:1235:d068:1f9e.6697 > ff02::1:6.6697: babel 2 (8) hello
    7  2011-04-07 19:45:11.864852 IP6 fe80::3428:af91:251:d626.6697 > ff02::1:6.6697: babel 2 (24) hello ihu
    8  2011-04-07 19:45:16.008864 IP6 fe80::68d3:1235:d068:1f9e.6697 > ff02::1:6.6697: babel 2 (8) hello
    9  2011-04-07 19:45:27.868910 IP6 fe80::3428:af91:251:d626.6697 > ff02::1:6.6697: babel 2 (8) hello
   10  2011-04-07 19:45:31.077442 IP6 fe80::68d3:1235:d068:1f9e.6697 > ff02::1:6.6697: babel 2 (52) update/prefix/id update/prefix update/prefix
   11  2011-04-07 19:45:31.088831 IP6 fe80::3428:af91:251:d626.6697 > ff02::1:6.6697: babel 2 (32) seqno-request
   12  2011-04-07 19:45:31.268214 IP6 fe80::68d3:1235:d068:1f9e.5359 > ff02::cca6:c0f9:e182:5359.5359: AHCP Version 1
   13  2011-04-07 19:45:32.068699 IP6 fe80::68d3:1235:d068:1f9e.5359 > ff02::cca6:c0f9:e182:5359.5359: AHCP Version 1
   14  2011-04-07 19:45:32.636373 IP6 fe80::3428:af91:251:d626.5359 > fe80::68d3:1235:d068:1f9e.5359: AHCP Version 1
   15  2011-04-07 19:45:32.638108 IP6 fe80::68d3:1235:d068:1f9e.5359 > ff02::cca6:c0f9:e182:5359.5359: AHCP Version 1
   16  2011-04-07 19:45:32.655976 IP6 fe80::3428:af91:251:d626.5359 > ff02::cca6:c0f9:e182:5359.5359: AHCP Version 1
   17  2011-04-07 19:45:33.066768 IP6 fe80::68d3:1235:d068:1f9e.6697 > ff02::1:6.6697: babel 2 (28) update/prefix/id
   18  2011-04-07 19:45:33.204835 IP6 fe80::3428:af91:251:d626.6697 > ff02::1:6.6697: babel 2 (32) seqno-request
   19  2011-04-07 19:45:34.024965 IP6 fe80::3428:af91:251:d626.5359 > fe80::68d3:1235:d068:1f9e.5359: AHCP Version 1
   20  2011-04-07 19:45:34.028257 IP6 fe80::68d3:1235:d068:1f9e.5359 > ff02::cca6:c0f9:e182:5359.5359: AHCP Version 1
   21  2011-04-07 19:45:34.726727 IP6 fe80::68d3:1235:d068:1f9e.6697 > ff02::1:6.6697: babel 2 (24) hello ihu
   22  2011-04-07 19:45:35.096873 IP6 fe80::68d3:1235:d068:1f9e.6697 > ff02::1:6.6697: babel 2 (28) update/prefix/id
   23  2011-04-07 19:45:35.192868 IP6 fe80::3428:af91:251:d626.6697 > ff02::1:6.6697: babel 2 (32) seqno-request
   24  2011-04-07 19:45:35.388520 IP6 fe80::3428:af91:251:d626.5359 > fe80::68d3:1235:d068:1f9e.5359: AHCP Version 1
   25  2011-04-07 19:45:35.537445 IP6 fe80::68d3:1235:d068:1f9e > ff02::16: HBH ICMP6, multicast listener report v2, 2 group record(s), length 48
