    1  2019-04-26 15:32:49.715242 IP 161.1.12.1.60409 > 161.1.12.12.3784: BFDv1, Control, State Up, Flags: [none], length: 24
    2  2019-04-26 15:32:49.725449 IP 101.0.0.12.51993 > 101.0.0.1.4784: BFDv1, Multihop, State Up, Flags: [none], length: 24
    3  2019-04-26 15:32:49.771212 IP 101.0.0.1.62545 > 101.0.0.12.4784: BFDv1, Multihop, State Up, Flags: [none], length: 24
    4  2019-04-26 15:32:49.963242 IP 161.1.12.1.60409 > 161.1.12.12.3784: BFDv1, Control, State Up, Flags: [none], length: 24
    5  2019-04-26 15:32:50.077458 IP 101.0.0.12.51993 > 101.0.0.1.4784: BFDv1, Multihop, State Up, Flags: [none], length: 24
    6  2019-04-26 15:32:50.123245 IP 101.0.0.1.62545 > 101.0.0.12.4784: BFDv1, Multihop, State Up, Flags: [none], length: 24
    7  2019-04-26 15:32:50.251236 IP 161.1.12.1.60409 > 161.1.12.12.3784: BFDv1, Control, State Up, Flags: [none], length: 24
    8  2019-04-26 15:32:50.429453 IP 101.0.0.12.51993 > 101.0.0.1.4784: BFDv1, Multihop, State Up, Flags: [none], length: 24
    9  2019-04-26 15:32:50.443240 IP 101.0.0.1.62545 > 101.0.0.12.4784: BFDv1, Multihop, State Up, Flags: [none], length: 24
   10  2019-04-26 15:32:50.495231 IP 161.1.12.1.60409 > 161.1.12.12.3784: BFDv1, Control, State Up, Flags: [none], length: 24
   11  2019-04-26 15:32:50.763252 IP 161.1.12.1.60409 > 161.1.12.12.3784: BFDv1, Control, State Up, Flags: [none], length: 24
   12  2019-04-26 15:32:50.781440 IP 101.0.0.12.51993 > 101.0.0.1.4784: BFDv1, Multihop, State Up, Flags: [none], length: 24
   13  2019-04-26 15:32:50.795209 IP 101.0.0.1.62545 > 101.0.0.12.4784: BFDv1, Multihop, State Up, Flags: [none], length: 24
   14  2019-04-26 15:32:51.055254 IP 161.1.12.1.60409 > 161.1.12.12.3784: BFDv1, Control, State Up, Flags: [none], length: 24
   15  2019-04-26 15:32:51.169437 IP 101.0.0.12.51993 > 101.0.0.1.4784: BFDv1, Multihop, State Up, Flags: [none], length: 24
   16  2019-04-26 15:32:51.179235 IP 101.0.0.1.62545 > 101.0.0.12.4784: BFDv1, Multihop, State Up, Flags: [none], length: 24
   17  2019-04-26 15:32:51.263249 IP 161.1.12.1.60409 > 161.1.12.12.3784: BFDv1, Control, State Up, Flags: [none], length: 24
   18  2019-04-26 15:32:51.517455 IP 101.0.0.12.51993 > 101.0.0.1.4784: BFDv1, Multihop, State Up, Flags: [none], length: 24
   19  2019-04-26 15:32:51.531253 IP 101.0.0.1.62545 > 101.0.0.12.4784: BFDv1, Multihop, State Up, Flags: [none], length: 24
   20  2019-04-26 15:32:51.563242 IP 161.1.12.1.60409 > 161.1.12.12.3784: BFDv1, Control, State Up, Flags: [none], length: 24
   21  2019-04-26 15:32:51.815238 IP 161.1.12.1.60409 > 161.1.12.12.3784: BFDv1, Control, State Up, Flags: [none], length: 24
   22  2019-04-26 15:32:51.851228 IP 101.0.0.1.62545 > 101.0.0.12.4784: BFDv1, Multihop, State Up, Flags: [none], length: 24
   23  2019-04-26 15:32:51.901437 IP 101.0.0.12.51993 > 101.0.0.1.4784: BFDv1, Multihop, State Up, Flags: [none], length: 24
   24  2019-04-26 15:32:52.055249 IP 161.1.12.1.60409 > 161.1.12.12.3784: BFDv1, Control, State Up, Flags: [none], length: 24
   25  2019-04-26 15:32:52.171267 IP 101.0.0.1.62545 > 101.0.0.12.4784: BFDv1, Multihop, State Up, Flags: [none], length: 24
   26  2019-04-26 15:32:52.221449 IP 101.0.0.12.51993 > 101.0.0.1.4784: BFDv1, Multihop, State Up, Flags: [none], length: 24
   27  2019-04-26 15:32:52.363241 IP 161.1.12.1.60409 > 161.1.12.12.3784: BFDv1, Control, State Up, Flags: [none], length: 24
   28  2019-04-26 15:32:52.523246 IP 101.0.0.1.62545 > 101.0.0.12.4784: BFDv1, Multihop, State Up, Flags: [none], length: 24
   29  2019-04-26 15:32:52.541447 IP 101.0.0.12.51993 > 101.0.0.1.4784: BFDv1, Multihop, State Up, Flags: [none], length: 24
   30  2019-04-26 15:32:52.623226 IP 161.1.12.1.60409 > 161.1.12.12.3784: BFDv1, Control, State Up, Flags: [none], length: 24
   31  2019-04-26 15:32:52.893448 IP 101.0.0.12.51993 > 101.0.0.1.4784: BFDv1, Multihop, State Up, Flags: [none], length: 24
   32  2019-04-26 15:32:52.907208 IP 101.0.0.1.62545 > 101.0.0.12.4784: BFDv1, Multihop, State Up, Flags: [none], length: 24
   33  2019-04-26 15:32:52.939217 IP 161.1.12.1.60409 > 161.1.12.12.3784: BFDv1, Control, State Up, Flags: [none], length: 24
   34  2019-04-26 15:32:53.175261 IP 161.1.12.1.60409 > 161.1.12.12.3784: BFDv1, Control, State Up, Flags: [none], length: 24
   35  2019-04-26 15:32:53.245445 IP 101.0.0.12.51993 > 101.0.0.1.4784: BFDv1, Multihop, State Up, Flags: [none], length: 24
   36  2019-04-26 15:32:53.259218 IP 101.0.0.1.62545 > 101.0.0.12.4784: BFDv1, Multihop, State Up, Flags: [none], length: 24
   37  2019-04-26 15:32:53.455241 IP 161.1.12.1.60409 > 161.1.12.12.3784: BFDv1, Control, State Up, Flags: [none], length: 24
   38  2019-04-26 15:32:53.565443 IP 101.0.0.12.51993 > 101.0.0.1.4784: BFDv1, Multihop, State Up, Flags: [none], length: 24
   39  2019-04-26 15:32:53.611260 IP 101.0.0.1.62545 > 101.0.0.12.4784: BFDv1, Multihop, State Up, Flags: [none], length: 24
   40  2019-04-26 15:32:53.739250 IP 161.1.12.1.60409 > 161.1.12.12.3784: BFDv1, Control, State Up, Flags: [none], length: 24
