    1  2019-04-26 17:19:29.162992 IP 10.0.0.2.51255 > 10.0.0.1.6784: BFDv1, Lag, State Down, Flags: [Poll], length: 24
    2  2019-04-26 17:19:30.154937 IP 10.0.0.2.51255 > 10.0.0.1.6784: BFDv1, Lag, State Down, Flags: [Poll], length: 24
    3  2019-04-26 17:19:31.146839 IP 10.0.0.2.51255 > 10.0.0.1.6784: BFDv1, Lag, State Down, Flags: [Poll], length: 24
    4  2019-04-26 17:19:32.074819 IP 10.0.0.2.51255 > 10.0.0.1.6784: BFDv1, Lag, State Down, Flags: [Poll], length: 24
    5  2019-04-26 17:19:32.842739 IP 10.0.0.2.51255 > 10.0.0.1.6784: BFDv1, Lag, State Down, Flags: [Poll], length: 24
