    1  1970-01-06 15:54:23.344158 IP 192.85.1.2.1024 > 192.0.0.1.3784: BFDv1, Control, State Down, Flags: [Authentication Present], length: 33
    2  1970-01-06 15:54:23.544158 IP 192.85.1.2.1024 > 192.0.0.1.3784: BFDv1, Control, State Down, Flags: [Authentication Present], length: 33
    3  1970-01-06 15:54:23.744158 IP 192.85.1.2.1024 > 192.0.0.1.3784: BFDv1, Control, State Down, Flags: [Authentication Present], length: 33
    4  1970-01-06 15:54:23.944158 IP 192.85.1.2.1024 > 192.0.0.1.3784: BFDv1, Control, State Down, Flags: [Authentication Present], length: 33
    5  1970-01-06 15:54:24.144158 IP 192.85.1.2.1024 > 192.0.0.1.3784: BFDv1, Control, State Down, Flags: [Authentication Present], length: 33
    6  1970-01-06 15:54:24.344158 IP 192.85.1.2.1024 > 192.0.0.1.3784: BFDv1, Control, State Down, Flags: [Authentication Present], length: 33
    7  1970-01-06 15:54:24.544158 IP 192.85.1.2.1024 > 192.0.0.1.3784: BFDv1, Control, State Down, Flags: [Authentication Present], length: 33
    8  1970-01-06 15:54:24.744158 IP 192.85.1.2.1024 > 192.0.0.1.3784: BFDv1, Control, State Down, Flags: [Authentication Present], length: 33
    9  1970-01-06 15:54:24.944158 IP 192.85.1.2.1024 > 192.0.0.1.3784: BFDv1, Control, State Down, Flags: [Authentication Present], length: 33
   10  1970-01-06 15:54:25.144158 IP 192.85.1.2.1024 > 192.0.0.1.3784: BFDv1, Control, State Down, Flags: [Authentication Present], length: 33
   11  1970-01-06 15:54:25.344158 IP 192.85.1.2.1024 > 192.0.0.1.3784: BFDv1, Control, State Down, Flags: [Authentication Present], length: 33
   12  1970-01-06 15:54:25.544158 IP 192.85.1.2.1024 > 192.0.0.1.3784: BFDv1, Control, State Down, Flags: [Authentication Present], length: 33
   13  1970-01-06 15:54:25.744158 IP 192.85.1.2.1024 > 192.0.0.1.3784: BFDv1, Control, State Down, Flags: [Authentication Present], length: 33
   14  1970-01-06 15:54:25.944158 IP 192.85.1.2.1024 > 192.0.0.1.3784: BFDv1, Control, State Down, Flags: [Authentication Present], length: 33
   15  1970-01-06 15:54:26.144158 IP 192.85.1.2.1024 > 192.0.0.1.3784: BFDv1, Control, State Down, Flags: [Authentication Present], length: 33
