    1  07:44:00.997462 IP 192.85.1.2.1024 > 192.0.0.1.3784: BFDv1, Control, State Down, Flags: [Authentication Present], length: 48
    2  07:44:01.197462 IP 192.85.1.2.1024 > 192.0.0.1.3784: BFDv1, Control, State Down, Flags: [Authentication Present], length: 48
    3  07:44:01.397462 IP 192.85.1.2.1024 > 192.0.0.1.3784: BFDv1, Control, State Down, Flags: [Authentication Present], length: 48
    4  07:44:01.597462 IP 192.85.1.2.1024 > 192.0.0.1.3784: BFDv1, Control, State Down, Flags: [Authentication Present], length: 48
    5  07:44:01.797462 IP 192.85.1.2.1024 > 192.0.0.1.3784: BFDv1, Control, State Down, Flags: [Authentication Present], length: 48
    6  07:44:01.997462 IP 192.85.1.2.1024 > 192.0.0.1.3784: BFDv1, Control, State Down, Flags: [Authentication Present], length: 48
    7  07:44:02.197462 IP 192.85.1.2.1024 > 192.0.0.1.3784: BFDv1, Control, State Down, Flags: [Authentication Present], length: 48
    8  07:44:02.397462 IP 192.85.1.2.1024 > 192.0.0.1.3784: BFDv1, Control, State Down, Flags: [Authentication Present], length: 48
    9  07:44:02.597462 IP 192.85.1.2.1024 > 192.0.0.1.3784: BFDv1, Control, State Down, Flags: [Authentication Present], length: 48
   10  07:44:02.797462 IP 192.85.1.2.1024 > 192.0.0.1.3784: BFDv1, Control, State Down, Flags: [Authentication Present], length: 48
   11  07:44:02.997462 IP 192.85.1.2.1024 > 192.0.0.1.3784: BFDv1, Control, State Down, Flags: [Authentication Present], length: 48
   12  07:44:03.197462 IP 192.85.1.2.1024 > 192.0.0.1.3784: BFDv1, Control, State Down, Flags: [Authentication Present], length: 48
   13  07:44:03.397462 IP 192.85.1.2.1024 > 192.0.0.1.3784: BFDv1, Control, State Down, Flags: [Authentication Present], length: 48
   14  07:44:03.597462 IP 192.85.1.2.1024 > 192.0.0.1.3784: BFDv1, Control, State Down, Flags: [Authentication Present], length: 48
   15  07:44:03.797462 IP 192.85.1.2.1024 > 192.0.0.1.3784: BFDv1, Control, State Down, Flags: [Authentication Present], length: 48
   16  07:44:03.997462 IP 192.85.1.2.1024 > 192.0.0.1.3784: BFDv1, Control, State Down, Flags: [Authentication Present], length: 48
   17  07:44:04.197462 IP 192.85.1.2.1024 > 192.0.0.1.3784: BFDv1, Control, State Down, Flags: [Authentication Present], length: 48
   18  07:44:04.397462 IP 192.85.1.2.1024 > 192.0.0.1.3784: BFDv1, Control, State Down, Flags: [Authentication Present], length: 48
   19  07:44:04.597462 IP 192.85.1.2.1024 > 192.0.0.1.3784: BFDv1, Control, State Down, Flags: [Authentication Present], length: 48
   20  07:44:04.797462 IP 192.85.1.2.1024 > 192.0.0.1.3784: BFDv1, Control, State Down, Flags: [Authentication Present], length: 48
   21  07:44:04.997462 IP 192.85.1.2.1024 > 192.0.0.1.3784: BFDv1, Control, State Down, Flags: [Authentication Present], length: 48
   22  07:44:05.197462 IP 192.85.1.2.1024 > 192.0.0.1.3784: BFDv1, Control, State Down, Flags: [Authentication Present], length: 48
   23  07:44:05.397462 IP 192.85.1.2.1024 > 192.0.0.1.3784: BFDv1, Control, State Down, Flags: [Authentication Present], length: 48
   24  07:44:05.597462 IP 192.85.1.2.1024 > 192.0.0.1.3784: BFDv1, Control, State Down, Flags: [Authentication Present], length: 48
   25  07:44:05.797462 IP 192.85.1.2.1024 > 192.0.0.1.3784: BFDv1, Control, State Down, Flags: [Authentication Present], length: 48
   26  07:44:05.997462 IP 192.85.1.2.1024 > 192.0.0.1.3784: BFDv1, Control, State Down, Flags: [Authentication Present], length: 48
   27  07:44:06.197462 IP 192.85.1.2.1024 > 192.0.0.1.3784: BFDv1, Control, State Down, Flags: [Authentication Present], length: 48
   28  07:44:06.397462 IP 192.85.1.2.1024 > 192.0.0.1.3784: BFDv1, Control, State Down, Flags: [Authentication Present], length: 48
   29  07:44:06.597462 IP 192.85.1.2.1024 > 192.0.0.1.3784: BFDv1, Control, State Down, Flags: [Authentication Present], length: 48
   30  07:44:06.797462 IP 192.85.1.2.1024 > 192.0.0.1.3784: BFDv1, Control, State Down, Flags: [Authentication Present], length: 48
   31  07:44:06.997462 IP 192.85.1.2.1024 > 192.0.0.1.3784: BFDv1, Control, State Down, Flags: [Authentication Present], length: 48
