    1  2005-04-27 18:09:40.809286 IP (tos 0x0, ttl 128, id 1467, offset 0, flags [DF], proto TCP (6), length 74)
    196.59.48.65.14214 > 192.168.1.1.179: Flags [P.], cksum 0xbec1 (correct), seq 2470159403:2470159437, ack 160570221, win 8192, length 34: BGP
	Update Message (2), length: 19 [|bgp]
    2  2005-04-27 18:09:40.866491 IP (tos 0x0, ttl 64, id 39449, offset 0, flags [DF], proto TCP (6), length 74)
    235.101.90.12.60082 > 192.168.1.1.179: Flags [P.], cksum 0x742d (correct), seq 1978178:1978212, ack 2473062416, win 4096, length 34: BGP
	Update Message (2), length: 19 [|bgp]
    3  2005-04-27 18:09:40.926459 IP (tos 0x0, ttl 128, id 43331, offset 0, flags [DF], proto TCP (6), length 74)
    179.110.109.87.40936 > 192.168.1.1.179: Flags [P.], cksum 0xd82d (correct), seq 3014673177:3014673211, ack 1498443316, win 4096, length 34: BGP
	Update Message (2), length: 19 [|bgp]
    4  2005-04-27 18:09:40.986430 IP (tos 0x0, ttl 64, id 51082, offset 0, flags [DF], proto TCP (6), length 74)
    114.227.144.98.32757 > 192.168.1.1.179: Flags [P.], cksum 0xb456 (correct), seq 1117364848:1117364882, ack 3778435416, win 4096, length 34: BGP
	Update Message (2), length: 19 [|bgp]
    5  2005-04-27 18:09:41.046387 IP (tos 0x0, ttl 64, id 51082, offset 0, flags [DF], proto TCP (6), length 74)
    114.227.144.98.32757 > 192.168.1.1.179: Flags [P.], cksum 0xb456 (correct), seq 0:34, ack 1, win 4096, length 34: BGP
	Update Message (2), length: 19 [|bgp]
