    1  09:21:03.720289 IP 192.168.1.11.33779 > 209.87.249.18.53: Flags [S], seq 603899916, win 64240, options [mss 1460,sackOK,TS val 2044906138 ecr 0,nop,wscale 7], length 0
    2  09:21:03.846908 IP 209.87.249.18.53 > 192.168.1.11.33779: Flags [S.], seq 2043824403, ack 603899917, win 64240, options [mss 1460], length 0
    3  09:21:03.847060 IP 192.168.1.11.33779 > 209.87.249.18.53: Flags [.], ack 1, win 64240, length 0
    4  09:21:03.847323 IP 192.168.1.11.33779 > 209.87.249.18.53: Flags [P.], seq 1:59, ack 1, win 64240, length 58 17177+ [1au] A? www.tcpdump.org. (56)
    5  09:21:03.847457 IP 209.87.249.18.53 > 192.168.1.11.33779: Flags [.], ack 59, win 64240, length 0
    6  09:21:03.973180 IP 209.87.249.18.53 > 192.168.1.11.33779: Flags [P.], seq 1:227, ack 59, win 64240, length 226 17177*- 2/2/5 A 192.139.46.66, A 198.199.88.104 (224)
    7  09:21:03.973220 IP 192.168.1.11.33779 > 209.87.249.18.53: Flags [.], ack 227, win 64014, length 0
    8  09:21:03.974844 IP 192.168.1.11.33779 > 209.87.249.18.53: Flags [F.], seq 59, ack 227, win 64014, length 0
    9  09:21:03.975246 IP 209.87.249.18.53 > 192.168.1.11.33779: Flags [.], ack 60, win 64239, length 0
   10  09:21:04.101184 IP 209.87.249.18.53 > 192.168.1.11.33779: Flags [FP.], seq 227, ack 60, win 64239, length 0
   11  09:21:04.101256 IP 192.168.1.11.33779 > 209.87.249.18.53: Flags [.], ack 228, win 64014, length 0
