    1  20:58:40.639715 IP 192.0.0.1.46225 > 192.0.0.2.53: 13784+ A? example.com. (29)
    2  20:58:40.661836 IP 192.0.0.2.53 > 192.0.0.1.46225: 13784*- 1/0/0 A 93.184.216.34 (45)
    3  20:58:41.671700 IP 192.0.0.1.46225 > 192.0.0.2.53: 47424+ [1au] A? example.com. (40)
    4  20:58:41.693577 IP 192.0.0.2.53 > 192.0.0.1.46225: 47424*- 2/0/1 A 93.184.216.34, RRSIG (227)
    5  20:58:42.703534 IP 192.0.0.1.46225 > 192.0.0.2.53: 41739+ [1au] A? example.com. (51)
    6  20:58:42.725559 IP 192.0.0.2.53 > 192.0.0.1.46225: 41739*- 1/0/1 A 93.184.216.34 (67)
    7  20:58:43.734693 IP 192.0.0.1.46225 > 192.0.0.2.53: 18065+ [1au] A? example.com. (52)
    8  20:58:43.756707 IP 192.0.0.2.53 > 192.0.0.1.46225: 18065*- 1/0/1 A 93.184.216.34 (68)
    9  20:58:44.766528 IP 192.0.0.1.46225 > 192.0.0.2.53: 34237+ [1au] A? example.com. (61)
   10  20:58:44.788502 IP 192.0.0.2.53 > 192.0.0.1.46225: 34237*- 1/0/1 A 93.184.216.34 (77)
   11  20:58:45.797638 IP 192.0.0.1.46225 > 192.0.0.2.53: 30225+ [1au] A? example.com. (52)
   12  20:58:45.819504 IP 192.0.0.2.53 > 192.0.0.1.46225: 30225*- 1/0/1 A 93.184.216.34 (84)
   13  20:58:46.829454 IP 192.0.0.1.46225 > 192.0.0.2.53: 52688+ [1au] A? example.com. (46)
   14  20:58:46.851441 IP 192.0.0.2.53 > 192.0.0.1.46225: 52688*- 2/0/1 A 93.184.216.34, RRSIG (227)
   15  20:58:47.860858 IP 192.0.0.1.46225 > 192.0.0.2.53: 57808+ [1au] A? example.com. (55)
   16  20:58:47.882669 IP 192.0.0.2.53 > 192.0.0.1.46225: 57808*- 2/0/1 A 93.184.216.34, RRSIG (227)
   17  20:58:48.892587 IP 192.0.0.1.46225 > 192.0.0.2.53: 33054+ [1au] A? example.com. (61)
   18  20:58:48.914406 IP 192.0.0.2.53 > 192.0.0.1.46225: 33054*- 2/0/1 A 93.184.216.34, RRSIG (227)
   19  20:58:49.924625 IP 192.0.0.1.46225 > 192.0.0.2.53: 14353+ [1au] A? example.com. (46)
   20  20:58:49.946523 IP 192.0.0.2.53 > 192.0.0.1.46225: 14353*- 1/0/1 A 93.184.216.34 (56)
   21  20:58:50.956601 IP 192.0.0.1.46225 > 192.0.0.2.53: 17010+ [1au] A? example.com. (46)
   22  20:58:50.978366 IP 192.0.0.2.53 > 192.0.0.1.46225: 17010*- 2/0/1 A 93.184.216.34, RRSIG (227)
   23  20:58:51.988387 IP 192.0.0.1.46225 > 192.0.0.2.53: 3894+ [1au] A? example.com. (48)
   24  20:58:52.010258 IP 192.0.0.2.53 > 192.0.0.1.46225: 3894*- 2/0/1 A 93.184.216.34, RRSIG (227)
   25  20:58:53.015716 IP 192.0.0.1.46225 > 192.0.0.2.53: 8476+ [1au] A? example.com. (44)
   26  20:58:53.037529 IP 192.0.0.2.53 > 192.0.0.1.46225: 8476*- 1/0/1 A 93.184.216.34 (56)
   27  20:58:54.047412 IP 192.0.0.1.46225 > 192.0.0.2.53: 3966+ [1au] A? example.com. (48)
   28  20:58:54.069358 IP 192.0.0.2.53 > 192.0.0.1.46225: 3966*- 1/0/1 A 93.184.216.34 (56)
   29  20:58:55.078435 IP 192.0.0.1.46225 > 192.0.0.2.53: 26580+ [1au] A? example.com. (44)
   30  20:58:55.100224 IP 192.0.0.2.53 > 192.0.0.1.46225: 26580*- 1/0/1 A 93.184.216.34 (56)
   31  20:58:56.110237 IP 192.0.0.1.46225 > 192.0.0.2.53: 2190+ [1au] A? example.com. (54)
   32  20:58:56.132070 IP 192.0.0.2.53 > 192.0.0.1.46225: 2190*- 1/0/1 A 93.184.216.34 (56)
   33  20:58:57.142215 IP 192.0.0.1.46225 > 192.0.0.2.53: 16386+ [1au] A? example.com. (48)
   34  20:58:57.164050 IP 192.0.0.2.53 > 192.0.0.1.46225: 16386*- 1/0/1 A 93.184.216.34 (56)
   35  20:58:58.174193 IP 192.0.0.1.46225 > 192.0.0.2.53: 6373+ [1au] A? example.com. (50)
   36  20:58:58.195911 IP 192.0.0.2.53 > 192.0.0.1.46225: 6373*- 1/0/1 A 93.184.216.34 (56)
   37  20:58:59.206181 IP 192.0.0.1.46225 > 192.0.0.2.53: 29267+ [1au] A? example.com. (80)
   38  20:58:59.228465 IP 192.0.0.2.53 > 192.0.0.1.46225: 29267*- 1/0/1 A 93.184.216.34 (84)
   39  20:59:00.238274 IP 192.0.0.1.46225 > 192.0.0.2.53: 59326+ [1au] A? example.com. (62)
   40  20:59:00.260209 IP 192.0.0.2.53 > 192.0.0.1.46225: 59326*- 1/0/1 A 93.184.216.34 (94)
   41  20:59:01.269390 IP 192.0.0.1.46225 > 192.0.0.2.53: 17122+ [1au] A? example.com. (72)
   42  20:59:01.291167 IP 192.0.0.2.53 > 192.0.0.1.46225: 17122*- 2/0/1 A 93.184.216.34, RRSIG (227)
