    1  2011-03-03 12:23:04.260400 IP 150.140.254.202.57077 > 211.129.72.8.6704: sctp[ForCES HP] (1) [DATA] (B)(E) [TSN: 1048037094] [SID: 0] [SSEQ 1] [PPID 0x0] 
	ForCES Query Response 
    2  2011-03-03 12:23:04.726175 IP 211.129.72.8.6706 > 150.140.254.202.48316: sctp[ForCES LP] (1) [DATA] (B)(E) [TSN: 18398476] [SID: 0] [SSEQ 0] [PPID 0x0] 
	ForCES HeartBeat 
    3  2011-03-03 12:23:04.726228 IP 150.140.254.202.48316 > 211.129.72.8.6706: sctp[ForCES LP] (1) [SACK] [cum ack 18398476] [a_rwnd 57320] [#gap acks 0] [#dup tsns 0] 
    4  2011-03-03 12:23:04.728649 IP 211.129.72.8.6704 > 150.140.254.202.57077: sctp[ForCES HP] (1) [DATA] (B)(E) [TSN: 167996938] [SID: 0] [SSEQ 2] [PPID 0x0] 
	ForCES Query 
    5  2011-03-03 12:23:04.733639 IP 211.129.72.8.6704 > 150.140.254.202.57077: sctp[ForCES HP] (1) [DATA] (B)(E) [TSN: 167996939] [SID: 0] [SSEQ 3] [PPID 0x0] 
	ForCES Config 
    6  2011-03-03 12:23:04.733672 IP 150.140.254.202.57077 > 211.129.72.8.6704: sctp[ForCES HP] (1) [SACK] [cum ack 167996939] [a_rwnd 57228] [#gap acks 0] [#dup tsns 0] 
    7  2011-03-03 12:23:04.734755 IP 211.129.72.8.6704 > 150.140.254.202.57077: sctp[ForCES HP] (1) [DATA] (B)(E) [TSN: 167996940] [SID: 0] [SSEQ 4] [PPID 0x0] 
	ForCES Config 
    8  2011-03-03 12:23:04.736911 IP 211.129.72.8.6704 > 150.140.254.202.57077: sctp[ForCES HP] (1) [DATA] (B)(E) [TSN: 167996941] [SID: 0] [SSEQ 5] [PPID 0x0] 
	ForCES Config 
    9  2011-03-03 12:23:04.736980 IP 150.140.254.202.57077 > 211.129.72.8.6704: sctp[ForCES HP] (1) [SACK] [cum ack 167996941] [a_rwnd 57100] [#gap acks 0] [#dup tsns 0] 
   10  2011-03-03 12:23:04.740959 IP 211.129.72.8.6704 > 150.140.254.202.57077: sctp[ForCES HP] (1) [DATA] (B)(E) [TSN: 167996942] [SID: 0] [SSEQ 6] [PPID 0x0] 
	ForCES Config 
   11  2011-03-03 12:24:26.948354 IP 211.129.72.8.6706 > 150.140.254.202.48316: sctp[ForCES LP] (1) [SACK] [cum ack 1830592459] [a_rwnd 55272] [#gap acks 0] [#dup tsns 0] 
   12  2011-03-03 12:24:26.973201 IP 150.140.254.202.57077 > 211.129.72.8.6704: sctp[ForCES HP] (1) [HB REQ] 
   13  2011-03-03 12:24:27.282739 IP 211.129.72.8.6704 > 150.140.254.202.57077: sctp[ForCES HP] (1) [HB REQ] 
   14  2011-03-03 12:24:27.282783 IP 150.140.254.202.57077 > 211.129.72.8.6704: sctp[ForCES HP] (1) [HB ACK] 
   15  2011-03-03 12:24:27.354881 IP 150.140.254.202.48316 > 211.129.72.8.6706: sctp[ForCES LP] (1) [DATA] (B)(E) [TSN: 1830592460] [SID: 0] [SSEQ 30] [PPID 0x0] 
	ForCES HeartBeat 
   16  2011-03-03 12:24:27.372769 IP 211.129.72.8.6704 > 150.140.254.202.57077: sctp[ForCES HP] (1) [HB ACK] 
   17  2011-03-03 12:24:27.759030 IP 211.129.72.8.6706 > 150.140.254.202.48316: sctp[ForCES LP] (1) [DATA] (B)(E) [TSN: 18398553] [SID: 0] [SSEQ 77] [PPID 0x0] 
	ForCES HeartBeat 
   18  2011-03-03 12:24:44.777986 IP 211.129.72.8.6706 > 150.140.254.202.48316: sctp[ForCES LP] (1) [DATA] (B)(E) [TSN: 18398573] [SID: 0] [SSEQ 97] [PPID 0x0] 
	ForCES HeartBeat 
   19  2011-03-03 12:24:44.963122 IP 211.129.72.8.6706 > 150.140.254.202.48316: sctp[ForCES LP] (1) [SACK] [cum ack 1830592477] [a_rwnd 55272] [#gap acks 0] [#dup tsns 0] 
   20  2011-03-03 12:24:44.978321 IP 150.140.254.202.48316 > 211.129.72.8.6706: sctp[ForCES LP] (1) [SACK] [cum ack 18398573] [a_rwnd 56144] [#gap acks 0] [#dup tsns 0] 
