IP 20.0.0.2.43443 > 20.0.0.1.6081: Geneve, Flags [none], vni 0xb: IP 30.0.0.2.51225 > 30.0.0.1.22: Flags [S], seq 397610159, win 14600, options [mss 1460,sackOK,TS val 2876069566 ecr 0,nop,wscale 7], length 0
IP 20.0.0.1.22540 > 20.0.0.2.6081: Geneve, Flags [C], vni 0xa, options [8 bytes]: IP 30.0.0.1.22 > 30.0.0.2.51225: Flags [S.], seq 2910871522, ack 397610160, win 28960, options [mss 1460,sackOK,TS val 84248969 ecr 2876069566,nop,wscale 7], length 0
IP 20.0.0.2.43443 > 20.0.0.1.6081: Geneve, Flags [none], vni 0xb: IP 30.0.0.2.51225 > 30.0.0.1.22: Flags [.], ack 1, win 115, options [nop,nop,TS val 2876069566 ecr 84248969], length 0
IP 20.0.0.1.22540 > 20.0.0.2.6081: Geneve, Flags [C], vni 0xa, options [8 bytes]: IP 30.0.0.1.22 > 30.0.0.2.51225: Flags [P.], seq 1:40, ack 1, win 227, options [nop,nop,TS val 84248971 ecr 2876069566], length 39
IP 20.0.0.2.43443 > 20.0.0.1.6081: Geneve, Flags [none], vni 0xb: IP 30.0.0.2.51225 > 30.0.0.1.22: Flags [.], ack 40, win 115, options [nop,nop,TS val 2876069573 ecr 84248971], length 0
IP 20.0.0.2.43443 > 20.0.0.1.6081: Geneve, Flags [none], vni 0xb: IP 30.0.0.2.51225 > 30.0.0.1.22: Flags [P.], seq 1:22, ack 40, win 115, options [nop,nop,TS val 2876069573 ecr 84248971], length 21
IP 20.0.0.1.22540 > 20.0.0.2.6081: Geneve, Flags [C], vni 0xa, options [8 bytes]: IP 30.0.0.1.22 > 30.0.0.2.51225: Flags [.], ack 22, win 227, options [nop,nop,TS val 84248971 ecr 2876069573], length 0
IP 20.0.0.2.43443 > 20.0.0.1.6081: Geneve, Flags [none], vni 0xb: IP 30.0.0.2.51225 > 30.0.0.1.22: Flags [P.], seq 22:814, ack 40, win 115, options [nop,nop,TS val 2876069573 ecr 84248971], length 792
IP 20.0.0.1.22540 > 20.0.0.2.6081: Geneve, Flags [C], vni 0xa, options [8 bytes]: IP 30.0.0.1.22 > 30.0.0.2.51225: Flags [.], ack 814, win 239, options [nop,nop,TS val 84248971 ecr 2876069573], length 0
IP 20.0.0.1.22540 > 20.0.0.2.6081: Geneve, Flags [C], vni 0xa, options [8 bytes]: IP 30.0.0.1.22 > 30.0.0.2.51225: Flags [P.], seq 40:1024, ack 814, win 239, options [nop,nop,TS val 84248971 ecr 2876069573], length 984
IP 20.0.0.2.43443 > 20.0.0.1.6081: Geneve, Flags [none], vni 0xb: IP 30.0.0.2.51225 > 30.0.0.1.22: Flags [P.], seq 814:838, ack 1024, win 130, options [nop,nop,TS val 2876069574 ecr 84248971], length 24
IP 20.0.0.1.22540 > 20.0.0.2.6081: Geneve, Flags [C], vni 0xa, options [8 bytes]: IP 30.0.0.1.22 > 30.0.0.2.51225: Flags [P.], seq 1024:1176, ack 838, win 239, options [nop,nop,TS val 84248972 ecr 2876069574], length 152
IP 20.0.0.2.43443 > 20.0.0.1.6081: Geneve, Flags [none], vni 0xb: IP 30.0.0.2.51225 > 30.0.0.1.22: Flags [P.], seq 838:982, ack 1176, win 145, options [nop,nop,TS val 2876069577 ecr 84248972], length 144
IP 20.0.0.1.22540 > 20.0.0.2.6081: Geneve, Flags [C], vni 0xa, options [8 bytes]: IP 30.0.0.1.22 > 30.0.0.2.51225: Flags [P.], seq 1176:1896, ack 982, win 251, options [nop,nop,TS val 84248973 ecr 2876069577], length 720
IP 20.0.0.2.43443 > 20.0.0.1.6081: Geneve, Flags [none], vni 0xb: IP 30.0.0.2.51225 > 30.0.0.1.22: Flags [P.], seq 982:998, ack 1896, win 161, options [nop,nop,TS val 2876069583 ecr 84248973], length 16
IP 20.0.0.1.22540 > 20.0.0.2.6081: Geneve, Flags [C], vni 0xa, options [8 bytes]: IP 30.0.0.1.22 > 30.0.0.2.51225: Flags [.], ack 998, win 251, options [nop,nop,TS val 84248983 ecr 2876069583], length 0
IP 20.0.0.2.43443 > 20.0.0.1.6081: Geneve, Flags [none], vni 0xb: IP 30.0.0.2.51225 > 30.0.0.1.22: Flags [P.], seq 998:1046, ack 1896, win 161, options [nop,nop,TS val 2876069620 ecr 84248983], length 48
IP 20.0.0.1.22540 > 20.0.0.2.6081: Geneve, Flags [C], vni 0xa, options [8 bytes]: IP 30.0.0.1.22 > 30.0.0.2.51225: Flags [.], ack 1046, win 251, options [nop,nop,TS val 84248983 ecr 2876069620], length 0
IP 20.0.0.1.22540 > 20.0.0.2.6081: Geneve, Flags [C], vni 0xa, options [8 bytes]: IP 30.0.0.1.22 > 30.0.0.2.51225: Flags [P.], seq 1896:1944, ack 1046, win 251, options [nop,nop,TS val 84248983 ecr 2876069620], length 48
IP 20.0.0.2.43443 > 20.0.0.1.6081: Geneve, Flags [none], vni 0xb: IP 30.0.0.2.51225 > 30.0.0.1.22: Flags [P.], seq 1046:1110, ack 1944, win 161, options [nop,nop,TS val 2876069621 ecr 84248983], length 64
IP 20.0.0.1.22540 > 20.0.0.2.6081: Geneve, Flags [C], vni 0xa, options [8 bytes]: IP 30.0.0.1.22 > 30.0.0.2.51225: Flags [P.], seq 1944:2008, ack 1110, win 251, options [nop,nop,TS val 84248983 ecr 2876069621], length 64
IP 20.0.0.2.43443 > 20.0.0.1.6081: Geneve, Flags [none], vni 0xb: IP 30.0.0.2.51225 > 30.0.0.1.22: Flags [.], ack 2008, win 161, options [nop,nop,TS val 2876069662 ecr 84248983], length 0
IP 20.0.0.2.43443 > 20.0.0.1.6081: Geneve, Flags [none], vni 0xb: IP 30.0.0.2.51225 > 30.0.0.1.22: Flags [P.], seq 1110:1254, ack 2008, win 161, options [nop,nop,TS val 2876070845 ecr 84248983], length 144
IP 20.0.0.1.22540 > 20.0.0.2.6081: Geneve, Flags [C], vni 0xa, options [8 bytes]: IP 30.0.0.1.22 > 30.0.0.2.51225: Flags [P.], seq 2008:2040, ack 1254, win 264, options [nop,nop,TS val 84249289 ecr 2876070845], length 32
IP 20.0.0.2.43443 > 20.0.0.1.6081: Geneve, Flags [none], vni 0xb: IP 30.0.0.2.51225 > 30.0.0.1.22: Flags [.], ack 2040, win 161, options [nop,nop,TS val 2876070846 ecr 84249289], length 0
IP 20.0.0.2.43443 > 20.0.0.1.6081: Geneve, Flags [none], vni 0xb: IP 30.0.0.2.51225 > 30.0.0.1.22: Flags [P.], seq 1254:1382, ack 2040, win 161, options [nop,nop,TS val 2876070846 ecr 84249289], length 128
IP 20.0.0.1.22540 > 20.0.0.2.6081: Geneve, Flags [C], vni 0xa, options [8 bytes]: IP 30.0.0.1.22 > 30.0.0.2.51225: Flags [P.], seq 2040:2088, ack 1382, win 276, options [nop,nop,TS val 84249292 ecr 2876070846], length 48
IP 20.0.0.2.43443 > 20.0.0.1.6081: Geneve, Flags [none], vni 0xb: IP 30.0.0.2.51225 > 30.0.0.1.22: Flags [P.], seq 1382:1830, ack 2088, win 161, options [nop,nop,TS val 2876070859 ecr 84249292], length 448
IP 20.0.0.1.22540 > 20.0.0.2.6081: Geneve, Flags [C], vni 0xa, options [8 bytes]: IP 30.0.0.1.22 > 30.0.0.2.51225: Flags [P.], seq 2088:2200, ack 1830, win 289, options [nop,nop,TS val 84249292 ecr 2876070859], length 112
IP 20.0.0.1.22540 > 20.0.0.2.6081: Geneve, Flags [C], vni 0xa, options [8 bytes]: IP 30.0.0.1.22 > 30.0.0.2.51225: Flags [P.], seq 2200:2488, ack 1830, win 289, options [nop,nop,TS val 84249293 ecr 2876070859], length 288
IP 20.0.0.2.43443 > 20.0.0.1.6081: Geneve, Flags [none], vni 0xb: IP 30.0.0.2.51225 > 30.0.0.1.22: Flags [.], ack 2488, win 176, options [nop,nop,TS val 2876070861 ecr 84249292], length 0
IP 20.0.0.1.22540 > 20.0.0.2.6081: Geneve, Flags [C], vni 0xa, options [8 bytes]: IP 30.0.0.1.22 > 30.0.0.2.51225: Flags [P.], seq 2488:2568, ack 1830, win 289, options [nop,nop,TS val 84249351 ecr 2876070861], length 80
IP 20.0.0.2.43443 > 20.0.0.1.6081: Geneve, Flags [none], vni 0xb: IP 30.0.0.2.51225 > 30.0.0.1.22: Flags [.], ack 2568, win 176, options [nop,nop,TS val 2876071133 ecr 84249351], length 0
