    1  22:04:33.817454 IP 20.0.0.2.50525 > 20.0.0.1.6081: Geneve, Flags [none], vni 0xb: IP 30.0.0.2 > 30.0.0.1: ICMP echo reply, id 10578, seq 23, length 64
    2  22:04:33.999279 IP 20.0.0.2.43443 > 20.0.0.1.6081: Geneve, Flags [none], vni 0xb: IP 30.0.0.2.51225 > 30.0.0.1.22: Flags [S], seq 397610159, win 14600, options [mss 1460,sackOK,TS val 2876069566 ecr 0,nop,wscale 7], length 0
    3  22:04:33.999513 IP 20.0.0.2.43443 > 20.0.0.1.6081: Geneve, Flags [none], vni 0xb: IP 30.0.0.2.51225 > 30.0.0.1.22: Flags [.], ack 2910871523, win 115, options [nop,nop,TS val 2876069566 ecr 84248969], length 0
    4  22:04:34.006357 IP 20.0.0.2.43443 > 20.0.0.1.6081: Geneve, Flags [none], vni 0xb: IP 30.0.0.2.51225 > 30.0.0.1.22: Flags [.], ack 40, win 115, options [nop,nop,TS val 2876069573 ecr 84248971], length 0
    5  22:04:34.006387 IP 20.0.0.2.43443 > 20.0.0.1.6081: Geneve, Flags [none], vni 0xb: IP 30.0.0.2.51225 > 30.0.0.1.22: Flags [P.], seq 0:21, ack 40, win 115, options [nop,nop,TS val 2876069573 ecr 84248971], length 21: SSH: SSH-2.0-OpenSSH_5.3
    6  22:04:34.006523 IP 20.0.0.2.43443 > 20.0.0.1.6081: Geneve, Flags [none], vni 0xb: IP 30.0.0.2.51225 > 30.0.0.1.22: Flags [P.], seq 21:813, ack 40, win 115, options [nop,nop,TS val 2876069573 ecr 84248971], length 792
    7  22:04:34.007397 IP 20.0.0.2.43443 > 20.0.0.1.6081: Geneve, Flags [none], vni 0xb: IP 30.0.0.2.51225 > 30.0.0.1.22: Flags [P.], seq 813:837, ack 1024, win 130, options [nop,nop,TS val 2876069574 ecr 84248971], length 24
    8  22:04:34.010470 IP 20.0.0.2.43443 > 20.0.0.1.6081: Geneve, Flags [none], vni 0xb: IP 30.0.0.2.51225 > 30.0.0.1.22: Flags [P.], seq 837:981, ack 1176, win 145, options [nop,nop,TS val 2876069577 ecr 84248972], length 144
    9  22:04:34.015904 IP 20.0.0.2.43443 > 20.0.0.1.6081: Geneve, Flags [none], vni 0xb: IP 30.0.0.2.51225 > 30.0.0.1.22: Flags [P.], seq 981:997, ack 1896, win 161, options [nop,nop,TS val 2876069583 ecr 84248973], length 16
   10  22:04:34.053378 IP 20.0.0.2.43443 > 20.0.0.1.6081: Geneve, Flags [none], vni 0xb: IP 30.0.0.2.51225 > 30.0.0.1.22: Flags [P.], seq 997:1045, ack 1896, win 161, options [nop,nop,TS val 2876069620 ecr 84248983], length 48
   11  22:04:34.053708 IP 20.0.0.2.43443 > 20.0.0.1.6081: Geneve, Flags [none], vni 0xb: IP 30.0.0.2.51225 > 30.0.0.1.22: Flags [P.], seq 1045:1109, ack 1944, win 161, options [nop,nop,TS val 2876069621 ecr 84248983], length 64
   12  22:04:34.094717 IP 20.0.0.2.43443 > 20.0.0.1.6081: Geneve, Flags [none], vni 0xb: IP 30.0.0.2.51225 > 30.0.0.1.22: Flags [.], ack 2008, win 161, options [nop,nop,TS val 2876069662 ecr 84248983], length 0
   13  22:04:34.817457 IP 20.0.0.2.50525 > 20.0.0.1.6081: Geneve, Flags [none], vni 0xb: IP 30.0.0.2 > 30.0.0.1: ICMP echo reply, id 10578, seq 24, length 64
   14  22:04:35.277947 IP 20.0.0.2.43443 > 20.0.0.1.6081: Geneve, Flags [none], vni 0xb: IP 30.0.0.2.51225 > 30.0.0.1.22: Flags [P.], seq 1109:1253, ack 2008, win 161, options [nop,nop,TS val 2876070845 ecr 84248983], length 144
   15  22:04:35.279142 IP 20.0.0.2.43443 > 20.0.0.1.6081: Geneve, Flags [none], vni 0xb: IP 30.0.0.2.51225 > 30.0.0.1.22: Flags [.], ack 2040, win 161, options [nop,nop,TS val 2876070846 ecr 84249289], length 0
   16  22:04:35.279158 IP 20.0.0.2.43443 > 20.0.0.1.6081: Geneve, Flags [none], vni 0xb: IP 30.0.0.2.51225 > 30.0.0.1.22: Flags [P.], seq 1253:1381, ack 2040, win 161, options [nop,nop,TS val 2876070846 ecr 84249289], length 128
   17  22:04:35.292151 IP 20.0.0.2.43443 > 20.0.0.1.6081: Geneve, Flags [none], vni 0xb: IP 30.0.0.2.51225 > 30.0.0.1.22: Flags [P.], seq 1381:1829, ack 2088, win 161, options [nop,nop,TS val 2876070859 ecr 84249292], length 448
   18  22:04:35.294109 IP 20.0.0.2.43443 > 20.0.0.1.6081: Geneve, Flags [none], vni 0xb: IP 30.0.0.2.51225 > 30.0.0.1.22: Flags [.], ack 2488, win 176, options [nop,nop,TS val 2876070861 ecr 84249292], length 0
   19  22:04:35.565723 IP 20.0.0.2.43443 > 20.0.0.1.6081: Geneve, Flags [none], vni 0xb: IP 30.0.0.2.51225 > 30.0.0.1.22: Flags [.], ack 2568, win 176, options [nop,nop,TS val 2876071133 ecr 84249351], length 0
   20  22:04:35.817506 IP 20.0.0.2.50525 > 20.0.0.1.6081: Geneve, Flags [none], vni 0xb: IP 30.0.0.2 > 30.0.0.1: ICMP echo reply, id 10578, seq 25, length 64
