    1  2008-06-19 05:52:16.041638 IP 192.168.0.30.1985 > 224.0.0.2.1985: HSRPv0-hello 20: state=active group=1 addr=192.168.0.1
    2  2008-06-19 05:52:17.053757 IP 192.168.0.20.1985 > 224.0.0.2.1985: HSRPv0-hello 20: state=standby group=1 addr=192.168.0.1
    3  2008-06-19 05:52:19.049810 IP 192.168.0.30.1985 > 224.0.0.2.1985: HSRPv0-hello 20: state=active group=1 addr=192.168.0.1
    4  2008-06-19 05:52:20.053952 IP 192.168.0.20.1985 > 224.0.0.2.1985: HSRPv0-hello 20: state=standby group=1 addr=192.168.0.1
    5  2008-06-19 05:52:22.058588 IP 192.168.0.30.1985 > 224.0.0.2.1985: HSRPv0-hello 20: state=active group=1 addr=192.168.0.1
    6  2008-06-19 05:52:22.826625 IP 192.168.0.30.1985 > 224.0.0.2.1985: HSRPv0-hello 20: state=active group=1 addr=192.168.0.1
    7  2008-06-19 05:52:23.030764 IP 192.168.0.20.1985 > 224.0.0.2.1985: HSRPv0-hello 20: state=standby group=1 addr=192.168.0.1
    8  2008-06-19 05:52:23.278711 IP 192.168.0.20.1985 > 224.0.0.2.1985: HSRPv0-unknown (3) 16: state=initial group=2  [|hsrp]
    9  2008-06-19 05:52:25.050768 IP 192.168.0.30.1985 > 224.0.0.2.1985: HSRPv0-hello 20: state=active group=1 addr=192.168.0.1
   10  2008-06-19 05:52:26.042314 IP 192.168.0.20.1985 > 224.0.0.2.1985: HSRPv0-hello 20: state=standby group=1 addr=192.168.0.1
   11  2008-06-19 05:52:28.050368 IP 192.168.0.30.1985 > 224.0.0.2.1985: HSRPv0-hello 20: state=active group=1 addr=192.168.0.1
   12  2008-06-19 05:52:29.059037 IP 192.168.0.20.1985 > 224.0.0.2.1985: HSRPv0-hello 20: state=standby group=1 addr=192.168.0.1
   13  2008-06-19 05:52:31.026541 IP 192.168.0.30.1985 > 224.0.0.2.1985: HSRPv0-hello 20: state=active group=1 addr=192.168.0.1
   14  2008-06-19 05:52:32.042652 IP 192.168.0.20.1985 > 224.0.0.2.1985: HSRPv0-hello 20: state=standby group=1 addr=192.168.0.1
   15  2008-06-19 05:52:32.346611 IP 192.168.0.30.1985 > 224.0.0.2.1985: HSRPv0-hello 20: state=active group=1 addr=192.168.0.1
   16  2008-06-19 05:52:34.051285 IP 192.168.0.30.1985 > 224.0.0.2.1985: HSRPv0-hello 20: state=active group=1 addr=192.168.0.1
   17  2008-06-19 05:52:35.043436 IP 192.168.0.20.1985 > 224.0.0.2.1985: HSRPv0-hello 20: state=standby group=1 addr=192.168.0.1
   18  2008-06-19 05:52:36.726243 IP 192.168.0.10.1985 > 224.0.0.2.1985: HSRPv0-unknown (3) 16: state=initial group=2  [|hsrp]
   19  2008-06-19 05:52:37.054900 IP 192.168.0.30.1985 > 224.0.0.2.1985: HSRPv0-hello 20: state=active group=1 addr=192.168.0.1
   20  2008-06-19 05:52:37.059547 IP 192.168.0.10.1985 > 224.0.0.2.1985: HSRPv0-unknown (3) 16: state=initial group=2  [|hsrp]
   21  2008-06-19 05:52:37.067529 IP 192.168.0.10.1985 > 224.0.0.2.1985: HSRPv0-unknown (3) 16: state=initial group=3  [|hsrp]
   22  2008-06-19 05:52:37.075537 IP 192.168.0.10.1985 > 224.0.0.2.1985: HSRPv0-coup 20: state=listen group=1 addr=192.168.0.1
   23  2008-06-19 05:52:37.078911 IP 192.168.0.30.1985 > 224.0.0.2.1985: HSRPv0-unknown (3) 16: state=initial group=2  [|hsrp]
   24  2008-06-19 05:52:37.083532 IP 192.168.0.20.1985 > 224.0.0.2.1985: HSRPv0-unknown (3) 16: state=initial group=2  [|hsrp]
   25  2008-06-19 05:52:37.083576 IP 192.168.0.10.1985 > 224.0.0.2.1985: HSRPv0-unknown (3) 16: state=initial group=3  [|hsrp]
   26  2008-06-19 05:52:37.086910 IP 192.168.0.30.1985 > 224.0.0.2.1985: HSRPv0-hello 20: state=speak group=1 addr=192.168.0.1
   27  2008-06-19 05:52:37.091536 IP 192.168.0.10.1985 > 224.0.0.2.1985: HSRPv0-hello 20: state=active group=1 addr=192.168.0.1
   28  2008-06-19 05:52:40.043736 IP 192.168.0.10.1985 > 224.0.0.2.1985: HSRPv0-hello 20: state=active group=1 addr=192.168.0.1
   29  2008-06-19 05:52:40.095073 IP 192.168.0.30.1985 > 224.0.0.2.1985: HSRPv0-hello 20: state=speak group=1 addr=192.168.0.1
   30  2008-06-19 05:52:43.059900 IP 192.168.0.10.1985 > 224.0.0.2.1985: HSRPv0-hello 20: state=active group=1 addr=192.168.0.1
   31  2008-06-19 05:52:43.111241 IP 192.168.0.30.1985 > 224.0.0.2.1985: HSRPv0-hello 20: state=speak group=1 addr=192.168.0.1
   32  2008-06-19 05:52:46.060051 IP 192.168.0.10.1985 > 224.0.0.2.1985: HSRPv0-hello 20: state=active group=1 addr=192.168.0.1
   33  2008-06-19 05:52:46.103419 IP 192.168.0.30.1985 > 224.0.0.2.1985: HSRPv0-hello 20: state=speak group=1 addr=192.168.0.1
   34  2008-06-19 05:52:46.436087 IP 192.168.0.10.1985 > 224.0.0.2.1985: HSRPv0-hello 20: state=active group=1 addr=192.168.0.1
   35  2008-06-19 05:52:47.079471 IP 192.168.0.30.1985 > 224.0.0.2.1985: HSRPv0-hello 20: state=standby group=1 addr=192.168.0.1
   36  2008-06-19 05:52:49.060238 IP 192.168.0.10.1985 > 224.0.0.2.1985: HSRPv0-hello 20: state=active group=1 addr=192.168.0.1
   37  2008-06-19 05:52:50.104235 IP 192.168.0.30.1985 > 224.0.0.2.1985: HSRPv0-hello 20: state=standby group=1 addr=192.168.0.1
   38  2008-06-19 05:52:52.044538 IP 192.168.0.10.1985 > 224.0.0.2.1985: HSRPv0-hello 20: state=active group=1 addr=192.168.0.1
   39  2008-06-19 05:52:53.088415 IP 192.168.0.30.1985 > 224.0.0.2.1985: HSRPv0-hello 20: state=standby group=1 addr=192.168.0.1
   40  2008-06-19 05:52:55.056012 IP 192.168.0.10.1985 > 224.0.0.2.1985: HSRPv0-hello 20: state=active group=1 addr=192.168.0.1
   41  2008-06-19 05:52:55.856040 IP 192.168.0.10.1985 > 224.0.0.2.1985: HSRPv0-hello 20: state=active group=1 addr=192.168.0.1
   42  2008-06-19 05:52:56.104001 IP 192.168.0.30.1985 > 224.0.0.2.1985: HSRPv0-hello 20: state=standby group=1 addr=192.168.0.1
   43  2008-06-19 05:52:58.064776 IP 192.168.0.10.1985 > 224.0.0.2.1985: HSRPv0-hello 20: state=active group=1 addr=192.168.0.1
   44  2008-06-19 05:52:59.088780 IP 192.168.0.30.1985 > 224.0.0.2.1985: HSRPv0-hello 20: state=standby group=1 addr=192.168.0.1
   45  2008-06-19 05:53:01.064366 IP 192.168.0.10.1985 > 224.0.0.2.1985: HSRPv0-hello 20: state=active group=1 addr=192.168.0.1
   46  2008-06-19 05:53:02.112360 IP 192.168.0.30.1985 > 224.0.0.2.1985: HSRPv0-hello 20: state=standby group=1 addr=192.168.0.1
   47  2008-06-19 05:53:04.056567 IP 192.168.0.10.1985 > 224.0.0.2.1985: HSRPv0-hello 20: state=active group=1 addr=192.168.0.1
   48  2008-06-19 05:53:04.104537 IP 192.168.0.20.1985 > 224.0.0.2.1985: HSRPv0-unknown (3) 16: state=initial group=2  [|hsrp]
   49  2008-06-19 05:53:04.432502 IP 192.168.0.30.1985 > 224.0.0.2.1985: HSRPv0-unknown (3) 16: state=initial group=2  [|hsrp]
   50  2008-06-19 05:53:05.121142 IP 192.168.0.30.1985 > 224.0.0.2.1985: HSRPv0-hello 20: state=standby group=1 addr=192.168.0.1
   51  2008-06-19 05:53:05.321235 IP 192.168.0.10.1985 > 224.0.0.2.1985: HSRPv0-hello 20: state=active group=1 addr=192.168.0.1
