    1  2022-09-06 13:56:00.443595 IP6 fe80::5054:ff:fe43:2ca8 > fe80::5054:ff:fe2c:3629: ICMP6, who-are-you request node information query (node addresses [A], subject=fe80::5054:ff:fe2c:3629), length 32
    2  2022-09-06 13:56:46.614177 IP6 fe80::5054:ff:fe43:2ca8 > fe80::5054:ff:fe2c:3629: ICMP6, who-are-you request node information query (node addresses [C], subject=fe80::5054:ff:fe2c:3629), length 32
    3  2022-09-06 13:57:14.854456 IP6 fe80::5054:ff:fe43:2ca8 > fe80::5054:ff:fe2c:3629: ICMP6, who-are-you request node information query (node addresses [L], subject=fe80::5054:ff:fe2c:3629), length 32
    4  2022-09-06 13:57:22.010951 IP6 fe80::5054:ff:fe43:2ca8 > fe80::5054:ff:fe2c:3629: ICMP6, who-are-you request node information query (node addresses [S], subject=fe80::5054:ff:fe2c:3629), length 32
    5  2022-09-06 13:57:41.727114 IP6 fe80::5054:ff:fe43:2ca8 > fe80::5054:ff:fe2c:3629: ICMP6, who-are-you request node information query (node addresses [G], subject=fe80::5054:ff:fe2c:3629), length 32
