    1  2012-04-02 07:22:09.213827 IP 10.0.200.151 > 224.0.0.1: igmp query v1
    2  2012-04-02 07:22:09.537934 IP 10.0.200.163 > 224.0.0.252: igmp v1 report 224.0.0.252
    3  2012-04-02 07:22:09.903027 IP 192.168.1.3 > 239.255.255.250: igmp v1 report 239.255.255.250
    4  2012-04-02 07:22:13.069582 IP 10.0.200.108 > 224.0.1.24: igmp v1 report 224.0.1.24
    5  2012-04-02 07:22:14.681981 IP 10.0.200.100 > 224.0.1.60: igmp v1 report 224.0.1.60
    6  2012-04-02 07:22:16.045107 IP 10.0.200.144 > 224.0.0.9: igmp v1 report 224.0.0.9
    7  2012-04-02 07:22:16.069769 IP 10.0.200.108 > 239.255.255.254: igmp v1 report 239.255.255.254
    8  2012-04-02 07:22:17.446276 IP 10.0.200.10 > 224.0.0.251: igmp v1 report 224.0.0.251
    9  2012-04-02 07:24:14.209361 IP 10.0.200.151 > 224.0.0.1: igmp query v1
   10  2012-04-02 07:24:14.577751 IP 10.0.200.108 > 239.255.255.250: igmp v1 report 239.255.255.250
   11  2012-04-02 07:24:15.077718 IP 10.0.200.108 > 239.255.255.254: igmp v1 report 239.255.255.254
   12  2012-04-02 07:24:15.353766 IP 10.0.200.10 > 224.0.0.251: igmp v1 report 224.0.0.251
   13  2012-04-02 07:24:16.030428 IP 10.0.200.163 > 224.0.0.252: igmp v1 report 224.0.0.252
   14  2012-04-02 07:24:18.577987 IP 10.0.200.108 > 224.0.1.24: igmp v1 report 224.0.1.24
   15  2012-04-02 07:24:21.040295 IP 10.0.200.144 > 224.0.0.9: igmp v1 report 224.0.0.9
   16  2012-04-02 07:24:22.545577 IP 10.0.200.100 > 224.0.1.60: igmp v1 report 224.0.1.60
   17  2012-04-02 07:24:36.662121 IP 10.0.200.25 > 239.255.255.250: igmp v1 report 239.255.255.250
   18  2012-04-02 07:24:37.352184 IP 10.0.200.25 > 239.255.255.250: igmp v1 report 239.255.255.250
   19  2012-04-02 07:24:38.352158 IP 10.0.200.25 > 239.255.255.250: igmp v1 report 239.255.255.250
   20  2012-04-02 07:26:19.206625 IP 10.0.200.151 > 224.0.0.1: igmp query v1
   21  2012-04-02 07:26:19.519645 IP 10.0.200.163 > 239.255.255.250: igmp v1 report 239.255.255.250
   22  2012-04-02 07:26:24.035541 IP 10.0.200.144 > 224.0.0.9: igmp v1 report 224.0.0.9
   23  2012-04-02 07:26:25.026107 IP 10.0.200.163 > 224.0.0.252: igmp v1 report 224.0.0.252
   24  2012-04-02 07:26:25.229410 IP 10.0.200.100 > 224.0.1.60: igmp v1 report 224.0.1.60
   25  2012-04-02 07:26:26.586611 IP 10.0.200.108 > 224.0.1.24: igmp v1 report 224.0.1.24
   26  2012-04-02 07:26:27.086667 IP 10.0.200.108 > 239.255.255.254: igmp v1 report 239.255.255.254
   27  2012-04-02 07:26:28.252675 IP 10.0.200.10 > 224.0.0.251: igmp v1 report 224.0.0.251
