    1  2004-07-05 13:09:59.862196 IP 10.28.6.42.2905 > 10.28.6.44.2905: sctp (1) [DATA] (B)(E) [TSN: 1822994892] [SID: 6] [SSEQ 42] [PPID M3UA] 
    2  2004-07-05 13:09:59.868817 IP 10.28.6.44.2905 > 10.28.6.42.2905: sctp (1) [DATA] (B)(E) [TSN: 4307] [SID: 0] [SSEQ 643] [PPID M3UA] 
    3  2004-07-05 13:09:59.986040 IP 10.28.6.44.2905 > 10.28.6.42.2905: sctp (1) [DATA] (B)(E) [TSN: 4308] [SID: 0] [SSEQ 644] [PPID M3UA] 
    4  2004-07-05 13:09:59.986353 IP 10.28.6.44.2905 > 10.28.6.42.2905: sctp (1) [DATA] (B)(E) [TSN: 4309] [SID: 0] [SSEQ 645] [PPID M3UA] 
    5  2004-07-05 13:10:16.931117 IP 10.28.6.42.2905 > 10.28.6.44.2905: sctp (1) [DATA] (B)(E) [TSN: 1822994893] [SID: 6] [SSEQ 43] [PPID M3UA] 
    6  2004-07-05 13:10:16.952114 IP 10.28.6.44.2905 > 10.28.6.42.2905: sctp (1) [DATA] (B)(E) [TSN: 4310] [SID: 0] [SSEQ 646] [PPID M3UA] 
