    1  2004-06-14 10:13:29.315598 MPLS (label 100704, tc 0, [S], ttl 1) IP 12.4.4.4.42315 > 12.1.1.1.33435: UDP, length 12
    2  2004-06-14 10:13:29.316413 IP 10.5.0.1 > 12.4.4.4: ICMP time exceeded in-transit, length 148
    3  2004-06-14 10:13:29.319182 MPLS (label 100704, tc 0, [S], ttl 1) IP 12.4.4.4.42315 > 12.1.1.1.33436: UDP, length 12
    4  2004-06-14 10:13:29.326330 IP 10.5.0.1 > 12.4.4.4: ICMP time exceeded in-transit, length 148
    5  2004-06-14 10:13:29.326697 MPLS (label 100704, tc 0, [S], ttl 1) IP 12.4.4.4.42315 > 12.1.1.1.33437: UDP, length 12
    6  2004-06-14 10:13:29.327328 IP 10.5.0.1 > 12.4.4.4: ICMP time exceeded in-transit, length 148
    7  2004-06-14 10:13:29.327769 MPLS (label 100704, tc 0, [S], ttl 2) IP 12.4.4.4.42315 > 12.1.1.1.33438: UDP, length 12
    8  2004-06-14 10:13:29.328510 IP 10.4.0.2 > 12.4.4.4: ICMP time exceeded in-transit, length 148
    9  2004-06-14 10:13:29.330110 MPLS (label 100704, tc 0, [S], ttl 2) IP 12.4.4.4.42315 > 12.1.1.1.33439: UDP, length 12
   10  2004-06-14 10:13:29.330735 IP 10.4.0.2 > 12.4.4.4: ICMP time exceeded in-transit, length 148
   11  2004-06-14 10:13:29.331066 MPLS (label 100704, tc 0, [S], ttl 2) IP 12.4.4.4.42315 > 12.1.1.1.33440: UDP, length 12
   12  2004-06-14 10:13:29.331681 IP 10.4.0.2 > 12.4.4.4: ICMP time exceeded in-transit, length 148
   13  2004-06-14 10:13:29.332494 MPLS (label 100704, tc 0, [S], ttl 3) IP 12.4.4.4.42315 > 12.1.1.1.33441: UDP, length 12
   14  2004-06-14 10:13:29.333151 IP 12.1.1.1 > 12.4.4.4: ICMP 12.1.1.1 udp port 33441 unreachable, length 36
   15  2004-06-14 10:13:29.609602 MPLS (label 100704, tc 0, [S], ttl 3) IP 12.4.4.4.42315 > 12.1.1.1.33442: UDP, length 12
   16  2004-06-14 10:13:29.610234 IP 12.1.1.1 > 12.4.4.4: ICMP 12.1.1.1 udp port 33442 unreachable, length 36
   17  2004-06-14 10:13:29.610710 MPLS (label 100704, tc 0, [S], ttl 3) IP 12.4.4.4.42315 > 12.1.1.1.33443: UDP, length 12
   18  2004-06-14 10:13:29.611307 IP 12.1.1.1 > 12.4.4.4: ICMP 12.1.1.1 udp port 33443 unreachable, length 36
