    1  2020-02-26 18:44:15.949492 IP 192.168.125.165.43428 > 192.168.125.1.53: 61359+ A? proxy-chain.intel.com.network2. (48)
    2  2020-02-26 18:44:15.949675 IP 192.168.125.165.43428 > 192.168.125.1.53: 30665+ AAAA? proxy-chain.intel.com.network2. (48)
    3  2020-02-26 18:44:24.039044 IP 192.168.125.212.52278 > 192.168.125.165.55555: Flags [S], seq 653223703, win 64240, options [mss 1460,sackOK,TS val 2070300959 ecr 0,nop,wscale 7,mptcp 4 capable v1], length 0
    4  2020-02-26 18:44:24.039622 IP 192.168.125.165.55555 > 192.168.125.212.52278: Flags [S.], seq 3797229782, ack 653223704, win 65160, options [mss 1460,sackOK,TS val 938670159 ecr 2070300959,nop,wscale 7,mptcp 12 capable v1 {0x73bb150358a0aecb}], length 0
    5  2020-02-26 18:44:24.039910 IP 192.168.125.212.52278 > 192.168.125.165.55555: Flags [.], ack 1, win 502, options [nop,nop,TS val 2070300960 ecr 938670159,mptcp 20 capable v1 {0x8f0c7c64a6a32ac1,0x73bb150358a0aecb}], length 0
    6  2020-02-26 18:44:24.042337 IP 192.168.125.212.52278 > 192.168.125.165.55555: Flags [P.], seq 1:17, ack 1, win 502, options [nop,nop,TS val 2070300963 ecr 938670159,mptcp 22 capable v1 {0x8f0c7c64a6a32ac1,0x73bb150358a0aecb},nop,nop], length 16
    7  2020-02-26 18:44:24.042622 IP 192.168.125.165.55555 > 192.168.125.212.52278: Flags [.], ack 17, win 509, options [nop,nop,TS val 938670162 ecr 2070300963,mptcp 12 dss ack 17186763219675866565], length 0
    8  2020-02-26 18:44:24.043277 IP 192.168.125.165.55555 > 192.168.125.212.52278: Flags [P.], seq 1:17, ack 17, win 509, options [nop,nop,TS val 938670163 ecr 2070300963,mptcp 26 dss ack 17186763219675866581 seq 12148165319181844526 subseq 1 len 16,nop,nop], length 16
    9  2020-02-26 18:44:24.043512 IP 192.168.125.212.52278 > 192.168.125.165.55555: Flags [.], ack 17, win 502, options [nop,nop,TS val 2070300964 ecr 938670163,mptcp 12 dss ack 12148165319181844526], length 0
   10  2020-02-26 18:44:24.247920 IP 192.168.125.165.55555 > 192.168.125.212.52278: Flags [P.], seq 17:33, ack 17, win 509, options [nop,nop,TS val 938670368 ecr 2070300964,mptcp 26 dss ack 17186763219675866581 seq 12148165319181844526 subseq 17 len 16,nop,nop], length 16
   11  2020-02-26 18:44:24.248383 IP 192.168.125.212.52278 > 192.168.125.165.55555: Flags [.], ack 33, win 502, options [nop,nop,TS val 2070301169 ecr 938670368,mptcp 12 dss ack 12148165319181844542], length 0
   12  2020-02-26 18:44:25.046480 IP 192.168.125.212.52278 > 192.168.125.165.55555: Flags [P.], seq 17:33, ack 33, win 502, options [nop,nop,TS val 2070301967 ecr 938670368,mptcp 26 dss ack 12148165319181844542 seq 17186763219675866581 subseq 17 len 16,nop,nop], length 16
   13  2020-02-26 18:44:25.046726 IP 192.168.125.165.55555 > 192.168.125.212.52278: Flags [.], ack 33, win 509, options [nop,nop,TS val 938671166 ecr 2070301967,mptcp 16 add-addr v1 id 1 192.168.136.225 hmac 0x669928744366716c,mptcp 12 dss ack 17186763219675866581], length 0
   14  2020-02-26 18:44:25.048465 IP 192.168.125.165.55555 > 192.168.125.212.52278: Flags [P.], seq 33:49, ack 33, win 509, options [nop,nop,TS val 938671168 ecr 2070301967,mptcp 26 dss ack 17186763219675866597 seq 12148165319181844542 subseq 33 len 16,nop,nop], length 16
   15  2020-02-26 18:44:25.048568 IP 192.168.125.212.52278 > 192.168.125.165.55555: Flags [.], ack 49, win 502, options [nop,nop,TS val 2070301969 ecr 938671168,mptcp 12 dss ack 12148165319181844542], length 0
   16  2020-02-26 18:44:25.256088 IP 192.168.125.165.55555 > 192.168.125.212.52278: Flags [P.], seq 49:65, ack 33, win 509, options [nop,nop,TS val 938671376 ecr 2070301969,mptcp 26 dss ack 17186763219675866597 seq 12148165319181844542 subseq 49 len 16,nop,nop], length 16
   17  2020-02-26 18:44:25.256361 IP 192.168.125.212.52278 > 192.168.125.165.55555: Flags [.], ack 65, win 502, options [nop,nop,TS val 2070302177 ecr 938671376,mptcp 12 dss ack 12148165319181844558], length 0
   18  2020-02-26 18:44:26.048795 IP 192.168.125.212.52278 > 192.168.125.165.55555: Flags [P.], seq 33:49, ack 65, win 502, options [nop,nop,TS val 2070302969 ecr 938671376,mptcp 26 dss ack 12148165319181844558 seq 17186763219675866597 subseq 33 len 16,nop,nop], length 16
   19  2020-02-26 18:44:26.049014 IP 192.168.125.165.55555 > 192.168.125.212.52278: Flags [.], ack 49, win 509, options [nop,nop,TS val 938672169 ecr 2070302969,mptcp 12 dss ack 17186763219675866597], length 0
   20  2020-02-26 18:44:26.049644 IP 192.168.125.165.55555 > 192.168.125.212.52278: Flags [P.], seq 65:81, ack 49, win 509, options [nop,nop,TS val 938672169 ecr 2070302969,mptcp 26 dss ack 17186763219675866613 seq 12148165319181844558 subseq 65 len 16,nop,nop], length 16
   21  2020-02-26 18:44:26.049972 IP 192.168.125.212.52278 > 192.168.125.165.55555: Flags [.], ack 81, win 502, options [nop,nop,TS val 2070302970 ecr 938672169,mptcp 12 dss ack 12148165319181844558], length 0
   22  2020-02-26 18:44:26.049982 IP 192.168.125.212.52278 > 192.168.125.165.55555: Flags [F.], seq 49, ack 81, win 502, options [nop,nop,TS val 2070302970 ecr 938672169,mptcp 26 dss fin ack 12148165319181844574 seq 17186763219675866613 subseq 0 len 1,nop,nop], length 0
   23  2020-02-26 18:44:26.050692 IP 192.168.125.165.55555 > 192.168.125.212.52278: Flags [F.], seq 81, ack 50, win 509, options [nop,nop,TS val 938672171 ecr 2070302970,mptcp 26 dss fin ack 17186763219675866613 seq 12148165319181844574 subseq 0 len 1,nop,nop], length 0
   24  2020-02-26 18:44:26.050757 IP 192.168.125.212.52278 > 192.168.125.165.55555: Flags [.], ack 82, win 502, options [nop,nop,TS val 2070302971 ecr 938672171,mptcp 12 dss ack 12148165319181844574], length 0
