    1  2013-02-25 12:56:35.701161 IP 10.2.1.2.35961 > 10.1.1.2.22: Flags [S], seq 2912457561, win 14600, options [mss 1460,sackOK,TS val 4294943152 ecr 0,nop,wscale 6,mptcp 12 capable v0 csum {0x9c9eabd1e46a33b2}], length 0
    2  2013-02-25 12:56:35.701661 IP 10.1.1.2.22 > 10.2.1.2.35961: Flags [S.], seq 125971326, ack 2912457562, win 14280, options [mss 1460,sackOK,TS val 4294943467 ecr 4294943152,nop,wscale 5,mptcp 12 capable v0 csum {0x967d2770b6960552}], length 0
    3  2013-02-25 12:56:35.702022 IP 10.2.1.2.35961 > 10.1.1.2.22: Flags [.], ack 1, win 229, options [nop,nop,TS val 4294943152 ecr 4294943467,mptcp 20 capable v0 csum {0x9c9eabd1e46a33b2,0x967d2770b6960552}], length 0
    4  2013-02-25 12:56:35.786074 IP 10.1.1.2.22 > 10.2.1.2.35961: Flags [P.], seq 1:42, ack 1, win 447, options [nop,nop,TS val 4294943474 ecr 4294943152,mptcp 8 add-addr v0-ip4 id 1 10.1.2.2,mptcp 20 dss ack 3576348362 seq 3518592144 subseq 1 len 41 csum 0x82f], length 41: SSH: SSH-2.0-OpenSSH_5.5p1 Debian-6+squeeze1
    5  2013-02-25 12:56:35.786240 IP 10.2.1.2.35961 > 10.1.1.2.22: Flags [.], ack 42, win 229, options [nop,nop,TS val 4294943168 ecr 4294943474,mptcp 8 dss ack 3518592185], length 0
    6  2013-02-25 12:56:35.787634 IP 10.2.1.2.35961 > 10.1.1.2.22: Flags [P.], seq 1:42, ack 42, win 229, options [nop,nop,TS val 4294943168 ecr 4294943474,mptcp 20 dss ack 3518592185 seq 3576348362 subseq 1 len 41 csum 0x45c9], length 41: SSH: SSH-2.0-OpenSSH_5.5p1 Debian-6+squeeze2
    7  2013-02-25 12:56:35.787786 IP 10.1.1.2.22 > 10.2.1.2.35961: Flags [.], ack 42, win 447, options [nop,nop,TS val 4294943474 ecr 4294943168,mptcp 8 dss ack 3576348403], length 0
    8  2013-02-25 12:56:35.788254 IP 10.2.1.2.41221 > 10.1.2.2.22: Flags [S], seq 1863826096, win 14600, options [mss 1460,sackOK,TS val 4294943168 ecr 0,nop,wscale 6,mptcp 12 join id 0 token 0xe47f0142 nonce 0x1b665a18], length 0
    9  2013-02-25 12:56:35.788849 IP 10.1.2.2.22 > 10.2.1.2.41221: Flags [S.], seq 1704897135, ack 1863826097, win 14280, options [mss 1460,sackOK,TS val 4294943474 ecr 4294943168,nop,wscale 5,mptcp 16 join id 1 hmac 0x5ab680c7884af03d nonce 0x33abe9d5], length 0
   10  2013-02-25 12:56:35.788970 IP 10.2.1.2.41221 > 10.1.2.2.22: Flags [.], ack 1, win 229, options [nop,nop,TS val 4294943168 ecr 4294943474,mptcp 24 join hmac 0xcb7b87f5e5f0502f43b535fb70ef6607df2e6c7a], length 0
   11  2013-02-25 12:56:35.789119 IP 10.2.1.2.35961 > 10.1.1.2.22: Flags [P.], seq 42:890, ack 42, win 229, options [nop,nop,TS val 4294943168 ecr 4294943474,mptcp 20 dss ack 3518592185 seq 3576348403 subseq 42 len 848 csum 0x6d11], length 848
   12  2013-02-25 12:56:35.789184 IP 10.1.2.2.22 > 10.2.1.2.41221: Flags [.], ack 1, win 447, options [nop,nop,TS val 4294943474 ecr 4294943168,mptcp 8 dss ack 3576348403], length 0
   13  2013-02-25 12:56:35.789363 IP 10.1.1.2.22 > 10.2.1.2.35961: Flags [.], ack 890, win 500, options [nop,nop,TS val 4294943474 ecr 4294943168,mptcp 8 dss ack 3576349251], length 0
   14  2013-02-25 12:56:35.808319 IP 10.1.2.2.22 > 10.2.1.2.41221: Flags [P.], seq 1:785, ack 1, win 500, options [nop,nop,TS val 4294943474 ecr 4294943168,mptcp 20 dss ack 3576349251 seq 3518592185 subseq 1 len 784 csum 0x5187], length 784
   15  2013-02-25 12:56:35.808457 IP 10.2.1.2.41221 > 10.1.2.2.22: Flags [.], ack 785, win 253, options [nop,nop,TS val 4294943170 ecr 4294943474,mptcp 8 dss ack 3518592969], length 0
   16  2013-02-25 12:56:35.809183 IP 10.2.1.2.41221 > 10.1.2.2.22: Flags [P.], seq 1:25, ack 785, win 253, options [nop,nop,TS val 4294943170 ecr 4294943474,mptcp 20 dss ack 3518592969 seq 3576349251 subseq 1 len 24 csum 0xec8a], length 24
   17  2013-02-25 12:56:35.809313 IP 10.1.2.2.22 > 10.2.1.2.41221: Flags [.], ack 25, win 500, options [nop,nop,TS val 4294943474 ecr 4294943170,mptcp 8 dss ack 3576349275], length 0
   18  2013-02-25 12:56:35.818371 IP 10.1.2.2.22 > 10.2.1.2.41221: Flags [P.], seq 785:937, ack 25, win 500, options [nop,nop,TS val 4294943474 ecr 4294943170,mptcp 20 dss ack 3576349275 seq 3518592969 subseq 785 len 152 csum 0x217c], length 152
   19  2013-02-25 12:56:35.820848 IP 10.2.1.2.41221 > 10.1.2.2.22: Flags [P.], seq 25:169, ack 937, win 258, options [nop,nop,TS val 4294943170 ecr 4294943474,mptcp 20 dss ack 3518593121 seq 3576349275 subseq 25 len 144 csum 0x7220], length 144
   20  2013-02-25 12:56:35.832310 IP 10.1.2.2.22 > 10.2.1.2.41221: Flags [P.], seq 937:1657, ack 169, win 533, options [nop,nop,TS val 4294943474 ecr 4294943170,mptcp 20 dss ack 3576349419 seq 3518593121 subseq 937 len 720 csum 0xfb83], length 720
   21  2013-02-25 12:56:35.836233 IP 10.2.1.2.35961 > 10.1.1.2.22: Flags [P.], seq 890:906, ack 42, win 280, options [nop,nop,TS val 4294943172 ecr 4294943474,mptcp 20 dss ack 3518593841 seq 3576349419 subseq 890 len 16 csum 0xc87], length 16
   22  2013-02-25 12:56:35.836394 IP 10.1.1.2.22 > 10.2.1.2.35961: Flags [.], ack 906, win 533, options [nop,nop,TS val 4294943474 ecr 4294943172,mptcp 8 dss ack 3576349435], length 0
   23  2013-02-25 12:56:35.836507 IP 10.2.1.2.35961 > 10.1.1.2.22: Flags [P.], seq 906:954, ack 42, win 280, options [nop,nop,TS val 4294943172 ecr 4294943474,mptcp 20 dss ack 3518593841 seq 3576349435 subseq 906 len 48 csum 0x36d0], length 48
   24  2013-02-25 12:56:35.836611 IP 10.1.1.2.22 > 10.2.1.2.35961: Flags [.], ack 954, win 533, options [nop,nop,TS val 4294943474 ecr 4294943172,mptcp 8 dss ack 3576349483], length 0
   25  2013-02-25 12:56:35.836876 IP 10.1.2.2.22 > 10.2.1.2.41221: Flags [P.], seq 1657:1705, ack 169, win 533, options [nop,nop,TS val 4294943474 ecr 4294943170,mptcp 20 dss ack 3576349483 seq 3518593841 subseq 1657 len 48 csum 0xb8f3], length 48
   26  2013-02-25 12:56:35.837021 IP 10.2.1.2.41221 > 10.1.2.2.22: Flags [.], ack 1705, win 280, options [nop,nop,TS val 4294943172 ecr 4294943474,mptcp 8 dss ack 3518593889], length 0
   27  2013-02-25 12:56:35.837331 IP 10.2.1.2.35961 > 10.1.1.2.22: Flags [P.], seq 954:1018, ack 42, win 280, options [nop,nop,TS val 4294943172 ecr 4294943474,mptcp 20 dss ack 3518593889 seq 3576349483 subseq 954 len 64 csum 0x71f6], length 64
   28  2013-02-25 12:56:35.837430 IP 10.1.1.2.22 > 10.2.1.2.35961: Flags [.], ack 1018, win 533, options [nop,nop,TS val 4294943474 ecr 4294943172,mptcp 8 dss ack 3576349547], length 0
   29  2013-02-25 12:56:35.855648 IP 10.1.2.2.22 > 10.2.1.2.41221: Flags [P.], seq 1705:1769, ack 169, win 533, options [nop,nop,TS val 4294943474 ecr 4294943172,mptcp 20 dss ack 3576349547 seq 3518593889 subseq 1705 len 64 csum 0x67b9], length 64
   30  2013-02-25 12:56:35.855893 IP 10.2.1.2.35961 > 10.1.1.2.22: Flags [P.], seq 1018:1386, ack 42, win 280, options [nop,nop,TS val 4294943175 ecr 4294943474,mptcp 20 dss ack 3518593953 seq 3576349547 subseq 1018 len 368 csum 0x81d2], length 368
   31  2013-02-25 12:56:35.856045 IP 10.1.1.2.22 > 10.2.1.2.35961: Flags [.], ack 1386, win 567, options [nop,nop,TS val 4294943474 ecr 4294943175,mptcp 8 dss ack 3576349915], length 0
   32  2013-02-25 12:56:35.864308 IP 10.1.2.2.22 > 10.2.1.2.41221: Flags [P.], seq 1769:2089, ack 169, win 567, options [nop,nop,TS val 4294943474 ecr 4294943172,mptcp 20 dss ack 3576349915 seq 3518593953 subseq 1769 len 320 csum 0x5fc5], length 320
   33  2013-02-25 12:56:35.864462 IP 10.2.1.2.41221 > 10.1.2.2.22: Flags [.], ack 2089, win 290, options [nop,nop,TS val 4294943175 ecr 4294943474,mptcp 8 dss ack 3518594273], length 0
   34  2013-02-25 12:56:35.876367 IP 10.2.1.2.35961 > 10.1.1.2.22: Flags [P.], seq 1386:2026, ack 42, win 290, options [nop,nop,TS val 4294943175 ecr 4294943474,mptcp 20 dss ack 3518594273 seq 3576349915 subseq 1386 len 640 csum 0x5af4], length 640
   35  2013-02-25 12:56:35.876484 IP 10.1.1.2.22 > 10.2.1.2.35961: Flags [.], ack 2026, win 607, options [nop,nop,TS val 4294943485 ecr 4294943175,mptcp 8 dss ack 3576350555], length 0
   36  2013-02-25 12:56:35.881115 IP 10.1.2.2.22 > 10.2.1.2.41221: Flags [P.], seq 2089:2153, ack 169, win 607, options [nop,nop,TS val 4294943485 ecr 4294943175,mptcp 20 dss ack 3576350555 seq 3518594273 subseq 2089 len 64 csum 0x548b], length 64
   37  2013-02-25 12:56:35.894682 IP 10.2.1.2.41221 > 10.1.2.2.22: Flags [.], ack 2153, win 290, options [nop,nop,TS val 4294943179 ecr 4294943485,mptcp 8 dss ack 3518594337], length 0
   38  2013-02-25 12:56:37.122657 IP 10.2.1.2.35961 > 10.1.1.2.22: Flags [P.], seq 2026:2170, ack 42, win 290, options [nop,nop,TS val 4294943301 ecr 4294943485,mptcp 20 dss ack 3518594337 seq 3576350555 subseq 2026 len 144 csum 0x62d7], length 144
   39  2013-02-25 12:56:37.122822 IP 10.1.1.2.22 > 10.2.1.2.35961: Flags [.], ack 2170, win 640, options [nop,nop,TS val 4294943610 ecr 4294943301,mptcp 8 dss ack 3576350699], length 0
   40  2013-02-25 12:56:37.150400 IP 10.1.1.2.22 > 10.2.1.2.35961: Flags [P.], seq 42:74, ack 2170, win 640, options [nop,nop,TS val 4294943611 ecr 4294943301,mptcp 20 dss ack 3576350699 seq 3518594337 subseq 42 len 32 csum 0x24cb], length 32
   41  2013-02-25 12:56:37.152255 IP 10.2.1.2.35961 > 10.1.1.2.22: Flags [P.], seq 2170:2298, ack 74, win 290, options [nop,nop,TS val 4294943304 ecr 4294943611,mptcp 20 dss ack 3518594369 seq 3576350699 subseq 2170 len 128 csum 0x33ac], length 128
   42  2013-02-25 12:56:37.170125 IP 10.1.1.2.22 > 10.2.1.2.35961: Flags [P.], seq 74:122, ack 2298, win 674, options [nop,nop,TS val 4294943611 ecr 4294943304,mptcp 20 dss ack 3576350827 seq 3518594369 subseq 74 len 48 csum 0xf616], length 48
   43  2013-02-25 12:56:37.170732 IP 10.2.1.2.41221 > 10.1.2.2.22: Flags [P.], seq 169:617, ack 2153, win 290, options [nop,nop,TS val 4294943306 ecr 4294943485,mptcp 20 dss ack 3518594417 seq 3576350827 subseq 169 len 448 csum 0xe192], length 448
   44  2013-02-25 12:56:37.178205 IP 10.1.1.2.22 > 10.2.1.2.35961: Flags [P.], seq 122:234, ack 2298, win 707, options [nop,nop,TS val 4294943611 ecr 4294943304,mptcp 20 dss ack 3576351275 seq 3518594417 subseq 122 len 112 csum 0xeb29], length 112
   45  2013-02-25 12:56:37.178417 IP 10.2.1.2.35961 > 10.1.1.2.22: Flags [.], ack 234, win 290, options [nop,nop,TS val 4294943306 ecr 4294943611,mptcp 8 dss ack 3518594529], length 0
   46  2013-02-25 12:56:37.194867 IP 10.1.1.2.22 > 10.2.1.2.35961: Flags [P.], seq 234:346, ack 2298, win 707, options [nop,nop,TS val 4294943611 ecr 4294943306,mptcp 20 dss ack 3576351275 seq 3518594529 subseq 234 len 112 csum 0x70c0], length 112
   47  2013-02-25 12:56:37.195303 IP 10.1.1.2.22 > 10.2.1.2.35961: Flags [P.], seq 346:538, ack 2298, win 707, options [nop,nop,TS val 4294943611 ecr 4294943306,mptcp 20 dss ack 3576351275 seq 3518594641 subseq 346 len 192 csum 0x91c], length 192
   48  2013-02-25 12:56:37.195478 IP 10.2.1.2.35961 > 10.1.1.2.22: Flags [.], ack 538, win 296, options [nop,nop,TS val 4294943309 ecr 4294943611,mptcp 8 dss ack 3518594833], length 0
   49  2013-02-25 12:56:37.195903 IP 10.1.1.2.22 > 10.2.1.2.35961: Flags [P.], seq 538:634, ack 2298, win 707, options [nop,nop,TS val 4294943611 ecr 4294943309,mptcp 20 dss ack 3576351275 seq 3518594833 subseq 538 len 96 csum 0x5851], length 96
   50  2013-02-25 12:56:37.196257 IP 10.1.1.2.22 > 10.2.1.2.35961: Flags [P.], seq 634:778, ack 2298, win 707, options [nop,nop,TS val 4294943611 ecr 4294943309,mptcp 20 dss ack 3576351275 seq 3518594929 subseq 634 len 144 csum 0x405a], length 144
   51  2013-02-25 12:56:37.196413 IP 10.2.1.2.35961 > 10.1.1.2.22: Flags [.], ack 778, win 301, options [nop,nop,TS val 4294943309 ecr 4294943611,mptcp 8 dss ack 3518595073], length 0
   52  2013-02-25 12:56:37.233594 IP 10.1.2.2.22 > 10.2.1.2.41221: Flags [.], ack 617, win 707, options [nop,nop,TS val 4294943621 ecr 4294943306,mptcp 8 dss ack 3576351275], length 0
   53  2013-02-25 12:56:37.234006 IP 10.1.1.2.22 > 10.2.1.2.35961: Flags [P.], seq 778:858, ack 2298, win 707, options [nop,nop,TS val 4294943621 ecr 4294943309,mptcp 20 dss ack 3576351275 seq 3518595073 subseq 778 len 80 csum 0x3c7b], length 80
   54  2013-02-25 12:56:37.264660 IP 10.2.1.2.35961 > 10.1.1.2.22: Flags [.], ack 858, win 301, options [nop,nop,TS val 4294943316 ecr 4294943621,mptcp 8 dss ack 3518595153], length 0
   55  2013-02-25 12:56:37.386418 IP 10.2.1.2.35961 > 10.1.1.2.22: Flags [P.], seq 2298:2346, ack 858, win 301, options [nop,nop,TS val 4294943328 ecr 4294943621,mptcp 20 dss ack 3518595153 seq 3576351275 subseq 2298 len 48 csum 0xe0ce], length 48
   56  2013-02-25 12:56:37.387434 IP 10.1.1.2.22 > 10.2.1.2.35961: Flags [P.], seq 858:906, ack 2346, win 707, options [nop,nop,TS val 4294943629 ecr 4294943328,mptcp 20 dss ack 3576351323 seq 3518595153 subseq 858 len 48 csum 0xbe20], length 48
   57  2013-02-25 12:56:37.387609 IP 10.2.1.2.35961 > 10.1.1.2.22: Flags [.], ack 906, win 301, options [nop,nop,TS val 4294943328 ecr 4294943629,mptcp 8 dss ack 3518595201], length 0
   58  2013-02-25 12:56:37.503091 IP 10.1.1.2.22 > 10.2.1.2.35961: Flags [P.], seq 906:1034, ack 2346, win 707, options [nop,nop,TS val 4294943645 ecr 4294943328,mptcp 20 dss ack 3576351323 seq 3518595201 subseq 906 len 128 csum 0x3d9d], length 128
   59  2013-02-25 12:56:37.503218 IP 10.2.1.2.35961 > 10.1.1.2.22: Flags [.], ack 1034, win 305, options [nop,nop,TS val 4294943339 ecr 4294943645,mptcp 8 dss ack 3518595329], length 0
   60  2013-02-25 12:56:37.538348 IP 10.2.1.2.35961 > 10.1.1.2.22: Flags [P.], seq 2346:2394, ack 1034, win 305, options [nop,nop,TS val 4294943343 ecr 4294943645,mptcp 20 dss ack 3518595329 seq 3576351323 subseq 2346 len 48 csum 0x8505], length 48
   61  2013-02-25 12:56:37.540145 IP 10.1.1.2.22 > 10.2.1.2.35961: Flags [P.], seq 1034:1114, ack 2394, win 707, options [nop,nop,TS val 4294943651 ecr 4294943343,mptcp 20 dss ack 3576351371 seq 3518595329 subseq 1034 len 80 csum 0xb3da], length 80
   62  2013-02-25 12:56:37.540296 IP 10.2.1.2.35961 > 10.1.1.2.22: Flags [.], ack 1114, win 305, options [nop,nop,TS val 4294943343 ecr 4294943651,mptcp 8 dss ack 3518595409], length 0
   63  2013-02-25 12:56:37.658158 IP 10.2.1.2.35961 > 10.1.1.2.22: Flags [P.], seq 2394:2442, ack 1114, win 305, options [nop,nop,TS val 4294943355 ecr 4294943651,mptcp 20 dss ack 3518595409 seq 3576351371 subseq 2394 len 48 csum 0xd46b], length 48
   64  2013-02-25 12:56:37.660394 IP 10.1.1.2.22 > 10.2.1.2.35961: Flags [P.], seq 1114:1194, ack 2442, win 707, options [nop,nop,TS val 4294943663 ecr 4294943355,mptcp 20 dss ack 3576351419 seq 3518595409 subseq 1114 len 80 csum 0xfe3d], length 80
   65  2013-02-25 12:56:37.660555 IP 10.2.1.2.35961 > 10.1.1.2.22: Flags [.], ack 1194, win 305, options [nop,nop,TS val 4294943355 ecr 4294943663,mptcp 8 dss ack 3518595489], length 0
   66  2013-02-25 12:56:37.978284 IP 10.2.1.2.35961 > 10.1.1.2.22: Flags [P.], seq 2442:2490, ack 1194, win 305, options [nop,nop,TS val 4294943387 ecr 4294943663,mptcp 20 dss ack 3518595489 seq 3576351419 subseq 2442 len 48 csum 0xd83], length 48
   67  2013-02-25 12:56:37.979476 IP 10.1.1.2.22 > 10.2.1.2.35961: Flags [P.], seq 1194:1242, ack 2490, win 707, options [nop,nop,TS val 4294943695 ecr 4294943387,mptcp 20 dss ack 3576351467 seq 3518595489 subseq 1194 len 48 csum 0xad99], length 48
   68  2013-02-25 12:56:37.979628 IP 10.2.1.2.35961 > 10.1.1.2.22: Flags [.], ack 1242, win 305, options [nop,nop,TS val 4294943387 ecr 4294943695,mptcp 8 dss ack 3518595537], length 0
   69  2013-02-25 12:56:38.058374 IP 10.2.1.2.35961 > 10.1.1.2.22: Flags [P.], seq 2490:2538, ack 1242, win 305, options [nop,nop,TS val 4294943395 ecr 4294943695,mptcp 20 dss ack 3518595537 seq 3576351467 subseq 2490 len 48 csum 0x3689], length 48
   70  2013-02-25 12:56:38.059543 IP 10.1.1.2.22 > 10.2.1.2.35961: Flags [P.], seq 1242:1290, ack 2538, win 707, options [nop,nop,TS val 4294943703 ecr 4294943395,mptcp 20 dss ack 3576351515 seq 3518595537 subseq 1242 len 48 csum 0xf0cf], length 48
   71  2013-02-25 12:56:38.059692 IP 10.2.1.2.35961 > 10.1.1.2.22: Flags [.], ack 1290, win 305, options [nop,nop,TS val 4294943395 ecr 4294943703,mptcp 8 dss ack 3518595585], length 0
   72  2013-02-25 12:56:38.194189 IP 10.2.1.2.35961 > 10.1.1.2.22: Flags [P.], seq 2538:2586, ack 1290, win 305, options [nop,nop,TS val 4294943408 ecr 4294943703,mptcp 20 dss ack 3518595585 seq 3576351515 subseq 2538 len 48 csum 0xed5f], length 48
   73  2013-02-25 12:56:38.195084 IP 10.1.1.2.22 > 10.2.1.2.35961: Flags [P.], seq 1290:1338, ack 2586, win 707, options [nop,nop,TS val 4294943717 ecr 4294943408,mptcp 20 dss ack 3576351563 seq 3518595585 subseq 1290 len 48 csum 0xf2ec], length 48
   74  2013-02-25 12:56:38.195270 IP 10.2.1.2.35961 > 10.1.1.2.22: Flags [.], ack 1338, win 305, options [nop,nop,TS val 4294943408 ecr 4294943717,mptcp 8 dss ack 3518595633], length 0
   75  2013-02-25 12:56:38.281975 IP 10.2.1.2.35961 > 10.1.1.2.22: Flags [P.], seq 2586:2634, ack 1338, win 305, options [nop,nop,TS val 4294943417 ecr 4294943717,mptcp 20 dss ack 3518595633 seq 3576351563 subseq 2586 len 48 csum 0x3678], length 48
   76  2013-02-25 12:56:38.282916 IP 10.1.1.2.22 > 10.2.1.2.35961: Flags [P.], seq 1338:1386, ack 2634, win 707, options [nop,nop,TS val 4294943726 ecr 4294943417,mptcp 20 dss ack 3576351611 seq 3518595633 subseq 1338 len 48 csum 0xc9a1], length 48
   77  2013-02-25 12:56:38.283037 IP 10.2.1.2.35961 > 10.1.1.2.22: Flags [.], ack 1386, win 305, options [nop,nop,TS val 4294943417 ecr 4294943726,mptcp 8 dss ack 3518595681], length 0
   78  2013-02-25 12:56:38.354097 IP 10.2.1.2.35961 > 10.1.1.2.22: Flags [P.], seq 2634:2682, ack 1386, win 305, options [nop,nop,TS val 4294943424 ecr 4294943726,mptcp 20 dss ack 3518595681 seq 3576351611 subseq 2634 len 48 csum 0x54c7], length 48
   79  2013-02-25 12:56:38.355244 IP 10.1.1.2.22 > 10.2.1.2.35961: Flags [P.], seq 1386:1434, ack 2682, win 707, options [nop,nop,TS val 4294943733 ecr 4294943424,mptcp 20 dss ack 3576351659 seq 3518595681 subseq 1386 len 48 csum 0xf5e9], length 48
   80  2013-02-25 12:56:38.355394 IP 10.2.1.2.35961 > 10.1.1.2.22: Flags [.], ack 1434, win 305, options [nop,nop,TS val 4294943424 ecr 4294943733,mptcp 8 dss ack 3518595729], length 0
   81  2013-02-25 12:56:38.458056 IP 10.2.1.2.35961 > 10.1.1.2.22: Flags [P.], seq 2682:2730, ack 1434, win 305, options [nop,nop,TS val 4294943435 ecr 4294943733,mptcp 20 dss ack 3518595729 seq 3576351659 subseq 2682 len 48 csum 0xc90a], length 48
   82  2013-02-25 12:56:38.459591 IP 10.1.1.2.22 > 10.2.1.2.35961: Flags [P.], seq 1434:1482, ack 2730, win 707, options [nop,nop,TS val 4294943743 ecr 4294943435,mptcp 20 dss ack 3576351707 seq 3518595729 subseq 1434 len 48 csum 0x4e7d], length 48
   83  2013-02-25 12:56:38.459758 IP 10.2.1.2.35961 > 10.1.1.2.22: Flags [.], ack 1482, win 305, options [nop,nop,TS val 4294943435 ecr 4294943743,mptcp 8 dss ack 3518595777], length 0
   84  2013-02-25 12:56:38.514098 IP 10.2.1.2.35961 > 10.1.1.2.22: Flags [P.], seq 2730:2778, ack 1482, win 305, options [nop,nop,TS val 4294943440 ecr 4294943743,mptcp 20 dss ack 3518595777 seq 3576351707 subseq 2730 len 48 csum 0x7b3d], length 48
   85  2013-02-25 12:56:38.515052 IP 10.1.1.2.22 > 10.2.1.2.35961: Flags [P.], seq 1482:1530, ack 2778, win 707, options [nop,nop,TS val 4294943749 ecr 4294943440,mptcp 20 dss ack 3576351755 seq 3518595777 subseq 1482 len 48 csum 0x83e2], length 48
   86  2013-02-25 12:56:38.515220 IP 10.2.1.2.35961 > 10.1.1.2.22: Flags [.], ack 1530, win 305, options [nop,nop,TS val 4294943440 ecr 4294943749,mptcp 8 dss ack 3518595825], length 0
   87  2013-02-25 12:56:38.642379 IP 10.2.1.2.35961 > 10.1.1.2.22: Flags [P.], seq 2778:2826, ack 1530, win 305, options [nop,nop,TS val 4294943453 ecr 4294943749,mptcp 20 dss ack 3518595825 seq 3576351755 subseq 2778 len 48 csum 0x6e36], length 48
   88  2013-02-25 12:56:38.643664 IP 10.1.1.2.22 > 10.2.1.2.35961: Flags [P.], seq 1530:1578, ack 2826, win 707, options [nop,nop,TS val 4294943762 ecr 4294943453,mptcp 20 dss ack 3576351803 seq 3518595825 subseq 1530 len 48 csum 0xb348], length 48
   89  2013-02-25 12:56:38.643820 IP 10.2.1.2.35961 > 10.1.1.2.22: Flags [.], ack 1578, win 305, options [nop,nop,TS val 4294943453 ecr 4294943762,mptcp 8 dss ack 3518595873], length 0
   90  2013-02-25 12:56:38.689865 IP 10.2.1.2.35961 > 10.1.1.2.22: Flags [P.], seq 2826:2874, ack 1578, win 305, options [nop,nop,TS val 4294943458 ecr 4294943762,mptcp 20 dss ack 3518595873 seq 3576351803 subseq 2826 len 48 csum 0x1991], length 48
   91  2013-02-25 12:56:38.692847 IP 10.1.1.2.22 > 10.2.1.2.35961: Flags [P.], seq 1578:1626, ack 2874, win 707, options [nop,nop,TS val 4294943766 ecr 4294943458,mptcp 20 dss ack 3576351851 seq 3518595873 subseq 1578 len 48 csum 0xb4f], length 48
   92  2013-02-25 12:56:38.693226 IP 10.2.1.2.35961 > 10.1.1.2.22: Flags [.], ack 1626, win 305, options [nop,nop,TS val 4294943458 ecr 4294943766,mptcp 8 dss ack 3518595921], length 0
   93  2013-02-25 12:56:38.704430 IP 10.1.1.2.22 > 10.2.1.2.35961: Flags [P.], seq 1626:1722, ack 2874, win 707, options [nop,nop,TS val 4294943766 ecr 4294943458,mptcp 20 dss ack 3576351851 seq 3518595921 subseq 1626 len 96 csum 0x9334], length 96
   94  2013-02-25 12:56:38.704722 IP 10.1.1.2.22 > 10.2.1.2.35961: Flags [P.], seq 1722:1834, ack 2874, win 707, options [nop,nop,TS val 4294943766 ecr 4294943458,mptcp 20 dss ack 3576351851 seq 3518596017 subseq 1722 len 112 csum 0xdc3f], length 112
   95  2013-02-25 12:56:38.704720 IP 10.2.1.2.35961 > 10.1.1.2.22: Flags [.], ack 1722, win 305, options [nop,nop,TS val 4294943460 ecr 4294943766,mptcp 8 dss ack 3518596017], length 0
   96  2013-02-25 12:56:38.704912 IP 10.2.1.2.35961 > 10.1.1.2.22: Flags [.], ack 1834, win 305, options [nop,nop,TS val 4294943460 ecr 4294943766,mptcp 8 dss ack 3518596129], length 0
   97  2013-02-25 12:56:38.705398 IP 10.1.1.2.22 > 10.2.1.2.35961: Flags [P.], seq 1834:1946, ack 2874, win 707, options [nop,nop,TS val 4294943766 ecr 4294943460,mptcp 20 dss ack 3576351851 seq 3518596129 subseq 1834 len 112 csum 0x349e], length 112
   98  2013-02-25 12:56:38.705503 IP 10.2.1.2.35961 > 10.1.1.2.22: Flags [.], ack 1946, win 305, options [nop,nop,TS val 4294943460 ecr 4294943766,mptcp 8 dss ack 3518596241], length 0
   99  2013-02-25 12:56:38.705834 IP 10.1.1.2.22 > 10.2.1.2.35961: Flags [P.], seq 1946:2042, ack 2874, win 707, options [nop,nop,TS val 4294943766 ecr 4294943460,mptcp 20 dss ack 3576351851 seq 3518596241 subseq 1946 len 96 csum 0xd5fe], length 96
  100  2013-02-25 12:56:38.705918 IP 10.2.1.2.35961 > 10.1.1.2.22: Flags [.], ack 2042, win 305, options [nop,nop,TS val 4294943460 ecr 4294943766,mptcp 8 dss ack 3518596337], length 0
  101  2013-02-25 12:56:38.706030 IP 10.1.1.2.22 > 10.2.1.2.35961: Flags [P.], seq 2042:2154, ack 2874, win 707, options [nop,nop,TS val 4294943766 ecr 4294943460,mptcp 20 dss ack 3576351851 seq 3518596337 subseq 2042 len 112 csum 0x2c14], length 112
  102  2013-02-25 12:56:38.706106 IP 10.2.1.2.35961 > 10.1.1.2.22: Flags [.], ack 2154, win 305, options [nop,nop,TS val 4294943460 ecr 4294943766,mptcp 8 dss ack 3518596449], length 0
  103  2013-02-25 12:56:38.706219 IP 10.1.1.2.22 > 10.2.1.2.35961: Flags [P.], seq 2154:2266, ack 2874, win 707, options [nop,nop,TS val 4294943766 ecr 4294943460,mptcp 20 dss ack 3576351851 seq 3518596449 subseq 2154 len 112 csum 0xe76e], length 112
  104  2013-02-25 12:56:38.706294 IP 10.2.1.2.35961 > 10.1.1.2.22: Flags [.], ack 2266, win 305, options [nop,nop,TS val 4294943460 ecr 4294943766,mptcp 8 dss ack 3518596561], length 0
  105  2013-02-25 12:56:38.706439 IP 10.1.1.2.22 > 10.2.1.2.35961: Flags [P.], seq 2266:2346, ack 2874, win 707, options [nop,nop,TS val 4294943766 ecr 4294943460,mptcp 20 dss ack 3576351851 seq 3518596561 subseq 2266 len 80 csum 0x839a], length 80
  106  2013-02-25 12:56:38.706579 IP 10.1.1.2.22 > 10.2.1.2.35961: Flags [P.], seq 2346:2442, ack 2874, win 707, options [nop,nop,TS val 4294943766 ecr 4294943460,mptcp 20 dss ack 3576351851 seq 3518596641 subseq 2346 len 96 csum 0xc1ee], length 96
  107  2013-02-25 12:56:38.706621 IP 10.2.1.2.35961 > 10.1.1.2.22: Flags [.], ack 2346, win 305, options [nop,nop,TS val 4294943460 ecr 4294943766,mptcp 8 dss ack 3518596641], length 0
  108  2013-02-25 12:56:38.706745 IP 10.2.1.2.35961 > 10.1.1.2.22: Flags [.], ack 2442, win 305, options [nop,nop,TS val 4294943460 ecr 4294943766,mptcp 8 dss ack 3518596737], length 0
  109  2013-02-25 12:56:38.706787 IP 10.1.1.2.22 > 10.2.1.2.35961: Flags [P.], seq 2442:2506, ack 2874, win 707, options [nop,nop,TS val 4294943766 ecr 4294943460,mptcp 20 dss ack 3576351851 seq 3518596737 subseq 2442 len 64 csum 0xe67], length 64
  110  2013-02-25 12:56:38.706938 IP 10.1.1.2.22 > 10.2.1.2.35961: Flags [P.], seq 2506:2554, ack 2874, win 707, options [nop,nop,TS val 4294943766 ecr 4294943460,mptcp 20 dss ack 3576351851 seq 3518596801 subseq 2506 len 48 csum 0x1474], length 48
  111  2013-02-25 12:56:38.706974 IP 10.2.1.2.35961 > 10.1.1.2.22: Flags [.], ack 2506, win 305, options [nop,nop,TS val 4294943460 ecr 4294943766,mptcp 8 dss ack 3518596801], length 0
  112  2013-02-25 12:56:38.707090 IP 10.2.1.2.35961 > 10.1.1.2.22: Flags [.], ack 2554, win 305, options [nop,nop,TS val 4294943460 ecr 4294943766,mptcp 8 dss ack 3518596849], length 0
  113  2013-02-25 12:56:38.707290 IP 10.1.1.2.22 > 10.2.1.2.35961: Flags [P.], seq 2554:2650, ack 2874, win 707, options [nop,nop,TS val 4294943766 ecr 4294943460,mptcp 20 dss ack 3576351851 seq 3518596849 subseq 2554 len 96 csum 0x5dc1], length 96
  114  2013-02-25 12:56:38.707368 IP 10.2.1.2.35961 > 10.1.1.2.22: Flags [.], ack 2650, win 305, options [nop,nop,TS val 4294943460 ecr 4294943766,mptcp 8 dss ack 3518596945], length 0
  115  2013-02-25 12:56:38.707479 IP 10.1.1.2.22 > 10.2.1.2.35961: Flags [P.], seq 2650:2762, ack 2874, win 707, options [nop,nop,TS val 4294943766 ecr 4294943460,mptcp 20 dss ack 3576351851 seq 3518596945 subseq 2650 len 112 csum 0xa20c], length 112
  116  2013-02-25 12:56:38.707556 IP 10.2.1.2.35961 > 10.1.1.2.22: Flags [.], ack 2762, win 305, options [nop,nop,TS val 4294943460 ecr 4294943766,mptcp 8 dss ack 3518597057], length 0
  117  2013-02-25 12:56:38.707798 IP 10.1.1.2.22 > 10.2.1.2.35961: Flags [P.], seq 2762:2874, ack 2874, win 707, options [nop,nop,TS val 4294943766 ecr 4294943460,mptcp 20 dss ack 3576351851 seq 3518597057 subseq 2762 len 112 csum 0x643c], length 112
  118  2013-02-25 12:56:38.707907 IP 10.2.1.2.35961 > 10.1.1.2.22: Flags [.], ack 2874, win 305, options [nop,nop,TS val 4294943460 ecr 4294943766,mptcp 8 dss ack 3518597169], length 0
  119  2013-02-25 12:56:38.708069 IP 10.1.1.2.22 > 10.2.1.2.35961: Flags [P.], seq 2874:2970, ack 2874, win 707, options [nop,nop,TS val 4294943766 ecr 4294943460,mptcp 20 dss ack 3576351851 seq 3518597169 subseq 2874 len 96 csum 0x5244], length 96
  120  2013-02-25 12:56:38.708150 IP 10.2.1.2.35961 > 10.1.1.2.22: Flags [.], ack 2970, win 305, options [nop,nop,TS val 4294943460 ecr 4294943766,mptcp 8 dss ack 3518597265], length 0
  121  2013-02-25 12:56:38.708257 IP 10.1.1.2.22 > 10.2.1.2.35961: Flags [P.], seq 2970:3082, ack 2874, win 707, options [nop,nop,TS val 4294943766 ecr 4294943460,mptcp 20 dss ack 3576351851 seq 3518597265 subseq 2970 len 112 csum 0x295a], length 112
  122  2013-02-25 12:56:38.708364 IP 10.2.1.2.35961 > 10.1.1.2.22: Flags [.], ack 3082, win 305, options [nop,nop,TS val 4294943460 ecr 4294943766,mptcp 8 dss ack 3518597377], length 0
  123  2013-02-25 12:56:38.708439 IP 10.1.1.2.22 > 10.2.1.2.35961: Flags [P.], seq 3082:3194, ack 2874, win 707, options [nop,nop,TS val 4294943766 ecr 4294943460,mptcp 20 dss ack 3576351851 seq 3518597377 subseq 3082 len 112 csum 0x510b], length 112
  124  2013-02-25 12:56:38.708503 IP 10.2.1.2.35961 > 10.1.1.2.22: Flags [.], ack 3194, win 305, options [nop,nop,TS val 4294943460 ecr 4294943766,mptcp 8 dss ack 3518597489], length 0
  125  2013-02-25 12:56:38.708630 IP 10.1.1.2.22 > 10.2.1.2.35961: Flags [P.], seq 3194:3274, ack 2874, win 707, options [nop,nop,TS val 4294943766 ecr 4294943460,mptcp 20 dss ack 3576351851 seq 3518597489 subseq 3194 len 80 csum 0xc29a], length 80
  126  2013-02-25 12:56:38.708702 IP 10.2.1.2.35961 > 10.1.1.2.22: Flags [.], ack 3274, win 305, options [nop,nop,TS val 4294943460 ecr 4294943766,mptcp 8 dss ack 3518597569], length 0
  127  2013-02-25 12:56:38.708814 IP 10.1.1.2.22 > 10.2.1.2.35961: Flags [P.], seq 3274:3370, ack 2874, win 707, options [nop,nop,TS val 4294943766 ecr 4294943460,mptcp 20 dss ack 3576351851 seq 3518597569 subseq 3274 len 96 csum 0x22a5], length 96
  128  2013-02-25 12:56:38.708889 IP 10.2.1.2.35961 > 10.1.1.2.22: Flags [.], ack 3370, win 305, options [nop,nop,TS val 4294943460 ecr 4294943766,mptcp 8 dss ack 3518597665], length 0
  129  2013-02-25 12:56:38.709000 IP 10.1.1.2.22 > 10.2.1.2.35961: Flags [P.], seq 3370:3434, ack 2874, win 707, options [nop,nop,TS val 4294943766 ecr 4294943460,mptcp 20 dss ack 3576351851 seq 3518597665 subseq 3370 len 64 csum 0xe385], length 64
  130  2013-02-25 12:56:38.709084 IP 10.2.1.2.35961 > 10.1.1.2.22: Flags [.], ack 3434, win 305, options [nop,nop,TS val 4294943460 ecr 4294943766,mptcp 8 dss ack 3518597729], length 0
  131  2013-02-25 12:56:38.709182 IP 10.1.1.2.22 > 10.2.1.2.35961: Flags [P.], seq 3434:3482, ack 2874, win 707, options [nop,nop,TS val 4294943766 ecr 4294943460,mptcp 20 dss ack 3576351851 seq 3518597729 subseq 3434 len 48 csum 0xd6b0], length 48
  132  2013-02-25 12:56:38.709253 IP 10.2.1.2.35961 > 10.1.1.2.22: Flags [.], ack 3482, win 305, options [nop,nop,TS val 4294943460 ecr 4294943766,mptcp 8 dss ack 3518597777], length 0
  133  2013-02-25 12:56:38.709658 IP 10.1.1.2.22 > 10.2.1.2.35961: Flags [P.], seq 3482:3562, ack 2874, win 707, options [nop,nop,TS val 4294943766 ecr 4294943460,mptcp 20 dss ack 3576351851 seq 3518597777 subseq 3482 len 80 csum 0xec9d], length 80
  134  2013-02-25 12:56:38.709760 IP 10.2.1.2.35961 > 10.1.1.2.22: Flags [.], ack 3562, win 305, options [nop,nop,TS val 4294943460 ecr 4294943766,mptcp 8 dss ack 3518597857], length 0
  135  2013-02-25 12:56:38.709842 IP 10.1.1.2.22 > 10.2.1.2.35961: Flags [P.], seq 3562:3658, ack 2874, win 707, options [nop,nop,TS val 4294943766 ecr 4294943460,mptcp 20 dss ack 3576351851 seq 3518597857 subseq 3562 len 96 csum 0x1eee], length 96
  136  2013-02-25 12:56:38.709924 IP 10.2.1.2.35961 > 10.1.1.2.22: Flags [.], ack 3658, win 305, options [nop,nop,TS val 4294943460 ecr 4294943766,mptcp 8 dss ack 3518597953], length 0
  137  2013-02-25 12:56:38.710204 IP 10.1.1.2.22 > 10.2.1.2.35961: Flags [P.], seq 3658:3738, ack 2874, win 707, options [nop,nop,TS val 4294943766 ecr 4294943460,mptcp 20 dss ack 3576351851 seq 3518597953 subseq 3658 len 80 csum 0xbc5e], length 80
  138  2013-02-25 12:56:38.710292 IP 10.2.1.2.35961 > 10.1.1.2.22: Flags [.], ack 3738, win 305, options [nop,nop,TS val 4294943460 ecr 4294943766,mptcp 8 dss ack 3518598033], length 0
  139  2013-02-25 12:56:38.710464 IP 10.1.1.2.22 > 10.2.1.2.35961: Flags [P.], seq 3738:3834, ack 2874, win 707, options [nop,nop,TS val 4294943766 ecr 4294943460,mptcp 20 dss ack 3576351851 seq 3518598033 subseq 3738 len 96 csum 0xe], length 96
  140  2013-02-25 12:56:38.710548 IP 10.2.1.2.35961 > 10.1.1.2.22: Flags [.], ack 3834, win 305, options [nop,nop,TS val 4294943460 ecr 4294943766,mptcp 8 dss ack 3518598129], length 0
  141  2013-02-25 12:56:38.710649 IP 10.1.1.2.22 > 10.2.1.2.35961: Flags [P.], seq 3834:3930, ack 2874, win 707, options [nop,nop,TS val 4294943766 ecr 4294943460,mptcp 20 dss ack 3576351851 seq 3518598129 subseq 3834 len 96 csum 0xd42], length 96
  142  2013-02-25 12:56:38.710725 IP 10.2.1.2.35961 > 10.1.1.2.22: Flags [.], ack 3930, win 305, options [nop,nop,TS val 4294943460 ecr 4294943766,mptcp 8 dss ack 3518598225], length 0
  143  2013-02-25 12:56:38.710836 IP 10.1.1.2.22 > 10.2.1.2.35961: Flags [P.], seq 3930:4042, ack 2874, win 707, options [nop,nop,TS val 4294943766 ecr 4294943460,mptcp 20 dss ack 3576351851 seq 3518598225 subseq 3930 len 112 csum 0xb006], length 112
  144  2013-02-25 12:56:38.710917 IP 10.2.1.2.35961 > 10.1.1.2.22: Flags [.], ack 4042, win 305, options [nop,nop,TS val 4294943460 ecr 4294943766,mptcp 8 dss ack 3518598337], length 0
  145  2013-02-25 12:56:38.711017 IP 10.1.1.2.22 > 10.2.1.2.35961: Flags [P.], seq 4042:4122, ack 2874, win 707, options [nop,nop,TS val 4294943766 ecr 4294943460,mptcp 20 dss ack 3576351851 seq 3518598337 subseq 4042 len 80 csum 0x986f], length 80
  146  2013-02-25 12:56:38.711099 IP 10.2.1.2.35961 > 10.1.1.2.22: Flags [.], ack 4122, win 305, options [nop,nop,TS val 4294943460 ecr 4294943766,mptcp 8 dss ack 3518598417], length 0
  147  2013-02-25 12:56:38.711223 IP 10.1.1.2.22 > 10.2.1.2.35961: Flags [P.], seq 4122:4218, ack 2874, win 707, options [nop,nop,TS val 4294943766 ecr 4294943460,mptcp 20 dss ack 3576351851 seq 3518598417 subseq 4122 len 96 csum 0x43ff], length 96
  148  2013-02-25 12:56:38.711303 IP 10.2.1.2.35961 > 10.1.1.2.22: Flags [.], ack 4218, win 305, options [nop,nop,TS val 4294943460 ecr 4294943766,mptcp 8 dss ack 3518598513], length 0
  149  2013-02-25 12:56:38.711404 IP 10.1.1.2.22 > 10.2.1.2.35961: Flags [P.], seq 4218:4266, ack 2874, win 707, options [nop,nop,TS val 4294943766 ecr 4294943460,mptcp 20 dss ack 3576351851 seq 3518598513 subseq 4218 len 48 csum 0x8666], length 48
  150  2013-02-25 12:56:38.711483 IP 10.2.1.2.35961 > 10.1.1.2.22: Flags [.], ack 4266, win 305, options [nop,nop,TS val 4294943460 ecr 4294943766,mptcp 8 dss ack 3518598561], length 0
  151  2013-02-25 12:56:38.713568 IP 10.1.1.2.22 > 10.2.1.2.35961: Flags [P.], seq 4266:4346, ack 2874, win 707, options [nop,nop,TS val 4294943766 ecr 4294943460,mptcp 20 dss ack 3576351851 seq 3518598561 subseq 4266 len 80 csum 0x9239], length 80
  152  2013-02-25 12:56:38.713674 IP 10.2.1.2.35961 > 10.1.1.2.22: Flags [.], ack 4346, win 305, options [nop,nop,TS val 4294943460 ecr 4294943766,mptcp 8 dss ack 3518598641], length 0
  153  2013-02-25 12:56:38.954239 IP 10.2.1.2.35961 > 10.1.1.2.22: Flags [P.], seq 2874:2922, ack 4346, win 305, options [nop,nop,TS val 4294943484 ecr 4294943766,mptcp 20 dss ack 3518598641 seq 3576351851 subseq 2874 len 48 csum 0xd397], length 48
  154  2013-02-25 12:56:38.955671 IP 10.1.1.2.22 > 10.2.1.2.35961: Flags [P.], seq 4346:4394, ack 2922, win 707, options [nop,nop,TS val 4294943793 ecr 4294943484,mptcp 20 dss ack 3576351899 seq 3518598641 subseq 4346 len 48 csum 0xeeaa], length 48
  155  2013-02-25 12:56:38.955827 IP 10.2.1.2.35961 > 10.1.1.2.22: Flags [.], ack 4394, win 305, options [nop,nop,TS val 4294943484 ecr 4294943793,mptcp 8 dss ack 3518598689], length 0
  156  2013-02-25 12:56:39.074043 IP 10.2.1.2.35961 > 10.1.1.2.22: Flags [P.], seq 2922:2970, ack 4394, win 305, options [nop,nop,TS val 4294943496 ecr 4294943793,mptcp 20 dss ack 3518598689 seq 3576351899 subseq 2922 len 48 csum 0x48a7], length 48
  157  2013-02-25 12:56:39.075052 IP 10.1.1.2.22 > 10.2.1.2.35961: Flags [P.], seq 4394:4442, ack 2970, win 707, options [nop,nop,TS val 4294943805 ecr 4294943496,mptcp 20 dss ack 3576351947 seq 3518598689 subseq 4394 len 48 csum 0xc354], length 48
  158  2013-02-25 12:56:39.075234 IP 10.2.1.2.35961 > 10.1.1.2.22: Flags [.], ack 4442, win 305, options [nop,nop,TS val 4294943496 ecr 4294943805,mptcp 8 dss ack 3518598737], length 0
  159  2013-02-25 12:56:39.242209 IP 10.2.1.2.35961 > 10.1.1.2.22: Flags [P.], seq 2970:3018, ack 4442, win 305, options [nop,nop,TS val 4294943513 ecr 4294943805,mptcp 20 dss ack 3518598737 seq 3576351947 subseq 2970 len 48 csum 0xf6d], length 48
  160  2013-02-25 12:56:39.243635 IP 10.1.1.2.22 > 10.2.1.2.35961: Flags [P.], seq 4442:4490, ack 3018, win 707, options [nop,nop,TS val 4294943822 ecr 4294943513,mptcp 20 dss ack 3576351995 seq 3518598737 subseq 4442 len 48 csum 0xe0e2], length 48
  161  2013-02-25 12:56:39.243810 IP 10.2.1.2.35961 > 10.1.1.2.22: Flags [.], ack 4490, win 305, options [nop,nop,TS val 4294943513 ecr 4294943822,mptcp 8 dss ack 3518598785], length 0
  162  2013-02-25 12:56:39.322026 IP 10.2.1.2.35961 > 10.1.1.2.22: Flags [P.], seq 3018:3066, ack 4490, win 305, options [nop,nop,TS val 4294943521 ecr 4294943822,mptcp 20 dss ack 3518598785 seq 3576351995 subseq 3018 len 48 csum 0xf320], length 48
  163  2013-02-25 12:56:39.323337 IP 10.1.1.2.22 > 10.2.1.2.35961: Flags [P.], seq 4490:4538, ack 3066, win 707, options [nop,nop,TS val 4294943830 ecr 4294943521,mptcp 20 dss ack 3576352043 seq 3518598785 subseq 4490 len 48 csum 0x9c04], length 48
  164  2013-02-25 12:56:39.323491 IP 10.2.1.2.35961 > 10.1.1.2.22: Flags [.], ack 4538, win 305, options [nop,nop,TS val 4294943521 ecr 4294943830,mptcp 8 dss ack 3518598833], length 0
  165  2013-02-25 12:56:39.361866 IP 10.2.1.2.35961 > 10.1.1.2.22: Flags [P.], seq 3066:3114, ack 4538, win 305, options [nop,nop,TS val 4294943525 ecr 4294943830,mptcp 20 dss ack 3518598833 seq 3576352043 subseq 3066 len 48 csum 0x88f6], length 48
  166  2013-02-25 12:56:39.362991 IP 10.1.1.2.22 > 10.2.1.2.35961: Flags [P.], seq 4538:4586, ack 3114, win 707, options [nop,nop,TS val 4294943834 ecr 4294943525,mptcp 20 dss ack 3576352091 seq 3518598833 subseq 4538 len 48 csum 0x8612], length 48
  167  2013-02-25 12:56:39.363134 IP 10.2.1.2.35961 > 10.1.1.2.22: Flags [.], ack 4586, win 305, options [nop,nop,TS val 4294943525 ecr 4294943834,mptcp 8 dss ack 3518598881], length 0
  168  2013-02-25 12:56:39.433951 IP 10.2.1.2.35961 > 10.1.1.2.22: Flags [P.], seq 3114:3162, ack 4586, win 305, options [nop,nop,TS val 4294943532 ecr 4294943834,mptcp 20 dss ack 3518598881 seq 3576352091 subseq 3114 len 48 csum 0xa14c], length 48
  169  2013-02-25 12:56:39.434823 IP 10.1.1.2.22 > 10.2.1.2.35961: Flags [P.], seq 4586:4634, ack 3162, win 707, options [nop,nop,TS val 4294943841 ecr 4294943532,mptcp 20 dss ack 3576352139 seq 3518598881 subseq 4586 len 48 csum 0x7979], length 48
  170  2013-02-25 12:56:39.434954 IP 10.2.1.2.35961 > 10.1.1.2.22: Flags [.], ack 4634, win 305, options [nop,nop,TS val 4294943532 ecr 4294943841,mptcp 8 dss ack 3518598929], length 0
  171  2013-02-25 12:56:39.538085 IP 10.2.1.2.35961 > 10.1.1.2.22: Flags [P.], seq 3162:3210, ack 4634, win 305, options [nop,nop,TS val 4294943543 ecr 4294943841,mptcp 20 dss ack 3518598929 seq 3576352139 subseq 3162 len 48 csum 0x7c49], length 48
  172  2013-02-25 12:56:39.539055 IP 10.1.1.2.22 > 10.2.1.2.35961: Flags [P.], seq 4634:4682, ack 3210, win 707, options [nop,nop,TS val 4294943851 ecr 4294943543,mptcp 20 dss ack 3576352187 seq 3518598929 subseq 4634 len 48 csum 0x7799], length 48
  173  2013-02-25 12:56:39.539201 IP 10.2.1.2.35961 > 10.1.1.2.22: Flags [.], ack 4682, win 305, options [nop,nop,TS val 4294943543 ecr 4294943851,mptcp 8 dss ack 3518598977], length 0
  174  2013-02-25 12:56:39.602143 IP 10.2.1.2.35961 > 10.1.1.2.22: Flags [P.], seq 3210:3258, ack 4682, win 305, options [nop,nop,TS val 4294943549 ecr 4294943851,mptcp 20 dss ack 3518598977 seq 3576352187 subseq 3210 len 48 csum 0x7589], length 48
  175  2013-02-25 12:56:39.603190 IP 10.1.1.2.22 > 10.2.1.2.35961: Flags [P.], seq 4682:4730, ack 3258, win 707, options [nop,nop,TS val 4294943858 ecr 4294943549,mptcp 20 dss ack 3576352235 seq 3518598977 subseq 4682 len 48 csum 0x9da3], length 48
  176  2013-02-25 12:56:39.603371 IP 10.2.1.2.35961 > 10.1.1.2.22: Flags [.], ack 4730, win 305, options [nop,nop,TS val 4294943549 ecr 4294943858,mptcp 8 dss ack 3518599025], length 0
  177  2013-02-25 12:56:39.714195 IP 10.2.1.2.35961 > 10.1.1.2.22: Flags [P.], seq 3258:3306, ack 4730, win 305, options [nop,nop,TS val 4294943560 ecr 4294943858,mptcp 20 dss ack 3518599025 seq 3576352235 subseq 3258 len 48 csum 0x652], length 48
  178  2013-02-25 12:56:39.715277 IP 10.1.1.2.22 > 10.2.1.2.35961: Flags [P.], seq 4730:4778, ack 3306, win 707, options [nop,nop,TS val 4294943869 ecr 4294943560,mptcp 20 dss ack 3576352283 seq 3518599025 subseq 4730 len 48 csum 0xf212], length 48
  179  2013-02-25 12:56:39.715503 IP 10.2.1.2.35961 > 10.1.1.2.22: Flags [.], ack 4778, win 305, options [nop,nop,TS val 4294943560 ecr 4294943869,mptcp 8 dss ack 3518599073], length 0
  180  2013-02-25 12:56:39.833979 IP 10.2.1.2.35961 > 10.1.1.2.22: Flags [P.], seq 3306:3354, ack 4778, win 305, options [nop,nop,TS val 4294943572 ecr 4294943869,mptcp 20 dss ack 3518599073 seq 3576352283 subseq 3306 len 48 csum 0x757c], length 48
  181  2013-02-25 12:56:39.834867 IP 10.1.1.2.22 > 10.2.1.2.35961: Flags [P.], seq 4778:4826, ack 3354, win 707, options [nop,nop,TS val 4294943881 ecr 4294943572,mptcp 20 dss ack 3576352331 seq 3518599073 subseq 4778 len 48 csum 0x5cf1], length 48
  182  2013-02-25 12:56:39.835113 IP 10.2.1.2.35961 > 10.1.1.2.22: Flags [.], ack 4826, win 305, options [nop,nop,TS val 4294943572 ecr 4294943881,mptcp 8 dss ack 3518599121], length 0
  183  2013-02-25 12:56:39.914071 IP 10.2.1.2.35961 > 10.1.1.2.22: Flags [P.], seq 3354:3402, ack 4826, win 305, options [nop,nop,TS val 4294943580 ecr 4294943881,mptcp 20 dss ack 3518599121 seq 3576352331 subseq 3354 len 48 csum 0x363c], length 48
  184  2013-02-25 12:56:39.914889 IP 10.1.1.2.22 > 10.2.1.2.35961: Flags [P.], seq 4826:4874, ack 3402, win 707, options [nop,nop,TS val 4294943889 ecr 4294943580,mptcp 20 dss ack 3576352379 seq 3518599121 subseq 4826 len 48 csum 0xdae4], length 48
  185  2013-02-25 12:56:39.915103 IP 10.2.1.2.35961 > 10.1.1.2.22: Flags [.], ack 4874, win 305, options [nop,nop,TS val 4294943580 ecr 4294943889,mptcp 8 dss ack 3518599169], length 0
  186  2013-02-25 12:56:40.002079 IP 10.2.1.2.35961 > 10.1.1.2.22: Flags [P.], seq 3402:3450, ack 4874, win 305, options [nop,nop,TS val 4294943589 ecr 4294943889,mptcp 20 dss ack 3518599169 seq 3576352379 subseq 3402 len 48 csum 0x5ded], length 48
  187  2013-02-25 12:56:40.003138 IP 10.1.1.2.22 > 10.2.1.2.35961: Flags [P.], seq 4874:4922, ack 3450, win 707, options [nop,nop,TS val 4294943898 ecr 4294943589,mptcp 20 dss ack 3576352427 seq 3518599169 subseq 4874 len 48 csum 0xb977], length 48
  188  2013-02-25 12:56:40.003379 IP 10.2.1.2.35961 > 10.1.1.2.22: Flags [.], ack 4922, win 305, options [nop,nop,TS val 4294943589 ecr 4294943898,mptcp 8 dss ack 3518599217], length 0
  189  2013-02-25 12:56:40.354251 IP 10.2.1.2.35961 > 10.1.1.2.22: Flags [P.], seq 3450:3498, ack 4922, win 305, options [nop,nop,TS val 4294943624 ecr 4294943898,mptcp 20 dss ack 3518599217 seq 3576352427 subseq 3450 len 48 csum 0x8425], length 48
  190  2013-02-25 12:56:40.355428 IP 10.1.1.2.22 > 10.2.1.2.35961: Flags [P.], seq 4922:4970, ack 3498, win 707, options [nop,nop,TS val 4294943933 ecr 4294943624,mptcp 20 dss ack 3576352475 seq 3518599217 subseq 4922 len 48 csum 0x1a42], length 48
  191  2013-02-25 12:56:40.355583 IP 10.2.1.2.35961 > 10.1.1.2.22: Flags [.], ack 4970, win 305, options [nop,nop,TS val 4294943624 ecr 4294943933,mptcp 8 dss ack 3518599265], length 0
  192  2013-02-25 12:56:40.859118 IP 10.2.1.2.35961 > 10.1.1.2.22: Flags [P.], seq 3498:3546, ack 4970, win 305, options [nop,nop,TS val 4294943675 ecr 4294943933,mptcp 20 dss ack 3518599265 seq 3576352475 subseq 3498 len 48 csum 0x37f5], length 48
  193  2013-02-25 12:56:40.860192 IP 10.1.1.2.22 > 10.2.1.2.35961: Flags [P.], seq 4970:5018, ack 3546, win 707, options [nop,nop,TS val 4294943983 ecr 4294943675,mptcp 20 dss ack 3576352523 seq 3518599265 subseq 4970 len 48 csum 0xb0f0], length 48
  194  2013-02-25 12:56:40.860346 IP 10.2.1.2.35961 > 10.1.1.2.22: Flags [.], ack 5018, win 305, options [nop,nop,TS val 4294943675 ecr 4294943983,mptcp 8 dss ack 3518599313], length 0
  195  2013-02-25 12:56:40.994318 IP 10.2.1.2.35961 > 10.1.1.2.22: Flags [P.], seq 3546:3594, ack 5018, win 305, options [nop,nop,TS val 4294943688 ecr 4294943983,mptcp 20 dss ack 3518599313 seq 3576352523 subseq 3546 len 48 csum 0xd912], length 48
  196  2013-02-25 12:56:40.995959 IP 10.1.1.2.22 > 10.2.1.2.35961: Flags [P.], seq 5018:5066, ack 3594, win 707, options [nop,nop,TS val 4294943997 ecr 4294943688,mptcp 20 dss ack 3576352571 seq 3518599313 subseq 5018 len 48 csum 0x5be5], length 48
  197  2013-02-25 12:56:40.996118 IP 10.2.1.2.35961 > 10.1.1.2.22: Flags [.], ack 5066, win 305, options [nop,nop,TS val 4294943688 ecr 4294943997,mptcp 8 dss ack 3518599361], length 0
  198  2013-02-25 12:56:41.138012 IP 10.2.1.2.35961 > 10.1.1.2.22: Flags [P.], seq 3594:3642, ack 5066, win 305, options [nop,nop,TS val 4294943703 ecr 4294943997,mptcp 20 dss ack 3518599361 seq 3576352571 subseq 3594 len 48 csum 0x539a], length 48
  199  2013-02-25 12:56:41.139064 IP 10.1.1.2.22 > 10.2.1.2.35961: Flags [P.], seq 5066:5114, ack 3642, win 707, options [nop,nop,TS val 4294944011 ecr 4294943703,mptcp 20 dss ack 3576352619 seq 3518599361 subseq 5066 len 48 csum 0x2d9e], length 48
  200  2013-02-25 12:56:41.139220 IP 10.2.1.2.35961 > 10.1.1.2.22: Flags [.], ack 5114, win 305, options [nop,nop,TS val 4294943703 ecr 4294944011,mptcp 8 dss ack 3518599409], length 0
  201  2013-02-25 12:56:41.233988 IP 10.2.1.2.35961 > 10.1.1.2.22: Flags [P.], seq 3642:3690, ack 5114, win 305, options [nop,nop,TS val 4294943712 ecr 4294944011,mptcp 20 dss ack 3518599409 seq 3576352619 subseq 3642 len 48 csum 0xbda6], length 48
  202  2013-02-25 12:56:41.235129 IP 10.1.1.2.22 > 10.2.1.2.35961: Flags [P.], seq 5114:5162, ack 3690, win 707, options [nop,nop,TS val 4294944021 ecr 4294943712,mptcp 20 dss ack 3576352667 seq 3518599409 subseq 5114 len 48 csum 0x1bc7], length 48
  203  2013-02-25 12:56:41.235295 IP 10.2.1.2.35961 > 10.1.1.2.22: Flags [.], ack 5162, win 305, options [nop,nop,TS val 4294943712 ecr 4294944021,mptcp 8 dss ack 3518599457], length 0
  204  2013-02-25 12:56:41.361966 IP 10.2.1.2.35961 > 10.1.1.2.22: Flags [P.], seq 3690:3738, ack 5162, win 305, options [nop,nop,TS val 4294943725 ecr 4294944021,mptcp 20 dss ack 3518599457 seq 3576352667 subseq 3690 len 48 csum 0xad71], length 48
  205  2013-02-25 12:56:41.362913 IP 10.1.1.2.22 > 10.2.1.2.35961: Flags [P.], seq 5162:5210, ack 3738, win 707, options [nop,nop,TS val 4294944034 ecr 4294943725,mptcp 20 dss ack 3576352715 seq 3518599457 subseq 5162 len 48 csum 0xf8f7], length 48
  206  2013-02-25 12:56:41.363042 IP 10.2.1.2.35961 > 10.1.1.2.22: Flags [.], ack 5210, win 305, options [nop,nop,TS val 4294943725 ecr 4294944034,mptcp 8 dss ack 3518599505], length 0
  207  2013-02-25 12:56:41.570122 IP 10.2.1.2.35961 > 10.1.1.2.22: Flags [P.], seq 3738:3786, ack 5210, win 305, options [nop,nop,TS val 4294943746 ecr 4294944034,mptcp 20 dss ack 3518599505 seq 3576352715 subseq 3738 len 48 csum 0xd16], length 48
  208  2013-02-25 12:56:41.575162 IP 10.1.1.2.22 > 10.2.1.2.35961: Flags [P.], seq 5210:5258, ack 3786, win 707, options [nop,nop,TS val 4294944054 ecr 4294943746,mptcp 20 dss ack 3576352763 seq 3518599505 subseq 5210 len 48 csum 0x8122], length 48
  209  2013-02-25 12:56:41.575354 IP 10.2.1.2.35961 > 10.1.1.2.22: Flags [.], ack 5258, win 305, options [nop,nop,TS val 4294943746 ecr 4294944054,mptcp 8 dss ack 3518599553], length 0
  210  2013-02-25 12:56:41.599551 IP 10.1.2.2.22 > 10.2.1.2.41221: Flags [.], ack 617, win 707, options [nop,nop,TS val 4294944054 ecr 4294943306,mptcp 4 rem-addr id 0,mptcp 8 dss ack 3576352763], length 0
  211  2013-02-25 12:56:41.599719 IP 10.2.1.2.35961 > 10.1.1.2.22: Flags [R.], seq 3786, ack 5258, win 305, options [nop,nop,TS val 4294943749 ecr 4294944054,mptcp 8 dss ack 3518599553], length 0
  212  2013-02-25 12:56:41.602591 IP 10.1.2.2.22 > 10.2.1.2.41221: Flags [P.], seq 2153:2233, ack 617, win 707, options [nop,nop,TS val 4294944054 ecr 4294943306,mptcp 20 dss ack 3576352763 seq 3518599553 subseq 2153 len 80 csum 0xe206], length 80
  213  2013-02-25 12:56:41.602690 IP 10.2.1.2.41221 > 10.1.2.2.22: Flags [.], ack 2233, win 305, options [nop,nop,TS val 4294943749 ecr 4294944054,mptcp 8 dss ack 3518599633], length 0
  214  2013-02-25 12:56:41.930276 IP 10.2.1.2.41221 > 10.1.2.2.22: Flags [P.], seq 617:665, ack 2233, win 305, options [nop,nop,TS val 4294943782 ecr 4294944054,mptcp 20 dss ack 3518599633 seq 3576352763 subseq 617 len 48 csum 0xa135], length 48
  215  2013-02-25 12:56:41.930432 IP 10.1.2.2.22 > 10.2.1.2.41221: Flags [.], ack 665, win 707, options [nop,nop,TS val 4294944090 ecr 4294943782,mptcp 8 dss ack 3576352811], length 0
  216  2013-02-25 12:56:41.932626 IP 10.1.2.2.22 > 10.2.1.2.41221: Flags [P.], seq 2233:2313, ack 665, win 707, options [nop,nop,TS val 4294944090 ecr 4294943782,mptcp 20 dss ack 3576352811 seq 3518599633 subseq 2233 len 80 csum 0x917d], length 80
  217  2013-02-25 12:56:41.932708 IP 10.2.1.2.41221 > 10.1.2.2.22: Flags [.], ack 2313, win 305, options [nop,nop,TS val 4294943782 ecr 4294944090,mptcp 8 dss ack 3518599713], length 0
  218  2013-02-25 12:56:42.081986 IP 10.2.1.2.41221 > 10.1.2.2.22: Flags [P.], seq 665:713, ack 2313, win 305, options [nop,nop,TS val 4294943797 ecr 4294944090,mptcp 20 dss ack 3518599713 seq 3576352811 subseq 665 len 48 csum 0x3789], length 48
  219  2013-02-25 12:56:42.083828 IP 10.1.2.2.22 > 10.2.1.2.41221: Flags [P.], seq 2313:2393, ack 713, win 707, options [nop,nop,TS val 4294944106 ecr 4294943797,mptcp 20 dss ack 3576352859 seq 3518599713 subseq 2313 len 80 csum 0x6cf1], length 80
  220  2013-02-25 12:56:42.083976 IP 10.2.1.2.41221 > 10.1.2.2.22: Flags [.], ack 2393, win 305, options [nop,nop,TS val 4294943797 ecr 4294944106,mptcp 8 dss ack 3518599793], length 0
  221  2013-02-25 12:56:42.218171 IP 10.2.1.2.41221 > 10.1.2.2.22: Flags [P.], seq 713:761, ack 2393, win 305, options [nop,nop,TS val 4294943811 ecr 4294944106,mptcp 20 dss ack 3518599793 seq 3576352859 subseq 713 len 48 csum 0xc47b], length 48
  222  2013-02-25 12:56:42.220075 IP 10.1.2.2.22 > 10.2.1.2.41221: Flags [P.], seq 2393:2473, ack 761, win 707, options [nop,nop,TS val 4294944119 ecr 4294943811,mptcp 20 dss ack 3576352907 seq 3518599793 subseq 2393 len 80 csum 0x226], length 80
  223  2013-02-25 12:56:42.220224 IP 10.2.1.2.41221 > 10.1.2.2.22: Flags [.], ack 2473, win 305, options [nop,nop,TS val 4294943811 ecr 4294944119,mptcp 8 dss ack 3518599873], length 0
  224  2013-02-25 12:56:42.370244 IP 10.2.1.2.41221 > 10.1.2.2.22: Flags [P.], seq 761:809, ack 2473, win 305, options [nop,nop,TS val 4294943826 ecr 4294944119,mptcp 20 dss ack 3518599873 seq 3576352907 subseq 761 len 48 csum 0x187f], length 48
  225  2013-02-25 12:56:42.372486 IP 10.1.2.2.22 > 10.2.1.2.41221: Flags [P.], seq 2473:2553, ack 809, win 707, options [nop,nop,TS val 4294944134 ecr 4294943826,mptcp 20 dss ack 3576352955 seq 3518599873 subseq 2473 len 80 csum 0xe4fe], length 80
  226  2013-02-25 12:56:42.372640 IP 10.2.1.2.41221 > 10.1.2.2.22: Flags [.], ack 2553, win 305, options [nop,nop,TS val 4294943826 ecr 4294944134,mptcp 8 dss ack 3518599953], length 0
  227  2013-02-25 12:56:42.514114 IP 10.2.1.2.41221 > 10.1.2.2.22: Flags [P.], seq 809:857, ack 2553, win 305, options [nop,nop,TS val 4294943840 ecr 4294944134,mptcp 20 dss ack 3518599953 seq 3576352955 subseq 809 len 48 csum 0xf780], length 48
  228  2013-02-25 12:56:42.516305 IP 10.1.2.2.22 > 10.2.1.2.41221: Flags [P.], seq 2553:2633, ack 857, win 707, options [nop,nop,TS val 4294944149 ecr 4294943840,mptcp 20 dss ack 3576353003 seq 3518599953 subseq 2553 len 80 csum 0xb0e6], length 80
  229  2013-02-25 12:56:42.516474 IP 10.2.1.2.41221 > 10.1.2.2.22: Flags [.], ack 2633, win 305, options [nop,nop,TS val 4294943841 ecr 4294944149,mptcp 8 dss ack 3518600033], length 0
  230  2013-02-25 12:56:42.666380 IP 10.2.1.2.41221 > 10.1.2.2.22: Flags [P.], seq 857:905, ack 2633, win 305, options [nop,nop,TS val 4294943856 ecr 4294944149,mptcp 20 dss ack 3518600033 seq 3576353003 subseq 857 len 48 csum 0x1272], length 48
  231  2013-02-25 12:56:42.668518 IP 10.1.2.2.22 > 10.2.1.2.41221: Flags [P.], seq 2633:2713, ack 905, win 707, options [nop,nop,TS val 4294944164 ecr 4294943856,mptcp 20 dss ack 3576353051 seq 3518600033 subseq 2633 len 80 csum 0x2521], length 80
  232  2013-02-25 12:56:42.668674 IP 10.2.1.2.41221 > 10.1.2.2.22: Flags [.], ack 2713, win 305, options [nop,nop,TS val 4294943856 ecr 4294944164,mptcp 8 dss ack 3518600113], length 0
  233  2013-02-25 12:56:42.818341 IP 10.2.1.2.41221 > 10.1.2.2.22: Flags [P.], seq 905:953, ack 2713, win 305, options [nop,nop,TS val 4294943871 ecr 4294944164,mptcp 20 dss ack 3518600113 seq 3576353051 subseq 905 len 48 csum 0xeb71], length 48
  234  2013-02-25 12:56:42.820464 IP 10.1.2.2.22 > 10.2.1.2.41221: Flags [P.], seq 2713:2793, ack 953, win 707, options [nop,nop,TS val 4294944179 ecr 4294943871,mptcp 20 dss ack 3576353099 seq 3518600113 subseq 2713 len 80 csum 0xdd08], length 80
  235  2013-02-25 12:56:42.820698 IP 10.2.1.2.41221 > 10.1.2.2.22: Flags [.], ack 2793, win 305, options [nop,nop,TS val 4294943871 ecr 4294944179,mptcp 8 dss ack 3518600193], length 0
  236  2013-02-25 12:56:42.978188 IP 10.2.1.2.41221 > 10.1.2.2.22: Flags [P.], seq 953:1001, ack 2793, win 305, options [nop,nop,TS val 4294943887 ecr 4294944179,mptcp 20 dss ack 3518600193 seq 3576353099 subseq 953 len 48 csum 0xf047], length 48
  237  2013-02-25 12:56:42.980124 IP 10.1.2.2.22 > 10.2.1.2.41221: Flags [P.], seq 2793:2873, ack 1001, win 707, options [nop,nop,TS val 4294944195 ecr 4294943887,mptcp 20 dss ack 3576353147 seq 3518600193 subseq 2793 len 80 csum 0x3967], length 80
  238  2013-02-25 12:56:42.980335 IP 10.2.1.2.41221 > 10.1.2.2.22: Flags [.], ack 2873, win 305, options [nop,nop,TS val 4294943887 ecr 4294944195,mptcp 8 dss ack 3518600273], length 0
  239  2013-02-25 12:56:44.290226 IP 10.2.1.2.41221 > 10.1.2.2.22: Flags [P.], seq 1001:1049, ack 2873, win 305, options [nop,nop,TS val 4294944018 ecr 4294944195,mptcp 20 dss ack 3518600273 seq 3576353147 subseq 1001 len 48 csum 0xa43d], length 48
  240  2013-02-25 12:56:44.291486 IP 10.1.2.2.22 > 10.2.1.2.41221: Flags [P.], seq 2873:2921, ack 1049, win 707, options [nop,nop,TS val 4294944326 ecr 4294944018,mptcp 20 dss ack 3576353195 seq 3518600273 subseq 2873 len 48 csum 0x1c25], length 48
  241  2013-02-25 12:56:44.291654 IP 10.2.1.2.41221 > 10.1.2.2.22: Flags [.], ack 2921, win 305, options [nop,nop,TS val 4294944018 ecr 4294944326,mptcp 8 dss ack 3518600321], length 0
  242  2013-02-25 12:56:44.434269 IP 10.2.1.2.41221 > 10.1.2.2.22: Flags [P.], seq 1049:1097, ack 2921, win 305, options [nop,nop,TS val 4294944032 ecr 4294944326,mptcp 20 dss ack 3518600321 seq 3576353195 subseq 1049 len 48 csum 0xebdc], length 48
  243  2013-02-25 12:56:44.435415 IP 10.1.2.2.22 > 10.2.1.2.41221: Flags [P.], seq 2921:2969, ack 1097, win 707, options [nop,nop,TS val 4294944341 ecr 4294944032,mptcp 20 dss ack 3576353243 seq 3518600321 subseq 2921 len 48 csum 0xf7df], length 48
  244  2013-02-25 12:56:44.435573 IP 10.2.1.2.41221 > 10.1.2.2.22: Flags [.], ack 2969, win 305, options [nop,nop,TS val 4294944032 ecr 4294944341,mptcp 8 dss ack 3518600369], length 0
  245  2013-02-25 12:56:44.482151 IP 10.2.1.2.41221 > 10.1.2.2.22: Flags [P.], seq 1097:1145, ack 2969, win 305, options [nop,nop,TS val 4294944037 ecr 4294944341,mptcp 20 dss ack 3518600369 seq 3576353243 subseq 1097 len 48 csum 0xb656], length 48
  246  2013-02-25 12:56:44.483062 IP 10.1.2.2.22 > 10.2.1.2.41221: Flags [P.], seq 2969:3017, ack 1145, win 707, options [nop,nop,TS val 4294944346 ecr 4294944037,mptcp 20 dss ack 3576353291 seq 3518600369 subseq 2969 len 48 csum 0x73fb], length 48
  247  2013-02-25 12:56:44.483215 IP 10.2.1.2.41221 > 10.1.2.2.22: Flags [.], ack 3017, win 305, options [nop,nop,TS val 4294944037 ecr 4294944346,mptcp 8 dss ack 3518600417], length 0
  248  2013-02-25 12:56:44.674296 IP 10.2.1.2.41221 > 10.1.2.2.22: Flags [P.], seq 1145:1193, ack 3017, win 305, options [nop,nop,TS val 4294944056 ecr 4294944346,mptcp 20 dss ack 3518600417 seq 3576353291 subseq 1145 len 48 csum 0x7813], length 48
  249  2013-02-25 12:56:44.675404 IP 10.1.2.2.22 > 10.2.1.2.41221: Flags [P.], seq 3017:3065, ack 1193, win 707, options [nop,nop,TS val 4294944365 ecr 4294944056,mptcp 20 dss ack 3576353339 seq 3518600417 subseq 3017 len 48 csum 0xa7ff], length 48
  250  2013-02-25 12:56:44.675561 IP 10.2.1.2.41221 > 10.1.2.2.22: Flags [.], ack 3065, win 305, options [nop,nop,TS val 4294944056 ecr 4294944365,mptcp 8 dss ack 3518600465], length 0
  251  2013-02-25 12:56:44.746191 IP 10.2.1.2.41221 > 10.1.2.2.22: Flags [P.], seq 1193:1241, ack 3065, win 305, options [nop,nop,TS val 4294944064 ecr 4294944365,mptcp 20 dss ack 3518600465 seq 3576353339 subseq 1193 len 48 csum 0xd43c], length 48
  252  2013-02-25 12:56:44.755013 IP 10.1.2.2.22 > 10.2.1.2.41221: Flags [P.], seq 3065:3241, ack 1241, win 707, options [nop,nop,TS val 4294944372 ecr 4294944064,mptcp 20 dss ack 3576353387 seq 3518600465 subseq 3065 len 176 csum 0x49a0], length 176
  253  2013-02-25 12:56:44.755179 IP 10.1.2.2.22 > 10.2.1.2.41221: Flags [P.], seq 3241:3305, ack 1241, win 707, options [nop,nop,TS val 4294944372 ecr 4294944064,mptcp 20 dss ack 3576353387 seq 3518600641 subseq 3241 len 64 csum 0x2541], length 64
  254  2013-02-25 12:56:44.755227 IP 10.2.1.2.41221 > 10.1.2.2.22: Flags [.], ack 3241, win 310, options [nop,nop,TS val 4294944064 ecr 4294944372,mptcp 8 dss ack 3518600641], length 0
  255  2013-02-25 12:56:44.755349 IP 10.2.1.2.41221 > 10.1.2.2.22: Flags [.], ack 3305, win 310, options [nop,nop,TS val 4294944064 ecr 4294944372,mptcp 8 dss ack 3518600705], length 0
  256  2013-02-25 12:56:44.755920 IP 10.2.1.2.41221 > 10.1.2.2.22: Flags [P.], seq 1241:1273, ack 3305, win 310, options [nop,nop,TS val 4294944064 ecr 4294944372,mptcp 20 dss ack 3518600705 seq 3576353387 subseq 1241 len 32 csum 0xec34], length 32
  257  2013-02-25 12:56:44.756076 IP 10.2.1.2.41221 > 10.1.2.2.22: Flags [P.], seq 1273:1337, ack 3305, win 310, options [nop,nop,TS val 4294944064 ecr 4294944372,mptcp 20 dss ack 3518600705 seq 3576353419 subseq 1273 len 64 csum 0x3f93], length 64
  258  2013-02-25 12:56:44.756224 IP 10.1.2.2.22 > 10.2.1.2.41221: Flags [.], ack 1337, win 707, options [nop,nop,TS val 4294944372 ecr 4294944064,mptcp 8 dss ack 3576353483], length 0
  259  2013-02-25 12:56:44.756736 IP 10.2.1.2.41221 > 10.1.2.2.22: Flags [.], ack 3305, win 310, options [nop,nop,TS val 4294944064 ecr 4294944372,mptcp 20 dss fin ack 3518600705 seq 3576353483 subseq 0 len 1 csum 0xa51], length 0
  260  2013-02-25 12:56:44.765654 IP 10.1.2.2.22 > 10.2.1.2.41221: Flags [.], ack 1337, win 707, options [nop,nop,TS val 4294944372 ecr 4294944064,mptcp 20 dss fin ack 3576353484 seq 3518600705 subseq 0 len 1 csum 0xbe46], length 0
  261  2013-02-25 12:56:44.765795 IP 10.2.1.2.41221 > 10.1.2.2.22: Flags [F.], seq 1337, ack 3305, win 310, options [nop,nop,TS val 4294944066 ecr 4294944372,mptcp 8 dss ack 3518600705], length 0
  262  2013-02-25 12:56:44.765879 IP 10.2.1.2.41221 > 10.1.2.2.22: Flags [.], ack 3305, win 310, options [nop,nop,TS val 4294944066 ecr 4294944372,mptcp 8 dss ack 3518600706], length 0
  263  2013-02-25 12:56:44.766083 IP 10.1.2.2.22 > 10.2.1.2.41221: Flags [F.], seq 3305, ack 1338, win 707, options [nop,nop,TS val 4294944372 ecr 4294944066,mptcp 8 dss ack 3576353484], length 0
  264  2013-02-25 12:56:44.766202 IP 10.2.1.2.41221 > 10.1.2.2.22: Flags [.], ack 3306, win 310, options [nop,nop,TS val 4294944066 ecr 4294944372,mptcp 8 dss ack 3518600706], length 0
