    1  15:51:06.676845 IP 10.0.1.1.33306 > 10.0.2.1.10004: Flags [S], seq 2180756989, win 65535, options [mss 1460,sackOK,TS val 464494241 ecr 0,nop,wscale 8,mptcp 4 capable v1], length 0
    2  15:51:06.676888 IP 10.0.2.1.10004 > 10.0.1.1.33306: Flags [S.], seq 791415661, ack 2180756990, win 65535, options [mss 1460,sackOK,TS val 3275212179 ecr 464494241,nop,wscale 8,mptcp 12 capable v1 {0x29a6c86981ad933c}], length 0
    3  15:51:06.676958 IP 10.0.1.1.33306 > 10.0.2.1.10004: Flags [.], ack 1, win 256, options [nop,nop,TS val 464494241 ecr 3275212179,mptcp 20 capable v1 {0x1fdb5df328bc3def,0x29a6c86981ad933c}], length 0
    4  15:51:06.677099 IP 10.0.1.1.33306 > 10.0.2.1.10004: Flags [P.], seq 1:7101, ack 1, win 256, options [nop,nop,TS val 464494241 ecr 3275212179,mptcp 22 capable v1 {0x1fdb5df328bc3def,0x29a6c86981ad933c},nop,nop], length 7100
    5  15:51:06.677113 IP 10.0.2.1.10004 > 10.0.1.1.33306: Flags [.], ack 7101, win 312, options [nop,nop,TS val 3275212179 ecr 464494241,mptcp 12 dss ack 14413541604287230030], length 0
    6  15:51:06.677130 IP 10.0.1.1.33306 > 10.0.2.1.10004: Flags [P.], seq 7101:8193, ack 1, win 256, options [nop,nop,TS val 464494241 ecr 3275212179,mptcp 12 dss ack 11713449205243392242], length 1092
    7  15:51:06.677136 IP 10.0.2.1.10004 > 10.0.1.1.33306: Flags [P.], seq 1:7101, ack 7101, win 312, options [nop,nop,TS val 3275212179 ecr 464494241,mptcp 26 dss ack 14413541604287230030 seq 11713449205243392242 subseq 1 len 8192,nop,nop], length 7100
    8  15:51:06.677163 IP 10.0.1.1.33306 > 10.0.2.1.10004: Flags [.], ack 7101, win 312, options [nop,nop,TS val 464494241 ecr 3275212179,mptcp 12 dss ack 11713449205243392242], length 0
    9  15:51:06.677173 IP 10.0.1.1.33306 > 10.0.2.1.10004: Flags [.], seq 8193:9613, ack 7101, win 312, options [nop,nop,TS val 464494241 ecr 3275212179,mptcp 26 dss ack 11713449205243392242 seq 14413541604287238222 subseq 8193 len 2076,nop,nop], length 1420
   10  15:51:06.677174 IP 10.0.2.1.10004 > 10.0.1.1.33306: Flags [P.], seq 7101:8193, ack 7101, win 312, options [nop,nop,TS val 3275212179 ecr 464494241,mptcp 12 dss ack 14413541604287230030], length 1092
   11  15:51:06.677188 IP 10.0.2.1.10004 > 10.0.1.1.33306: Flags [.], ack 8193, win 323, options [nop,nop,TS val 3275212179 ecr 464494241,mptcp 12 dss ack 14413541604287230030], length 0
   12  15:51:06.677188 IP 10.0.1.1.33306 > 10.0.2.1.10004: Flags [.], ack 8193, win 323, options [nop,nop,TS val 464494241 ecr 3275212179,mptcp 12 dss ack 11713449205243392242], length 0
   13  15:51:06.677207 IP 10.0.1.1.33306 > 10.0.2.1.10004: Flags [P.], seq 9613:10269, ack 8193, win 323, options [nop,nop,TS val 464494241 ecr 3275212179,mptcp 12 dss ack 11713449205243392242], length 656
   14  15:51:06.677221 IP 10.0.2.1.10004 > 10.0.1.1.33306: Flags [.], ack 9613, win 334, options [nop,nop,TS val 3275212179 ecr 464494241,mptcp 12 dss ack 14413541604287230030], length 0
   15  15:51:06.677237 IP 10.0.2.1.10004 > 10.0.1.1.33306: Flags [.], ack 10269, win 345, options [nop,nop,TS val 3275212179 ecr 464494241,mptcp 12 dss ack 14413541604287230030], length 0
   16  15:51:06.677259 IP 10.0.1.1.33306 > 10.0.2.1.10004: Flags [F.], seq 10269, ack 8193, win 323, options [nop,nop,TS val 464494241 ecr 3275212179,mptcp 26 dss fin ack 11713449205243400434 seq 14413541604287240298 subseq 0 len 1,nop,nop], length 0
   17  15:51:06.677321 IP 10.0.2.1.10004 > 10.0.1.1.33306: Flags [P.], seq 8193:10269, ack 10270, win 345, options [nop,nop,TS val 3275212179 ecr 464494241,mptcp 26 dss ack 14413541604287238222 seq 11713449205243400434 subseq 8193 len 2076,nop,nop], length 2076
   18  15:51:06.677357 IP 10.0.1.1.33306 > 10.0.2.1.10004: Flags [.], ack 10269, win 339, options [nop,nop,TS val 464494241 ecr 3275212179,mptcp 12 dss ack 11713449205243400434], length 0
   19  15:51:06.677404 IP 10.0.2.1.10004 > 10.0.1.1.33306: Flags [F.], seq 10269, ack 10270, win 345, options [nop,nop,TS val 3275212179 ecr 464494241,mptcp 26 dss fin ack 14413541604287240298 seq 11713449205243402510 subseq 0 len 1,nop,nop], length 0
   20  15:51:06.677429 IP 10.0.1.1.33306 > 10.0.2.1.10004: Flags [.], ack 10270, win 339, options [nop,nop,TS val 464494241 ecr 3275212179,mptcp 12 dss ack 11713449205243402510], length 0
