    1  2017-09-05 07:22:22.252624 IP 127.0.0.1.32795 > 127.0.0.1.123: NTPv2, Reserved, length 192
    2  2017-09-05 07:22:22.252700 IP 127.0.0.1.123 > 127.0.0.1.32795: NTPv2, Reserved, length 44
    3  2017-09-05 07:22:29.460683 IP 127.0.0.1.32795 > 127.0.0.1.123: NTPv2, Reserved, length 192
    4  2017-09-05 07:22:29.460754 IP 127.0.0.1.123 > 127.0.0.1.32795: NTPv2, Reserved, length 32
    5  2017-09-05 07:22:39.972764 IP 127.0.0.1.32795 > 127.0.0.1.123: NTPv2, Reserved, length 192
    6  2017-09-05 07:22:39.972837 IP 127.0.0.1.123 > 127.0.0.1.32795: NTPv2, Reserved, length 68
    7  2017-09-05 07:22:44.396700 IP 127.0.0.1.32795 > 127.0.0.1.123: NTPv2, Reserved, length 192
    8  2017-09-05 07:22:44.396781 IP 127.0.0.1.123 > 127.0.0.1.32795: NTPv2, Reserved, length 440
