    1  2017-06-19 14:12:10.230949 IP 192.168.100.2.58054 > 192.168.100.1.123: NTPv4, Client, length 72
    2  2017-06-19 14:12:10.231082 IP 192.168.100.1.123 > 192.168.100.2.58054: NTPv4, Server, length 52
    3  2017-06-19 14:19:18.494390 IP 192.168.100.2.42818 > 192.168.100.1.123: NTPv4, Client, length 72
    4  2017-06-19 14:19:18.494589 IP 192.168.100.1.123 > 192.168.100.2.42818: NTPv4, Server, length 72
    5  2017-06-19 14:22:54.488500 IP 192.168.100.2.53144 > 192.168.100.1.123: NTPv4, Client, length 48
    6  2017-06-19 14:22:54.488761 IP 192.168.100.1.123 > 192.168.100.2.53144: NTPv4, Server, length 48
    7  2017-06-19 14:47:12.800853 IP 192.168.100.2.123 > 192.168.100.1.123: NTPv4, Client, length 68
    8  2017-06-19 14:47:12.800979 IP 192.168.100.1.123 > 192.168.100.2.123: NTPv4, Server, length 68
