IP 127.0.0.1.35901 > 127.0.0.1.6379: Flags [S], seq 1159918511, win 43690, options [mss 65495,sackOK,TS val 2004405846 ecr 0,nop,wscale 7], length 0
IP 127.0.0.1.6379 > 127.0.0.1.35901: Flags [S.], seq 1309831771, ack 1159918512, win 43690, options [mss 65495,sackOK,TS val 2004405846 ecr 2004405846,nop,wscale 7], length 0
IP 127.0.0.1.35901 > 127.0.0.1.6379: Flags [.], ack 1, win 342, options [nop,nop,TS val 2004405846 ecr 2004405846], length 0
IP 127.0.0.1.35901 > 127.0.0.1.6379: Flags [P.], seq 1:7, ack 1, win 342, options [nop,nop,TS val 2004405846 ecr 2004405846], length 6: RESP "PING"
IP 127.0.0.1.6379 > 127.0.0.1.35901: Flags [.], ack 7, win 342, options [nop,nop,TS val 2004405846 ecr 2004405846], length 0
IP 127.0.0.1.6379 > 127.0.0.1.35901: Flags [P.], seq 1:8, ack 7, win 342, options [nop,nop,TS val 2004405846 ecr 2004405846], length 7: RESP "PONG"
IP 127.0.0.1.35901 > 127.0.0.1.6379: Flags [.], ack 8, win 342, options [nop,nop,TS val 2004405846 ecr 2004405846], length 0
IP 127.0.0.1.35901 > 127.0.0.1.6379: Flags [F.], seq 7, ack 8, win 342, options [nop,nop,TS val 2004405846 ecr 2004405846], length 0
IP 127.0.0.1.6379 > 127.0.0.1.35901: Flags [F.], seq 8, ack 8, win 342, options [nop,nop,TS val 2004405846 ecr 2004405846], length 0
IP 127.0.0.1.35901 > 127.0.0.1.6379: Flags [.], ack 9, win 342, options [nop,nop,TS val 2004405846 ecr 2004405846], length 0
IP 127.0.0.1.35902 > 127.0.0.1.6379: Flags [S], seq 3880036895, win 43690, options [mss 65495,sackOK,TS val 2004405846 ecr 0,nop,wscale 7], length 0
IP 127.0.0.1.6379 > 127.0.0.1.35902: Flags [S.], seq 95825237, ack 3880036896, win 43690, options [mss 65495,sackOK,TS val 2004405846 ecr 2004405846,nop,wscale 7], length 0
IP 127.0.0.1.35902 > 127.0.0.1.6379: Flags [.], ack 1, win 342, options [nop,nop,TS val 2004405846 ecr 2004405846], length 0
IP 127.0.0.1.35902 > 127.0.0.1.6379: Flags [P.], seq 1:15, ack 1, win 342, options [nop,nop,TS val 2004405846 ecr 2004405846], length 14: RESP "PING"
IP 127.0.0.1.6379 > 127.0.0.1.35902: Flags [.], ack 15, win 342, options [nop,nop,TS val 2004405846 ecr 2004405846], length 0
IP 127.0.0.1.6379 > 127.0.0.1.35902: Flags [P.], seq 1:8, ack 15, win 342, options [nop,nop,TS val 2004405846 ecr 2004405846], length 7: RESP "PONG"
IP 127.0.0.1.35902 > 127.0.0.1.6379: Flags [.], ack 8, win 342, options [nop,nop,TS val 2004405846 ecr 2004405846], length 0
IP 127.0.0.1.35902 > 127.0.0.1.6379: Flags [F.], seq 15, ack 8, win 342, options [nop,nop,TS val 2004405846 ecr 2004405846], length 0
IP 127.0.0.1.6379 > 127.0.0.1.35902: Flags [F.], seq 8, ack 16, win 342, options [nop,nop,TS val 2004405846 ecr 2004405846], length 0
IP 127.0.0.1.35902 > 127.0.0.1.6379: Flags [.], ack 9, win 342, options [nop,nop,TS val 2004405846 ecr 2004405846], length 0
IP 127.0.0.1.35903 > 127.0.0.1.6379: Flags [S], seq 3040658582, win 43690, options [mss 65495,sackOK,TS val 2004405846 ecr 0,nop,wscale 7], length 0
IP 127.0.0.1.6379 > 127.0.0.1.35903: Flags [S.], seq 2458684268, ack 3040658583, win 43690, options [mss 65495,sackOK,TS val 2004405846 ecr 2004405846,nop,wscale 7], length 0
IP 127.0.0.1.35903 > 127.0.0.1.6379: Flags [.], ack 1, win 342, options [nop,nop,TS val 2004405846 ecr 2004405846], length 0
IP 127.0.0.1.35903 > 127.0.0.1.6379: Flags [P.], seq 1:46, ack 1, win 342, options [nop,nop,TS val 2004405846 ecr 2004405846], length 45: RESP "SET" "key:000000000943" "xxx"
IP 127.0.0.1.6379 > 127.0.0.1.35903: Flags [.], ack 46, win 342, options [nop,nop,TS val 2004405846 ecr 2004405846], length 0
IP 127.0.0.1.6379 > 127.0.0.1.35903: Flags [P.], seq 1:6, ack 46, win 342, options [nop,nop,TS val 2004405846 ecr 2004405846], length 5: RESP "OK"
IP 127.0.0.1.35903 > 127.0.0.1.6379: Flags [.], ack 6, win 342, options [nop,nop,TS val 2004405846 ecr 2004405846], length 0
IP 127.0.0.1.35903 > 127.0.0.1.6379: Flags [F.], seq 46, ack 6, win 342, options [nop,nop,TS val 2004405846 ecr 2004405846], length 0
IP 127.0.0.1.6379 > 127.0.0.1.35903: Flags [F.], seq 6, ack 47, win 342, options [nop,nop,TS val 2004405846 ecr 2004405846], length 0
IP 127.0.0.1.35903 > 127.0.0.1.6379: Flags [.], ack 7, win 342, options [nop,nop,TS val 2004405846 ecr 2004405846], length 0
IP 127.0.0.1.35904 > 127.0.0.1.6379: Flags [S], seq 2555867980, win 43690, options [mss 65495,sackOK,TS val 2004405846 ecr 0,nop,wscale 7], length 0
IP 127.0.0.1.6379 > 127.0.0.1.35904: Flags [S.], seq 4291997072, ack 2555867981, win 43690, options [mss 65495,sackOK,TS val 2004405846 ecr 2004405846,nop,wscale 7], length 0
IP 127.0.0.1.35904 > 127.0.0.1.6379: Flags [.], ack 1, win 342, options [nop,nop,TS val 2004405846 ecr 2004405846], length 0
IP 127.0.0.1.35904 > 127.0.0.1.6379: Flags [P.], seq 1:37, ack 1, win 342, options [nop,nop,TS val 2004405846 ecr 2004405846], length 36: RESP "GET" "key:000000000199"
IP 127.0.0.1.6379 > 127.0.0.1.35904: Flags [.], ack 37, win 342, options [nop,nop,TS val 2004405846 ecr 2004405846], length 0
IP 127.0.0.1.6379 > 127.0.0.1.35904: Flags [P.], seq 1:10, ack 37, win 342, options [nop,nop,TS val 2004405846 ecr 2004405846], length 9: RESP "xxx"
IP 127.0.0.1.35904 > 127.0.0.1.6379: Flags [.], ack 10, win 342, options [nop,nop,TS val 2004405846 ecr 2004405846], length 0
IP 127.0.0.1.35904 > 127.0.0.1.6379: Flags [F.], seq 37, ack 10, win 342, options [nop,nop,TS val 2004405846 ecr 2004405846], length 0
IP 127.0.0.1.6379 > 127.0.0.1.35904: Flags [F.], seq 10, ack 38, win 342, options [nop,nop,TS val 2004405846 ecr 2004405846], length 0
IP 127.0.0.1.35904 > 127.0.0.1.6379: Flags [.], ack 11, win 342, options [nop,nop,TS val 2004405846 ecr 2004405846], length 0
IP 127.0.0.1.35905 > 127.0.0.1.6379: Flags [S], seq 2342248419, win 43690, options [mss 65495,sackOK,TS val 2004405846 ecr 0,nop,wscale 7], length 0
IP 127.0.0.1.6379 > 127.0.0.1.35905: Flags [S.], seq 2490886259, ack 2342248420, win 43690, options [mss 65495,sackOK,TS val 2004405847 ecr 2004405846,nop,wscale 7], length 0
IP 127.0.0.1.35905 > 127.0.0.1.6379: Flags [.], ack 1, win 342, options [nop,nop,TS val 2004405847 ecr 2004405847], length 0
IP 127.0.0.1.35905 > 127.0.0.1.6379: Flags [P.], seq 1:42, ack 1, win 342, options [nop,nop,TS val 2004405847 ecr 2004405847], length 41: RESP "INCR" "counter:000000000293"
IP 127.0.0.1.6379 > 127.0.0.1.35905: Flags [.], ack 42, win 342, options [nop,nop,TS val 2004405847 ecr 2004405847], length 0
IP 127.0.0.1.6379 > 127.0.0.1.35905: Flags [P.], seq 1:5, ack 42, win 342, options [nop,nop,TS val 2004405847 ecr 2004405847], length 4: RESP "3"
IP 127.0.0.1.35905 > 127.0.0.1.6379: Flags [.], ack 5, win 342, options [nop,nop,TS val 2004405847 ecr 2004405847], length 0
IP 127.0.0.1.35905 > 127.0.0.1.6379: Flags [F.], seq 42, ack 5, win 342, options [nop,nop,TS val 2004405847 ecr 2004405847], length 0
IP 127.0.0.1.6379 > 127.0.0.1.35905: Flags [F.], seq 5, ack 43, win 342, options [nop,nop,TS val 2004405847 ecr 2004405847], length 0
IP 127.0.0.1.35905 > 127.0.0.1.6379: Flags [.], ack 6, win 342, options [nop,nop,TS val 2004405847 ecr 2004405847], length 0
IP 127.0.0.1.35906 > 127.0.0.1.6379: Flags [S], seq 131158412, win 43690, options [mss 65495,sackOK,TS val 2004405847 ecr 0,nop,wscale 7], length 0
IP 127.0.0.1.6379 > 127.0.0.1.35906: Flags [S.], seq 49781958, ack 131158413, win 43690, options [mss 65495,sackOK,TS val 2004405847 ecr 2004405847,nop,wscale 7], length 0
IP 127.0.0.1.35906 > 127.0.0.1.6379: Flags [.], ack 1, win 342, options [nop,nop,TS val 2004405847 ecr 2004405847], length 0
IP 127.0.0.1.35906 > 127.0.0.1.6379: Flags [P.], seq 1:37, ack 1, win 342, options [nop,nop,TS val 2004405847 ecr 2004405847], length 36: RESP "LPUSH" "mylist" "xxx"
IP 127.0.0.1.6379 > 127.0.0.1.35906: Flags [.], ack 37, win 342, options [nop,nop,TS val 2004405847 ecr 2004405847], length 0
IP 127.0.0.1.6379 > 127.0.0.1.35906: Flags [P.], seq 1:9, ack 37, win 342, options [nop,nop,TS val 2004405847 ecr 2004405847], length 8: RESP "47158"
IP 127.0.0.1.35906 > 127.0.0.1.6379: Flags [.], ack 9, win 342, options [nop,nop,TS val 2004405847 ecr 2004405847], length 0
IP 127.0.0.1.35906 > 127.0.0.1.6379: Flags [F.], seq 37, ack 9, win 342, options [nop,nop,TS val 2004405847 ecr 2004405847], length 0
IP 127.0.0.1.6379 > 127.0.0.1.35906: Flags [F.], seq 9, ack 38, win 342, options [nop,nop,TS val 2004405847 ecr 2004405847], length 0
IP 127.0.0.1.35906 > 127.0.0.1.6379: Flags [.], ack 10, win 342, options [nop,nop,TS val 2004405847 ecr 2004405847], length 0
IP 127.0.0.1.35907 > 127.0.0.1.6379: Flags [S], seq 1454742392, win 43690, options [mss 65495,sackOK,TS val 2004405847 ecr 0,nop,wscale 7], length 0
IP 127.0.0.1.6379 > 127.0.0.1.35907: Flags [S.], seq 4166501195, ack 1454742393, win 43690, options [mss 65495,sackOK,TS val 2004405847 ecr 2004405847,nop,wscale 7], length 0
IP 127.0.0.1.35907 > 127.0.0.1.6379: Flags [.], ack 1, win 342, options [nop,nop,TS val 2004405847 ecr 2004405847], length 0
IP 127.0.0.1.35907 > 127.0.0.1.6379: Flags [P.], seq 1:27, ack 1, win 342, options [nop,nop,TS val 2004405847 ecr 2004405847], length 26: RESP "LPOP" "mylist"
IP 127.0.0.1.6379 > 127.0.0.1.35907: Flags [.], ack 27, win 342, options [nop,nop,TS val 2004405847 ecr 2004405847], length 0
IP 127.0.0.1.6379 > 127.0.0.1.35907: Flags [P.], seq 1:10, ack 27, win 342, options [nop,nop,TS val 2004405847 ecr 2004405847], length 9: RESP "xxx"
IP 127.0.0.1.35907 > 127.0.0.1.6379: Flags [.], ack 10, win 342, options [nop,nop,TS val 2004405847 ecr 2004405847], length 0
IP 127.0.0.1.35907 > 127.0.0.1.6379: Flags [F.], seq 27, ack 10, win 342, options [nop,nop,TS val 2004405847 ecr 2004405847], length 0
IP 127.0.0.1.6379 > 127.0.0.1.35907: Flags [F.], seq 10, ack 28, win 342, options [nop,nop,TS val 2004405847 ecr 2004405847], length 0
IP 127.0.0.1.35907 > 127.0.0.1.6379: Flags [.], ack 11, win 342, options [nop,nop,TS val 2004405847 ecr 2004405847], length 0
IP 127.0.0.1.35908 > 127.0.0.1.6379: Flags [S], seq 545589487, win 43690, options [mss 65495,sackOK,TS val 2004405847 ecr 0,nop,wscale 7], length 0
IP 127.0.0.1.6379 > 127.0.0.1.35908: Flags [S.], seq 2823817844, ack 545589488, win 43690, options [mss 65495,sackOK,TS val 2004405847 ecr 2004405847,nop,wscale 7], length 0
IP 127.0.0.1.35908 > 127.0.0.1.6379: Flags [.], ack 1, win 342, options [nop,nop,TS val 2004405847 ecr 2004405847], length 0
IP 127.0.0.1.35908 > 127.0.0.1.6379: Flags [P.], seq 1:53, ack 1, win 342, options [nop,nop,TS val 2004405847 ecr 2004405847], length 52: RESP "SADD" "myset" "element:000000000063"
IP 127.0.0.1.6379 > 127.0.0.1.35908: Flags [.], ack 53, win 342, options [nop,nop,TS val 2004405847 ecr 2004405847], length 0
IP 127.0.0.1.6379 > 127.0.0.1.35908: Flags [P.], seq 1:5, ack 53, win 342, options [nop,nop,TS val 2004405847 ecr 2004405847], length 4: RESP "1"
IP 127.0.0.1.35908 > 127.0.0.1.6379: Flags [.], ack 5, win 342, options [nop,nop,TS val 2004405847 ecr 2004405847], length 0
IP 127.0.0.1.35908 > 127.0.0.1.6379: Flags [F.], seq 53, ack 5, win 342, options [nop,nop,TS val 2004405847 ecr 2004405847], length 0
IP 127.0.0.1.6379 > 127.0.0.1.35908: Flags [F.], seq 5, ack 54, win 342, options [nop,nop,TS val 2004405847 ecr 2004405847], length 0
IP 127.0.0.1.35908 > 127.0.0.1.6379: Flags [.], ack 6, win 342, options [nop,nop,TS val 2004405847 ecr 2004405847], length 0
IP 127.0.0.1.35909 > 127.0.0.1.6379: Flags [S], seq 296698850, win 43690, options [mss 65495,sackOK,TS val 2004405847 ecr 0,nop,wscale 7], length 0
IP 127.0.0.1.6379 > 127.0.0.1.35909: Flags [S.], seq 3970806453, ack 296698851, win 43690, options [mss 65495,sackOK,TS val 2004405847 ecr 2004405847,nop,wscale 7], length 0
IP 127.0.0.1.35909 > 127.0.0.1.6379: Flags [.], ack 1, win 342, options [nop,nop,TS val 2004405847 ecr 2004405847], length 0
IP 127.0.0.1.35909 > 127.0.0.1.6379: Flags [P.], seq 1:26, ack 1, win 342, options [nop,nop,TS val 2004405847 ecr 2004405847], length 25: RESP "SPOP" "myset"
IP 127.0.0.1.6379 > 127.0.0.1.35909: Flags [.], ack 26, win 342, options [nop,nop,TS val 2004405847 ecr 2004405847], length 0
IP 127.0.0.1.6379 > 127.0.0.1.35909: Flags [P.], seq 1:28, ack 26, win 342, options [nop,nop,TS val 2004405847 ecr 2004405847], length 27: RESP "element:000000000063"
IP 127.0.0.1.35909 > 127.0.0.1.6379: Flags [.], ack 28, win 342, options [nop,nop,TS val 2004405847 ecr 2004405847], length 0
IP 127.0.0.1.35909 > 127.0.0.1.6379: Flags [F.], seq 26, ack 28, win 342, options [nop,nop,TS val 2004405847 ecr 2004405847], length 0
IP 127.0.0.1.6379 > 127.0.0.1.35909: Flags [F.], seq 28, ack 27, win 342, options [nop,nop,TS val 2004405847 ecr 2004405847], length 0
IP 127.0.0.1.35909 > 127.0.0.1.6379: Flags [.], ack 29, win 342, options [nop,nop,TS val 2004405847 ecr 2004405847], length 0
IP 127.0.0.1.35910 > 127.0.0.1.6379: Flags [S], seq 2082555059, win 43690, options [mss 65495,sackOK,TS val 2004405847 ecr 0,nop,wscale 7], length 0
IP 127.0.0.1.6379 > 127.0.0.1.35910: Flags [S.], seq 1762470779, ack 2082555060, win 43690, options [mss 65495,sackOK,TS val 2004405847 ecr 2004405847,nop,wscale 7], length 0
IP 127.0.0.1.35910 > 127.0.0.1.6379: Flags [.], ack 1, win 342, options [nop,nop,TS val 2004405847 ecr 2004405847], length 0
IP 127.0.0.1.35910 > 127.0.0.1.6379: Flags [P.], seq 1:37, ack 1, win 342, options [nop,nop,TS val 2004405847 ecr 2004405847], length 36: RESP "LPUSH" "mylist" "xxx"
IP 127.0.0.1.6379 > 127.0.0.1.35910: Flags [.], ack 37, win 342, options [nop,nop,TS val 2004405847 ecr 2004405847], length 0
IP 127.0.0.1.6379 > 127.0.0.1.35910: Flags [P.], seq 1:9, ack 37, win 342, options [nop,nop,TS val 2004405847 ecr 2004405847], length 8: RESP "47158"
IP 127.0.0.1.35910 > 127.0.0.1.6379: Flags [.], ack 9, win 342, options [nop,nop,TS val 2004405847 ecr 2004405847], length 0
IP 127.0.0.1.35910 > 127.0.0.1.6379: Flags [F.], seq 37, ack 9, win 342, options [nop,nop,TS val 2004405847 ecr 2004405847], length 0
IP 127.0.0.1.6379 > 127.0.0.1.35910: Flags [F.], seq 9, ack 38, win 342, options [nop,nop,TS val 2004405847 ecr 2004405847], length 0
IP 127.0.0.1.35910 > 127.0.0.1.6379: Flags [.], ack 10, win 342, options [nop,nop,TS val 2004405847 ecr 2004405847], length 0
IP 127.0.0.1.35911 > 127.0.0.1.6379: Flags [S], seq 823555559, win 43690, options [mss 65495,sackOK,TS val 2004405847 ecr 0,nop,wscale 7], length 0
IP 127.0.0.1.6379 > 127.0.0.1.35911: Flags [S.], seq 1343119127, ack 823555560, win 43690, options [mss 65495,sackOK,TS val 2004405847 ecr 2004405847,nop,wscale 7], length 0
IP 127.0.0.1.35911 > 127.0.0.1.6379: Flags [.], ack 1, win 342, options [nop,nop,TS val 2004405847 ecr 2004405847], length 0
IP 127.0.0.1.35911 > 127.0.0.1.6379: Flags [P.], seq 1:44, ack 1, win 342, options [nop,nop,TS val 2004405847 ecr 2004405847], length 43: RESP "LRANGE" "mylist" "0" "99"
IP 127.0.0.1.6379 > 127.0.0.1.35911: Flags [.], ack 44, win 342, options [nop,nop,TS val 2004405847 ecr 2004405847], length 0
IP 127.0.0.1.6379 > 127.0.0.1.35911: Flags [P.], seq 1:907, ack 44, win 342, options [nop,nop,TS val 2004405847 ecr 2004405847], length 906: RESP "xxx" "xxx" "xxx" "xxx" "xxx" "xxx" "xxx" "xxx" "xxx" "xxx" "xxx" "xxx" "xxx" "xxx" "xxx" "xxx" "xxx" "xxx" "xxx" "xxx" "xxx" "xxx" "xxx" "xxx" "xxx" "xxx" "xxx" "xxx" "xxx" "xxx" "xxx" "xxx" "xxx" "xxx" "xxx" "xxx" "xxx" "xxx" "xxx" "xxx" "xxx" "xxx" "xxx" "xxx" "xxx" "xxx" "xxx" "xxx" "xxx" "xxx" "xxx" "xxx" "xxx" "xxx" "xxx" "xxx" "xxx" "xxx" "xxx" "xxx" "xxx" "xxx" "xxx" "xxx" "xxx" "xxx" "xxx" "xxx" "xxx" "xxx" "xxx" "xxx" "xxx" "xxx" "xxx" "xxx" "xxx" "xxx" "xxx" "xxx" "xxx" "xxx" "xxx" "xxx" "xxx" "xxx" "xxx" "xxx" "xxx" "xxx" "xxx" "xxx" "xxx" "xxx" "xxx" "xxx" "xxx" "xxx" "xxx" "xxx"
IP 127.0.0.1.35911 > 127.0.0.1.6379: Flags [.], ack 907, win 356, options [nop,nop,TS val 2004405847 ecr 2004405847], length 0
IP 127.0.0.1.35911 > 127.0.0.1.6379: Flags [F.], seq 44, ack 907, win 356, options [nop,nop,TS val 2004405847 ecr 2004405847], length 0
IP 127.0.0.1.6379 > 127.0.0.1.35911: Flags [F.], seq 907, ack 45, win 342, options [nop,nop,TS val 2004405847 ecr 2004405847], length 0
IP 127.0.0.1.35911 > 127.0.0.1.6379: Flags [.], ack 908, win 356, options [nop,nop,TS val 2004405847 ecr 2004405847], length 0
IP 127.0.0.1.35912 > 127.0.0.1.6379: Flags [S], seq 2379661641, win 43690, options [mss 65495,sackOK,TS val 2004405847 ecr 0,nop,wscale 7], length 0
IP 127.0.0.1.6379 > 127.0.0.1.35912: Flags [S.], seq 1832740480, ack 2379661642, win 43690, options [mss 65495,sackOK,TS val 2004405847 ecr 2004405847,nop,wscale 7], length 0
IP 127.0.0.1.35912 > 127.0.0.1.6379: Flags [.], ack 1, win 342, options [nop,nop,TS val 2004405847 ecr 2004405847], length 0
IP 127.0.0.1.35912 > 127.0.0.1.6379: Flags [P.], seq 1:45, ack 1, win 342, options [nop,nop,TS val 2004405847 ecr 2004405847], length 44: RESP "LRANGE" "mylist" "0" "299"
IP 127.0.0.1.6379 > 127.0.0.1.35912: Flags [.], ack 45, win 342, options [nop,nop,TS val 2004405847 ecr 2004405847], length 0
IP 127.0.0.1.6379 > 127.0.0.1.35912: Flags [P.], seq 1:2707, ack 45, win 342, options [nop,nop,TS val 2004405847 ecr 2004405847], length 2706: RESP "xxx" "xxx" "xxx" "xxx" "xxx" "xxx" "xxx" "xxx" "xxx" "xxx" "xxx" "xxx" "xxx" "xxx" "xxx" "xxx" "xxx" "xxx" "xxx" "xxx" "xxx" "xxx" "xxx" "xxx" "xxx" "xxx" "xxx" "xxx" "xxx" "xxx" "xxx" "xxx" "xxx" "xxx" "xxx" "xxx" "xxx" "xxx" "xxx" "xxx" "xxx" "xxx" "xxx" "xxx" "xxx" "xxx" "xxx" "xxx" "xxx" "xxx" "xxx" "xxx" "xxx" "xxx" "xxx" "xxx" "xxx" "xxx" "xxx" "xxx" "xxx" "xxx" "xxx" "xxx" "xxx" "xxx" "xxx" "xxx" "xxx" "xxx" "xxx" "xxx" "xxx" "xxx" "xxx" "xxx" "xxx" "xxx" "xxx" "xxx" "xxx" "xxx" "xxx" "xxx" "xxx" "xxx" "xxx" "xxx" "xxx" "xxx" "xxx" "xxx" "xxx" "xxx" "xxx" "xxx" "xxx" "xxx" "xxx" "xxx" "xxx" "xxx" "xxx" "xxx" "xxx" "xxx" "xxx" "xxx" "xxx" "xxx" "xxx" "xxx" "xxx" "xxx" "xxx" "xxx" "xxx" "xxx" "xxx" "xxx" "xxx" "xxx" "xxx" "xxx" "xxx" "xxx" "xxx" "xxx" "xxx" "xxx" "xxx" "xxx" "xxx" "xxx" "xxx" "xxx" "xxx" "xxx" "xxx" "xxx" "xxx" "xxx" "xxx" "xxx" "xxx" "xxx" "xxx" "xxx" "xxx" "xxx" "xxx" "xxx" "xxx" "xxx" "xxx" "xxx" "xxx" "xxx" "xxx" "xxx" "xxx" "xxx" "xxx" "xxx" "xxx" "xxx" "xxx" "xxx" "xxx" "xxx" "xxx" "xxx" "xxx" "xxx" "xxx" "xxx" "xxx" "xxx" "xxx" "xxx" "xxx" "xxx" "xxx" "xxx" "xxx" "xxx" "xxx" "xxx" "xxx" "xxx" "xxx" "xxx" "xxx" "xxx" "xxx" "xxx" "xxx" "xxx" "xxx" "xxx" "xxx" "xxx" "xxx" "xxx" "xxx" "xxx" "xxx" "xxx" "xxx" "xxx" "xxx" "xxx" "xxx" "xxx" "xxx" "xxx" "xxx" "xxx" "xxx" "xxx" "xxx" "xxx" "xxx" "xxx" "xxx" "xxx" "xxx" "xxx" "xxx" "xxx" "xxx" "xxx" "xxx" "xxx" "xxx" "xxx" "xxx" "xxx" "xxx" "xxx" "xxx" "xxx" "xxx" "xxx" "xxx" "xxx" "xxx" "xxx" "xxx" "xxx" "xxx" "xxx" "xxx" "xxx" "xxx" "xxx" "xxx" "xxx" "xxx" "xxx" "xxx" "xxx" "xxx" "xxx" "xxx" "xxx" "xxx" "xxx" "xxx" "xxx" "xxx" "xxx" "xxx" "xxx" "xxx" "xxx" "xxx" "xxx" "xxx" "xxx" "xxx" "xxx" "xxx" "xxx" "xxx" "xxx" "xxx" "xxx" "xxx" "xxx" "xxx" "xxx" "xxx" "xxx" "xxx" "xxx" "xxx" "xxx" "xxx" "xxx"
IP 127.0.0.1.35912 > 127.0.0.1.6379: Flags [.], ack 2707, win 1365, options [nop,nop,TS val 2004405847 ecr 2004405847], length 0
IP 127.0.0.1.35912 > 127.0.0.1.6379: Flags [F.], seq 45, ack 2707, win 1365, options [nop,nop,TS val 2004405847 ecr 2004405847], length 0
IP 127.0.0.1.6379 > 127.0.0.1.35912: Flags [F.], seq 2707, ack 46, win 342, options [nop,nop,TS val 2004405847 ecr 2004405847], length 0
IP 127.0.0.1.35912 > 127.0.0.1.6379: Flags [.], ack 2708, win 1365, options [nop,nop,TS val 2004405847 ecr 2004405847], length 0
IP 127.0.0.1.35913 > 127.0.0.1.6379: Flags [S], seq 1669304377, win 43690, options [mss 65495,sackOK,TS val 2004405847 ecr 0,nop,wscale 7], length 0
IP 127.0.0.1.6379 > 127.0.0.1.35913: Flags [S.], seq 1910612537, ack 1669304378, win 43690, options [mss 65495,sackOK,TS val 2004405847 ecr 2004405847,nop,wscale 7], length 0
IP 127.0.0.1.35913 > 127.0.0.1.6379: Flags [.], ack 1, win 342, options [nop,nop,TS val 2004405847 ecr 2004405847], length 0
IP 127.0.0.1.35913 > 127.0.0.1.6379: Flags [P.], seq 1:45, ack 1, win 342, options [nop,nop,TS val 2004405848 ecr 2004405847], length 44: RESP "LRANGE" "mylist" "0" "449"
IP 127.0.0.1.6379 > 127.0.0.1.35913: Flags [.], ack 45, win 342, options [nop,nop,TS val 2004405848 ecr 2004405848], length 0
IP 127.0.0.1.6379 > 127.0.0.1.35913: Flags [P.], seq 1:4057, ack 45, win 342, options [nop,nop,TS val 2004405848 ecr 2004405848], length 4056: RESP "xxx" "xxx" "xxx" "xxx" "xxx" "xxx" "xxx" "xxx" "xxx" "xxx" "xxx" "xxx" "xxx" "xxx" "xxx" "xxx" "xxx" "xxx" "xxx" "xxx" "xxx" "xxx" "xxx" "xxx" "xxx" "xxx" "xxx" "xxx" "xxx" "xxx" "xxx" "xxx" "xxx" "xxx" "xxx" "xxx" "xxx" "xxx" "xxx" "xxx" "xxx" "xxx" "xxx" "xxx" "xxx" "xxx" "xxx" "xxx" "xxx" "xxx" "xxx" "xxx" "xxx" "xxx" "xxx" "xxx" "xxx" "xxx" "xxx" "xxx" "xxx" "xxx" "xxx" "xxx" "xxx" "xxx" "xxx" "xxx" "xxx" "xxx" "xxx" "xxx" "xxx" "xxx" "xxx" "xxx" "xxx" "xxx" "xxx" "xxx" "xxx" "xxx" "xxx" "xxx" "xxx" "xxx" "xxx" "xxx" "xxx" "xxx" "xxx" "xxx" "xxx" "xxx" "xxx" "xxx" "xxx" "xxx" "xxx" "xxx" "xxx" "xxx" "xxx" "xxx" "xxx" "xxx" "xxx" "xxx" "xxx" "xxx" "xxx" "xxx" "xxx" "xxx" "xxx" "xxx" "xxx" "xxx" "xxx" "xxx" "xxx" "xxx" "xxx" "xxx" "xxx" "xxx" "xxx" "xxx" "xxx" "xxx" "xxx" "xxx" "xxx" "xxx" "xxx" "xxx" "xxx" "xxx" "xxx" "xxx" "xxx" "xxx" "xxx" "xxx" "xxx" "xxx" "xxx" "xxx" "xxx" "xxx" "xxx" "xxx" "xxx" "xxx" "xxx" "xxx" "xxx" "xxx" "xxx" "xxx" "xxx" "xxx" "xxx" "xxx" "xxx" "xxx" "xxx" "xxx" "xxx" "xxx" "xxx" "xxx" "xxx" "xxx" "xxx" "xxx" "xxx" "xxx" "xxx" "xxx" "xxx" "xxx" "xxx" "xxx" "xxx" "xxx" "xxx" "xxx" "xxx" "xxx" "xxx" "xxx" "xxx" "xxx" "xxx" "xxx" "xxx" "xxx" "xxx" "xxx" "xxx" "xxx" "xxx" "xxx" "xxx" "xxx" "xxx" "xxx" "xxx" "xxx" "xxx" "xxx" "xxx" "xxx" "xxx" "xxx" "xxx" "xxx" "xxx" "xxx" "xxx" "xxx" "xxx" "xxx" "xxx" "xxx" "xxx" "xxx" "xxx" "xxx" "xxx" "xxx" "xxx" "xxx" "xxx" "xxx" "xxx" "xxx" "xxx" "xxx" "xxx" "xxx" "xxx" "xxx" "xxx" "xxx" "xxx" "xxx" "xxx" "xxx" "xxx" "xxx" "xxx" "xxx" "xxx" "xxx" "xxx" "xxx" "xxx" "xxx" "xxx" "xxx" "xxx" "xxx" "xxx" "xxx" "xxx" "xxx" "xxx" "xxx" "xxx" "xxx" "xxx" "xxx" "xxx" "xxx" "xxx" "xxx" "xxx" "xxx" "xxx" "xxx" "xxx" "xxx" "xxx" "xxx" "xxx" "xxx" "xxx" "xxx" "xxx" "xxx" "xxx" "xxx" "xxx" "xxx" "xxx" "xxx" "xxx" "xxx" "xxx" "xxx" "xxx" "xxx" "xxx" "xxx" "xxx" "xxx" "xxx" "xxx" "xxx" "xxx" "xxx" "xxx" "xxx" "xxx" "xxx" "xxx" "xxx" "xxx" "xxx" "xxx" "xxx" "xxx" "xxx" "xxx" "xxx" "xxx" "xxx" "xxx" "xxx" "xxx" "xxx" "xxx" "xxx" "xxx" "xxx" "xxx" "xxx" "xxx" "xxx" "xxx" "xxx" "xxx" "xxx" "xxx" "xxx" "xxx" "xxx" "xxx" "xxx" "xxx" "xxx" "xxx" "xxx" "xxx" "xxx" "xxx" "xxx" "xxx" "xxx" "xxx" "xxx" "xxx" "xxx" "xxx" "xxx" "xxx" "xxx" "xxx" "xxx" "xxx" "xxx" "xxx" "xxx" "xxx" "xxx" "xxx" "xxx" "xxx" "xxx" "xxx" "xxx" "xxx" "xxx" "xxx" "xxx" "xxx" "xxx" "xxx" "xxx" "xxx" "xxx" "xxx" "xxx" "xxx" "xxx" "xxx" "xxx" "xxx" "xxx" "xxx" "xxx" "xxx" "xxx" "xxx" "xxx" "xxx" "xxx" "xxx" "xxx" "xxx" "xxx" "xxx" "xxx" "xxx" "xxx" "xxx" "xxx" "xxx" "xxx" "xxx" "xxx" "xxx" "xxx" "xxx" "xxx" "xxx" "xxx" "xxx" "xxx" "xxx" "xxx" "xxx" "xxx" "xxx" "xxx" "xxx" "xxx" "xxx" "xxx" "xxx" "xxx" "xxx" "xxx" "xxx" "xxx" "xxx" "xxx" "xxx"
IP 127.0.0.1.35913 > 127.0.0.1.6379: Flags [.], ack 4057, win 1365, options [nop,nop,TS val 2004405848 ecr 2004405848], length 0
IP 127.0.0.1.35913 > 127.0.0.1.6379: Flags [F.], seq 45, ack 4057, win 1365, options [nop,nop,TS val 2004405848 ecr 2004405848], length 0
IP 127.0.0.1.6379 > 127.0.0.1.35913: Flags [F.], seq 4057, ack 46, win 342, options [nop,nop,TS val 2004405848 ecr 2004405848], length 0
IP 127.0.0.1.35913 > 127.0.0.1.6379: Flags [.], ack 4058, win 1365, options [nop,nop,TS val 2004405848 ecr 2004405848], length 0
IP 127.0.0.1.35914 > 127.0.0.1.6379: Flags [S], seq 1695153288, win 43690, options [mss 65495,sackOK,TS val 2004405848 ecr 0,nop,wscale 7], length 0
IP 127.0.0.1.6379 > 127.0.0.1.35914: Flags [S.], seq 488402032, ack 1695153289, win 43690, options [mss 65495,sackOK,TS val 2004405848 ecr 2004405848,nop,wscale 7], length 0
IP 127.0.0.1.35914 > 127.0.0.1.6379: Flags [.], ack 1, win 342, options [nop,nop,TS val 2004405848 ecr 2004405848], length 0
IP 127.0.0.1.35914 > 127.0.0.1.6379: Flags [P.], seq 1:45, ack 1, win 342, options [nop,nop,TS val 2004405848 ecr 2004405848], length 44: RESP "LRANGE" "mylist" "0" "599"
IP 127.0.0.1.6379 > 127.0.0.1.35914: Flags [.], ack 45, win 342, options [nop,nop,TS val 2004405848 ecr 2004405848], length 0
IP 127.0.0.1.6379 > 127.0.0.1.35914: Flags [P.], seq 1:5407, ack 45, win 342, options [nop,nop,TS val 2004405848 ecr 2004405848], length 5406: RESP "xxx" "xxx" "xxx" "xxx" "xxx" "xxx" "xxx" "xxx" "xxx" "xxx" "xxx" "xxx" "xxx" "xxx" "xxx" "xxx" "xxx" "xxx" "xxx" "xxx" "xxx" "xxx" "xxx" "xxx" "xxx" "xxx" "xxx" "xxx" "xxx" "xxx" "xxx" "xxx" "xxx" "xxx" "xxx" "xxx" "xxx" "xxx" "xxx" "xxx" "xxx" "xxx" "xxx" "xxx" "xxx" "xxx" "xxx" "xxx" "xxx" "xxx" "xxx" "xxx" "xxx" "xxx" "xxx" "xxx" "xxx" "xxx" "xxx" "xxx" "xxx" "xxx" "xxx" "xxx" "xxx" "xxx" "xxx" "xxx" "xxx" "xxx" "xxx" "xxx" "xxx" "xxx" "xxx" "xxx" "xxx" "xxx" "xxx" "xxx" "xxx" "xxx" "xxx" "xxx" "xxx" "xxx" "xxx" "xxx" "xxx" "xxx" "xxx" "xxx" "xxx" "xxx" "xxx" "xxx" "xxx" "xxx" "xxx" "xxx" "xxx" "xxx" "xxx" "xxx" "xxx" "xxx" "xxx" "xxx" "xxx" "xxx" "xxx" "xxx" "xxx" "xxx" "xxx" "xxx" "xxx" "xxx" "xxx" "xxx" "xxx" "xxx" "xxx" "xxx" "xxx" "xxx" "xxx" "xxx" "xxx" "xxx" "xxx" "xxx" "xxx" "xxx" "xxx" "xxx" "xxx" "xxx" "xxx" "xxx" "xxx" "xxx" "xxx" "xxx" "xxx" "xxx" "xxx" "xxx" "xxx" "xxx" "xxx" "xxx" "xxx" "xxx" "xxx" "xxx" "xxx" "xxx" "xxx" "xxx" "xxx" "xxx" "xxx" "xxx" "xxx" "xxx" "xxx" "xxx" "xxx" "xxx" "xxx" "xxx" "xxx" "xxx" "xxx" "xxx" "xxx" "xxx" "xxx" "xxx" "xxx" "xxx" "xxx" "xxx" "xxx" "xxx" "xxx" "xxx" "xxx" "xxx" "xxx" "xxx" "xxx" "xxx" "xxx" "xxx" "xxx" "xxx" "xxx" "xxx" "xxx" "xxx" "xxx" "xxx" "xxx" "xxx" "xxx" "xxx" "xxx" "xxx" "xxx" "xxx" "xxx" "xxx" "xxx" "xxx" "xxx" "xxx" "xxx" "xxx" "xxx" "xxx" "xxx" "xxx" "xxx" "xxx" "xxx" "xxx" "xxx" "xxx" "xxx" "xxx" "xxx" "xxx" "xxx" "xxx" "xxx" "xxx" "xxx" "xxx" "xxx" "xxx" "xxx" "xxx" "xxx" "xxx" "xxx" "xxx" "xxx" "xxx" "xxx" "xxx" "xxx" "xxx" "xxx" "xxx" "xxx" "xxx" "xxx" "xxx" "xxx" "xxx" "xxx" "xxx" "xxx" "xxx" "xxx" "xxx" "xxx" "xxx" "xxx" "xxx" "xxx" "xxx" "xxx" "xxx" "xxx" "xxx" "xxx" "xxx" "xxx" "xxx" "xxx" "xxx" "xxx" "xxx" "xxx" "xxx" "xxx" "xxx" "xxx" "xxx" "xxx" "xxx" "xxx" "xxx" "xxx" "xxx" "xxx" "xxx" "xxx" "xxx" "xxx" "xxx" "xxx" "xxx" "xxx" "xxx" "xxx" "xxx" "xxx" "xxx" "xxx" "xxx" "xxx" "xxx" "xxx" "xxx" "xxx" "xxx" "xxx" "xxx" "xxx" "xxx" "xxx" "xxx" "xxx" "xxx" "xxx" "xxx" "xxx" "xxx" "xxx" "xxx" "xxx" "xxx" "xxx" "xxx" "xxx" "xxx" "xxx" "xxx" "xxx" "xxx" "xxx" "xxx" "xxx" "xxx" "xxx" "xxx" "xxx" "xxx" "xxx" "xxx" "xxx" "xxx" "xxx" "xxx" "xxx" "xxx" "xxx" "xxx" "xxx" "xxx" "xxx" "xxx" "xxx" "xxx" "xxx" "xxx" "xxx" "xxx" "xxx" "xxx" "xxx" "xxx" "xxx" "xxx" "xxx" "xxx" "xxx" "xxx" "xxx" "xxx" "xxx" "xxx" "xxx" "xxx" "xxx" "xxx" "xxx" "xxx" "xxx" "xxx" "xxx" "xxx" "xxx" "xxx" "xxx" "xxx" "xxx" "xxx" "xxx" "xxx" "xxx" "xxx" "xxx" "xxx" "xxx" "xxx" "xxx" "xxx" "xxx" "xxx" "xxx" "xxx" "xxx" "xxx" "xxx" "xxx" "xxx" "xxx" "xxx" "xxx" "xxx" "xxx" "xxx" "xxx" "xxx" "xxx" "xxx" "xxx" "xxx" "xxx" "xxx" "xxx" "xxx" "xxx" "xxx" "xxx" "xxx" "xxx" "xxx" "xxx" "xxx" "xxx" "xxx" "xxx" "xxx" "xxx" "xxx" "xxx" "xxx" "xxx" "xxx" "xxx" "xxx" "xxx" "xxx" "xxx" "xxx" "xxx" "xxx" "xxx" "xxx" "xxx" "xxx" "xxx" "xxx" "xxx" "xxx" "xxx" "xxx" "xxx" "xxx" "xxx" "xxx" "xxx" "xxx" "xxx" "xxx" "xxx" "xxx" "xxx" "xxx" "xxx" "xxx" "xxx" "xxx" "xxx" "xxx" "xxx" "xxx" "xxx" "xxx" "xxx" "xxx" "xxx" "xxx" "xxx" "xxx" "xxx" "xxx" "xxx" "xxx" "xxx" "xxx" "xxx" "xxx" "xxx" "xxx" "xxx" "xxx" "xxx" "xxx" "xxx" "xxx" "xxx" "xxx" "xxx" "xxx" "xxx" "xxx" "xxx" "xxx" "xxx" "xxx" "xxx" "xxx" "xxx" "xxx" "xxx" "xxx" "xxx" "xxx" "xxx" "xxx" "xxx" "xxx" "xxx" "xxx" "xxx" "xxx" "xxx" "xxx" "xxx" "xxx" "xxx" "xxx" "xxx" "xxx" "xxx" "xxx" "xxx" "xxx" "xxx" "xxx" "xxx" "xxx" "xxx" "xxx" "xxx" "xxx" "xxx" "xxx" "xxx" "xxx" "xxx" "xxx" "xxx" "xxx" "xxx" "xxx" "xxx" "xxx" "xxx" "xxx" "xxx" "xxx" "xxx" "xxx" "xxx" "xxx" "xxx" "xxx" "xxx" "xxx" "xxx" "xxx" "xxx" "xxx" "xxx" "xxx" "xxx" "xxx" "xxx" "xxx" "xxx" "xxx" "xxx"
IP 127.0.0.1.35914 > 127.0.0.1.6379: Flags [.], ack 5407, win 1365, options [nop,nop,TS val 2004405848 ecr 2004405848], length 0
IP 127.0.0.1.35914 > 127.0.0.1.6379: Flags [F.], seq 45, ack 5407, win 1365, options [nop,nop,TS val 2004405848 ecr 2004405848], length 0
IP 127.0.0.1.6379 > 127.0.0.1.35914: Flags [F.], seq 5407, ack 46, win 342, options [nop,nop,TS val 2004405848 ecr 2004405848], length 0
IP 127.0.0.1.35914 > 127.0.0.1.6379: Flags [.], ack 5408, win 1365, options [nop,nop,TS val 2004405848 ecr 2004405848], length 0
IP 127.0.0.1.35915 > 127.0.0.1.6379: Flags [S], seq 3952529642, win 43690, options [mss 65495,sackOK,TS val 2004405848 ecr 0,nop,wscale 7], length 0
IP 127.0.0.1.6379 > 127.0.0.1.35915: Flags [S.], seq 2079771045, ack 3952529643, win 43690, options [mss 65495,sackOK,TS val 2004405848 ecr 2004405848,nop,wscale 7], length 0
IP 127.0.0.1.35915 > 127.0.0.1.6379: Flags [.], ack 1, win 342, options [nop,nop,TS val 2004405848 ecr 2004405848], length 0
IP 127.0.0.1.35915 > 127.0.0.1.6379: Flags [P.], seq 1:336, ack 1, win 342, options [nop,nop,TS val 2004405848 ecr 2004405848], length 335: RESP "MSET" "key:000000000525" "xxx" "key:000000000050" "xxx" "key:000000000416" "xxx" "key:000000000263" "xxx" "key:000000000941" "xxx" "key:000000000148" "xxx" "key:000000000739" "xxx" "key:000000000571" "xxx" "key:000000000974" "xxx" "key:000000000495" "xxx"
IP 127.0.0.1.6379 > 127.0.0.1.35915: Flags [.], ack 336, win 350, options [nop,nop,TS val 2004405848 ecr 2004405848], length 0
IP 127.0.0.1.6379 > 127.0.0.1.35915: Flags [P.], seq 1:6, ack 336, win 350, options [nop,nop,TS val 2004405848 ecr 2004405848], length 5: RESP "OK"
IP 127.0.0.1.35915 > 127.0.0.1.6379: Flags [.], ack 6, win 342, options [nop,nop,TS val 2004405848 ecr 2004405848], length 0
IP 127.0.0.1.35915 > 127.0.0.1.6379: Flags [F.], seq 336, ack 6, win 342, options [nop,nop,TS val 2004405848 ecr 2004405848], length 0
IP 127.0.0.1.6379 > 127.0.0.1.35915: Flags [F.], seq 6, ack 337, win 350, options [nop,nop,TS val 2004405848 ecr 2004405848], length 0
IP 127.0.0.1.35915 > 127.0.0.1.6379: Flags [.], ack 7, win 342, options [nop,nop,TS val 2004405848 ecr 2004405848], length 0
