    1  2015-02-24 02:23:25.886821 IP 127.0.0.1.35934 > 127.0.0.1.6379: Flags [S], seq 270581733, win 43690, options [mss 65495,sackOK,TS val 2004413385 ecr 0,nop,wscale 7], length 0
    2  2015-02-24 02:23:25.886837 IP 127.0.0.1.6379 > 127.0.0.1.35934: Flags [S.], seq 3524975383, ack 270581734, win 43690, options [mss 65495,sackOK,TS val 2004413385 ecr 2004413385,nop,wscale 7], length 0
    3  2015-02-24 02:23:25.886856 IP 127.0.0.1.35934 > 127.0.0.1.6379: Flags [.], ack 1, win 342, options [nop,nop,TS val 2004413385 ecr 2004413385], length 0
    4  2015-02-24 02:23:26.881392 IP 127.0.0.1.35934 > 127.0.0.1.6379: Flags [P.], seq 1:13, ack 1, win 342, options [nop,nop,TS val 2004413683 ecr 2004413385], length 12: RESP "set test 1"
    5  2015-02-24 02:23:26.881448 IP 127.0.0.1.6379 > 127.0.0.1.35934: Flags [.], ack 13, win 342, options [nop,nop,TS val 2004413683 ecr 2004413683], length 0
    6  2015-02-24 02:23:26.881467 IP 127.0.0.1.35934 > 127.0.0.1.6379: Flags [P.], seq 13:157, ack 1, win 342, options [nop,nop,TS val 2004413683 ecr 2004413683], length 144: RESP "incr test" "set test2 redis" "get test2" "lpush test3 r" "lpush test3 e" "lpush test3 d" "lpush test3 i" "lpush test3 s" "lrange test3 0 -1" "del test4"
    7  2015-02-24 02:23:26.881483 IP 127.0.0.1.6379 > 127.0.0.1.35934: Flags [.], ack 157, win 350, options [nop,nop,TS val 2004413683 ecr 2004413683], length 0
    8  2015-02-24 02:23:26.881494 IP 127.0.0.1.35934 > 127.0.0.1.6379: Flags [P.], seq 157:168, ack 1, win 342, options [nop,nop,TS val 2004413683 ecr 2004413683], length 11: RESP "get test4"
    9  2015-02-24 02:23:26.881506 IP 127.0.0.1.6379 > 127.0.0.1.35934: Flags [.], ack 168, win 350, options [nop,nop,TS val 2004413683 ecr 2004413683], length 0
   10  2015-02-24 02:23:26.881629 IP 127.0.0.1.6379 > 127.0.0.1.35934: Flags [P.], seq 1:1289, ack 168, win 350, options [nop,nop,TS val 2004413683 ecr 2004413683], length 1288: RESP "OK" "2" "OK" "redis" "170" "171" "172" "173" "174" "s" "i" "d" "e" "r" "s" "i" "d" "e" "r" "s" "i" "d" "e" "r" "s" "i" "d" "e" "r" "s" "i" "d" "e" "r" "s" "i" "d" "e" "r" "s" "i" "d" "e" "r" "s" "i" "d" "e" "r" "s" "i" "d" "e" "r" "s" "i" "d" "e" "r" "s" "i" "d" "e" "r" "s" "i" "d" "e" "r" "s" "i" "d" "e" "r" "s" "i" "d" "e" "r" "s" "i" "d" "e" "r" "s" "i" "d" "e" "r" "s" "i" "d" "e" "r" "s" "i" "d" "e" "r" "s" "i" "d" "e" "r" "s" "i" "d" "e" "r" "i" "r" "s" "i" "d" "e" "r" "s" "i" "d" "e" "r" "s" "i" "d" "e" "r" "s" "i" "d" "e" "r" "s" "i" "d" "e" "r" "s" "i" "d" "e" "r" "s" "i" "d" "e" "r" "d" "r" "s" "i" "d" "e" "r" "s" "i" "d" "e" "r" "s" "i" "d" "e" "r" "s" "i" "d" "e" "r" "s" "i" "d" "e" "r" "i" "s" "i" "e" "r" "s" "i" "d" "e" "r" "0" null
   11  2015-02-24 02:23:26.881658 IP 127.0.0.1.35934 > 127.0.0.1.6379: Flags [.], ack 1289, win 1365, options [nop,nop,TS val 2004413683 ecr 2004413683], length 0
   12  2015-02-24 02:23:27.885057 IP 127.0.0.1.35934 > 127.0.0.1.6379: Flags [F.], seq 168, ack 1289, win 1365, options [nop,nop,TS val 2004413984 ecr 2004413683], length 0
   13  2015-02-24 02:23:27.885157 IP 127.0.0.1.6379 > 127.0.0.1.35934: Flags [F.], seq 1289, ack 169, win 350, options [nop,nop,TS val 2004413984 ecr 2004413984], length 0
   14  2015-02-24 02:23:27.885191 IP 127.0.0.1.35934 > 127.0.0.1.6379: Flags [.], ack 1290, win 1365, options [nop,nop,TS val 2004413984 ecr 2004413984], length 0
