    1  2015-02-24 02:23:00.757048 IP 127.0.0.1.35901 > 127.0.0.1.6379: Flags [S], seq 1159918511, win 43690, options [mss 65495,sackOK,TS val 2004405846 ecr 0,nop,wscale 7], length 0
    2  2015-02-24 02:23:00.757078 IP 127.0.0.1.6379 > 127.0.0.1.35901: Flags [S.], seq 1309831771, ack 1159918512, win 43690, options [mss 65495,sackOK,TS val 2004405846 ecr 2004405846,nop,wscale 7], length 0
    3  2015-02-24 02:23:00.757105 IP 127.0.0.1.35901 > 127.0.0.1.6379: Flags [.], ack 1, win 342, options [nop,nop,TS val 2004405846 ecr 2004405846], length 0
    4  2015-02-24 02:23:00.757197 IP 127.0.0.1.35901 > 127.0.0.1.6379: Flags [P.], seq 1:7, ack 1, win 342, options [nop,nop,TS val 2004405846 ecr 2004405846], length 6: RESP "PING"
    5  2015-02-24 02:23:00.757225 IP 127.0.0.1.6379 > 127.0.0.1.35901: Flags [.], ack 7, win 342, options [nop,nop,TS val 2004405846 ecr 2004405846], length 0
    6  2015-02-24 02:23:00.757314 IP 127.0.0.1.6379 > 127.0.0.1.35901: Flags [P.], seq 1:8, ack 7, win 342, options [nop,nop,TS val 2004405846 ecr 2004405846], length 7: RESP "PONG"
    7  2015-02-24 02:23:00.757344 IP 127.0.0.1.35901 > 127.0.0.1.6379: Flags [.], ack 8, win 342, options [nop,nop,TS val 2004405846 ecr 2004405846], length 0
    8  2015-02-24 02:23:00.757391 IP 127.0.0.1.35901 > 127.0.0.1.6379: Flags [F.], seq 7, ack 8, win 342, options [nop,nop,TS val 2004405846 ecr 2004405846], length 0
    9  2015-02-24 02:23:00.757457 IP 127.0.0.1.6379 > 127.0.0.1.35901: Flags [F.], seq 8, ack 8, win 342, options [nop,nop,TS val 2004405846 ecr 2004405846], length 0
   10  2015-02-24 02:23:00.757491 IP 127.0.0.1.35901 > 127.0.0.1.6379: Flags [.], ack 9, win 342, options [nop,nop,TS val 2004405846 ecr 2004405846], length 0
   11  2015-02-24 02:23:00.757586 IP 127.0.0.1.35902 > 127.0.0.1.6379: Flags [S], seq 3880036895, win 43690, options [mss 65495,sackOK,TS val 2004405846 ecr 0,nop,wscale 7], length 0
   12  2015-02-24 02:23:00.757599 IP 127.0.0.1.6379 > 127.0.0.1.35902: Flags [S.], seq 95825237, ack 3880036896, win 43690, options [mss 65495,sackOK,TS val 2004405846 ecr 2004405846,nop,wscale 7], length 0
   13  2015-02-24 02:23:00.757612 IP 127.0.0.1.35902 > 127.0.0.1.6379: Flags [.], ack 1, win 342, options [nop,nop,TS val 2004405846 ecr 2004405846], length 0
   14  2015-02-24 02:23:00.757657 IP 127.0.0.1.35902 > 127.0.0.1.6379: Flags [P.], seq 1:15, ack 1, win 342, options [nop,nop,TS val 2004405846 ecr 2004405846], length 14: RESP "PING"
   15  2015-02-24 02:23:00.757686 IP 127.0.0.1.6379 > 127.0.0.1.35902: Flags [.], ack 15, win 342, options [nop,nop,TS val 2004405846 ecr 2004405846], length 0
   16  2015-02-24 02:23:00.757739 IP 127.0.0.1.6379 > 127.0.0.1.35902: Flags [P.], seq 1:8, ack 15, win 342, options [nop,nop,TS val 2004405846 ecr 2004405846], length 7: RESP "PONG"
   17  2015-02-24 02:23:00.757763 IP 127.0.0.1.35902 > 127.0.0.1.6379: Flags [.], ack 8, win 342, options [nop,nop,TS val 2004405846 ecr 2004405846], length 0
   18  2015-02-24 02:23:00.757810 IP 127.0.0.1.35902 > 127.0.0.1.6379: Flags [F.], seq 15, ack 8, win 342, options [nop,nop,TS val 2004405846 ecr 2004405846], length 0
   19  2015-02-24 02:23:00.757854 IP 127.0.0.1.6379 > 127.0.0.1.35902: Flags [F.], seq 8, ack 16, win 342, options [nop,nop,TS val 2004405846 ecr 2004405846], length 0
   20  2015-02-24 02:23:00.757880 IP 127.0.0.1.35902 > 127.0.0.1.6379: Flags [.], ack 9, win 342, options [nop,nop,TS val 2004405846 ecr 2004405846], length 0
   21  2015-02-24 02:23:00.758056 IP 127.0.0.1.35903 > 127.0.0.1.6379: Flags [S], seq 3040658582, win 43690, options [mss 65495,sackOK,TS val 2004405846 ecr 0,nop,wscale 7], length 0
   22  2015-02-24 02:23:00.758070 IP 127.0.0.1.6379 > 127.0.0.1.35903: Flags [S.], seq 2458684268, ack 3040658583, win 43690, options [mss 65495,sackOK,TS val 2004405846 ecr 2004405846,nop,wscale 7], length 0
   23  2015-02-24 02:23:00.758083 IP 127.0.0.1.35903 > 127.0.0.1.6379: Flags [.], ack 1, win 342, options [nop,nop,TS val 2004405846 ecr 2004405846], length 0
   24  2015-02-24 02:23:00.758126 IP 127.0.0.1.35903 > 127.0.0.1.6379: Flags [P.], seq 1:46, ack 1, win 342, options [nop,nop,TS val 2004405846 ecr 2004405846], length 45: RESP "SET" "key:000000000943" "xxx"
   25  2015-02-24 02:23:00.758159 IP 127.0.0.1.6379 > 127.0.0.1.35903: Flags [.], ack 46, win 342, options [nop,nop,TS val 2004405846 ecr 2004405846], length 0
   26  2015-02-24 02:23:00.758232 IP 127.0.0.1.6379 > 127.0.0.1.35903: Flags [P.], seq 1:6, ack 46, win 342, options [nop,nop,TS val 2004405846 ecr 2004405846], length 5: RESP "OK"
   27  2015-02-24 02:23:00.758258 IP 127.0.0.1.35903 > 127.0.0.1.6379: Flags [.], ack 6, win 342, options [nop,nop,TS val 2004405846 ecr 2004405846], length 0
   28  2015-02-24 02:23:00.758312 IP 127.0.0.1.35903 > 127.0.0.1.6379: Flags [F.], seq 46, ack 6, win 342, options [nop,nop,TS val 2004405846 ecr 2004405846], length 0
   29  2015-02-24 02:23:00.758375 IP 127.0.0.1.6379 > 127.0.0.1.35903: Flags [F.], seq 6, ack 47, win 342, options [nop,nop,TS val 2004405846 ecr 2004405846], length 0
   30  2015-02-24 02:23:00.758410 IP 127.0.0.1.35903 > 127.0.0.1.6379: Flags [.], ack 7, win 342, options [nop,nop,TS val 2004405846 ecr 2004405846], length 0
   31  2015-02-24 02:23:00.758491 IP 127.0.0.1.35904 > 127.0.0.1.6379: Flags [S], seq 2555867980, win 43690, options [mss 65495,sackOK,TS val 2004405846 ecr 0,nop,wscale 7], length 0
   32  2015-02-24 02:23:00.758504 IP 127.0.0.1.6379 > 127.0.0.1.35904: Flags [S.], seq 4291997072, ack 2555867981, win 43690, options [mss 65495,sackOK,TS val 2004405846 ecr 2004405846,nop,wscale 7], length 0
   33  2015-02-24 02:23:00.758517 IP 127.0.0.1.35904 > 127.0.0.1.6379: Flags [.], ack 1, win 342, options [nop,nop,TS val 2004405846 ecr 2004405846], length 0
   34  2015-02-24 02:23:00.758562 IP 127.0.0.1.35904 > 127.0.0.1.6379: Flags [P.], seq 1:37, ack 1, win 342, options [nop,nop,TS val 2004405846 ecr 2004405846], length 36: RESP "GET" "key:000000000199"
   35  2015-02-24 02:23:00.758590 IP 127.0.0.1.6379 > 127.0.0.1.35904: Flags [.], ack 37, win 342, options [nop,nop,TS val 2004405846 ecr 2004405846], length 0
   36  2015-02-24 02:23:00.758687 IP 127.0.0.1.6379 > 127.0.0.1.35904: Flags [P.], seq 1:10, ack 37, win 342, options [nop,nop,TS val 2004405846 ecr 2004405846], length 9: RESP "xxx"
   37  2015-02-24 02:23:00.758717 IP 127.0.0.1.35904 > 127.0.0.1.6379: Flags [.], ack 10, win 342, options [nop,nop,TS val 2004405846 ecr 2004405846], length 0
   38  2015-02-24 02:23:00.758764 IP 127.0.0.1.35904 > 127.0.0.1.6379: Flags [F.], seq 37, ack 10, win 342, options [nop,nop,TS val 2004405846 ecr 2004405846], length 0
   39  2015-02-24 02:23:00.758805 IP 127.0.0.1.6379 > 127.0.0.1.35904: Flags [F.], seq 10, ack 38, win 342, options [nop,nop,TS val 2004405846 ecr 2004405846], length 0
   40  2015-02-24 02:23:00.758838 IP 127.0.0.1.35904 > 127.0.0.1.6379: Flags [.], ack 11, win 342, options [nop,nop,TS val 2004405846 ecr 2004405846], length 0
   41  2015-02-24 02:23:00.758938 IP 127.0.0.1.35905 > 127.0.0.1.6379: Flags [S], seq 2342248419, win 43690, options [mss 65495,sackOK,TS val 2004405846 ecr 0,nop,wscale 7], length 0
   42  2015-02-24 02:23:00.758954 IP 127.0.0.1.6379 > 127.0.0.1.35905: Flags [S.], seq 2490886259, ack 2342248420, win 43690, options [mss 65495,sackOK,TS val 2004405847 ecr 2004405846,nop,wscale 7], length 0
   43  2015-02-24 02:23:00.758968 IP 127.0.0.1.35905 > 127.0.0.1.6379: Flags [.], ack 1, win 342, options [nop,nop,TS val 2004405847 ecr 2004405847], length 0
   44  2015-02-24 02:23:00.758999 IP 127.0.0.1.35905 > 127.0.0.1.6379: Flags [P.], seq 1:42, ack 1, win 342, options [nop,nop,TS val 2004405847 ecr 2004405847], length 41: RESP "INCR" "counter:000000000293"
   45  2015-02-24 02:23:00.759029 IP 127.0.0.1.6379 > 127.0.0.1.35905: Flags [.], ack 42, win 342, options [nop,nop,TS val 2004405847 ecr 2004405847], length 0
   46  2015-02-24 02:23:00.759067 IP 127.0.0.1.6379 > 127.0.0.1.35905: Flags [P.], seq 1:5, ack 42, win 342, options [nop,nop,TS val 2004405847 ecr 2004405847], length 4: RESP "3"
   47  2015-02-24 02:23:00.759095 IP 127.0.0.1.35905 > 127.0.0.1.6379: Flags [.], ack 5, win 342, options [nop,nop,TS val 2004405847 ecr 2004405847], length 0
   48  2015-02-24 02:23:00.759183 IP 127.0.0.1.35905 > 127.0.0.1.6379: Flags [F.], seq 42, ack 5, win 342, options [nop,nop,TS val 2004405847 ecr 2004405847], length 0
   49  2015-02-24 02:23:00.759224 IP 127.0.0.1.6379 > 127.0.0.1.35905: Flags [F.], seq 5, ack 43, win 342, options [nop,nop,TS val 2004405847 ecr 2004405847], length 0
   50  2015-02-24 02:23:00.759256 IP 127.0.0.1.35905 > 127.0.0.1.6379: Flags [.], ack 6, win 342, options [nop,nop,TS val 2004405847 ecr 2004405847], length 0
   51  2015-02-24 02:23:00.759421 IP 127.0.0.1.35906 > 127.0.0.1.6379: Flags [S], seq 131158412, win 43690, options [mss 65495,sackOK,TS val 2004405847 ecr 0,nop,wscale 7], length 0
   52  2015-02-24 02:23:00.759433 IP 127.0.0.1.6379 > 127.0.0.1.35906: Flags [S.], seq 49781958, ack 131158413, win 43690, options [mss 65495,sackOK,TS val 2004405847 ecr 2004405847,nop,wscale 7], length 0
   53  2015-02-24 02:23:00.759446 IP 127.0.0.1.35906 > 127.0.0.1.6379: Flags [.], ack 1, win 342, options [nop,nop,TS val 2004405847 ecr 2004405847], length 0
   54  2015-02-24 02:23:00.759476 IP 127.0.0.1.35906 > 127.0.0.1.6379: Flags [P.], seq 1:37, ack 1, win 342, options [nop,nop,TS val 2004405847 ecr 2004405847], length 36: RESP "LPUSH" "mylist" "xxx"
   55  2015-02-24 02:23:00.759511 IP 127.0.0.1.6379 > 127.0.0.1.35906: Flags [.], ack 37, win 342, options [nop,nop,TS val 2004405847 ecr 2004405847], length 0
   56  2015-02-24 02:23:00.759549 IP 127.0.0.1.6379 > 127.0.0.1.35906: Flags [P.], seq 1:9, ack 37, win 342, options [nop,nop,TS val 2004405847 ecr 2004405847], length 8: RESP "47158"
   57  2015-02-24 02:23:00.759564 IP 127.0.0.1.35906 > 127.0.0.1.6379: Flags [.], ack 9, win 342, options [nop,nop,TS val 2004405847 ecr 2004405847], length 0
   58  2015-02-24 02:23:00.759594 IP 127.0.0.1.35906 > 127.0.0.1.6379: Flags [F.], seq 37, ack 9, win 342, options [nop,nop,TS val 2004405847 ecr 2004405847], length 0
   59  2015-02-24 02:23:00.759634 IP 127.0.0.1.6379 > 127.0.0.1.35906: Flags [F.], seq 9, ack 38, win 342, options [nop,nop,TS val 2004405847 ecr 2004405847], length 0
   60  2015-02-24 02:23:00.759667 IP 127.0.0.1.35906 > 127.0.0.1.6379: Flags [.], ack 10, win 342, options [nop,nop,TS val 2004405847 ecr 2004405847], length 0
   61  2015-02-24 02:23:00.759744 IP 127.0.0.1.35907 > 127.0.0.1.6379: Flags [S], seq 1454742392, win 43690, options [mss 65495,sackOK,TS val 2004405847 ecr 0,nop,wscale 7], length 0
   62  2015-02-24 02:23:00.759762 IP 127.0.0.1.6379 > 127.0.0.1.35907: Flags [S.], seq 4166501195, ack 1454742393, win 43690, options [mss 65495,sackOK,TS val 2004405847 ecr 2004405847,nop,wscale 7], length 0
   63  2015-02-24 02:23:00.759781 IP 127.0.0.1.35907 > 127.0.0.1.6379: Flags [.], ack 1, win 342, options [nop,nop,TS val 2004405847 ecr 2004405847], length 0
   64  2015-02-24 02:23:00.759817 IP 127.0.0.1.35907 > 127.0.0.1.6379: Flags [P.], seq 1:27, ack 1, win 342, options [nop,nop,TS val 2004405847 ecr 2004405847], length 26: RESP "LPOP" "mylist"
   65  2015-02-24 02:23:00.759846 IP 127.0.0.1.6379 > 127.0.0.1.35907: Flags [.], ack 27, win 342, options [nop,nop,TS val 2004405847 ecr 2004405847], length 0
   66  2015-02-24 02:23:00.759873 IP 127.0.0.1.6379 > 127.0.0.1.35907: Flags [P.], seq 1:10, ack 27, win 342, options [nop,nop,TS val 2004405847 ecr 2004405847], length 9: RESP "xxx"
   67  2015-02-24 02:23:00.759895 IP 127.0.0.1.35907 > 127.0.0.1.6379: Flags [.], ack 10, win 342, options [nop,nop,TS val 2004405847 ecr 2004405847], length 0
   68  2015-02-24 02:23:00.759923 IP 127.0.0.1.35907 > 127.0.0.1.6379: Flags [F.], seq 27, ack 10, win 342, options [nop,nop,TS val 2004405847 ecr 2004405847], length 0
   69  2015-02-24 02:23:00.759965 IP 127.0.0.1.6379 > 127.0.0.1.35907: Flags [F.], seq 10, ack 28, win 342, options [nop,nop,TS val 2004405847 ecr 2004405847], length 0
   70  2015-02-24 02:23:00.759993 IP 127.0.0.1.35907 > 127.0.0.1.6379: Flags [.], ack 11, win 342, options [nop,nop,TS val 2004405847 ecr 2004405847], length 0
   71  2015-02-24 02:23:00.760073 IP 127.0.0.1.35908 > 127.0.0.1.6379: Flags [S], seq 545589487, win 43690, options [mss 65495,sackOK,TS val 2004405847 ecr 0,nop,wscale 7], length 0
   72  2015-02-24 02:23:00.760087 IP 127.0.0.1.6379 > 127.0.0.1.35908: Flags [S.], seq 2823817844, ack 545589488, win 43690, options [mss 65495,sackOK,TS val 2004405847 ecr 2004405847,nop,wscale 7], length 0
   73  2015-02-24 02:23:00.760100 IP 127.0.0.1.35908 > 127.0.0.1.6379: Flags [.], ack 1, win 342, options [nop,nop,TS val 2004405847 ecr 2004405847], length 0
   74  2015-02-24 02:23:00.760141 IP 127.0.0.1.35908 > 127.0.0.1.6379: Flags [P.], seq 1:53, ack 1, win 342, options [nop,nop,TS val 2004405847 ecr 2004405847], length 52: RESP "SADD" "myset" "element:000000000063"
   75  2015-02-24 02:23:00.760171 IP 127.0.0.1.6379 > 127.0.0.1.35908: Flags [.], ack 53, win 342, options [nop,nop,TS val 2004405847 ecr 2004405847], length 0
   76  2015-02-24 02:23:00.760225 IP 127.0.0.1.6379 > 127.0.0.1.35908: Flags [P.], seq 1:5, ack 53, win 342, options [nop,nop,TS val 2004405847 ecr 2004405847], length 4: RESP "1"
   77  2015-02-24 02:23:00.760248 IP 127.0.0.1.35908 > 127.0.0.1.6379: Flags [.], ack 5, win 342, options [nop,nop,TS val 2004405847 ecr 2004405847], length 0
   78  2015-02-24 02:23:00.760288 IP 127.0.0.1.35908 > 127.0.0.1.6379: Flags [F.], seq 53, ack 5, win 342, options [nop,nop,TS val 2004405847 ecr 2004405847], length 0
   79  2015-02-24 02:23:00.760343 IP 127.0.0.1.6379 > 127.0.0.1.35908: Flags [F.], seq 5, ack 54, win 342, options [nop,nop,TS val 2004405847 ecr 2004405847], length 0
   80  2015-02-24 02:23:00.760376 IP 127.0.0.1.35908 > 127.0.0.1.6379: Flags [.], ack 6, win 342, options [nop,nop,TS val 2004405847 ecr 2004405847], length 0
   81  2015-02-24 02:23:00.760502 IP 127.0.0.1.35909 > 127.0.0.1.6379: Flags [S], seq 296698850, win 43690, options [mss 65495,sackOK,TS val 2004405847 ecr 0,nop,wscale 7], length 0
   82  2015-02-24 02:23:00.760523 IP 127.0.0.1.6379 > 127.0.0.1.35909: Flags [S.], seq 3970806453, ack 296698851, win 43690, options [mss 65495,sackOK,TS val 2004405847 ecr 2004405847,nop,wscale 7], length 0
   83  2015-02-24 02:23:00.760544 IP 127.0.0.1.35909 > 127.0.0.1.6379: Flags [.], ack 1, win 342, options [nop,nop,TS val 2004405847 ecr 2004405847], length 0
   84  2015-02-24 02:23:00.760589 IP 127.0.0.1.35909 > 127.0.0.1.6379: Flags [P.], seq 1:26, ack 1, win 342, options [nop,nop,TS val 2004405847 ecr 2004405847], length 25: RESP "SPOP" "myset"
   85  2015-02-24 02:23:00.760628 IP 127.0.0.1.6379 > 127.0.0.1.35909: Flags [.], ack 26, win 342, options [nop,nop,TS val 2004405847 ecr 2004405847], length 0
   86  2015-02-24 02:23:00.760659 IP 127.0.0.1.6379 > 127.0.0.1.35909: Flags [P.], seq 1:28, ack 26, win 342, options [nop,nop,TS val 2004405847 ecr 2004405847], length 27: RESP "element:000000000063"
   87  2015-02-24 02:23:00.760682 IP 127.0.0.1.35909 > 127.0.0.1.6379: Flags [.], ack 28, win 342, options [nop,nop,TS val 2004405847 ecr 2004405847], length 0
   88  2015-02-24 02:23:00.760714 IP 127.0.0.1.35909 > 127.0.0.1.6379: Flags [F.], seq 26, ack 28, win 342, options [nop,nop,TS val 2004405847 ecr 2004405847], length 0
   89  2015-02-24 02:23:00.760757 IP 127.0.0.1.6379 > 127.0.0.1.35909: Flags [F.], seq 28, ack 27, win 342, options [nop,nop,TS val 2004405847 ecr 2004405847], length 0
   90  2015-02-24 02:23:00.760777 IP 127.0.0.1.35909 > 127.0.0.1.6379: Flags [.], ack 29, win 342, options [nop,nop,TS val 2004405847 ecr 2004405847], length 0
   91  2015-02-24 02:23:00.760892 IP 127.0.0.1.35910 > 127.0.0.1.6379: Flags [S], seq 2082555059, win 43690, options [mss 65495,sackOK,TS val 2004405847 ecr 0,nop,wscale 7], length 0
   92  2015-02-24 02:23:00.760911 IP 127.0.0.1.6379 > 127.0.0.1.35910: Flags [S.], seq 1762470779, ack 2082555060, win 43690, options [mss 65495,sackOK,TS val 2004405847 ecr 2004405847,nop,wscale 7], length 0
   93  2015-02-24 02:23:00.760931 IP 127.0.0.1.35910 > 127.0.0.1.6379: Flags [.], ack 1, win 342, options [nop,nop,TS val 2004405847 ecr 2004405847], length 0
   94  2015-02-24 02:23:00.760973 IP 127.0.0.1.35910 > 127.0.0.1.6379: Flags [P.], seq 1:37, ack 1, win 342, options [nop,nop,TS val 2004405847 ecr 2004405847], length 36: RESP "LPUSH" "mylist" "xxx"
   95  2015-02-24 02:23:00.761006 IP 127.0.0.1.6379 > 127.0.0.1.35910: Flags [.], ack 37, win 342, options [nop,nop,TS val 2004405847 ecr 2004405847], length 0
   96  2015-02-24 02:23:00.761026 IP 127.0.0.1.6379 > 127.0.0.1.35910: Flags [P.], seq 1:9, ack 37, win 342, options [nop,nop,TS val 2004405847 ecr 2004405847], length 8: RESP "47158"
   97  2015-02-24 02:23:00.761047 IP 127.0.0.1.35910 > 127.0.0.1.6379: Flags [.], ack 9, win 342, options [nop,nop,TS val 2004405847 ecr 2004405847], length 0
   98  2015-02-24 02:23:00.761078 IP 127.0.0.1.35910 > 127.0.0.1.6379: Flags [F.], seq 37, ack 9, win 342, options [nop,nop,TS val 2004405847 ecr 2004405847], length 0
   99  2015-02-24 02:23:00.761119 IP 127.0.0.1.6379 > 127.0.0.1.35910: Flags [F.], seq 9, ack 38, win 342, options [nop,nop,TS val 2004405847 ecr 2004405847], length 0
  100  2015-02-24 02:23:00.761139 IP 127.0.0.1.35910 > 127.0.0.1.6379: Flags [.], ack 10, win 342, options [nop,nop,TS val 2004405847 ecr 2004405847], length 0
  101  2015-02-24 02:23:00.761303 IP 127.0.0.1.35911 > 127.0.0.1.6379: Flags [S], seq 823555559, win 43690, options [mss 65495,sackOK,TS val 2004405847 ecr 0,nop,wscale 7], length 0
  102  2015-02-24 02:23:00.761322 IP 127.0.0.1.6379 > 127.0.0.1.35911: Flags [S.], seq 1343119127, ack 823555560, win 43690, options [mss 65495,sackOK,TS val 2004405847 ecr 2004405847,nop,wscale 7], length 0
  103  2015-02-24 02:23:00.761344 IP 127.0.0.1.35911 > 127.0.0.1.6379: Flags [.], ack 1, win 342, options [nop,nop,TS val 2004405847 ecr 2004405847], length 0
  104  2015-02-24 02:23:00.761382 IP 127.0.0.1.35911 > 127.0.0.1.6379: Flags [P.], seq 1:44, ack 1, win 342, options [nop,nop,TS val 2004405847 ecr 2004405847], length 43: RESP "LRANGE" "mylist" "0" "99"
  105  2015-02-24 02:23:00.761415 IP 127.0.0.1.6379 > 127.0.0.1.35911: Flags [.], ack 44, win 342, options [nop,nop,TS val 2004405847 ecr 2004405847], length 0
  106  2015-02-24 02:23:00.761444 IP 127.0.0.1.6379 > 127.0.0.1.35911: Flags [P.], seq 1:907, ack 44, win 342, options [nop,nop,TS val 2004405847 ecr 2004405847], length 906: RESP "xxx" "xxx" "xxx" "xxx" "xxx" "xxx" "xxx" "xxx" "xxx" "xxx" "xxx" "xxx" "xxx" "xxx" "xxx" "xxx" "xxx" "xxx" "xxx" "xxx" "xxx" "xxx" "xxx" "xxx" "xxx" "xxx" "xxx" "xxx" "xxx" "xxx" "xxx" "xxx" "xxx" "xxx" "xxx" "xxx" "xxx" "xxx" "xxx" "xxx" "xxx" "xxx" "xxx" "xxx" "xxx" "xxx" "xxx" "xxx" "xxx" "xxx" "xxx" "xxx" "xxx" "xxx" "xxx" "xxx" "xxx" "xxx" "xxx" "xxx" "xxx" "xxx" "xxx" "xxx" "xxx" "xxx" "xxx" "xxx" "xxx" "xxx" "xxx" "xxx" "xxx" "xxx" "xxx" "xxx" "xxx" "xxx" "xxx" "xxx" "xxx" "xxx" "xxx" "xxx" "xxx" "xxx" "xxx" "xxx" "xxx" "xxx" "xxx" "xxx" "xxx" "xxx" "xxx" "xxx" "xxx" "xxx" "xxx" "xxx"
  107  2015-02-24 02:23:00.761465 IP 127.0.0.1.35911 > 127.0.0.1.6379: Flags [.], ack 907, win 356, options [nop,nop,TS val 2004405847 ecr 2004405847], length 0
  108  2015-02-24 02:23:00.761570 IP 127.0.0.1.35911 > 127.0.0.1.6379: Flags [F.], seq 44, ack 907, win 356, options [nop,nop,TS val 2004405847 ecr 2004405847], length 0
  109  2015-02-24 02:23:00.761643 IP 127.0.0.1.6379 > 127.0.0.1.35911: Flags [F.], seq 907, ack 45, win 342, options [nop,nop,TS val 2004405847 ecr 2004405847], length 0
  110  2015-02-24 02:23:00.761669 IP 127.0.0.1.35911 > 127.0.0.1.6379: Flags [.], ack 908, win 356, options [nop,nop,TS val 2004405847 ecr 2004405847], length 0
  111  2015-02-24 02:23:00.761779 IP 127.0.0.1.35912 > 127.0.0.1.6379: Flags [S], seq 2379661641, win 43690, options [mss 65495,sackOK,TS val 2004405847 ecr 0,nop,wscale 7], length 0
  112  2015-02-24 02:23:00.761792 IP 127.0.0.1.6379 > 127.0.0.1.35912: Flags [S.], seq 1832740480, ack 2379661642, win 43690, options [mss 65495,sackOK,TS val 2004405847 ecr 2004405847,nop,wscale 7], length 0
  113  2015-02-24 02:23:00.761805 IP 127.0.0.1.35912 > 127.0.0.1.6379: Flags [.], ack 1, win 342, options [nop,nop,TS val 2004405847 ecr 2004405847], length 0
  114  2015-02-24 02:23:00.761832 IP 127.0.0.1.35912 > 127.0.0.1.6379: Flags [P.], seq 1:45, ack 1, win 342, options [nop,nop,TS val 2004405847 ecr 2004405847], length 44: RESP "LRANGE" "mylist" "0" "299"
  115  2015-02-24 02:23:00.761857 IP 127.0.0.1.6379 > 127.0.0.1.35912: Flags [.], ack 45, win 342, options [nop,nop,TS val 2004405847 ecr 2004405847], length 0
  116  2015-02-24 02:23:00.761899 IP 127.0.0.1.6379 > 127.0.0.1.35912: Flags [P.], seq 1:2707, ack 45, win 342, options [nop,nop,TS val 2004405847 ecr 2004405847], length 2706: RESP "xxx" "xxx" "xxx" "xxx" "xxx" "xxx" "xxx" "xxx" "xxx" "xxx" "xxx" "xxx" "xxx" "xxx" "xxx" "xxx" "xxx" "xxx" "xxx" "xxx" "xxx" "xxx" "xxx" "xxx" "xxx" "xxx" "xxx" "xxx" "xxx" "xxx" "xxx" "xxx" "xxx" "xxx" "xxx" "xxx" "xxx" "xxx" "xxx" "xxx" "xxx" "xxx" "xxx" "xxx" "xxx" "xxx" "xxx" "xxx" "xxx" "xxx" "xxx" "xxx" "xxx" "xxx" "xxx" "xxx" "xxx" "xxx" "xxx" "xxx" "xxx" "xxx" "xxx" "xxx" "xxx" "xxx" "xxx" "xxx" "xxx" "xxx" "xxx" "xxx" "xxx" "xxx" "xxx" "xxx" "xxx" "xxx" "xxx" "xxx" "xxx" "xxx" "xxx" "xxx" "xxx" "xxx" "xxx" "xxx" "xxx" "xxx" "xxx" "xxx" "xxx" "xxx" "xxx" "xxx" "xxx" "xxx" "xxx" "xxx" "xxx" "xxx" "xxx" "xxx" "xxx" "xxx" "xxx" "xxx" "xxx" "xxx" "xxx" "xxx" "xxx" "xxx" "xxx" "xxx" "xxx" "xxx" "xxx" "xxx" "xxx" "xxx" "xxx" "xxx" "xxx" "xxx" "xxx" "xxx" "xxx" "xxx" "xxx" "xxx" "xxx" "xxx" "xxx" "xxx" "xxx" "xxx" "xxx" "xxx" "xxx" "xxx" "xxx" "xxx" "xxx" "xxx" "xxx" "xxx" "xxx" "xxx" "xxx" "xxx" "xxx" "xxx" "xxx" "xxx" "xxx" "xxx" "xxx" "xxx" "xxx" "xxx" "xxx" "xxx" "xxx" "xxx" "xxx" "xxx" "xxx" "xxx" "xxx" "xxx" "xxx" "xxx" "xxx" "xxx" "xxx" "xxx" "xxx" "xxx" "xxx" "xxx" "xxx" "xxx" "xxx" "xxx" "xxx" "xxx" "xxx" "xxx" "xxx" "xxx" "xxx" "xxx" "xxx" "xxx" "xxx" "xxx" "xxx" "xxx" "xxx" "xxx" "xxx" "xxx" "xxx" "xxx" "xxx" "xxx" "xxx" "xxx" "xxx" "xxx" "xxx" "xxx" "xxx" "xxx" "xxx" "xxx" "xxx" "xxx" "xxx" "xxx" "xxx" "xxx" "xxx" "xxx" "xxx" "xxx" "xxx" "xxx" "xxx" "xxx" "xxx" "xxx" "xxx" "xxx" "xxx" "xxx" "xxx" "xxx" "xxx" "xxx" "xxx" "xxx" "xxx" "xxx" "xxx" "xxx" "xxx" "xxx" "xxx" "xxx" "xxx" "xxx" "xxx" "xxx" "xxx" "xxx" "xxx" "xxx" "xxx" "xxx" "xxx" "xxx" "xxx" "xxx" "xxx" "xxx" "xxx" "xxx" "xxx" "xxx" "xxx" "xxx" "xxx" "xxx" "xxx" "xxx" "xxx" "xxx" "xxx" "xxx" "xxx" "xxx" "xxx" "xxx" "xxx" "xxx" "xxx" "xxx" "xxx" "xxx" "xxx" "xxx" "xxx" "xxx" "xxx" "xxx" "xxx" "xxx"
  117  2015-02-24 02:23:00.761922 IP 127.0.0.1.35912 > 127.0.0.1.6379: Flags [.], ack 2707, win 1365, options [nop,nop,TS val 2004405847 ecr 2004405847], length 0
  118  2015-02-24 02:23:00.762025 IP 127.0.0.1.35912 > 127.0.0.1.6379: Flags [F.], seq 45, ack 2707, win 1365, options [nop,nop,TS val 2004405847 ecr 2004405847], length 0
  119  2015-02-24 02:23:00.762064 IP 127.0.0.1.6379 > 127.0.0.1.35912: Flags [F.], seq 2707, ack 46, win 342, options [nop,nop,TS val 2004405847 ecr 2004405847], length 0
  120  2015-02-24 02:23:00.762084 IP 127.0.0.1.35912 > 127.0.0.1.6379: Flags [.], ack 2708, win 1365, options [nop,nop,TS val 2004405847 ecr 2004405847], length 0
  121  2015-02-24 02:23:00.762164 IP 127.0.0.1.35913 > 127.0.0.1.6379: Flags [S], seq 1669304377, win 43690, options [mss 65495,sackOK,TS val 2004405847 ecr 0,nop,wscale 7], length 0
  122  2015-02-24 02:23:00.762174 IP 127.0.0.1.6379 > 127.0.0.1.35913: Flags [S.], seq 1910612537, ack 1669304378, win 43690, options [mss 65495,sackOK,TS val 2004405847 ecr 2004405847,nop,wscale 7], length 0
  123  2015-02-24 02:23:00.762189 IP 127.0.0.1.35913 > 127.0.0.1.6379: Flags [.], ack 1, win 342, options [nop,nop,TS val 2004405847 ecr 2004405847], length 0
  124  2015-02-24 02:23:00.762214 IP 127.0.0.1.35913 > 127.0.0.1.6379: Flags [P.], seq 1:45, ack 1, win 342, options [nop,nop,TS val 2004405848 ecr 2004405847], length 44: RESP "LRANGE" "mylist" "0" "449"
  125  2015-02-24 02:23:00.762237 IP 127.0.0.1.6379 > 127.0.0.1.35913: Flags [.], ack 45, win 342, options [nop,nop,TS val 2004405848 ecr 2004405848], length 0
  126  2015-02-24 02:23:00.762297 IP 127.0.0.1.6379 > 127.0.0.1.35913: Flags [P.], seq 1:4057, ack 45, win 342, options [nop,nop,TS val 2004405848 ecr 2004405848], length 4056: RESP "xxx" "xxx" "xxx" "xxx" "xxx" "xxx" "xxx" "xxx" "xxx" "xxx" "xxx" "xxx" "xxx" "xxx" "xxx" "xxx" "xxx" "xxx" "xxx" "xxx" "xxx" "xxx" "xxx" "xxx" "xxx" "xxx" "xxx" "xxx" "xxx" "xxx" "xxx" "xxx" "xxx" "xxx" "xxx" "xxx" "xxx" "xxx" "xxx" "xxx" "xxx" "xxx" "xxx" "xxx" "xxx" "xxx" "xxx" "xxx" "xxx" "xxx" "xxx" "xxx" "xxx" "xxx" "xxx" "xxx" "xxx" "xxx" "xxx" "xxx" "xxx" "xxx" "xxx" "xxx" "xxx" "xxx" "xxx" "xxx" "xxx" "xxx" "xxx" "xxx" "xxx" "xxx" "xxx" "xxx" "xxx" "xxx" "xxx" "xxx" "xxx" "xxx" "xxx" "xxx" "xxx" "xxx" "xxx" "xxx" "xxx" "xxx" "xxx" "xxx" "xxx" "xxx" "xxx" "xxx" "xxx" "xxx" "xxx" "xxx" "xxx" "xxx" "xxx" "xxx" "xxx" "xxx" "xxx" "xxx" "xxx" "xxx" "xxx" "xxx" "xxx" "xxx" "xxx" "xxx" "xxx" "xxx" "xxx" "xxx" "xxx" "xxx" "xxx" "xxx" "xxx" "xxx" "xxx" "xxx" "xxx" "xxx" "xxx" "xxx" "xxx" "xxx" "xxx" "xxx" "xxx" "xxx" "xxx" "xxx" "xxx" "xxx" "xxx" "xxx" "xxx" "xxx" "xxx" "xxx" "xxx" "xxx" "xxx" "xxx" "xxx" "xxx" "xxx" "xxx" "xxx" "xxx" "xxx" "xxx" "xxx" "xxx" "xxx" "xxx" "xxx" "xxx" "xxx" "xxx" "xxx" "xxx" "xxx" "xxx" "xxx" "xxx" "xxx" "xxx" "xxx" "xxx" "xxx" "xxx" "xxx" "xxx" "xxx" "xxx" "xxx" "xxx" "xxx" "xxx" "xxx" "xxx" "xxx" "xxx" "xxx" "xxx" "xxx" "xxx" "xxx" "xxx" "xxx" "xxx" "xxx" "xxx" "xxx" "xxx" "xxx" "xxx" "xxx" "xxx" "xxx" "xxx" "xxx" "xxx" "xxx" "xxx" "xxx" "xxx" "xxx" "xxx" "xxx" "xxx" "xxx" "xxx" "xxx" "xxx" "xxx" "xxx" "xxx" "xxx" "xxx" "xxx" "xxx" "xxx" "xxx" "xxx" "xxx" "xxx" "xxx" "xxx" "xxx" "xxx" "xxx" "xxx" "xxx" "xxx" "xxx" "xxx" "xxx" "xxx" "xxx" "xxx" "xxx" "xxx" "xxx" "xxx" "xxx" "xxx" "xxx" "xxx" "xxx" "xxx" "xxx" "xxx" "xxx" "xxx" "xxx" "xxx" "xxx" "xxx" "xxx" "xxx" "xxx" "xxx" "xxx" "xxx" "xxx" "xxx" "xxx" "xxx" "xxx" "xxx" "xxx" "xxx" "xxx" "xxx" "xxx" "xxx" "xxx" "xxx" "xxx" "xxx" "xxx" "xxx" "xxx" "xxx" "xxx" "xxx" "xxx" "xxx" "xxx" "xxx" "xxx" "xxx" "xxx" "xxx" "xxx" "xxx" "xxx" "xxx" "xxx" "xxx" "xxx" "xxx" "xxx" "xxx" "xxx" "xxx" "xxx" "xxx" "xxx" "xxx" "xxx" "xxx" "xxx" "xxx" "xxx" "xxx" "xxx" "xxx" "xxx" "xxx" "xxx" "xxx" "xxx" "xxx" "xxx" "xxx" "xxx" "xxx" "xxx" "xxx" "xxx" "xxx" "xxx" "xxx" "xxx" "xxx" "xxx" "xxx" "xxx" "xxx" "xxx" "xxx" "xxx" "xxx" "xxx" "xxx" "xxx" "xxx" "xxx" "xxx" "xxx" "xxx" "xxx" "xxx" "xxx" "xxx" "xxx" "xxx" "xxx" "xxx" "xxx" "xxx" "xxx" "xxx" "xxx" "xxx" "xxx" "xxx" "xxx" "xxx" "xxx" "xxx" "xxx" "xxx" "xxx" "xxx" "xxx" "xxx" "xxx" "xxx" "xxx" "xxx" "xxx" "xxx" "xxx" "xxx" "xxx" "xxx" "xxx" "xxx" "xxx" "xxx" "xxx" "xxx" "xxx" "xxx" "xxx" "xxx" "xxx" "xxx" "xxx" "xxx" "xxx" "xxx" "xxx" "xxx" "xxx" "xxx" "xxx" "xxx" "xxx" "xxx" "xxx" "xxx" "xxx" "xxx" "xxx" "xxx" "xxx" "xxx" "xxx" "xxx" "xxx" "xxx" "xxx" "xxx" "xxx" "xxx" "xxx" "xxx" "xxx" "xxx" "xxx" "xxx" "xxx" "xxx" "xxx" "xxx" "xxx" "xxx"
  127  2015-02-24 02:23:00.762326 IP 127.0.0.1.35913 > 127.0.0.1.6379: Flags [.], ack 4057, win 1365, options [nop,nop,TS val 2004405848 ecr 2004405848], length 0
  128  2015-02-24 02:23:00.762419 IP 127.0.0.1.35913 > 127.0.0.1.6379: Flags [F.], seq 45, ack 4057, win 1365, options [nop,nop,TS val 2004405848 ecr 2004405848], length 0
  129  2015-02-24 02:23:00.762466 IP 127.0.0.1.6379 > 127.0.0.1.35913: Flags [F.], seq 4057, ack 46, win 342, options [nop,nop,TS val 2004405848 ecr 2004405848], length 0
  130  2015-02-24 02:23:00.762497 IP 127.0.0.1.35913 > 127.0.0.1.6379: Flags [.], ack 4058, win 1365, options [nop,nop,TS val 2004405848 ecr 2004405848], length 0
  131  2015-02-24 02:23:00.762545 IP 127.0.0.1.35914 > 127.0.0.1.6379: Flags [S], seq 1695153288, win 43690, options [mss 65495,sackOK,TS val 2004405848 ecr 0,nop,wscale 7], length 0
  132  2015-02-24 02:23:00.762557 IP 127.0.0.1.6379 > 127.0.0.1.35914: Flags [S.], seq 488402032, ack 1695153289, win 43690, options [mss 65495,sackOK,TS val 2004405848 ecr 2004405848,nop,wscale 7], length 0
  133  2015-02-24 02:23:00.762569 IP 127.0.0.1.35914 > 127.0.0.1.6379: Flags [.], ack 1, win 342, options [nop,nop,TS val 2004405848 ecr 2004405848], length 0
  134  2015-02-24 02:23:00.762595 IP 127.0.0.1.35914 > 127.0.0.1.6379: Flags [P.], seq 1:45, ack 1, win 342, options [nop,nop,TS val 2004405848 ecr 2004405848], length 44: RESP "LRANGE" "mylist" "0" "599"
  135  2015-02-24 02:23:00.762620 IP 127.0.0.1.6379 > 127.0.0.1.35914: Flags [.], ack 45, win 342, options [nop,nop,TS val 2004405848 ecr 2004405848], length 0
  136  2015-02-24 02:23:00.762673 IP 127.0.0.1.6379 > 127.0.0.1.35914: Flags [P.], seq 1:5407, ack 45, win 342, options [nop,nop,TS val 2004405848 ecr 2004405848], length 5406: RESP "xxx" "xxx" "xxx" "xxx" "xxx" "xxx" "xxx" "xxx" "xxx" "xxx" "xxx" "xxx" "xxx" "xxx" "xxx" "xxx" "xxx" "xxx" "xxx" "xxx" "xxx" "xxx" "xxx" "xxx" "xxx" "xxx" "xxx" "xxx" "xxx" "xxx" "xxx" "xxx" "xxx" "xxx" "xxx" "xxx" "xxx" "xxx" "xxx" "xxx" "xxx" "xxx" "xxx" "xxx" "xxx" "xxx" "xxx" "xxx" "xxx" "xxx" "xxx" "xxx" "xxx" "xxx" "xxx" "xxx" "xxx" "xxx" "xxx" "xxx" "xxx" "xxx" "xxx" "xxx" "xxx" "xxx" "xxx" "xxx" "xxx" "xxx" "xxx" "xxx" "xxx" "xxx" "xxx" "xxx" "xxx" "xxx" "xxx" "xxx" "xxx" "xxx" "xxx" "xxx" "xxx" "xxx" "xxx" "xxx" "xxx" "xxx" "xxx" "xxx" "xxx" "xxx" "xxx" "xxx" "xxx" "xxx" "xxx" "xxx" "xxx" "xxx" "xxx" "xxx" "xxx" "xxx" "xxx" "xxx" "xxx" "xxx" "xxx" "xxx" "xxx" "xxx" "xxx" "xxx" "xxx" "xxx" "xxx" "xxx" "xxx" "xxx" "xxx" "xxx" "xxx" "xxx" "xxx" "xxx" "xxx" "xxx" "xxx" "xxx" "xxx" "xxx" "xxx" "xxx" "xxx" "xxx" "xxx" "xxx" "xxx" "xxx" "xxx" "xxx" "xxx" "xxx" "xxx" "xxx" "xxx" "xxx" "xxx" "xxx" "xxx" "xxx" "xxx" "xxx" "xxx" "xxx" "xxx" "xxx" "xxx" "xxx" "xxx" "xxx" "xxx" "xxx" "xxx" "xxx" "xxx" "xxx" "xxx" "xxx" "xxx" "xxx" "xxx" "xxx" "xxx" "xxx" "xxx" "xxx" "xxx" "xxx" "xxx" "xxx" "xxx" "xxx" "xxx" "xxx" "xxx" "xxx" "xxx" "xxx" "xxx" "xxx" "xxx" "xxx" "xxx" "xxx" "xxx" "xxx" "xxx" "xxx" "xxx" "xxx" "xxx" "xxx" "xxx" "xxx" "xxx" "xxx" "xxx" "xxx" "xxx" "xxx" "xxx" "xxx" "xxx" "xxx" "xxx" "xxx" "xxx" "xxx" "xxx" "xxx" "xxx" "xxx" "xxx" "xxx" "xxx" "xxx" "xxx" "xxx" "xxx" "xxx" "xxx" "xxx" "xxx" "xxx" "xxx" "xxx" "xxx" "xxx" "xxx" "xxx" "xxx" "xxx" "xxx" "xxx" "xxx" "xxx" "xxx" "xxx" "xxx" "xxx" "xxx" "xxx" "xxx" "xxx" "xxx" "xxx" "xxx" "xxx" "xxx" "xxx" "xxx" "xxx" "xxx" "xxx" "xxx" "xxx" "xxx" "xxx" "xxx" "xxx" "xxx" "xxx" "xxx" "xxx" "xxx" "xxx" "xxx" "xxx" "xxx" "xxx" "xxx" "xxx" "xxx" "xxx" "xxx" "xxx" "xxx" "xxx" "xxx" "xxx" "xxx" "xxx" "xxx" "xxx" "xxx" "xxx" "xxx" "xxx" "xxx" "xxx" "xxx" "xxx" "xxx" "xxx" "xxx" "xxx" "xxx" "xxx" "xxx" "xxx" "xxx" "xxx" "xxx" "xxx" "xxx" "xxx" "xxx" "xxx" "xxx" "xxx" "xxx" "xxx" "xxx" "xxx" "xxx" "xxx" "xxx" "xxx" "xxx" "xxx" "xxx" "xxx" "xxx" "xxx" "xxx" "xxx" "xxx" "xxx" "xxx" "xxx" "xxx" "xxx" "xxx" "xxx" "xxx" "xxx" "xxx" "xxx" "xxx" "xxx" "xxx" "xxx" "xxx" "xxx" "xxx" "xxx" "xxx" "xxx" "xxx" "xxx" "xxx" "xxx" "xxx" "xxx" "xxx" "xxx" "xxx" "xxx" "xxx" "xxx" "xxx" "xxx" "xxx" "xxx" "xxx" "xxx" "xxx" "xxx" "xxx" "xxx" "xxx" "xxx" "xxx" "xxx" "xxx" "xxx" "xxx" "xxx" "xxx" "xxx" "xxx" "xxx" "xxx" "xxx" "xxx" "xxx" "xxx" "xxx" "xxx" "xxx" "xxx" "xxx" "xxx" "xxx" "xxx" "xxx" "xxx" "xxx" "xxx" "xxx" "xxx" "xxx" "xxx" "xxx" "xxx" "xxx" "xxx" "xxx" "xxx" "xxx" "xxx" "xxx" "xxx" "xxx" "xxx" "xxx" "xxx" "xxx" "xxx" "xxx" "xxx" "xxx" "xxx" "xxx" "xxx" "xxx" "xxx" "xxx" "xxx" "xxx" "xxx" "xxx" "xxx" "xxx" "xxx" "xxx" "xxx" "xxx" "xxx" "xxx" "xxx" "xxx" "xxx" "xxx" "xxx" "xxx" "xxx" "xxx" "xxx" "xxx" "xxx" "xxx" "xxx" "xxx" "xxx" "xxx" "xxx" "xxx" "xxx" "xxx" "xxx" "xxx" "xxx" "xxx" "xxx" "xxx" "xxx" "xxx" "xxx" "xxx" "xxx" "xxx" "xxx" "xxx" "xxx" "xxx" "xxx" "xxx" "xxx" "xxx" "xxx" "xxx" "xxx" "xxx" "xxx" "xxx" "xxx" "xxx" "xxx" "xxx" "xxx" "xxx" "xxx" "xxx" "xxx" "xxx" "xxx" "xxx" "xxx" "xxx" "xxx" "xxx" "xxx" "xxx" "xxx" "xxx" "xxx" "xxx" "xxx" "xxx" "xxx" "xxx" "xxx" "xxx" "xxx" "xxx" "xxx" "xxx" "xxx" "xxx" "xxx" "xxx" "xxx" "xxx" "xxx" "xxx" "xxx" "xxx" "xxx" "xxx" "xxx" "xxx" "xxx" "xxx" "xxx" "xxx" "xxx" "xxx" "xxx" "xxx" "xxx" "xxx" "xxx" "xxx" "xxx" "xxx" "xxx" "xxx" "xxx" "xxx" "xxx" "xxx" "xxx" "xxx" "xxx" "xxx" "xxx" "xxx" "xxx" "xxx" "xxx" "xxx" "xxx" "xxx" "xxx" "xxx" "xxx" "xxx" "xxx" "xxx" "xxx" "xxx" "xxx" "xxx" "xxx" "xxx" "xxx" "xxx" "xxx" "xxx" "xxx" "xxx" "xxx" "xxx" "xxx" "xxx"
  137  2015-02-24 02:23:00.762705 IP 127.0.0.1.35914 > 127.0.0.1.6379: Flags [.], ack 5407, win 1365, options [nop,nop,TS val 2004405848 ecr 2004405848], length 0
  138  2015-02-24 02:23:00.762835 IP 127.0.0.1.35914 > 127.0.0.1.6379: Flags [F.], seq 45, ack 5407, win 1365, options [nop,nop,TS val 2004405848 ecr 2004405848], length 0
  139  2015-02-24 02:23:00.762875 IP 127.0.0.1.6379 > 127.0.0.1.35914: Flags [F.], seq 5407, ack 46, win 342, options [nop,nop,TS val 2004405848 ecr 2004405848], length 0
  140  2015-02-24 02:23:00.762898 IP 127.0.0.1.35914 > 127.0.0.1.6379: Flags [.], ack 5408, win 1365, options [nop,nop,TS val 2004405848 ecr 2004405848], length 0
  141  2015-02-24 02:23:00.762974 IP 127.0.0.1.35915 > 127.0.0.1.6379: Flags [S], seq 3952529642, win 43690, options [mss 65495,sackOK,TS val 2004405848 ecr 0,nop,wscale 7], length 0
  142  2015-02-24 02:23:00.762987 IP 127.0.0.1.6379 > 127.0.0.1.35915: Flags [S.], seq 2079771045, ack 3952529643, win 43690, options [mss 65495,sackOK,TS val 2004405848 ecr 2004405848,nop,wscale 7], length 0
  143  2015-02-24 02:23:00.763000 IP 127.0.0.1.35915 > 127.0.0.1.6379: Flags [.], ack 1, win 342, options [nop,nop,TS val 2004405848 ecr 2004405848], length 0
  144  2015-02-24 02:23:00.763037 IP 127.0.0.1.35915 > 127.0.0.1.6379: Flags [P.], seq 1:336, ack 1, win 342, options [nop,nop,TS val 2004405848 ecr 2004405848], length 335: RESP "MSET" "key:000000000525" "xxx" "key:000000000050" "xxx" "key:000000000416" "xxx" "key:000000000263" "xxx" "key:000000000941" "xxx" "key:000000000148" "xxx" "key:000000000739" "xxx" "key:000000000571" "xxx" "key:000000000974" "xxx" "key:000000000495" "xxx"
  145  2015-02-24 02:23:00.763060 IP 127.0.0.1.6379 > 127.0.0.1.35915: Flags [.], ack 336, win 350, options [nop,nop,TS val 2004405848 ecr 2004405848], length 0
  146  2015-02-24 02:23:00.763159 IP 127.0.0.1.6379 > 127.0.0.1.35915: Flags [P.], seq 1:6, ack 336, win 350, options [nop,nop,TS val 2004405848 ecr 2004405848], length 5: RESP "OK"
  147  2015-02-24 02:23:00.763180 IP 127.0.0.1.35915 > 127.0.0.1.6379: Flags [.], ack 6, win 342, options [nop,nop,TS val 2004405848 ecr 2004405848], length 0
  148  2015-02-24 02:23:00.763202 IP 127.0.0.1.35915 > 127.0.0.1.6379: Flags [F.], seq 336, ack 6, win 342, options [nop,nop,TS val 2004405848 ecr 2004405848], length 0
  149  2015-02-24 02:23:00.763238 IP 127.0.0.1.6379 > 127.0.0.1.35915: Flags [F.], seq 6, ack 337, win 350, options [nop,nop,TS val 2004405848 ecr 2004405848], length 0
  150  2015-02-24 02:23:00.763263 IP 127.0.0.1.35915 > 127.0.0.1.6379: Flags [.], ack 7, win 342, options [nop,nop,TS val 2004405848 ecr 2004405848], length 0
