    1  2016-01-27 20:01:00.856800 IP 127.0.0.1.52759 > 127.0.0.1.6379: Flags [F.], seq 2169831382, ack 489972337, win 342, options [nop,nop,TS val 1132418034 ecr 1132417734], length 0
    2  2016-01-27 20:01:00.856919 IP 127.0.0.1.6379 > 127.0.0.1.52759: Flags [F.], seq 1, ack 1, win 342, options [nop,nop,TS val 1132418034 ecr 1132418034], length 0
    3  2016-01-27 20:01:00.856944 IP 127.0.0.1.52759 > 127.0.0.1.6379: Flags [.], ack 2, win 342, options [nop,nop,TS val 1132418034 ecr 1132418034], length 0
    4  2016-01-27 20:01:00.864538 IP 127.0.0.1.52760 > 127.0.0.1.6379: Flags [S], seq 264055152, win 43690, options [mss 65495,sackOK,TS val 1132418037 ecr 0,nop,wscale 7], length 0
    5  2016-01-27 20:01:00.864559 IP 127.0.0.1.6379 > 127.0.0.1.52760: Flags [S.], seq 4227148888, ack 264055153, win 43690, options [mss 65495,sackOK,TS val 1132418037 ecr 1132418037,nop,wscale 7], length 0
    6  2016-01-27 20:01:00.864573 IP 127.0.0.1.52760 > 127.0.0.1.6379: Flags [.], ack 1, win 342, options [nop,nop,TS val 1132418037 ecr 1132418037], length 0
    7  2016-01-27 20:01:00.864630 IP 127.0.0.1.52760 > 127.0.0.1.6379: Flags [P.], seq 1:7, ack 1, win 342, options [nop,nop,TS val 1132418037 ecr 1132418037], length 6: RESP empty
    8  2016-01-27 20:01:00.864641 IP 127.0.0.1.6379 > 127.0.0.1.52760: Flags [.], ack 7, win 342, options [nop,nop,TS val 1132418037 ecr 1132418037], length 0
    9  2016-01-27 20:01:00.864680 IP 127.0.0.1.6379 > 127.0.0.1.52760: Flags [P.], seq 1:28, ack 7, win 342, options [nop,nop,TS val 1132418037 ecr 1132418037], length 27: RESP "ERR unknown command '$0'"
   10  2016-01-27 20:01:00.864690 IP 127.0.0.1.52760 > 127.0.0.1.6379: Flags [.], ack 28, win 342, options [nop,nop,TS val 1132418037 ecr 1132418037], length 0
   11  2016-01-27 20:01:01.865454 IP 127.0.0.1.52760 > 127.0.0.1.6379: Flags [F.], seq 7, ack 28, win 342, options [nop,nop,TS val 1132418337 ecr 1132418037], length 0
   12  2016-01-27 20:01:01.865587 IP 127.0.0.1.6379 > 127.0.0.1.52760: Flags [F.], seq 28, ack 8, win 342, options [nop,nop,TS val 1132418337 ecr 1132418337], length 0
   13  2016-01-27 20:01:01.865615 IP 127.0.0.1.52760 > 127.0.0.1.6379: Flags [.], ack 29, win 342, options [nop,nop,TS val 1132418337 ecr 1132418337], length 0
   14  2016-01-27 20:01:01.875422 IP 127.0.0.1.52763 > 127.0.0.1.6379: Flags [S], seq 4029577365, win 43690, options [mss 65495,sackOK,TS val 1132418340 ecr 0,nop,wscale 7], length 0
   15  2016-01-27 20:01:01.875455 IP 127.0.0.1.6379 > 127.0.0.1.52763: Flags [S.], seq 365322185, ack 4029577366, win 43690, options [mss 65495,sackOK,TS val 1132418340 ecr 1132418340,nop,wscale 7], length 0
   16  2016-01-27 20:01:01.875478 IP 127.0.0.1.52763 > 127.0.0.1.6379: Flags [.], ack 1, win 342, options [nop,nop,TS val 1132418340 ecr 1132418340], length 0
   17  2016-01-27 20:01:01.875571 IP 127.0.0.1.52763 > 127.0.0.1.6379: Flags [P.], seq 1:4, ack 1, win 342, options [nop,nop,TS val 1132418340 ecr 1132418340], length 3: RESP ""
   18  2016-01-27 20:01:01.875586 IP 127.0.0.1.6379 > 127.0.0.1.52763: Flags [.], ack 4, win 342, options [nop,nop,TS val 1132418340 ecr 1132418340], length 0
   19  2016-01-27 20:01:01.875659 IP 127.0.0.1.6379 > 127.0.0.1.52763: Flags [P.], seq 1:27, ack 4, win 342, options [nop,nop,TS val 1132418340 ecr 1132418340], length 26: RESP "ERR unknown command '+'"
   20  2016-01-27 20:01:01.875669 IP 127.0.0.1.52763 > 127.0.0.1.6379: Flags [.], ack 27, win 342, options [nop,nop,TS val 1132418340 ecr 1132418340], length 0
   21  2016-01-27 20:01:02.876545 IP 127.0.0.1.52763 > 127.0.0.1.6379: Flags [F.], seq 4, ack 27, win 342, options [nop,nop,TS val 1132418640 ecr 1132418340], length 0
   22  2016-01-27 20:01:02.876650 IP 127.0.0.1.6379 > 127.0.0.1.52763: Flags [F.], seq 27, ack 5, win 342, options [nop,nop,TS val 1132418640 ecr 1132418640], length 0
   23  2016-01-27 20:01:02.876675 IP 127.0.0.1.52763 > 127.0.0.1.6379: Flags [.], ack 28, win 342, options [nop,nop,TS val 1132418640 ecr 1132418640], length 0
   24  2016-01-27 20:01:02.881313 IP 127.0.0.1.52764 > 127.0.0.1.6379: Flags [S], seq 3994485171, win 43690, options [mss 65495,sackOK,TS val 1132418642 ecr 0,nop,wscale 7], length 0
   25  2016-01-27 20:01:02.881334 IP 127.0.0.1.6379 > 127.0.0.1.52764: Flags [S.], seq 3089553256, ack 3994485172, win 43690, options [mss 65495,sackOK,TS val 1132418642 ecr 1132418642,nop,wscale 7], length 0
   26  2016-01-27 20:01:02.881348 IP 127.0.0.1.52764 > 127.0.0.1.6379: Flags [.], ack 1, win 342, options [nop,nop,TS val 1132418642 ecr 1132418642], length 0
   27  2016-01-27 20:01:02.881402 IP 127.0.0.1.52764 > 127.0.0.1.6379: Flags [P.], seq 1:4, ack 1, win 342, options [nop,nop,TS val 1132418642 ecr 1132418642], length 3: RESP ""
   28  2016-01-27 20:01:02.881411 IP 127.0.0.1.6379 > 127.0.0.1.52764: Flags [.], ack 4, win 342, options [nop,nop,TS val 1132418642 ecr 1132418642], length 0
   29  2016-01-27 20:01:02.881466 IP 127.0.0.1.6379 > 127.0.0.1.52764: Flags [P.], seq 1:27, ack 4, win 342, options [nop,nop,TS val 1132418642 ecr 1132418642], length 26: RESP "ERR unknown command '-'"
   30  2016-01-27 20:01:02.881478 IP 127.0.0.1.52764 > 127.0.0.1.6379: Flags [.], ack 27, win 342, options [nop,nop,TS val 1132418642 ecr 1132418642], length 0
   31  2016-01-27 20:01:03.882913 IP 127.0.0.1.52764 > 127.0.0.1.6379: Flags [F.], seq 4, ack 27, win 342, options [nop,nop,TS val 1132418942 ecr 1132418642], length 0
   32  2016-01-27 20:01:03.883071 IP 127.0.0.1.6379 > 127.0.0.1.52764: Flags [F.], seq 27, ack 5, win 342, options [nop,nop,TS val 1132418942 ecr 1132418942], length 0
   33  2016-01-27 20:01:03.883106 IP 127.0.0.1.52764 > 127.0.0.1.6379: Flags [.], ack 28, win 342, options [nop,nop,TS val 1132418942 ecr 1132418942], length 0
   34  2016-01-27 20:01:03.890753 IP 127.0.0.1.52765 > 127.0.0.1.6379: Flags [S], seq 3235592213, win 43690, options [mss 65495,sackOK,TS val 1132418944 ecr 0,nop,wscale 7], length 0
   35  2016-01-27 20:01:03.890793 IP 127.0.0.1.6379 > 127.0.0.1.52765: Flags [S.], seq 1213611847, ack 3235592214, win 43690, options [mss 65495,sackOK,TS val 1132418944 ecr 1132418944,nop,wscale 7], length 0
   36  2016-01-27 20:01:03.890828 IP 127.0.0.1.52765 > 127.0.0.1.6379: Flags [.], ack 1, win 342, options [nop,nop,TS val 1132418944 ecr 1132418944], length 0
   37  2016-01-27 20:01:03.890947 IP 127.0.0.1.52765 > 127.0.0.1.6379: Flags [P.], seq 1:4, ack 1, win 342, options [nop,nop,TS val 1132418944 ecr 1132418944], length 3: RESP ""
   38  2016-01-27 20:01:03.890980 IP 127.0.0.1.6379 > 127.0.0.1.52765: Flags [.], ack 4, win 342, options [nop,nop,TS val 1132418944 ecr 1132418944], length 0
   39  2016-01-27 20:01:03.891074 IP 127.0.0.1.6379 > 127.0.0.1.52765: Flags [P.], seq 1:27, ack 4, win 342, options [nop,nop,TS val 1132418945 ecr 1132418944], length 26: RESP "ERR unknown command ':'"
   40  2016-01-27 20:01:03.891091 IP 127.0.0.1.52765 > 127.0.0.1.6379: Flags [.], ack 27, win 342, options [nop,nop,TS val 1132418945 ecr 1132418945], length 0
   41  2016-01-27 20:01:04.890081 IP 127.0.0.1.52765 > 127.0.0.1.6379: Flags [F.], seq 4, ack 27, win 342, options [nop,nop,TS val 1132419244 ecr 1132418945], length 0
   42  2016-01-27 20:01:04.890218 IP 127.0.0.1.6379 > 127.0.0.1.52765: Flags [F.], seq 27, ack 5, win 342, options [nop,nop,TS val 1132419244 ecr 1132419244], length 0
   43  2016-01-27 20:01:04.890244 IP 127.0.0.1.52765 > 127.0.0.1.6379: Flags [.], ack 28, win 342, options [nop,nop,TS val 1132419244 ecr 1132419244], length 0
   44  2016-01-27 20:01:04.898057 IP 127.0.0.1.52766 > 127.0.0.1.6379: Flags [S], seq 1161779316, win 43690, options [mss 65495,sackOK,TS val 1132419247 ecr 0,nop,wscale 7], length 0
   45  2016-01-27 20:01:04.898079 IP 127.0.0.1.6379 > 127.0.0.1.52766: Flags [S.], seq 1206331179, ack 1161779317, win 43690, options [mss 65495,sackOK,TS val 1132419247 ecr 1132419247,nop,wscale 7], length 0
   46  2016-01-27 20:01:04.898093 IP 127.0.0.1.52766 > 127.0.0.1.6379: Flags [.], ack 1, win 342, options [nop,nop,TS val 1132419247 ecr 1132419247], length 0
   47  2016-01-27 20:01:04.898151 IP 127.0.0.1.52766 > 127.0.0.1.6379: Flags [P.], seq 1:89, ack 1, win 342, options [nop,nop,TS val 1132419247 ecr 1132419247], length 88: RESP "0392049029024920492304923049032940329402394092304932049230492034932094032940234902340"
   48  2016-01-27 20:01:04.898161 IP 127.0.0.1.6379 > 127.0.0.1.52766: Flags [.], ack 89, win 342, options [nop,nop,TS val 1132419247 ecr 1132419247], length 0
   49  2016-01-27 20:01:04.898226 IP 127.0.0.1.6379 > 127.0.0.1.52766: Flags [P.], seq 1:112, ack 89, win 342, options [nop,nop,TS val 1132419247 ecr 1132419247], length 111: RESP "ERR unknown command ':0392049029024920492304923049032940329402394092304932049230492034932094032940234902340'"
   50  2016-01-27 20:01:04.898237 IP 127.0.0.1.52766 > 127.0.0.1.6379: Flags [.], ack 112, win 342, options [nop,nop,TS val 1132419247 ecr 1132419247], length 0
   51  2016-01-27 20:01:05.898747 IP 127.0.0.1.52766 > 127.0.0.1.6379: Flags [F.], seq 89, ack 112, win 342, options [nop,nop,TS val 1132419547 ecr 1132419247], length 0
   52  2016-01-27 20:01:05.898853 IP 127.0.0.1.6379 > 127.0.0.1.52766: Flags [F.], seq 112, ack 90, win 342, options [nop,nop,TS val 1132419547 ecr 1132419547], length 0
   53  2016-01-27 20:01:05.898878 IP 127.0.0.1.52766 > 127.0.0.1.6379: Flags [.], ack 113, win 342, options [nop,nop,TS val 1132419547 ecr 1132419547], length 0
   54  2016-01-27 20:01:05.906739 IP 127.0.0.1.52767 > 127.0.0.1.6379: Flags [S], seq 3453687710, win 43690, options [mss 65495,sackOK,TS val 1132419549 ecr 0,nop,wscale 7], length 0
   55  2016-01-27 20:01:05.906767 IP 127.0.0.1.6379 > 127.0.0.1.52767: Flags [S.], seq 4076862539, ack 3453687711, win 43690, options [mss 65495,sackOK,TS val 1132419549 ecr 1132419549,nop,wscale 7], length 0
   56  2016-01-27 20:01:05.906784 IP 127.0.0.1.52767 > 127.0.0.1.6379: Flags [.], ack 1, win 342, options [nop,nop,TS val 1132419549 ecr 1132419549], length 0
   57  2016-01-27 20:01:05.906843 IP 127.0.0.1.52767 > 127.0.0.1.6379: Flags [P.], seq 1:39, ack 1, win 342, options [nop,nop,TS val 1132419549 ecr 1132419549], length 38: RESP length too large
   58  2016-01-27 20:01:05.906856 IP 127.0.0.1.6379 > 127.0.0.1.52767: Flags [.], ack 39, win 342, options [nop,nop,TS val 1132419549 ecr 1132419549], length 0
   59  2016-01-27 20:01:05.906935 IP 127.0.0.1.6379 > 127.0.0.1.52767: Flags [P.], seq 1:48, ack 39, win 342, options [nop,nop,TS val 1132419549 ecr 1132419549], length 47: RESP "ERR Protocol error: invalid multibulk length"
   60  2016-01-27 20:01:05.906947 IP 127.0.0.1.52767 > 127.0.0.1.6379: Flags [.], ack 48, win 342, options [nop,nop,TS val 1132419549 ecr 1132419549], length 0
   61  2016-01-27 20:01:05.906977 IP 127.0.0.1.6379 > 127.0.0.1.52767: Flags [F.], seq 48, ack 39, win 342, options [nop,nop,TS val 1132419549 ecr 1132419549], length 0
   62  2016-01-27 20:01:05.907017 IP 127.0.0.1.52767 > 127.0.0.1.6379: Flags [F.], seq 39, ack 49, win 342, options [nop,nop,TS val 1132419549 ecr 1132419549], length 0
   63  2016-01-27 20:01:05.907028 IP 127.0.0.1.6379 > 127.0.0.1.52767: Flags [.], ack 40, win 342, options [nop,nop,TS val 1132419549 ecr 1132419549], length 0
   64  2016-01-27 20:01:06.915271 IP 127.0.0.1.52768 > 127.0.0.1.6379: Flags [S], seq 3109305893, win 43690, options [mss 65495,sackOK,TS val 1132419852 ecr 0,nop,wscale 7], length 0
   65  2016-01-27 20:01:06.915304 IP 127.0.0.1.6379 > 127.0.0.1.52768: Flags [S.], seq 4202059680, ack 3109305894, win 43690, options [mss 65495,sackOK,TS val 1132419852 ecr 1132419852,nop,wscale 7], length 0
   66  2016-01-27 20:01:06.915326 IP 127.0.0.1.52768 > 127.0.0.1.6379: Flags [.], ack 1, win 342, options [nop,nop,TS val 1132419852 ecr 1132419852], length 0
   67  2016-01-27 20:01:06.915390 IP 127.0.0.1.52768 > 127.0.0.1.6379: Flags [P.], seq 1:7, ack 1, win 342, options [nop,nop,TS val 1132419852 ecr 1132419852], length 6: RESP length negative and not -1
   68  2016-01-27 20:01:06.915401 IP 127.0.0.1.6379 > 127.0.0.1.52768: Flags [.], ack 7, win 342, options [nop,nop,TS val 1132419852 ecr 1132419852], length 0
   69  2016-01-27 20:01:07.915368 IP 127.0.0.1.52768 > 127.0.0.1.6379: Flags [F.], seq 7, ack 1, win 342, options [nop,nop,TS val 1132420152 ecr 1132419852], length 0
   70  2016-01-27 20:01:07.915456 IP 127.0.0.1.6379 > 127.0.0.1.52768: Flags [F.], seq 1, ack 8, win 342, options [nop,nop,TS val 1132420152 ecr 1132420152], length 0
   71  2016-01-27 20:01:07.915479 IP 127.0.0.1.52768 > 127.0.0.1.6379: Flags [.], ack 2, win 342, options [nop,nop,TS val 1132420152 ecr 1132420152], length 0
   72  2016-01-27 20:01:07.922920 IP 127.0.0.1.52769 > 127.0.0.1.6379: Flags [S], seq 4072438166, win 43690, options [mss 65495,sackOK,TS val 1132420154 ecr 0,nop,wscale 7], length 0
   73  2016-01-27 20:01:07.922939 IP 127.0.0.1.6379 > 127.0.0.1.52769: Flags [S.], seq 156730490, ack 4072438167, win 43690, options [mss 65495,sackOK,TS val 1132420154 ecr 1132420154,nop,wscale 7], length 0
   74  2016-01-27 20:01:07.922954 IP 127.0.0.1.52769 > 127.0.0.1.6379: Flags [.], ack 1, win 342, options [nop,nop,TS val 1132420154 ecr 1132420154], length 0
   75  2016-01-27 20:01:07.923009 IP 127.0.0.1.52769 > 127.0.0.1.6379: Flags [P.], seq 1:11, ack 1, win 342, options [nop,nop,TS val 1132420154 ecr 1132420154], length 10: RESP length negative and not -1 "hi"
   76  2016-01-27 20:01:07.923019 IP 127.0.0.1.6379 > 127.0.0.1.52769: Flags [.], ack 11, win 342, options [nop,nop,TS val 1132420154 ecr 1132420154], length 0
   77  2016-01-27 20:01:07.923065 IP 127.0.0.1.6379 > 127.0.0.1.52769: Flags [P.], seq 1:57, ack 11, win 342, options [nop,nop,TS val 1132420154 ecr 1132420154], length 56: RESP "ERR unknown command '$-20'" "ERR unknown command 'hi'"
   78  2016-01-27 20:01:07.923076 IP 127.0.0.1.52769 > 127.0.0.1.6379: Flags [.], ack 57, win 342, options [nop,nop,TS val 1132420154 ecr 1132420154], length 0
   79  2016-01-27 20:01:08.923657 IP 127.0.0.1.52769 > 127.0.0.1.6379: Flags [F.], seq 11, ack 57, win 342, options [nop,nop,TS val 1132420454 ecr 1132420154], length 0
   80  2016-01-27 20:01:08.923760 IP 127.0.0.1.6379 > 127.0.0.1.52769: Flags [F.], seq 57, ack 12, win 342, options [nop,nop,TS val 1132420454 ecr 1132420454], length 0
   81  2016-01-27 20:01:08.923793 IP 127.0.0.1.52769 > 127.0.0.1.6379: Flags [.], ack 58, win 342, options [nop,nop,TS val 1132420454 ecr 1132420454], length 0
   82  2016-01-27 20:01:08.932823 IP 127.0.0.1.52770 > 127.0.0.1.6379: Flags [S], seq 374549345, win 43690, options [mss 65495,sackOK,TS val 1132420457 ecr 0,nop,wscale 7], length 0
   83  2016-01-27 20:01:08.932841 IP 127.0.0.1.6379 > 127.0.0.1.52770: Flags [S.], seq 1146630634, ack 374549346, win 43690, options [mss 65495,sackOK,TS val 1132420457 ecr 1132420457,nop,wscale 7], length 0
   84  2016-01-27 20:01:08.932863 IP 127.0.0.1.52770 > 127.0.0.1.6379: Flags [.], ack 1, win 342, options [nop,nop,TS val 1132420457 ecr 1132420457], length 0
   85  2016-01-27 20:01:08.932925 IP 127.0.0.1.52770 > 127.0.0.1.6379: Flags [P.], seq 1:7, ack 1, win 342, options [nop,nop,TS val 1132420457 ecr 1132420457], length 6: RESP [|resp]
   86  2016-01-27 20:01:08.932935 IP 127.0.0.1.6379 > 127.0.0.1.52770: Flags [.], ack 7, win 342, options [nop,nop,TS val 1132420457 ecr 1132420457], length 0
   87  2016-01-27 20:01:09.933192 IP 127.0.0.1.52770 > 127.0.0.1.6379: Flags [F.], seq 7, ack 1, win 342, options [nop,nop,TS val 1132420757 ecr 1132420457], length 0
   88  2016-01-27 20:01:09.933360 IP 127.0.0.1.6379 > 127.0.0.1.52770: Flags [F.], seq 1, ack 8, win 342, options [nop,nop,TS val 1132420757 ecr 1132420757], length 0
   89  2016-01-27 20:01:09.933424 IP 127.0.0.1.52770 > 127.0.0.1.6379: Flags [.], ack 2, win 342, options [nop,nop,TS val 1132420757 ecr 1132420757], length 0
   90  2016-01-27 20:01:09.942037 IP 127.0.0.1.52771 > 127.0.0.1.6379: Flags [S], seq 2541241523, win 43690, options [mss 65495,sackOK,TS val 1132420760 ecr 0,nop,wscale 7], length 0
   91  2016-01-27 20:01:09.942090 IP 127.0.0.1.6379 > 127.0.0.1.52771: Flags [S.], seq 3482468888, ack 2541241524, win 43690, options [mss 65495,sackOK,TS val 1132420760 ecr 1132420760,nop,wscale 7], length 0
   92  2016-01-27 20:01:09.942216 IP 127.0.0.1.52771 > 127.0.0.1.6379: Flags [.], ack 1, win 342, options [nop,nop,TS val 1132420760 ecr 1132420760], length 0
   93  2016-01-27 20:01:09.942332 IP 127.0.0.1.52771 > 127.0.0.1.6379: Flags [P.], seq 1:7, ack 1, win 342, options [nop,nop,TS val 1132420760 ecr 1132420760], length 6: RESP [|resp]
   94  2016-01-27 20:01:09.942342 IP 127.0.0.1.6379 > 127.0.0.1.52771: Flags [.], ack 7, win 342, options [nop,nop,TS val 1132420760 ecr 1132420760], length 0
   95  2016-01-27 20:01:10.939178 IP 127.0.0.1.52771 > 127.0.0.1.6379: Flags [F.], seq 7, ack 1, win 342, options [nop,nop,TS val 1132421059 ecr 1132420760], length 0
   96  2016-01-27 20:01:10.939290 IP 127.0.0.1.6379 > 127.0.0.1.52771: Flags [F.], seq 1, ack 8, win 342, options [nop,nop,TS val 1132421059 ecr 1132421059], length 0
   97  2016-01-27 20:01:10.939308 IP 127.0.0.1.52771 > 127.0.0.1.6379: Flags [.], ack 2, win 342, options [nop,nop,TS val 1132421059 ecr 1132421059], length 0
   98  2016-01-27 20:01:10.943295 IP 127.0.0.1.52772 > 127.0.0.1.6379: Flags [S], seq 3376019145, win 43690, options [mss 65495,sackOK,TS val 1132421060 ecr 0,nop,wscale 7], length 0
   99  2016-01-27 20:01:10.943313 IP 127.0.0.1.6379 > 127.0.0.1.52772: Flags [S.], seq 2449011991, ack 3376019146, win 43690, options [mss 65495,sackOK,TS val 1132421060 ecr 1132421060,nop,wscale 7], length 0
  100  2016-01-27 20:01:10.943328 IP 127.0.0.1.52772 > 127.0.0.1.6379: Flags [.], ack 1, win 342, options [nop,nop,TS val 1132421060 ecr 1132421060], length 0
  101  2016-01-27 20:01:10.943393 IP 127.0.0.1.52772 > 127.0.0.1.6379: Flags [P.], seq 1:7, ack 1, win 342, options [nop,nop,TS val 1132421060 ecr 1132421060], length 6: RESP [|resp]
  102  2016-01-27 20:01:10.943402 IP 127.0.0.1.6379 > 127.0.0.1.52772: Flags [.], ack 7, win 342, options [nop,nop,TS val 1132421060 ecr 1132421060], length 0
  103  2016-01-27 20:01:11.943627 IP 127.0.0.1.52772 > 127.0.0.1.6379: Flags [F.], seq 7, ack 1, win 342, options [nop,nop,TS val 1132421360 ecr 1132421060], length 0
  104  2016-01-27 20:01:11.943780 IP 127.0.0.1.6379 > 127.0.0.1.52772: Flags [F.], seq 1, ack 8, win 342, options [nop,nop,TS val 1132421360 ecr 1132421360], length 0
  105  2016-01-27 20:01:11.943820 IP 127.0.0.1.52772 > 127.0.0.1.6379: Flags [.], ack 2, win 342, options [nop,nop,TS val 1132421360 ecr 1132421360], length 0
  106  2016-01-27 20:01:11.952316 IP 127.0.0.1.52773 > 127.0.0.1.6379: Flags [S], seq 3567970909, win 43690, options [mss 65495,sackOK,TS val 1132421363 ecr 0,nop,wscale 7], length 0
  107  2016-01-27 20:01:11.952336 IP 127.0.0.1.6379 > 127.0.0.1.52773: Flags [S.], seq 3366370739, ack 3567970910, win 43690, options [mss 65495,sackOK,TS val 1132421363 ecr 1132421363,nop,wscale 7], length 0
  108  2016-01-27 20:01:11.952351 IP 127.0.0.1.52773 > 127.0.0.1.6379: Flags [.], ack 1, win 342, options [nop,nop,TS val 1132421363 ecr 1132421363], length 0
  109  2016-01-27 20:01:11.952429 IP 127.0.0.1.52773 > 127.0.0.1.6379: Flags [P.], seq 1:6, ack 1, win 342, options [nop,nop,TS val 1132421363 ecr 1132421363], length 5: RESP null
  110  2016-01-27 20:01:11.952440 IP 127.0.0.1.6379 > 127.0.0.1.52773: Flags [.], ack 6, win 342, options [nop,nop,TS val 1132421363 ecr 1132421363], length 0
  111  2016-01-27 20:01:12.952173 IP 127.0.0.1.52773 > 127.0.0.1.6379: Flags [F.], seq 6, ack 1, win 342, options [nop,nop,TS val 1132421663 ecr 1132421363], length 0
  112  2016-01-27 20:01:12.952308 IP 127.0.0.1.6379 > 127.0.0.1.52773: Flags [F.], seq 1, ack 7, win 342, options [nop,nop,TS val 1132421663 ecr 1132421663], length 0
  113  2016-01-27 20:01:12.952341 IP 127.0.0.1.52773 > 127.0.0.1.6379: Flags [.], ack 2, win 342, options [nop,nop,TS val 1132421663 ecr 1132421663], length 0
  114  2016-01-27 20:01:12.960071 IP 127.0.0.1.52775 > 127.0.0.1.6379: Flags [S], seq 3374943379, win 43690, options [mss 65495,sackOK,TS val 1132421665 ecr 0,nop,wscale 7], length 0
  115  2016-01-27 20:01:12.960097 IP 127.0.0.1.6379 > 127.0.0.1.52775: Flags [S.], seq 363870070, ack 3374943380, win 43690, options [mss 65495,sackOK,TS val 1132421665 ecr 1132421665,nop,wscale 7], length 0
  116  2016-01-27 20:01:12.960118 IP 127.0.0.1.52775 > 127.0.0.1.6379: Flags [.], ack 1, win 342, options [nop,nop,TS val 1132421665 ecr 1132421665], length 0
  117  2016-01-27 20:01:12.960200 IP 127.0.0.1.52775 > 127.0.0.1.6379: Flags [P.], seq 1:6, ack 1, win 342, options [nop,nop,TS val 1132421665 ecr 1132421665], length 5: RESP null
  118  2016-01-27 20:01:12.960222 IP 127.0.0.1.6379 > 127.0.0.1.52775: Flags [.], ack 6, win 342, options [nop,nop,TS val 1132421665 ecr 1132421665], length 0
  119  2016-01-27 20:01:12.960265 IP 127.0.0.1.6379 > 127.0.0.1.52775: Flags [P.], seq 1:29, ack 6, win 342, options [nop,nop,TS val 1132421665 ecr 1132421665], length 28: RESP "ERR unknown command '$-1'"
  120  2016-01-27 20:01:12.960276 IP 127.0.0.1.52775 > 127.0.0.1.6379: Flags [.], ack 29, win 342, options [nop,nop,TS val 1132421665 ecr 1132421665], length 0
  121  2016-01-27 20:01:13.960353 IP 127.0.0.1.52775 > 127.0.0.1.6379: Flags [F.], seq 6, ack 29, win 342, options [nop,nop,TS val 1132421965 ecr 1132421665], length 0
  122  2016-01-27 20:01:13.960518 IP 127.0.0.1.6379 > 127.0.0.1.52775: Flags [F.], seq 29, ack 7, win 342, options [nop,nop,TS val 1132421965 ecr 1132421965], length 0
  123  2016-01-27 20:01:13.960558 IP 127.0.0.1.52775 > 127.0.0.1.6379: Flags [.], ack 30, win 342, options [nop,nop,TS val 1132421965 ecr 1132421965], length 0
  124  2016-01-27 20:01:13.973676 IP 127.0.0.1.52776 > 127.0.0.1.6379: Flags [S], seq 2780863902, win 43690, options [mss 65495,sackOK,TS val 1132421969 ecr 0,nop,wscale 7], length 0
  125  2016-01-27 20:01:13.973700 IP 127.0.0.1.6379 > 127.0.0.1.52776: Flags [S.], seq 2789065616, ack 2780863903, win 43690, options [mss 65495,sackOK,TS val 1132421969 ecr 1132421969,nop,wscale 7], length 0
  126  2016-01-27 20:01:13.973719 IP 127.0.0.1.52776 > 127.0.0.1.6379: Flags [.], ack 1, win 342, options [nop,nop,TS val 1132421969 ecr 1132421969], length 0
  127  2016-01-27 20:01:13.973782 IP 127.0.0.1.52776 > 127.0.0.1.6379: Flags [P.], seq 1:64, ack 1, win 342, options [nop,nop,TS val 1132421969 ecr 1132421969], length 63: RESP "INCR" "z" "INCR" "z" "INCR" "z"
  128  2016-01-27 20:01:13.973791 IP 127.0.0.1.6379 > 127.0.0.1.52776: Flags [.], ack 64, win 342, options [nop,nop,TS val 1132421969 ecr 1132421969], length 0
  129  2016-01-27 20:01:13.974013 IP 127.0.0.1.6379 > 127.0.0.1.52776: Flags [P.], seq 1:16, ack 64, win 342, options [nop,nop,TS val 1132421969 ecr 1132421969], length 15: RESP "69" "70" "71"
  130  2016-01-27 20:01:13.974039 IP 127.0.0.1.52776 > 127.0.0.1.6379: Flags [.], ack 16, win 342, options [nop,nop,TS val 1132421969 ecr 1132421969], length 0
  131  2016-01-27 20:01:14.975611 IP 127.0.0.1.52776 > 127.0.0.1.6379: Flags [F.], seq 64, ack 16, win 342, options [nop,nop,TS val 1132422270 ecr 1132421969], length 0
  132  2016-01-27 20:01:14.975736 IP 127.0.0.1.6379 > 127.0.0.1.52776: Flags [F.], seq 16, ack 65, win 342, options [nop,nop,TS val 1132422270 ecr 1132422270], length 0
  133  2016-01-27 20:01:14.975759 IP 127.0.0.1.52776 > 127.0.0.1.6379: Flags [.], ack 17, win 342, options [nop,nop,TS val 1132422270 ecr 1132422270], length 0
  134  2016-01-27 20:01:14.979830 IP 127.0.0.1.52777 > 127.0.0.1.6379: Flags [S], seq 357339476, win 43690, options [mss 65495,sackOK,TS val 1132422271 ecr 0,nop,wscale 7], length 0
  135  2016-01-27 20:01:14.979857 IP 127.0.0.1.6379 > 127.0.0.1.52777: Flags [S.], seq 3123925211, ack 357339477, win 43690, options [mss 65495,sackOK,TS val 1132422271 ecr 1132422271,nop,wscale 7], length 0
  136  2016-01-27 20:01:14.979875 IP 127.0.0.1.52777 > 127.0.0.1.6379: Flags [.], ack 1, win 342, options [nop,nop,TS val 1132422271 ecr 1132422271], length 0
  137  2016-01-27 20:01:14.979940 IP 127.0.0.1.52777 > 127.0.0.1.6379: Flags [P.], seq 1:21, ack 1, win 342, options [nop,nop,TS val 1132422271 ecr 1132422271], length 20: RESP "PING" "PING" "PING"
  138  2016-01-27 20:01:14.979953 IP 127.0.0.1.6379 > 127.0.0.1.52777: Flags [.], ack 21, win 342, options [nop,nop,TS val 1132422271 ecr 1132422271], length 0
  139  2016-01-27 20:01:14.980005 IP 127.0.0.1.6379 > 127.0.0.1.52777: Flags [P.], seq 1:22, ack 21, win 342, options [nop,nop,TS val 1132422271 ecr 1132422271], length 21: RESP "PONG" "PONG" "PONG"
  140  2016-01-27 20:01:14.980016 IP 127.0.0.1.52777 > 127.0.0.1.6379: Flags [.], ack 22, win 342, options [nop,nop,TS val 1132422271 ecr 1132422271], length 0
  141  2016-01-27 20:01:15.980290 IP 127.0.0.1.52777 > 127.0.0.1.6379: Flags [F.], seq 21, ack 22, win 342, options [nop,nop,TS val 1132422571 ecr 1132422271], length 0
  142  2016-01-27 20:01:15.980435 IP 127.0.0.1.6379 > 127.0.0.1.52777: Flags [F.], seq 22, ack 22, win 342, options [nop,nop,TS val 1132422571 ecr 1132422571], length 0
  143  2016-01-27 20:01:15.980477 IP 127.0.0.1.52777 > 127.0.0.1.6379: Flags [.], ack 23, win 342, options [nop,nop,TS val 1132422571 ecr 1132422571], length 0
  144  2016-01-27 20:01:15.984847 IP 127.0.0.1.52778 > 127.0.0.1.6379: Flags [S], seq 2069568772, win 43690, options [mss 65495,sackOK,TS val 1132422573 ecr 0,nop,wscale 7], length 0
  145  2016-01-27 20:01:15.984871 IP 127.0.0.1.6379 > 127.0.0.1.52778: Flags [S.], seq 1085796497, ack 2069568773, win 43690, options [mss 65495,sackOK,TS val 1132422573 ecr 1132422573,nop,wscale 7], length 0
  146  2016-01-27 20:01:15.984890 IP 127.0.0.1.52778 > 127.0.0.1.6379: Flags [.], ack 1, win 342, options [nop,nop,TS val 1132422573 ecr 1132422573], length 0
  147  2016-01-27 20:01:15.984949 IP 127.0.0.1.52778 > 127.0.0.1.6379: Flags [P.], seq 1:21, ack 1, win 342, options [nop,nop,TS val 1132422573 ecr 1132422573], length 20: RESP "PING" "PING" "PING"
  148  2016-01-27 20:01:15.984958 IP 127.0.0.1.6379 > 127.0.0.1.52778: Flags [.], ack 21, win 342, options [nop,nop,TS val 1132422573 ecr 1132422573], length 0
  149  2016-01-27 20:01:15.985039 IP 127.0.0.1.6379 > 127.0.0.1.52778: Flags [P.], seq 1:22, ack 21, win 342, options [nop,nop,TS val 1132422573 ecr 1132422573], length 21: RESP "PONG" "PONG" "PONG"
  150  2016-01-27 20:01:15.985054 IP 127.0.0.1.52778 > 127.0.0.1.6379: Flags [.], ack 22, win 342, options [nop,nop,TS val 1132422573 ecr 1132422573], length 0
  151  2016-01-27 20:01:16.985738 IP 127.0.0.1.52778 > 127.0.0.1.6379: Flags [F.], seq 21, ack 22, win 342, options [nop,nop,TS val 1132422873 ecr 1132422573], length 0
  152  2016-01-27 20:01:16.985950 IP 127.0.0.1.6379 > 127.0.0.1.52778: Flags [F.], seq 22, ack 22, win 342, options [nop,nop,TS val 1132422873 ecr 1132422873], length 0
  153  2016-01-27 20:01:16.986005 IP 127.0.0.1.52778 > 127.0.0.1.6379: Flags [.], ack 23, win 342, options [nop,nop,TS val 1132422873 ecr 1132422873], length 0
  154  2016-01-27 20:01:16.993564 IP 127.0.0.1.52779 > 127.0.0.1.6379: Flags [S], seq 1578479120, win 43690, options [mss 65495,sackOK,TS val 1132422875 ecr 0,nop,wscale 7], length 0
  155  2016-01-27 20:01:16.993605 IP 127.0.0.1.6379 > 127.0.0.1.52779: Flags [S.], seq 2529957046, ack 1578479121, win 43690, options [mss 65495,sackOK,TS val 1132422875 ecr 1132422875,nop,wscale 7], length 0
  156  2016-01-27 20:01:16.993635 IP 127.0.0.1.52779 > 127.0.0.1.6379: Flags [.], ack 1, win 342, options [nop,nop,TS val 1132422875 ecr 1132422875], length 0
  157  2016-01-27 20:01:16.993754 IP 127.0.0.1.52779 > 127.0.0.1.6379: Flags [P.], seq 1:24, ack 1, win 342, options [nop,nop,TS val 1132422875 ecr 1132422875], length 23: RESP "PING" "PING" "PING"
  158  2016-01-27 20:01:16.993773 IP 127.0.0.1.6379 > 127.0.0.1.52779: Flags [.], ack 24, win 342, options [nop,nop,TS val 1132422875 ecr 1132422875], length 0
  159  2016-01-27 20:01:16.993951 IP 127.0.0.1.6379 > 127.0.0.1.52779: Flags [P.], seq 1:22, ack 24, win 342, options [nop,nop,TS val 1132422875 ecr 1132422875], length 21: RESP "PONG" "PONG" "PONG"
  160  2016-01-27 20:01:16.993980 IP 127.0.0.1.52779 > 127.0.0.1.6379: Flags [.], ack 22, win 342, options [nop,nop,TS val 1132422875 ecr 1132422875], length 0
  161  2016-01-27 20:01:17.993748 IP 127.0.0.1.52779 > 127.0.0.1.6379: Flags [F.], seq 24, ack 22, win 342, options [nop,nop,TS val 1132423175 ecr 1132422875], length 0
  162  2016-01-27 20:01:17.993837 IP 127.0.0.1.6379 > 127.0.0.1.52779: Flags [F.], seq 22, ack 25, win 342, options [nop,nop,TS val 1132423175 ecr 1132423175], length 0
  163  2016-01-27 20:01:17.993863 IP 127.0.0.1.52779 > 127.0.0.1.6379: Flags [.], ack 23, win 342, options [nop,nop,TS val 1132423175 ecr 1132423175], length 0
