    1  1999-11-11 21:46:16.463334 IP 131.151.32.21.7001 > 131.151.1.59.7000:  rx data fs call fetch-status fid 536871098/846/1049757 (44)
    2  1999-11-11 21:46:16.483206 IP 131.151.1.59.7000 > 131.151.32.21.7001:  rx data fs reply fetch-status (148)
    3  1999-11-11 21:46:16.889677 IP 131.151.32.21.7001 > 131.151.1.59.7000:  rx ack first 2 serial 347 reason delay (65)
    4  1999-11-11 21:46:24.151512 IP 131.151.32.21.7001 > 131.151.1.59.7000:  rx data fs call makedir fid 536871098/1/1 "tmpdir" StoreStatus date 1999-11-11 21:46:24 group 0 mode 755 (80)
    5  1999-11-11 21:46:24.245048 IP 131.151.1.59.7000 > 131.151.32.91.7001:  rx data cb call callback fid 536871098/1/1 (52)
    6  1999-11-11 21:46:24.255513 IP 131.151.32.91.7001 > 131.151.1.59.7000:  rx data (28)
    7  1999-11-11 21:46:24.255528 IP 131.151.32.91.7001 > 131.151.1.59.7000:  rx data (28)
    8  1999-11-11 21:46:24.282365 IP 131.151.1.59.7000 > 131.151.32.21.7001:  rx data fs reply makedir new fid 536871098/677/1097448 (244)
    9  1999-11-11 21:46:24.283047 IP 131.151.32.21.7001 > 131.151.1.59.7000:  rx data fs call fetch-status fid 536871098/677/1097448 (44)
   10  1999-11-11 21:46:24.284042 IP 131.151.1.59.7000 > 131.151.32.21.7001:  rx data fs reply fetch-status (148)
   11  1999-11-11 21:46:24.679610 IP 131.151.32.21.7001 > 131.151.1.59.7000:  rx ack first 2 serial 349 reason delay (65)
   12  1999-11-11 21:46:24.781785 IP 131.151.1.59.7000 > 131.151.32.91.7001:  rx ack first 1 serial 1154 reason delay acked 1 (62)
   13  1999-11-11 21:46:28.541035 IP 131.151.32.21.7001 > 131.151.1.59.7000:  rx data fs call rmdir fid 536871098/1/1 "tmpdir" (56)
   14  1999-11-11 21:46:28.544636 IP 131.151.1.59.7000 > 131.151.32.21.7001:  rx data fs reply rmdir (136)
   15  1999-11-11 21:46:28.949547 IP 131.151.32.21.7001 > 131.151.1.59.7000:  rx ack first 2 serial 350 reason delay (65)
   16  1999-11-11 21:46:38.681457 IP 131.151.1.70.7000 > 131.151.32.91.7001:  rx data cb call probe (32)
   17  1999-11-11 21:46:38.690316 IP 131.151.32.91.7001 > 131.151.1.70.7000:  rx data (28)
   18  1999-11-11 21:46:38.690352 IP 131.151.32.91.7001 > 131.151.1.70.7000:  rx data (28)
   19  1999-11-11 21:46:39.196737 IP 131.151.1.70.7000 > 131.151.32.91.7001:  rx ack first 2 serial 656 reason delay (61)
   20  1999-11-11 21:46:48.590067 IP 131.151.32.21.7001 > 131.151.1.146.7000:  rx data fs call fetch-status fid 536977399/40/27 (44)
   21  1999-11-11 21:46:48.619971 IP 131.151.1.146.7000 > 131.151.32.21.7001:  rx data fs reply fetch-status (148)
   22  1999-11-11 21:46:48.810858 IP 131.151.32.21.1792 > 131.151.1.59.7003:  rx data vldb call get-entry-by-name "root.cell" (48)
   23  1999-11-11 21:46:48.812595 IP 131.151.1.59.7003 > 131.151.32.21.1792:  rx data vldb reply get-entry-by-name "root.cell" numservers 6 servers 131.151.1.146 131.151.1.60 131.151.1.146 131.151.1.59 131.151.1.70 131.151.1.85 partitions a a a a a a rwvol 536870915 rovol 536870916 backup 536870917 (412)
   24  1999-11-11 21:46:48.813282 IP 131.151.32.21.7001 > 131.151.1.59.7000:  rx data fs call symlink fid 536871098/1/1 "rotcel" link to "#root.cell." (96)
   25  1999-11-11 21:46:48.830808 IP 131.151.1.59.7000 > 131.151.32.21.7001:  rx data fs reply symlink (232)
   26  1999-11-11 21:46:49.029316 IP 131.151.32.21.7001 > 131.151.1.146.7000:  rx ack first 2 serial 2519 reason delay (65)
   27  1999-11-11 21:46:49.229306 IP 131.151.32.21.7001 > 131.151.1.59.7000:  rx ack first 2 serial 351 reason delay (65)
   28  1999-11-11 21:46:51.218454 IP 131.151.1.59.7003 > 131.151.32.21.1792:  rx data vldb reply get-entry-by-name "root.cell" numservers 6 servers 131.151.1.146 131.151.1.60 131.151.1.146 131.151.1.59 131.151.1.70 131.151.1.85 partitions a a a a a a rwvol 536870915 rovol 536870916 backup 536870917 (412)
   29  1999-11-11 21:46:51.218541 IP 131.151.32.21 > 131.151.1.59: ICMP 131.151.32.21 udp port 1792 unreachable, length 448
   30  1999-11-11 21:46:52.805338 IP 131.151.32.21.7001 > 131.151.1.59.7000:  rx data fs call remove-file fid 536871098/1/1 "rotcel" (56)
   31  1999-11-11 21:46:52.810150 IP 131.151.1.59.7000 > 131.151.32.21.7001:  rx data fs reply remove-file (136)
   32  1999-11-11 21:46:53.209266 IP 131.151.32.21.7001 > 131.151.1.59.7000:  rx ack first 2 serial 352 reason delay (65)
   33  1999-11-11 21:46:53.878655 IP 131.151.1.59.7003 > 131.151.32.21.1792:  rx data vldb reply get-entry-by-name "root.cell" numservers 6 servers 131.151.1.146 131.151.1.60 131.151.1.146 131.151.1.59 131.151.1.70 131.151.1.85 partitions a a a a a a rwvol 536870915 rovol 536870916 backup 536870917 (412)
   34  1999-11-11 21:46:53.878718 IP 131.151.32.21 > 131.151.1.59: ICMP 131.151.32.21 udp port 1792 unreachable, length 448
   35  1999-11-11 21:46:56.242994 IP 131.151.32.21.7001 > 131.151.1.146.7000:  rx data fs call fetch-status fid 536977399/86/51 (44)
   36  1999-11-11 21:46:56.245019 IP 131.151.1.146.7000 > 131.151.32.21.7001:  rx data fs reply fetch-status (148)
   37  1999-11-11 21:46:56.518772 IP 131.151.32.21.1792 > 131.151.1.59.7003:  rx data vldb call get-entry-by-name-n "users.nneul" (48)
   38  1999-11-11 21:46:56.519452 IP 131.151.1.59.7003 > 131.151.32.21.1792:  rx challenge (44)
   39  1999-11-11 21:46:56.523136 IP 131.151.32.21.1792 > 131.151.1.59.7003:  rx response (140)
   40  1999-11-11 21:46:56.525522 IP 131.151.1.59.7003 > 131.151.32.21.1792:  rx data vldb reply get-entry-by-name-n "users.nneul" numservers 1 servers 131.151.1.59 partitions b rwvol 536871098 rovol 536871099 backup 536871100 (504)
   41  1999-11-11 21:46:56.525791 IP 131.151.32.21.1792 > 131.151.1.59.7003:  rx data vldb call get-entry-by-id-n volid 536871098 (40)
   42  1999-11-11 21:46:56.527259 IP 131.151.1.59.7003 > 131.151.32.21.1792:  rx data vldb reply get-entry-by-id-n "users.nneul" numservers 1 servers 131.151.1.59 partitions b rwvol 536871098 rovol 536871099 backup 536871100 (504)
   43  1999-11-11 21:46:56.527629 IP 131.151.32.21.1792 > 131.151.1.59.7005:  rx data vol call list-one-volume partid 1 volid 536871098 (40)
   44  1999-11-11 21:46:56.637381 IP 131.151.1.59.7005 > 131.151.32.21.1792:  rx challenge (44)
   45  1999-11-11 21:46:56.637779 IP 131.151.32.21.1792 > 131.151.1.59.7005:  rx response (140)
   46  1999-11-11 21:46:56.639215 IP 131.151.32.21.7001 > 131.151.1.146.7000:  rx ack first 2 serial 2520 reason delay (65)
   47  1999-11-11 21:46:56.920017 IP 131.151.32.21.1792 > 131.151.1.59.7003:  rx ack first 2 serial 3 reason delay (65)
   48  1999-11-11 21:46:57.036390 IP 131.151.1.59.7005 > 131.151.32.21.1792:  rx data vol reply list-one-volume name "users.nneul" volid 536871098 type (252)
   49  1999-11-11 21:46:57.048744 IP 131.151.1.59.7003 > 131.151.32.21.1792:  rx data vldb reply get-entry-by-name "root.cell" numservers 6 servers 131.151.1.146 131.151.1.60 131.151.1.146 131.151.1.59 131.151.1.70 131.151.1.85 partitions a a a a a a rwvol 536870915 rovol 536870916 backup 536870917 (412)
   50  1999-11-11 21:46:57.061382 IP 131.151.32.21.1792 > 131.151.1.59.7005:  rx ackall (28)
   51  1999-11-11 21:47:00.778759 IP 131.151.1.59.7003 > 131.151.32.21.1792:  rx data vldb reply get-entry-by-name "root.cell" numservers 6 servers 131.151.1.146 131.151.1.60 131.151.1.146 131.151.1.59 131.151.1.70 131.151.1.85 partitions a a a a a a rwvol 536870915 rovol 536870916 backup 536870917 (412)
   52  1999-11-11 21:47:00.778818 IP 131.151.32.21 > 131.151.1.59: ICMP 131.151.32.21 udp port 1792 unreachable, length 448
   53  1999-11-11 21:47:00.817967 IP 131.151.32.21.7001 > 131.151.1.146.7000:  rx data fs call fetch-status fid 536977399/14/14 (44)
   54  1999-11-11 21:47:00.820615 IP 131.151.1.146.7000 > 131.151.32.21.7001:  rx data fs reply fetch-status (148)
   55  1999-11-11 21:47:00.995692 IP 131.151.32.21.1799 > 131.151.1.59.7002:  rx data pt call name-to-id "users.nneul" (292)
   56  1999-11-11 21:47:00.996639 IP 131.151.1.59.7002 > 131.151.32.21.1799:  rx challenge (44)
   57  1999-11-11 21:47:00.996822 IP 131.151.32.21.1799 > 131.151.1.59.7002:  rx response (140)
   58  1999-11-11 21:47:00.998994 IP 131.151.1.59.7002 > 131.151.32.21.1799:  rx data pt reply name-to-id ids: 32766 (36)
   59  1999-11-11 21:47:01.000150 IP 131.151.32.21.1799 > 131.151.1.59.7002:  rx data pt call name-to-id "users.nneul" (292)
   60  1999-11-11 21:47:01.001268 IP 131.151.1.59.7002 > 131.151.32.21.1799:  rx data pt reply name-to-id ids: 32766 (36)
   61  1999-11-11 21:47:01.005342 IP 131.151.32.21.1799 > 131.151.1.59.7002:  rx data pt call id-to-name ids: <none!> (36)
   62  1999-11-11 21:47:01.005915 IP 131.151.1.59.7002 > 131.151.32.21.1799:  rx data pt reply id-to-name <none!> (32)
   63  1999-11-11 21:47:01.006087 IP 131.151.32.21.1799 > 131.151.1.59.7002:  rx ackall (28)
   64  1999-11-11 21:47:01.219166 IP 131.151.32.21.7001 > 131.151.1.146.7000:  rx ack first 2 serial 2521 reason delay (65)
   65  1999-11-11 21:47:03.010034 IP 131.151.32.21.7001 > 131.151.1.70.7000:  rx data fs call give-cbs (112)
   66  1999-11-11 21:47:03.011088 IP 131.151.1.70.7000 > 131.151.32.21.7001:  rx data (28)
   67  1999-11-11 21:47:03.409140 IP 131.151.32.21.7001 > 131.151.1.70.7000:  rx ack first 2 serial 55 reason delay (65)
   68  1999-11-11 21:47:05.869072 IP 131.151.32.21.1799 > 131.151.1.59.7002:  rx data pt call name-to-id "nneul" (292)
   69  1999-11-11 21:47:05.869722 IP 131.151.1.59.7002 > 131.151.32.21.1799:  rx challenge (44)
   70  1999-11-11 21:47:05.870422 IP 131.151.32.21.1799 > 131.151.1.59.7002:  rx response (140)
   71  1999-11-11 21:47:05.872757 IP 131.151.1.59.7002 > 131.151.32.21.1799:  rx data pt reply name-to-id ids: 5879 (36)
   72  1999-11-11 21:47:05.873149 IP 131.151.32.21.1799 > 131.151.1.59.7002:  rx data pt call name-to-id "nneul" (292)
   73  1999-11-11 21:47:05.874355 IP 131.151.1.59.7002 > 131.151.32.21.1799:  rx data pt reply name-to-id ids: 5879 (36)
   74  1999-11-11 21:47:05.874531 IP 131.151.32.21.1799 > 131.151.1.59.7002:  rx data pt call id-to-name ids: <none!> (36)
   75  1999-11-11 21:47:05.875156 IP 131.151.1.59.7002 > 131.151.32.21.1799:  rx data pt reply id-to-name <none!> (32)
   76  1999-11-11 21:47:05.875335 IP 131.151.32.21.1799 > 131.151.1.59.7002:  rx data pt call list-entry id 5879 (36)
   77  1999-11-11 21:47:05.877704 IP 131.151.1.59.7002 > 131.151.32.21.1799:  rx data pt reply list-entry (332)
   78  1999-11-11 21:47:05.877925 IP 131.151.32.21.1799 > 131.151.1.59.7002:  rx data pt call id-to-name ids: -204 5113 (44)
   79  1999-11-11 21:47:05.879692 IP 131.151.1.59.7002 > 131.151.32.21.1799:  rx data pt reply id-to-name "system:administrators" "5113" (544)
   80  1999-11-11 21:47:05.883080 IP 131.151.32.21.1799 > 131.151.1.59.7002:  rx data pt call name-to-id "nneul" "system:administrators" (548)
   81  1999-11-11 21:47:05.884646 IP 131.151.1.59.7002 > 131.151.32.21.1799:  rx data pt reply name-to-id ids: 5879 -204 (40)
   82  1999-11-11 21:47:05.884950 IP 131.151.32.21.1799 > 131.151.1.59.7002:  rx data pt call same-mbr-of uid 5879 gid -204 (40)
   83  1999-11-11 21:47:05.886482 IP 131.151.1.59.7002 > 131.151.32.21.1799:  rx data pt reply same-mbr-of (32)
   84  1999-11-11 21:47:05.888922 IP 131.151.32.21.1799 > 131.151.1.59.7002:  rx ackall (28)
   85  1999-11-11 21:47:06.559070 IP 131.151.1.59.7003 > 131.151.32.21.1792:  rx data vldb reply get-entry-by-name "root.cell" numservers 6 servers 131.151.1.146 131.151.1.60 131.151.1.146 131.151.1.59 131.151.1.70 131.151.1.85 partitions a a a a a a rwvol 536870915 rovol 536870916 backup 536870917 (412)
   86  1999-11-11 21:47:06.559143 IP 131.151.32.21 > 131.151.1.59: ICMP 131.151.32.21 udp port 1792 unreachable, length 448
   87  1999-11-11 21:47:08.697010 IP 131.151.32.21.1799 > 131.151.1.59.7002:  rx data pt call name-to-id "nneul" (292)
   88  1999-11-11 21:47:08.697702 IP 131.151.1.59.7002 > 131.151.32.21.1799:  rx challenge (44)
   89  1999-11-11 21:47:08.697886 IP 131.151.32.21.1799 > 131.151.1.59.7002:  rx response (140)
   90  1999-11-11 21:47:08.700814 IP 131.151.1.59.7002 > 131.151.32.21.1799:  rx data pt reply name-to-id ids: 5879 (36)
   91  1999-11-11 21:47:08.701061 IP 131.151.32.21.1799 > 131.151.1.59.7002:  rx data pt call name-to-id "nneul" (292)
   92  1999-11-11 21:47:08.702243 IP 131.151.1.59.7002 > 131.151.32.21.1799:  rx data pt reply name-to-id ids: 5879 (36)
   93  1999-11-11 21:47:08.702422 IP 131.151.32.21.1799 > 131.151.1.59.7002:  rx data pt call id-to-name ids: <none!> (36)
   94  1999-11-11 21:47:08.703045 IP 131.151.1.59.7002 > 131.151.32.21.1799:  rx data pt reply id-to-name <none!> (32)
   95  1999-11-11 21:47:08.703345 IP 131.151.32.21.1799 > 131.151.1.59.7002:  rx data pt call list-elements id 5879 (36)
   96  1999-11-11 21:47:08.705113 IP 131.151.1.59.7002 > 131.151.32.21.1799:  rx data pt reply list-entry (80)
   97  1999-11-11 21:47:08.705296 IP 131.151.32.21.1799 > 131.151.1.59.7002:  rx data pt call id-to-name ids: -641 -569 -564 -478 -472 -441 -427 -424 -355 -348 -254 (80)
   98  1999-11-11 21:47:08.738631 IP 131.151.1.59.7002 > 131.151.32.21.1799:  rx data pt reply id-to-name "nneul:cs301" "cc-staff" "obrennan:sysprog" "software" "bbc:mtw" [|pt] (1472)
   99  1999-11-11 21:47:08.740294 IP 131.151.1.59.7002 > 131.151.32.21.1799:  rx data (1404)
  100  1999-11-11 21:47:08.740581 IP 131.151.32.21.1799 > 131.151.1.59.7002:  rx ack first 2 serial 7 reason delay acked 2 (66)
  101  1999-11-11 21:47:16.440550 IP 131.151.1.59.7003 > 131.151.32.21.1792:  rx data vldb reply get-entry-by-name "root.cell" numservers 6 servers 131.151.1.146 131.151.1.60 131.151.1.146 131.151.1.59 131.151.1.70 131.151.1.85 partitions a a a a a a rwvol 536870915 rovol 536870916 backup 536870917 (412)
  102  1999-11-11 21:47:16.440614 IP 131.151.32.21 > 131.151.1.59: ICMP 131.151.32.21 udp port 1792 unreachable, length 448
  103  1999-11-11 21:47:22.963348 IP 131.151.32.21.1799 > 131.151.1.59.7002:  rx data pt call name-to-id "cc-staff" (292)
  104  1999-11-11 21:47:22.964051 IP 131.151.1.59.7002 > 131.151.32.21.1799:  rx challenge (44)
  105  1999-11-11 21:47:22.964237 IP 131.151.32.21.1799 > 131.151.1.59.7002:  rx response (140)
  106  1999-11-11 21:47:22.966418 IP 131.151.1.59.7002 > 131.151.32.21.1799:  rx data pt reply name-to-id ids: -569 (36)
  107  1999-11-11 21:47:22.966644 IP 131.151.32.21.1799 > 131.151.1.59.7002:  rx data pt call name-to-id "cc-staff" (292)
  108  1999-11-11 21:47:22.967810 IP 131.151.1.59.7002 > 131.151.32.21.1799:  rx data pt reply name-to-id ids: -569 (36)
  109  1999-11-11 21:47:22.967987 IP 131.151.32.21.1799 > 131.151.1.59.7002:  rx data pt call id-to-name ids: <none!> (36)
  110  1999-11-11 21:47:22.968556 IP 131.151.1.59.7002 > 131.151.32.21.1799:  rx data pt reply id-to-name <none!> (32)
  111  1999-11-11 21:47:22.969841 IP 131.151.32.21.1799 > 131.151.1.59.7002:  rx data pt call list-elements id -569 (36)
  112  1999-11-11 21:47:22.971342 IP 131.151.1.59.7002 > 131.151.32.21.1799:  rx data pt reply list-entry (112)
  113  1999-11-11 21:47:22.971544 IP 131.151.32.21.1799 > 131.151.1.59.7002:  rx data pt call id-to-name ids: 5002 5004 5013 5016 5021 5022 5150 5171 5195 5211 5220 5339 5408 5879 13081 17342 19999 20041 20176 (112)
  114  1999-11-11 21:47:23.005534 IP 131.151.1.59.7002 > 131.151.32.21.1799:  rx data pt reply id-to-name "rms" "rwa" "uetrecht" "dwd" "kjh" [|pt] (1444)
  115  1999-11-11 21:47:23.006602 IP 131.151.1.59.7002 > 131.151.32.21.1799:  rx data (1444)
  116  1999-11-11 21:47:23.007048 IP 131.151.32.21.1799 > 131.151.1.59.7002:  rx ack first 2 serial 7 reason delay acked 2 (66)
  117  1999-11-11 21:47:23.007745 IP 131.151.1.59.7002 > 131.151.32.21.1799:  rx data (1444)
  118  1999-11-11 21:47:23.008408 IP 131.151.1.59.7002 > 131.151.32.21.1799:  rx data (648)
  119  1999-11-11 21:47:23.008550 IP 131.151.32.21.1799 > 131.151.1.59.7002:  rx ack first 4 serial 9 reason delay acked 4 (66)
  120  1999-11-11 21:47:26.569758 IP 131.151.1.59.7003 > 131.151.32.21.1792:  rx data vldb reply get-entry-by-name "root.cell" numservers 6 servers 131.151.1.146 131.151.1.60 131.151.1.146 131.151.1.59 131.151.1.70 131.151.1.85 partitions a a a a a a rwvol 536870915 rovol 536870916 backup 536870917 (412)
  121  1999-11-11 21:47:26.569822 IP 131.151.32.21 > 131.151.1.59: ICMP 131.151.32.21 udp port 1792 unreachable, length 448
  122  1999-11-11 21:47:31.825501 IP 131.151.32.21.7001 > 131.151.1.146.7000:  rx data fs call fetch-status fid 536977399/16/15 (44)
  123  1999-11-11 21:47:31.827985 IP 131.151.1.146.7000 > 131.151.32.21.7001:  rx data fs reply fetch-status (148)
  124  1999-11-11 21:47:31.829082 IP 131.151.32.21.7001 > 131.151.1.146.7000:  rx data fs call fetch-data fid 536977399/16/15 offset 0 length 65536 (52)
  125  1999-11-11 21:47:31.872588 IP 131.151.1.146.7000 > 131.151.32.21.7001:  rx data fs reply fetch-data (1472)
  126  1999-11-11 21:47:31.873045 IP 131.151.1.146 > 131.151.32.21: ip-proto-17
  127  1999-11-11 21:47:31.873238 IP 131.151.1.146 > 131.151.32.21: ip-proto-17
  128  1999-11-11 21:47:31.873323 IP 131.151.1.146 > 131.151.32.21: ip-proto-17
  129  1999-11-11 21:47:31.874199 IP 131.151.1.146.7000 > 131.151.32.21.7001:  rx data (1472)
  130  1999-11-11 21:47:31.874320 IP 131.151.1.146 > 131.151.32.21: ip-proto-17
  131  1999-11-11 21:47:31.874444 IP 131.151.1.146 > 131.151.32.21: ip-proto-17
  132  1999-11-11 21:47:31.874527 IP 131.151.1.146 > 131.151.32.21: ip-proto-17
  133  1999-11-11 21:47:31.874656 IP 131.151.32.21.7001 > 131.151.1.146.7000:  rx ack first 2 serial 2524 reason ack requested acked 2 (66)
  134  1999-11-11 21:47:31.911711 IP 131.151.1.146.7000 > 131.151.32.21.7001:  rx data (1472)
  135  1999-11-11 21:47:31.911830 IP 131.151.1.146 > 131.151.32.21: ip-proto-17
  136  1999-11-11 21:47:31.911963 IP 131.151.1.146 > 131.151.32.21: ip-proto-17
  137  1999-11-11 21:47:31.912047 IP 131.151.1.146 > 131.151.32.21: ip-proto-17
  138  1999-11-11 21:47:31.912793 IP 131.151.1.146.7000 > 131.151.32.21.7001:  rx data (1472)
  139  1999-11-11 21:47:31.912917 IP 131.151.1.146 > 131.151.32.21: ip-proto-17
  140  1999-11-11 21:47:31.913050 IP 131.151.1.146 > 131.151.32.21: ip-proto-17
  141  1999-11-11 21:47:31.913123 IP 131.151.1.146 > 131.151.32.21: ip-proto-17
  142  1999-11-11 21:47:31.913290 IP 131.151.32.21.7001 > 131.151.1.146.7000:  rx ack first 4 serial 2526 reason ack requested acked 4 (66)
  143  1999-11-11 21:47:31.914161 IP 131.151.1.146.7000 > 131.151.32.21.7001:  rx data (1472)
  144  1999-11-11 21:47:31.914283 IP 131.151.1.146 > 131.151.32.21: ip-proto-17
  145  1999-11-11 21:47:31.914405 IP 131.151.1.146 > 131.151.32.21: ip-proto-17
  146  1999-11-11 21:47:31.914488 IP 131.151.1.146 > 131.151.32.21: ip-proto-17
  147  1999-11-11 21:47:31.915372 IP 131.151.1.146.7000 > 131.151.32.21.7001:  rx data (1472)
  148  1999-11-11 21:47:31.915494 IP 131.151.1.146 > 131.151.32.21: ip-proto-17
  149  1999-11-11 21:47:31.915618 IP 131.151.1.146 > 131.151.32.21: ip-proto-17
  150  1999-11-11 21:47:31.915702 IP 131.151.1.146 > 131.151.32.21: ip-proto-17
  151  1999-11-11 21:47:31.915835 IP 131.151.32.21.7001 > 131.151.1.146.7000:  rx ack first 6 serial 2528 reason ack requested acked 6 (66)
  152  1999-11-11 21:47:31.921854 IP 131.151.1.146.7000 > 131.151.32.21.7001:  rx data (1472)
  153  1999-11-11 21:47:31.921976 IP 131.151.1.146 > 131.151.32.21: ip-proto-17
  154  1999-11-11 21:47:31.922099 IP 131.151.1.146 > 131.151.32.21: ip-proto-17
  155  1999-11-11 21:47:31.922182 IP 131.151.1.146 > 131.151.32.21: ip-proto-17
  156  1999-11-11 21:47:31.923223 IP 131.151.1.146.7000 > 131.151.32.21.7001:  rx data (1472)
  157  1999-11-11 21:47:31.923347 IP 131.151.1.146 > 131.151.32.21: ip-proto-17
  158  1999-11-11 21:47:31.923470 IP 131.151.1.146 > 131.151.32.21: ip-proto-17
  159  1999-11-11 21:47:31.923553 IP 131.151.1.146 > 131.151.32.21: ip-proto-17
  160  1999-11-11 21:47:31.923698 IP 131.151.32.21.7001 > 131.151.1.146.7000:  rx ack first 8 serial 2530 reason ack requested acked 8 (66)
  161  1999-11-11 21:47:31.924962 IP 131.151.1.146.7000 > 131.151.32.21.7001:  rx data (1472)
  162  1999-11-11 21:47:31.925085 IP 131.151.1.146 > 131.151.32.21: ip-proto-17
  163  1999-11-11 21:47:31.925207 IP 131.151.1.146 > 131.151.32.21: ip-proto-17
  164  1999-11-11 21:47:31.925291 IP 131.151.1.146 > 131.151.32.21: ip-proto-17
  165  1999-11-11 21:47:31.926314 IP 131.151.1.146.7000 > 131.151.32.21.7001:  rx data (1472)
  166  1999-11-11 21:47:31.926436 IP 131.151.1.146 > 131.151.32.21: ip-proto-17
  167  1999-11-11 21:47:31.926560 IP 131.151.1.146 > 131.151.32.21: ip-proto-17
  168  1999-11-11 21:47:31.926641 IP 131.151.1.146 > 131.151.32.21: ip-proto-17
  169  1999-11-11 21:47:31.926761 IP 131.151.32.21.7001 > 131.151.1.146.7000:  rx ack first 10 serial 2532 reason ack requested acked 10 (66)
  170  1999-11-11 21:47:31.927670 IP 131.151.1.146.7000 > 131.151.32.21.7001:  rx data (1472)
  171  1999-11-11 21:47:31.927794 IP 131.151.1.146 > 131.151.32.21: ip-proto-17
  172  1999-11-11 21:47:31.927917 IP 131.151.1.146 > 131.151.32.21: ip-proto-17
  173  1999-11-11 21:47:31.927999 IP 131.151.1.146 > 131.151.32.21: ip-proto-17
  174  1999-11-11 21:47:31.928955 IP 131.151.1.146.7000 > 131.151.32.21.7001:  rx data (1472)
  175  1999-11-11 21:47:31.929070 IP 131.151.1.146 > 131.151.32.21: ip-proto-17
  176  1999-11-11 21:47:31.929090 IP 131.151.1.146 > 131.151.32.21: ip-proto-17
  177  1999-11-11 21:47:31.929216 IP 131.151.32.21.7001 > 131.151.1.146.7000:  rx ack first 12 serial 2534 reason delay acked 12 (66)
  178  1999-11-11 21:47:31.931311 IP 131.151.32.21.7001 > 131.151.1.146.7000:  rx data fs call fetch-data fid 536977399/16/15 offset 131072 length 56972 (52)
  179  1999-11-11 21:47:31.946920 IP 131.151.1.146.7000 > 131.151.32.21.7001:  rx data fs reply fetch-data (1472)
  180  1999-11-11 21:47:31.947042 IP 131.151.1.146 > 131.151.32.21: ip-proto-17
  181  1999-11-11 21:47:31.947179 IP 131.151.1.146 > 131.151.32.21: ip-proto-17
  182  1999-11-11 21:47:31.947258 IP 131.151.1.146 > 131.151.32.21: ip-proto-17
  183  1999-11-11 21:47:31.948245 IP 131.151.1.146.7000 > 131.151.32.21.7001:  rx data (1472)
  184  1999-11-11 21:47:31.948368 IP 131.151.1.146 > 131.151.32.21: ip-proto-17
  185  1999-11-11 21:47:31.948492 IP 131.151.1.146 > 131.151.32.21: ip-proto-17
  186  1999-11-11 21:47:31.948574 IP 131.151.1.146 > 131.151.32.21: ip-proto-17
  187  1999-11-11 21:47:31.948714 IP 131.151.32.21.7001 > 131.151.1.146.7000:  rx ack first 2 serial 2536 reason ack requested acked 2 (66)
  188  1999-11-11 21:47:31.949601 IP 131.151.1.146.7000 > 131.151.32.21.7001:  rx data (1472)
  189  1999-11-11 21:47:31.949715 IP 131.151.1.146 > 131.151.32.21: ip-proto-17
  190  1999-11-11 21:47:31.949838 IP 131.151.1.146 > 131.151.32.21: ip-proto-17
  191  1999-11-11 21:47:31.949921 IP 131.151.1.146 > 131.151.32.21: ip-proto-17
  192  1999-11-11 21:47:31.950714 IP 131.151.1.146.7000 > 131.151.32.21.7001:  rx data (1472)
  193  1999-11-11 21:47:31.950835 IP 131.151.1.146 > 131.151.32.21: ip-proto-17
  194  1999-11-11 21:47:31.950959 IP 131.151.1.146 > 131.151.32.21: ip-proto-17
  195  1999-11-11 21:47:31.951042 IP 131.151.1.146 > 131.151.32.21: ip-proto-17
  196  1999-11-11 21:47:31.951177 IP 131.151.32.21.7001 > 131.151.1.146.7000:  rx ack first 4 serial 2538 reason ack requested acked 4 (66)
  197  1999-11-11 21:47:31.952808 IP 131.151.1.146.7000 > 131.151.32.21.7001:  rx data (1472)
  198  1999-11-11 21:47:31.952930 IP 131.151.1.146 > 131.151.32.21: ip-proto-17
  199  1999-11-11 21:47:31.953063 IP 131.151.1.146 > 131.151.32.21: ip-proto-17
  200  1999-11-11 21:47:31.953145 IP 131.151.1.146 > 131.151.32.21: ip-proto-17
  201  1999-11-11 21:47:31.954021 IP 131.151.1.146.7000 > 131.151.32.21.7001:  rx data (1472)
  202  1999-11-11 21:47:31.954153 IP 131.151.1.146 > 131.151.32.21: ip-proto-17
  203  1999-11-11 21:47:31.954266 IP 131.151.1.146 > 131.151.32.21: ip-proto-17
  204  1999-11-11 21:47:31.954351 IP 131.151.1.146 > 131.151.32.21: ip-proto-17
  205  1999-11-11 21:47:31.954501 IP 131.151.32.21.7001 > 131.151.1.146.7000:  rx ack first 6 serial 2540 reason ack requested acked 6 (66)
  206  1999-11-11 21:47:31.955104 IP 131.151.1.146.7000 > 131.151.32.21.7001:  rx data (1472)
  207  1999-11-11 21:47:31.955226 IP 131.151.1.146 > 131.151.32.21: ip-proto-17
  208  1999-11-11 21:47:31.955349 IP 131.151.1.146 > 131.151.32.21: ip-proto-17
  209  1999-11-11 21:47:31.955433 IP 131.151.1.146 > 131.151.32.21: ip-proto-17
  210  1999-11-11 21:47:31.956561 IP 131.151.1.146.7000 > 131.151.32.21.7001:  rx data (1472)
  211  1999-11-11 21:47:31.956683 IP 131.151.1.146 > 131.151.32.21: ip-proto-17
  212  1999-11-11 21:47:31.956807 IP 131.151.1.146 > 131.151.32.21: ip-proto-17
  213  1999-11-11 21:47:31.956897 IP 131.151.1.146 > 131.151.32.21: ip-proto-17
  214  1999-11-11 21:47:31.957074 IP 131.151.32.21.7001 > 131.151.1.146.7000:  rx ack first 8 serial 2542 reason ack requested acked 8 (66)
  215  1999-11-11 21:47:31.958291 IP 131.151.1.146.7000 > 131.151.32.21.7001:  rx data (1472)
  216  1999-11-11 21:47:31.958413 IP 131.151.1.146 > 131.151.32.21: ip-proto-17
  217  1999-11-11 21:47:31.958536 IP 131.151.1.146 > 131.151.32.21: ip-proto-17
  218  1999-11-11 21:47:31.958620 IP 131.151.1.146 > 131.151.32.21: ip-proto-17
  219  1999-11-11 21:47:31.959648 IP 131.151.1.146.7000 > 131.151.32.21.7001:  rx data (1472)
  220  1999-11-11 21:47:31.959768 IP 131.151.1.146 > 131.151.32.21: ip-proto-17
  221  1999-11-11 21:47:31.959881 IP 131.151.1.146 > 131.151.32.21: ip-proto-17
  222  1999-11-11 21:47:31.959978 IP 131.151.1.146 > 131.151.32.21: ip-proto-17
  223  1999-11-11 21:47:31.959997 IP 131.151.1.146.7000 > 131.151.32.21.7001:  rx data (484)
  224  1999-11-11 21:47:31.960153 IP 131.151.32.21.7001 > 131.151.1.146.7000:  rx ack first 10 serial 2544 reason ack requested acked 10 (66)
  225  1999-11-11 21:47:31.968719 IP 131.151.32.21.7001 > 131.151.1.146.7000:  rx data fs call fetch-data fid 536977399/16/15 offset 65536 length 65536 (52)
  226  1999-11-11 21:47:31.973708 IP 131.151.1.146.7000 > 131.151.32.21.7001:  rx data fs reply fetch-data (1472)
  227  1999-11-11 21:47:31.973826 IP 131.151.1.146 > 131.151.32.21: ip-proto-17
  228  1999-11-11 21:47:31.973953 IP 131.151.1.146 > 131.151.32.21: ip-proto-17
  229  1999-11-11 21:47:31.974036 IP 131.151.1.146 > 131.151.32.21: ip-proto-17
  230  1999-11-11 21:47:31.975130 IP 131.151.1.146.7000 > 131.151.32.21.7001:  rx data (1472)
  231  1999-11-11 21:47:31.975251 IP 131.151.1.146 > 131.151.32.21: ip-proto-17
  232  1999-11-11 21:47:31.975374 IP 131.151.1.146 > 131.151.32.21: ip-proto-17
  233  1999-11-11 21:47:31.975457 IP 131.151.1.146 > 131.151.32.21: ip-proto-17
  234  1999-11-11 21:47:31.975644 IP 131.151.32.21.7001 > 131.151.1.146.7000:  rx ack first 2 serial 2547 reason ack requested acked 2 (66)
  235  1999-11-11 21:47:31.976494 IP 131.151.1.146.7000 > 131.151.32.21.7001:  rx data (1472)
  236  1999-11-11 21:47:31.976614 IP 131.151.1.146 > 131.151.32.21: ip-proto-17
  237  1999-11-11 21:47:31.976732 IP 131.151.1.146 > 131.151.32.21: ip-proto-17
  238  1999-11-11 21:47:31.976816 IP 131.151.1.146 > 131.151.32.21: ip-proto-17
  239  1999-11-11 21:47:31.977547 IP 131.151.1.146.7000 > 131.151.32.21.7001:  rx data (1472)
  240  1999-11-11 21:47:31.977658 IP 131.151.1.146 > 131.151.32.21: ip-proto-17
  241  1999-11-11 21:47:31.977781 IP 131.151.1.146 > 131.151.32.21: ip-proto-17
  242  1999-11-11 21:47:31.977865 IP 131.151.1.146 > 131.151.32.21: ip-proto-17
  243  1999-11-11 21:47:31.978006 IP 131.151.32.21.7001 > 131.151.1.146.7000:  rx ack first 4 serial 2549 reason ack requested acked 4 (66)
  244  1999-11-11 21:47:31.978903 IP 131.151.1.146.7000 > 131.151.32.21.7001:  rx data (1472)
  245  1999-11-11 21:47:31.979022 IP 131.151.1.146 > 131.151.32.21: ip-proto-17
  246  1999-11-11 21:47:31.979152 IP 131.151.1.146 > 131.151.32.21: ip-proto-17
  247  1999-11-11 21:47:31.979234 IP 131.151.1.146 > 131.151.32.21: ip-proto-17
  248  1999-11-11 21:47:31.980103 IP 131.151.1.146.7000 > 131.151.32.21.7001:  rx data (1472)
  249  1999-11-11 21:47:31.980225 IP 131.151.1.146 > 131.151.32.21: ip-proto-17
  250  1999-11-11 21:47:31.980348 IP 131.151.1.146 > 131.151.32.21: ip-proto-17
  251  1999-11-11 21:47:31.980442 IP 131.151.1.146 > 131.151.32.21: ip-proto-17
  252  1999-11-11 21:47:31.980584 IP 131.151.32.21.7001 > 131.151.1.146.7000:  rx ack first 6 serial 2551 reason ack requested acked 6 (66)
  253  1999-11-11 21:47:31.981466 IP 131.151.1.146.7000 > 131.151.32.21.7001:  rx data (1472)
  254  1999-11-11 21:47:31.981612 IP 131.151.1.146 > 131.151.32.21: ip-proto-17
  255  1999-11-11 21:47:31.981736 IP 131.151.1.146 > 131.151.32.21: ip-proto-17
  256  1999-11-11 21:47:31.981819 IP 131.151.1.146 > 131.151.32.21: ip-proto-17
  257  1999-11-11 21:47:31.982687 IP 131.151.1.146.7000 > 131.151.32.21.7001:  rx data (1472)
  258  1999-11-11 21:47:31.982809 IP 131.151.1.146 > 131.151.32.21: ip-proto-17
  259  1999-11-11 21:47:31.982931 IP 131.151.1.146 > 131.151.32.21: ip-proto-17
  260  1999-11-11 21:47:31.983013 IP 131.151.1.146 > 131.151.32.21: ip-proto-17
  261  1999-11-11 21:47:31.983173 IP 131.151.32.21.7001 > 131.151.1.146.7000:  rx ack first 8 serial 2553 reason ack requested acked 8 (66)
  262  1999-11-11 21:47:31.984600 IP 131.151.1.146.7000 > 131.151.32.21.7001:  rx data (1472)
  263  1999-11-11 21:47:31.984721 IP 131.151.1.146 > 131.151.32.21: ip-proto-17
  264  1999-11-11 21:47:31.984846 IP 131.151.1.146 > 131.151.32.21: ip-proto-17
  265  1999-11-11 21:47:31.984929 IP 131.151.1.146 > 131.151.32.21: ip-proto-17
  266  1999-11-11 21:47:31.985969 IP 131.151.1.146.7000 > 131.151.32.21.7001:  rx data (1472)
  267  1999-11-11 21:47:31.986089 IP 131.151.1.146 > 131.151.32.21: ip-proto-17
  268  1999-11-11 21:47:31.986212 IP 131.151.1.146 > 131.151.32.21: ip-proto-17
  269  1999-11-11 21:47:31.986306 IP 131.151.1.146 > 131.151.32.21: ip-proto-17
  270  1999-11-11 21:47:31.986455 IP 131.151.32.21.7001 > 131.151.1.146.7000:  rx ack first 10 serial 2555 reason ack requested acked 10 (66)
  271  1999-11-11 21:47:31.987315 IP 131.151.1.146.7000 > 131.151.32.21.7001:  rx data (1472)
  272  1999-11-11 21:47:31.987436 IP 131.151.1.146 > 131.151.32.21: ip-proto-17
  273  1999-11-11 21:47:31.987559 IP 131.151.1.146 > 131.151.32.21: ip-proto-17
  274  1999-11-11 21:47:31.987643 IP 131.151.1.146 > 131.151.32.21: ip-proto-17
  275  1999-11-11 21:47:31.988562 IP 131.151.1.146.7000 > 131.151.32.21.7001:  rx data (1472)
  276  1999-11-11 21:47:31.988678 IP 131.151.1.146 > 131.151.32.21: ip-proto-17
  277  1999-11-11 21:47:31.988696 IP 131.151.1.146 > 131.151.32.21: ip-proto-17
  278  1999-11-11 21:47:31.989166 IP 131.151.32.21.7001 > 131.151.1.146.7000:  rx ack first 12 serial 2557 reason delay acked 12 (66)
  279  1999-11-11 21:47:36.960670 IP 131.151.1.59.7003 > 131.151.32.21.1792:  rx data vldb reply get-entry-by-name "root.cell" numservers 6 servers 131.151.1.146 131.151.1.60 131.151.1.146 131.151.1.59 131.151.1.70 131.151.1.85 partitions a a a a a a rwvol 536870915 rovol 536870916 backup 536870917 (412)
  280  1999-11-11 21:47:36.960736 IP 131.151.32.21 > 131.151.1.59: ICMP 131.151.32.21 udp port 1792 unreachable, length 448
  281  1999-11-11 21:47:38.824245 IP 131.151.1.59.7000 > 131.151.32.91.7001:  rx data cb call probe (32)
  282  1999-11-11 21:47:38.832720 IP 131.151.32.91.7001 > 131.151.1.59.7000:  rx data (28)
  283  1999-11-11 21:47:38.832736 IP 131.151.32.91.7001 > 131.151.1.59.7000:  rx data (28)
  284  1999-11-11 21:47:39.340205 IP 131.151.1.59.7000 > 131.151.32.91.7001:  rx ack first 2 serial 1155 reason delay (61)
  285  1999-11-11 21:47:47.600747 IP 131.151.1.59.7003 > 131.151.32.21.1792:  rx data vldb reply get-entry-by-name "root.cell" numservers 6 servers 131.151.1.146 131.151.1.60 131.151.1.146 131.151.1.59 131.151.1.70 131.151.1.85 partitions a a a a a a rwvol 536870915 rovol 536870916 backup 536870917 (412)
  286  1999-11-11 21:47:47.600817 IP 131.151.32.21 > 131.151.1.59: ICMP 131.151.32.21 udp port 1792 unreachable, length 448
  287  1999-11-11 21:47:50.558379 IP 131.151.32.21.7001 > 131.151.1.146.7000:  rx data fs call fetch-status fid 536977399/30/22 (44)
  288  1999-11-11 21:47:50.559765 IP 131.151.1.146.7000 > 131.151.32.21.7001:  rx data fs reply fetch-status (148)
  289  1999-11-11 21:47:50.560341 IP 131.151.32.21.7001 > 131.151.1.146.7000:  rx data fs call fetch-data fid 536977399/30/22 offset 0 length 65536 (52)
  290  1999-11-11 21:47:50.586027 IP 131.151.1.146.7000 > 131.151.32.21.7001:  rx data fs reply fetch-data (1472)
  291  1999-11-11 21:47:50.586148 IP 131.151.1.146 > 131.151.32.21: ip-proto-17
  292  1999-11-11 21:47:50.586270 IP 131.151.1.146 > 131.151.32.21: ip-proto-17
  293  1999-11-11 21:47:50.586353 IP 131.151.1.146 > 131.151.32.21: ip-proto-17
  294  1999-11-11 21:47:50.598397 IP 131.151.1.146.7000 > 131.151.32.21.7001:  rx data (1472)
  295  1999-11-11 21:47:50.598517 IP 131.151.1.146 > 131.151.32.21: ip-proto-17
  296  1999-11-11 21:47:50.598641 IP 131.151.1.146 > 131.151.32.21: ip-proto-17
  297  1999-11-11 21:47:50.598723 IP 131.151.1.146 > 131.151.32.21: ip-proto-17
  298  1999-11-11 21:47:50.599028 IP 131.151.32.21.7001 > 131.151.1.146.7000:  rx ack first 2 serial 2560 reason ack requested acked 2 (66)
  299  1999-11-11 21:47:50.613313 IP 131.151.1.146.7000 > 131.151.32.21.7001:  rx data (1472)
  300  1999-11-11 21:47:50.613434 IP 131.151.1.146 > 131.151.32.21: ip-proto-17
  301  1999-11-11 21:47:50.613557 IP 131.151.1.146 > 131.151.32.21: ip-proto-17
  302  1999-11-11 21:47:50.613640 IP 131.151.1.146 > 131.151.32.21: ip-proto-17
  303  1999-11-11 21:47:50.614408 IP 131.151.1.146.7000 > 131.151.32.21.7001:  rx data (1472)
  304  1999-11-11 21:47:50.614529 IP 131.151.1.146 > 131.151.32.21: ip-proto-17
  305  1999-11-11 21:47:50.614653 IP 131.151.1.146 > 131.151.32.21: ip-proto-17
  306  1999-11-11 21:47:50.614736 IP 131.151.1.146 > 131.151.32.21: ip-proto-17
  307  1999-11-11 21:47:50.614884 IP 131.151.32.21.7001 > 131.151.1.146.7000:  rx ack first 4 serial 2562 reason ack requested acked 4 (66)
  308  1999-11-11 21:47:50.615759 IP 131.151.1.146.7000 > 131.151.32.21.7001:  rx data (1472)
  309  1999-11-11 21:47:50.615881 IP 131.151.1.146 > 131.151.32.21: ip-proto-17
  310  1999-11-11 21:47:50.616003 IP 131.151.1.146 > 131.151.32.21: ip-proto-17
  311  1999-11-11 21:47:50.616086 IP 131.151.1.146 > 131.151.32.21: ip-proto-17
  312  1999-11-11 21:47:50.617064 IP 131.151.1.146.7000 > 131.151.32.21.7001:  rx data (1472)
  313  1999-11-11 21:47:50.617195 IP 131.151.1.146 > 131.151.32.21: ip-proto-17
  314  1999-11-11 21:47:50.617309 IP 131.151.1.146 > 131.151.32.21: ip-proto-17
  315  1999-11-11 21:47:50.617392 IP 131.151.1.146 > 131.151.32.21: ip-proto-17
  316  1999-11-11 21:47:50.617571 IP 131.151.32.21.7001 > 131.151.1.146.7000:  rx ack first 6 serial 2564 reason ack requested acked 6 (66)
  317  1999-11-11 21:47:50.618132 IP 131.151.1.146.7000 > 131.151.32.21.7001:  rx data (1472)
  318  1999-11-11 21:47:50.618264 IP 131.151.1.146 > 131.151.32.21: ip-proto-17
  319  1999-11-11 21:47:50.618388 IP 131.151.1.146 > 131.151.32.21: ip-proto-17
  320  1999-11-11 21:47:50.618470 IP 131.151.1.146 > 131.151.32.21: ip-proto-17
  321  1999-11-11 21:47:50.619700 IP 131.151.1.146.7000 > 131.151.32.21.7001:  rx data (1472)
  322  1999-11-11 21:47:50.619811 IP 131.151.1.146 > 131.151.32.21: ip-proto-17
  323  1999-11-11 21:47:50.619936 IP 131.151.1.146 > 131.151.32.21: ip-proto-17
  324  1999-11-11 21:47:50.620017 IP 131.151.1.146 > 131.151.32.21: ip-proto-17
  325  1999-11-11 21:47:50.620153 IP 131.151.32.21.7001 > 131.151.1.146.7000:  rx ack first 8 serial 2566 reason ack requested acked 8 (66)
  326  1999-11-11 21:47:50.621466 IP 131.151.1.146.7000 > 131.151.32.21.7001:  rx data (1472)
  327  1999-11-11 21:47:50.621587 IP 131.151.1.146 > 131.151.32.21: ip-proto-17
  328  1999-11-11 21:47:50.621710 IP 131.151.1.146 > 131.151.32.21: ip-proto-17
  329  1999-11-11 21:47:50.621794 IP 131.151.1.146 > 131.151.32.21: ip-proto-17
  330  1999-11-11 21:47:50.622905 IP 131.151.1.146.7000 > 131.151.32.21.7001:  rx data (1472)
  331  1999-11-11 21:47:50.623020 IP 131.151.1.146 > 131.151.32.21: ip-proto-17
  332  1999-11-11 21:47:50.623158 IP 131.151.1.146 > 131.151.32.21: ip-proto-17
  333  1999-11-11 21:47:50.623227 IP 131.151.1.146 > 131.151.32.21: ip-proto-17
  334  1999-11-11 21:47:50.623423 IP 131.151.32.21.7001 > 131.151.1.146.7000:  rx ack first 10 serial 2568 reason ack requested acked 10 (66)
  335  1999-11-11 21:47:50.624233 IP 131.151.1.146.7000 > 131.151.32.21.7001:  rx data (1472)
  336  1999-11-11 21:47:50.624358 IP 131.151.1.146 > 131.151.32.21: ip-proto-17
  337  1999-11-11 21:47:50.624479 IP 131.151.1.146 > 131.151.32.21: ip-proto-17
  338  1999-11-11 21:47:50.624562 IP 131.151.1.146 > 131.151.32.21: ip-proto-17
  339  1999-11-11 21:47:50.625618 IP 131.151.1.146.7000 > 131.151.32.21.7001:  rx data (1472)
  340  1999-11-11 21:47:50.625734 IP 131.151.1.146 > 131.151.32.21: ip-proto-17
  341  1999-11-11 21:47:50.625753 IP 131.151.1.146 > 131.151.32.21: ip-proto-17
  342  1999-11-11 21:47:50.625870 IP 131.151.32.21.7001 > 131.151.1.146.7000:  rx ack first 12 serial 2570 reason delay acked 12 (66)
  343  1999-11-11 21:47:50.627406 IP 131.151.32.21.7001 > 131.151.1.146.7000:  rx data fs call fetch-data fid 536977399/30/22 offset 65536 length 26996 (52)
  344  1999-11-11 21:47:50.630017 IP 131.151.1.146.7000 > 131.151.32.21.7001:  rx data fs reply fetch-data (1472)
  345  1999-11-11 21:47:50.630141 IP 131.151.1.146 > 131.151.32.21: ip-proto-17
  346  1999-11-11 21:47:50.630263 IP 131.151.1.146 > 131.151.32.21: ip-proto-17
  347  1999-11-11 21:47:50.630347 IP 131.151.1.146 > 131.151.32.21: ip-proto-17
  348  1999-11-11 21:47:50.631301 IP 131.151.1.146.7000 > 131.151.32.21.7001:  rx data (1472)
  349  1999-11-11 21:47:50.631423 IP 131.151.1.146 > 131.151.32.21: ip-proto-17
  350  1999-11-11 21:47:50.631547 IP 131.151.1.146 > 131.151.32.21: ip-proto-17
  351  1999-11-11 21:47:50.631630 IP 131.151.1.146 > 131.151.32.21: ip-proto-17
  352  1999-11-11 21:47:50.631783 IP 131.151.32.21.7001 > 131.151.1.146.7000:  rx ack first 2 serial 2572 reason ack requested acked 2 (66)
  353  1999-11-11 21:47:50.633172 IP 131.151.1.146.7000 > 131.151.32.21.7001:  rx data (1472)
  354  1999-11-11 21:47:50.633294 IP 131.151.1.146 > 131.151.32.21: ip-proto-17
  355  1999-11-11 21:47:50.633417 IP 131.151.1.146 > 131.151.32.21: ip-proto-17
  356  1999-11-11 21:47:50.633500 IP 131.151.1.146 > 131.151.32.21: ip-proto-17
  357  1999-11-11 21:47:50.634225 IP 131.151.1.146.7000 > 131.151.32.21.7001:  rx data (1472)
  358  1999-11-11 21:47:50.634348 IP 131.151.1.146 > 131.151.32.21: ip-proto-17
  359  1999-11-11 21:47:50.634470 IP 131.151.1.146 > 131.151.32.21: ip-proto-17
  360  1999-11-11 21:47:50.634554 IP 131.151.1.146 > 131.151.32.21: ip-proto-17
  361  1999-11-11 21:47:50.634697 IP 131.151.32.21.7001 > 131.151.1.146.7000:  rx ack first 4 serial 2574 reason ack requested acked 4 (66)
  362  1999-11-11 21:47:50.635315 IP 131.151.1.146.7000 > 131.151.32.21.7001:  rx data (1472)
  363  1999-11-11 21:47:50.635437 IP 131.151.1.146 > 131.151.32.21: ip-proto-17
  364  1999-11-11 21:47:50.635545 IP 131.151.1.146 > 131.151.32.21: ip-proto-17
  365  1999-11-11 21:47:50.635555 IP 131.151.1.146.7000 > 131.151.32.21.7001:  rx data (148)
  366  1999-11-11 21:47:50.635705 IP 131.151.32.21.7001 > 131.151.1.146.7000:  rx ack first 5 serial 2576 reason delay acked 5-6 (67)
  367  1999-11-11 21:47:53.906701 IP 131.151.32.21.7001 > 131.151.1.146.7000:  rx data fs call fetch-status fid 536977399/88/52 (44)
  368  1999-11-11 21:47:53.946230 IP 131.151.1.146.7000 > 131.151.32.21.7001:  rx data fs reply fetch-status (148)
  369  1999-11-11 21:47:54.163340 IP 131.151.32.21.1799 > 131.151.1.59.7021: UDP, length 32
  370  1999-11-11 21:47:54.338581 IP 131.151.32.21.7001 > 131.151.1.146.7000:  rx ack first 2 serial 1 reason delay (65)
  371  1999-11-11 21:47:54.799371 IP 131.151.1.59.7021 > 131.151.32.21.1799: UDP, length 61
  372  1999-11-11 21:47:55.159236 IP 131.151.1.59.7021 > 131.151.32.21.1799: UDP, length 32
  373  1999-11-11 21:47:55.165136 IP 131.151.32.21.1799 > 131.151.1.59.7021: UDP, length 1444
  374  1999-11-11 21:47:55.166071 IP 131.151.1.59.7021 > 131.151.32.21.1799: UDP, length 62
  375  1999-11-11 21:47:55.166321 IP 131.151.32.21.1799 > 131.151.1.59.7021: UDP, length 1444
  376  1999-11-11 21:47:55.166447 IP 131.151.32.21.1799 > 131.151.1.59.7021: UDP, length 1444
  377  1999-11-11 21:47:55.199519 IP 131.151.1.59.7021 > 131.151.32.21.1799: UDP, length 62
  378  1999-11-11 21:47:55.199686 IP 131.151.32.21.1799 > 131.151.1.59.7021: UDP, length 1444
  379  1999-11-11 21:47:55.199809 IP 131.151.32.21.1799 > 131.151.1.59.7021: UDP, length 1444
  380  1999-11-11 21:47:55.200825 IP 131.151.1.59.7021 > 131.151.32.21.1799: UDP, length 62
  381  1999-11-11 21:47:55.200977 IP 131.151.32.21.1799 > 131.151.1.59.7021: UDP, length 1444
  382  1999-11-11 21:47:55.201325 IP 131.151.32.21.1799 > 131.151.1.59.7021: UDP, length 136
  383  1999-11-11 21:47:55.202977 IP 131.151.1.59.7021 > 131.151.32.21.1799: UDP, length 62
  384  1999-11-11 21:47:55.251632 IP 131.151.1.59.7021 > 131.151.32.21.1799: UDP, length 1472
  385  1999-11-11 21:47:55.252731 IP 131.151.1.59.7021 > 131.151.32.21.1799: UDP, length 1472
  386  1999-11-11 21:47:55.253147 IP 131.151.32.21.1799 > 131.151.1.59.7021: UDP, length 66
  387  1999-11-11 21:47:55.253858 IP 131.151.1.59.7021 > 131.151.32.21.1799: UDP, length 1472
  388  1999-11-11 21:47:55.254848 IP 131.151.1.59.7021 > 131.151.32.21.1799: UDP, length 1472
  389  1999-11-11 21:47:55.255035 IP 131.151.32.21.1799 > 131.151.1.59.7021: UDP, length 66
  390  1999-11-11 21:47:55.255955 IP 131.151.1.59.7021 > 131.151.32.21.1799: UDP, length 1472
  391  1999-11-11 21:47:55.257190 IP 131.151.1.59.7021 > 131.151.32.21.1799: UDP, length 32
  392  1999-11-11 21:47:55.257491 IP 131.151.32.21.1799 > 131.151.1.59.7021: UDP, length 1444
  393  1999-11-11 21:47:55.258405 IP 131.151.1.59.7021 > 131.151.32.21.1799: UDP, length 62
  394  1999-11-11 21:47:55.262318 IP 131.151.32.21.1799 > 131.151.1.59.7021: UDP, length 1444
  395  1999-11-11 21:47:55.262601 IP 131.151.32.21.1799 > 131.151.1.59.7021: UDP, length 1444
  396  1999-11-11 21:47:55.263258 IP 131.151.1.59.7021 > 131.151.32.21.1799: UDP, length 62
  397  1999-11-11 21:47:55.263401 IP 131.151.32.21.1799 > 131.151.1.59.7021: UDP, length 1444
  398  1999-11-11 21:47:55.263685 IP 131.151.32.21.1799 > 131.151.1.59.7021: UDP, length 1444
  399  1999-11-11 21:47:55.264640 IP 131.151.1.59.7021 > 131.151.32.21.1799: UDP, length 62
  400  1999-11-11 21:47:55.264850 IP 131.151.32.21.1799 > 131.151.1.59.7021: UDP, length 1444
  401  1999-11-11 21:47:55.264965 IP 131.151.32.21.1799 > 131.151.1.59.7021: UDP, length 144
  402  1999-11-11 21:47:55.267052 IP 131.151.1.59.7021 > 131.151.32.21.1799: UDP, length 62
  403  1999-11-11 21:47:55.796405 IP 131.151.1.59.7021 > 131.151.32.21.1799: UDP, length 61
  404  1999-11-11 21:47:57.009474 IP 131.151.32.21.7001 > 131.151.1.70.7000:  rx data fs call give-cbs (112)
  405  1999-11-11 21:47:57.010421 IP 131.151.1.70.7000 > 131.151.32.21.7001:  rx data (28)
  406  1999-11-11 21:47:57.340299 IP 131.151.1.59.7021 > 131.151.32.21.1799: UDP, length 1444
  407  1999-11-11 21:47:57.341607 IP 131.151.1.59.7021 > 131.151.32.21.1799: UDP, length 1444
  408  1999-11-11 21:47:57.341937 IP 131.151.32.21.1799 > 131.151.1.59.7021: UDP, length 66
  409  1999-11-11 21:47:57.342924 IP 131.151.1.59.7021 > 131.151.32.21.1799: UDP, length 1444
  410  1999-11-11 21:47:57.344154 IP 131.151.1.59.7021 > 131.151.32.21.1799: UDP, length 1444
  411  1999-11-11 21:47:57.345387 IP 131.151.1.59.7021 > 131.151.32.21.1799: UDP, length 1444
  412  1999-11-11 21:47:57.345878 IP 131.151.32.21.1799 > 131.151.1.59.7021: UDP, length 66
  413  1999-11-11 21:47:57.346737 IP 131.151.1.59.7021 > 131.151.32.21.1799: UDP, length 1444
  414  1999-11-11 21:47:57.346990 IP 131.151.32.21.1799 > 131.151.1.59.7021: UDP, length 66
  415  1999-11-11 21:47:57.348062 IP 131.151.1.59.7021 > 131.151.32.21.1799: UDP, length 104
  416  1999-11-11 21:47:57.348264 IP 131.151.32.21.1799 > 131.151.1.59.7021: UDP, length 60
  417  1999-11-11 21:47:57.408506 IP 131.151.32.21.7001 > 131.151.1.70.7000:  rx ack first 2 serial 56 reason delay (65)
  418  1999-11-11 21:47:57.436536 IP 131.151.1.59.7021 > 131.151.32.21.1799: UDP, length 1444
  419  1999-11-11 21:47:57.438563 IP 131.151.1.59.7021 > 131.151.32.21.1799: UDP, length 1444
  420  1999-11-11 21:47:57.439547 IP 131.151.32.21.1799 > 131.151.1.59.7021: UDP, length 66
  421  1999-11-11 21:47:57.440789 IP 131.151.1.59.7021 > 131.151.32.21.1799: UDP, length 1356
  422  1999-11-11 21:47:57.441114 IP 131.151.32.21.1799 > 131.151.1.59.7021: UDP, length 60
  423  1999-11-11 21:47:57.460401 IP 131.151.1.59.7021 > 131.151.32.21.1799: UDP, length 1444
  424  1999-11-11 21:47:57.461517 IP 131.151.1.59.7021 > 131.151.32.21.1799: UDP, length 1444
  425  1999-11-11 21:47:57.461928 IP 131.151.32.21.1799 > 131.151.1.59.7021: UDP, length 66
  426  1999-11-11 21:47:57.462859 IP 131.151.1.59.7021 > 131.151.32.21.1799: UDP, length 1356
  427  1999-11-11 21:47:57.463197 IP 131.151.32.21.1799 > 131.151.1.59.7021: UDP, length 60
  428  1999-11-11 21:47:57.474817 IP 131.151.1.59.7021 > 131.151.32.21.1799: UDP, length 1444
  429  1999-11-11 21:47:57.475890 IP 131.151.1.59.7021 > 131.151.32.21.1799: UDP, length 1444
  430  1999-11-11 21:47:57.476056 IP 131.151.32.21.1799 > 131.151.1.59.7021: UDP, length 66
  431  1999-11-11 21:47:57.477328 IP 131.151.1.59.7021 > 131.151.32.21.1799: UDP, length 1356
  432  1999-11-11 21:47:57.477777 IP 131.151.32.21.1799 > 131.151.1.59.7021: UDP, length 60
  433  1999-11-11 21:47:57.487546 IP 131.151.1.59.7021 > 131.151.32.21.1799: UDP, length 1444
  434  1999-11-11 21:47:57.488558 IP 131.151.1.59.7021 > 131.151.32.21.1799: UDP, length 1444
  435  1999-11-11 21:47:57.489407 IP 131.151.32.21.1799 > 131.151.1.59.7021: UDP, length 66
  436  1999-11-11 21:47:57.489821 IP 131.151.1.59.7021 > 131.151.32.21.1799: UDP, length 1356
  437  1999-11-11 21:47:57.490288 IP 131.151.32.21.1799 > 131.151.1.59.7021: UDP, length 60
  438  1999-11-11 21:47:57.492785 IP 131.151.1.59.7021 > 131.151.32.21.1799: UDP, length 1444
  439  1999-11-11 21:47:57.493778 IP 131.151.1.59.7021 > 131.151.32.21.1799: UDP, length 1444
  440  1999-11-11 21:47:57.495046 IP 131.151.1.59.7021 > 131.151.32.21.1799: UDP, length 1356
  441  1999-11-11 21:47:57.497159 IP 131.151.32.21.1799 > 131.151.1.59.7021: UDP, length 66
  442  1999-11-11 21:47:57.497606 IP 131.151.32.21.1799 > 131.151.1.59.7021: UDP, length 60
  443  1999-11-11 21:47:57.514885 IP 131.151.1.59.7021 > 131.151.32.21.1799: UDP, length 1444
  444  1999-11-11 21:47:57.515935 IP 131.151.1.59.7021 > 131.151.32.21.1799: UDP, length 1444
  445  1999-11-11 21:47:57.516104 IP 131.151.32.21.1799 > 131.151.1.59.7021: UDP, length 66
  446  1999-11-11 21:47:57.517280 IP 131.151.1.59.7021 > 131.151.32.21.1799: UDP, length 1356
  447  1999-11-11 21:47:57.517812 IP 131.151.32.21.1799 > 131.151.1.59.7021: UDP, length 60
  448  1999-11-11 21:47:57.520085 IP 131.151.1.59.7021 > 131.151.32.21.1799: UDP, length 1444
  449  1999-11-11 21:47:57.521128 IP 131.151.1.59.7021 > 131.151.32.21.1799: UDP, length 1444
  450  1999-11-11 21:47:57.522427 IP 131.151.1.59.7021 > 131.151.32.21.1799: UDP, length 1356
  451  1999-11-11 21:47:57.530098 IP 131.151.32.21.1799 > 131.151.1.59.7021: UDP, length 66
  452  1999-11-11 21:47:57.530654 IP 131.151.32.21.1799 > 131.151.1.59.7021: UDP, length 60
  453  1999-11-11 21:47:57.533186 IP 131.151.1.59.7021 > 131.151.32.21.1799: UDP, length 1444
  454  1999-11-11 21:47:57.534230 IP 131.151.1.59.7021 > 131.151.32.21.1799: UDP, length 1444
  455  1999-11-11 21:47:57.534487 IP 131.151.32.21.1799 > 131.151.1.59.7021: UDP, length 66
  456  1999-11-11 21:47:57.535724 IP 131.151.1.59.7021 > 131.151.32.21.1799: UDP, length 1356
  457  1999-11-11 21:47:57.540121 IP 131.151.32.21.1799 > 131.151.1.59.7021: UDP, length 60
  458  1999-11-11 21:47:57.542840 IP 131.151.1.59.7021 > 131.151.32.21.1799: UDP, length 1444
  459  1999-11-11 21:47:57.544805 IP 131.151.1.59.7021 > 131.151.32.21.1799: UDP, length 1444
  460  1999-11-11 21:47:57.545061 IP 131.151.32.21.1799 > 131.151.1.59.7021: UDP, length 66
  461  1999-11-11 21:47:57.547074 IP 131.151.1.59.7021 > 131.151.32.21.1799: UDP, length 1356
  462  1999-11-11 21:47:57.547384 IP 131.151.32.21.1799 > 131.151.1.59.7021: UDP, length 60
  463  1999-11-11 21:47:57.549677 IP 131.151.1.59.7021 > 131.151.32.21.1799: UDP, length 1444
  464  1999-11-11 21:47:57.550730 IP 131.151.1.59.7021 > 131.151.32.21.1799: UDP, length 1444
  465  1999-11-11 21:47:57.550981 IP 131.151.32.21.1799 > 131.151.1.59.7021: UDP, length 66
  466  1999-11-11 21:47:57.552136 IP 131.151.1.59.7021 > 131.151.32.21.1799: UDP, length 1356
  467  1999-11-11 21:47:57.552446 IP 131.151.32.21.1799 > 131.151.1.59.7021: UDP, length 60
  468  1999-11-11 21:47:57.554703 IP 131.151.1.59.7021 > 131.151.32.21.1799: UDP, length 1444
  469  1999-11-11 21:47:57.555704 IP 131.151.1.59.7021 > 131.151.32.21.1799: UDP, length 1444
  470  1999-11-11 21:47:57.555872 IP 131.151.32.21.1799 > 131.151.1.59.7021: UDP, length 66
  471  1999-11-11 21:47:57.557029 IP 131.151.1.59.7021 > 131.151.32.21.1799: UDP, length 1356
  472  1999-11-11 21:47:57.557342 IP 131.151.32.21.1799 > 131.151.1.59.7021: UDP, length 60
  473  1999-11-11 21:47:57.559640 IP 131.151.1.59.7021 > 131.151.32.21.1799: UDP, length 1444
  474  1999-11-11 21:47:57.560653 IP 131.151.1.59.7021 > 131.151.32.21.1799: UDP, length 1444
  475  1999-11-11 21:47:57.560814 IP 131.151.32.21.1799 > 131.151.1.59.7021: UDP, length 66
  476  1999-11-11 21:47:57.562026 IP 131.151.1.59.7021 > 131.151.32.21.1799: UDP, length 1356
  477  1999-11-11 21:47:57.562466 IP 131.151.32.21.1799 > 131.151.1.59.7021: UDP, length 60
  478  1999-11-11 21:47:57.564746 IP 131.151.1.59.7021 > 131.151.32.21.1799: UDP, length 1444
  479  1999-11-11 21:47:57.565755 IP 131.151.1.59.7021 > 131.151.32.21.1799: UDP, length 1444
  480  1999-11-11 21:47:57.565920 IP 131.151.32.21.1799 > 131.151.1.59.7021: UDP, length 66
  481  1999-11-11 21:47:57.567069 IP 131.151.1.59.7021 > 131.151.32.21.1799: UDP, length 1356
  482  1999-11-11 21:47:57.567593 IP 131.151.32.21.1799 > 131.151.1.59.7021: UDP, length 60
  483  1999-11-11 21:47:57.569928 IP 131.151.1.59.7021 > 131.151.32.21.1799: UDP, length 1444
  484  1999-11-11 21:47:57.570928 IP 131.151.1.59.7021 > 131.151.32.21.1799: UDP, length 1444
  485  1999-11-11 21:47:57.571095 IP 131.151.32.21.1799 > 131.151.1.59.7021: UDP, length 66
  486  1999-11-11 21:47:57.572322 IP 131.151.1.59.7021 > 131.151.32.21.1799: UDP, length 1356
  487  1999-11-11 21:47:57.572720 IP 131.151.32.21.1799 > 131.151.1.59.7021: UDP, length 60
  488  1999-11-11 21:47:57.575003 IP 131.151.1.59.7021 > 131.151.32.21.1799: UDP, length 1444
  489  1999-11-11 21:47:57.576024 IP 131.151.1.59.7021 > 131.151.32.21.1799: UDP, length 1444
  490  1999-11-11 21:47:57.576388 IP 131.151.32.21.1799 > 131.151.1.59.7021: UDP, length 66
  491  1999-11-11 21:47:57.577373 IP 131.151.1.59.7021 > 131.151.32.21.1799: UDP, length 1356
  492  1999-11-11 21:47:57.577724 IP 131.151.32.21.1799 > 131.151.1.59.7021: UDP, length 60
  493  1999-11-11 21:47:57.580189 IP 131.151.1.59.7021 > 131.151.32.21.1799: UDP, length 1444
  494  1999-11-11 21:47:57.581306 IP 131.151.1.59.7021 > 131.151.32.21.1799: UDP, length 1444
  495  1999-11-11 21:47:57.581548 IP 131.151.32.21.1799 > 131.151.1.59.7021: UDP, length 66
  496  1999-11-11 21:47:57.582806 IP 131.151.1.59.7021 > 131.151.32.21.1799: UDP, length 1356
  497  1999-11-11 21:47:57.583269 IP 131.151.32.21.1799 > 131.151.1.59.7021: UDP, length 60
  498  1999-11-11 21:47:57.585922 IP 131.151.1.59.7021 > 131.151.32.21.1799: UDP, length 1444
  499  1999-11-11 21:47:57.587914 IP 131.151.1.59.7021 > 131.151.32.21.1799: UDP, length 1444
  500  1999-11-11 21:47:57.588147 IP 131.151.32.21.1799 > 131.151.1.59.7021: UDP, length 66
  501  1999-11-11 21:47:57.590180 IP 131.151.1.59.7021 > 131.151.32.21.1799: UDP, length 1356
  502  1999-11-11 21:47:57.590496 IP 131.151.32.21.1799 > 131.151.1.59.7021: UDP, length 60
  503  1999-11-11 21:47:57.593543 IP 131.151.1.59.7021 > 131.151.32.21.1799: UDP, length 1444
  504  1999-11-11 21:47:57.594586 IP 131.151.1.59.7021 > 131.151.32.21.1799: UDP, length 1444
  505  1999-11-11 21:47:57.594999 IP 131.151.32.21.1799 > 131.151.1.59.7021: UDP, length 66
  506  1999-11-11 21:47:57.595945 IP 131.151.1.59.7021 > 131.151.32.21.1799: UDP, length 1356
  507  1999-11-11 21:47:57.596253 IP 131.151.32.21.1799 > 131.151.1.59.7021: UDP, length 60
  508  1999-11-11 21:47:57.598753 IP 131.151.1.59.7021 > 131.151.32.21.1799: UDP, length 1444
  509  1999-11-11 21:47:57.599796 IP 131.151.1.59.7021 > 131.151.32.21.1799: UDP, length 1444
  510  1999-11-11 21:47:57.599958 IP 131.151.32.21.1799 > 131.151.1.59.7021: UDP, length 66
  511  1999-11-11 21:47:57.601168 IP 131.151.1.59.7021 > 131.151.32.21.1799: UDP, length 1356
  512  1999-11-11 21:47:57.601637 IP 131.151.32.21.1799 > 131.151.1.59.7021: UDP, length 60
  513  1999-11-11 21:47:57.609736 IP 131.151.1.59.7021 > 131.151.32.21.1799: UDP, length 1444
  514  1999-11-11 21:47:57.610744 IP 131.151.1.59.7021 > 131.151.32.21.1799: UDP, length 1444
  515  1999-11-11 21:47:57.610914 IP 131.151.32.21.1799 > 131.151.1.59.7021: UDP, length 66
  516  1999-11-11 21:47:57.612128 IP 131.151.1.59.7021 > 131.151.32.21.1799: UDP, length 1356
  517  1999-11-11 21:47:57.612774 IP 131.151.32.21.1799 > 131.151.1.59.7021: UDP, length 1444
  518  1999-11-11 21:47:57.613784 IP 131.151.1.59.7021 > 131.151.32.21.1799: UDP, length 62
  519  1999-11-11 21:47:57.613939 IP 131.151.32.21.1799 > 131.151.1.59.7021: UDP, length 1444
  520  1999-11-11 21:47:57.614059 IP 131.151.32.21.1799 > 131.151.1.59.7021: UDP, length 1444
  521  1999-11-11 21:47:57.615404 IP 131.151.1.59.7021 > 131.151.32.21.1799: UDP, length 62
  522  1999-11-11 21:47:57.615552 IP 131.151.32.21.1799 > 131.151.1.59.7021: UDP, length 1444
  523  1999-11-11 21:47:57.615674 IP 131.151.32.21.1799 > 131.151.1.59.7021: UDP, length 1444
  524  1999-11-11 21:47:57.618644 IP 131.151.1.59.7021 > 131.151.32.21.1799: UDP, length 62
  525  1999-11-11 21:47:57.623150 IP 131.151.1.59.7021 > 131.151.32.21.1799: UDP, length 62
  526  1999-11-11 21:47:57.623823 IP 131.151.32.21.1799 > 131.151.1.59.7021: UDP, length 1444
  527  1999-11-11 21:47:57.624002 IP 131.151.32.21.1799 > 131.151.1.59.7021: UDP, length 144
  528  1999-11-11 21:47:57.682626 IP 131.151.1.59.7021 > 131.151.32.21.1799: UDP, length 1444
  529  1999-11-11 21:47:57.683198 IP 131.151.1.59.7021 > 131.151.32.21.1799: UDP, length 764
  530  1999-11-11 21:47:57.683616 IP 131.151.32.21.1799 > 131.151.1.59.7021: UDP, length 66
  531  1999-11-11 21:47:57.683844 IP 131.151.32.21.1799 > 131.151.1.59.7021: UDP, length 60
  532  1999-11-11 21:47:57.689047 IP 131.151.1.59.7021 > 131.151.32.21.1799: UDP, length 1444
  533  1999-11-11 21:47:57.728006 IP 131.151.1.59.7021 > 131.151.32.21.1799: UDP, length 1444
  534  1999-11-11 21:47:57.728199 IP 131.151.32.21.1799 > 131.151.1.59.7021: UDP, length 66
  535  1999-11-11 21:47:57.771925 IP 131.151.1.59.7021 > 131.151.32.21.1799: UDP, length 1356
  536  1999-11-11 21:47:57.772583 IP 131.151.32.21.1799 > 131.151.1.59.7021: UDP, length 60
  537  1999-11-11 21:47:57.776216 IP 131.151.1.59.7021 > 131.151.32.21.1799: UDP, length 1444
  538  1999-11-11 21:47:57.778379 IP 131.151.1.59.7021 > 131.151.32.21.1799: UDP, length 1444
  539  1999-11-11 21:47:57.780051 IP 131.151.32.21.1799 > 131.151.1.59.7021: UDP, length 66
  540  1999-11-11 21:47:57.780898 IP 131.151.1.59.7021 > 131.151.32.21.1799: UDP, length 1356
  541  1999-11-11 21:47:57.781374 IP 131.151.32.21.1799 > 131.151.1.59.7021: UDP, length 60
  542  1999-11-11 21:47:57.786649 IP 131.151.1.59.7021 > 131.151.32.21.1799: UDP, length 1444
  543  1999-11-11 21:47:57.787702 IP 131.151.1.59.7021 > 131.151.32.21.1799: UDP, length 1444
  544  1999-11-11 21:47:57.788103 IP 131.151.32.21.1799 > 131.151.1.59.7021: UDP, length 66
  545  1999-11-11 21:47:57.789230 IP 131.151.1.59.7021 > 131.151.32.21.1799: UDP, length 1356
  546  1999-11-11 21:47:57.789699 IP 131.151.32.21.1799 > 131.151.1.59.7021: UDP, length 60
  547  1999-11-11 21:47:57.792483 IP 131.151.1.59.7021 > 131.151.32.21.1799: UDP, length 1444
  548  1999-11-11 21:47:57.794457 IP 131.151.1.59.7021 > 131.151.32.21.1799: UDP, length 1444
  549  1999-11-11 21:47:57.794696 IP 131.151.32.21.1799 > 131.151.1.59.7021: UDP, length 66
  550  1999-11-11 21:47:57.796695 IP 131.151.1.59.7021 > 131.151.32.21.1799: UDP, length 1356
  551  1999-11-11 21:47:57.797247 IP 131.151.32.21.1799 > 131.151.1.59.7021: UDP, length 60
  552  1999-11-11 21:47:57.800461 IP 131.151.1.59.7021 > 131.151.32.21.1799: UDP, length 1444
  553  1999-11-11 21:47:57.802376 IP 131.151.1.59.7021 > 131.151.32.21.1799: UDP, length 1444
  554  1999-11-11 21:47:57.802546 IP 131.151.32.21.1799 > 131.151.1.59.7021: UDP, length 66
  555  1999-11-11 21:47:57.803728 IP 131.151.1.59.7021 > 131.151.32.21.1799: UDP, length 1356
  556  1999-11-11 21:47:58.221671 IP 131.151.1.59.7021 > 131.151.32.21.1799: UDP, length 1356
  557  1999-11-11 21:47:58.221744 IP 131.151.32.21 > 131.151.1.59: ICMP 131.151.32.21 udp port 1799 unreachable, length 556
  558  1999-11-11 21:47:58.501236 IP 131.151.1.59.7003 > 131.151.32.21.1792:  rx data vldb reply get-entry-by-name "root.cell" numservers 6 servers 131.151.1.146 131.151.1.60 131.151.1.146 131.151.1.59 131.151.1.70 131.151.1.85 partitions a a a a a a rwvol 536870915 rovol 536870916 backup 536870917 (412)
  559  1999-11-11 21:47:58.501301 IP 131.151.32.21 > 131.151.1.59: ICMP 131.151.32.21 udp port 1792 unreachable, length 448
  560  1999-11-11 21:47:59.291588 IP 131.151.1.59.7021 > 131.151.32.21.1799: UDP, length 1356
  561  1999-11-11 21:47:59.291652 IP 131.151.32.21 > 131.151.1.59: ICMP 131.151.32.21 udp port 1799 unreachable, length 556
  562  1999-11-11 21:48:00.871744 IP 131.151.1.59.7021 > 131.151.32.21.1799: UDP, length 1356
  563  1999-11-11 21:48:00.871814 IP 131.151.32.21 > 131.151.1.59: ICMP 131.151.32.21 udp port 1799 unreachable, length 556
  564  1999-11-11 21:48:03.249685 IP 131.151.32.21.1799 > 131.151.1.60.88: kerberos v5
  565  1999-11-11 21:48:03.255469 IP 131.151.1.60.88 > 131.151.32.21.1799: kerberos v5
  566  1999-11-11 21:48:03.283149 IP 131.151.32.21.7001 > 131.151.1.60.7000:  rx data fs call fetch-status fid 536870913/4/3 (44)
  567  1999-11-11 21:48:03.284549 IP 131.151.1.60.7000 > 131.151.32.21.7001:  rx data fs reply fetch-status (148)
  568  1999-11-11 21:48:03.377621 IP 131.151.32.21.1799 > 131.151.1.60.88: kerberos
  569  1999-11-11 21:48:03.410404 IP 131.151.1.60.88 > 131.151.32.21.1799: kerberos
  570  1999-11-11 21:48:03.413361 IP 131.151.32.21.1799 > 131.151.1.60.4444: UDP, length 209
  571  1999-11-11 21:48:03.413986 IP 131.151.1.60 > 131.151.32.21: ICMP 131.151.1.60 udp port 4444 unreachable, length 92
  572  1999-11-11 21:48:03.414378 IP 131.151.32.21.1799 > 131.151.1.60.4444: UDP, length 209
  573  1999-11-11 21:48:03.481783 IP 131.151.1.59.7021 > 131.151.32.21.1799: UDP, length 1356
  574  1999-11-11 21:48:03.481851 IP 131.151.32.21 > 131.151.1.59: ICMP 131.151.32.21 udp port 1799 unreachable, length 556
  575  1999-11-11 21:48:03.678443 IP 131.151.32.21.7001 > 131.151.1.60.7000:  rx ack first 2 serial 1 reason delay (65)
  576  1999-11-11 21:48:04.409193 IP 131.151.32.21.1799 > 131.151.1.60.4444: UDP, length 209
  577  1999-11-11 21:48:04.409495 IP 131.151.1.60 > 131.151.32.21: ICMP 131.151.1.60 udp port 4444 unreachable, length 92
  578  1999-11-11 21:48:04.409893 IP 131.151.32.21.1799 > 131.151.1.146.4444: UDP, length 209
  579  1999-11-11 21:48:04.414101 IP 131.151.1.146.4444 > 131.151.32.21.1799: UDP, length 1266
  580  1999-11-11 21:48:04.426446 IP 131.151.32.21.1799 > 131.151.1.146.7002:  rx data pt call name-to-id "nneul" (292)
  581  1999-11-11 21:48:04.449366 IP 131.151.1.146.7002 > 131.151.32.21.1799:  rx data pt reply name-to-id ids: 5879 (36)
  582  1999-11-11 21:48:06.833046 IP 131.151.1.146.7002 > 131.151.32.21.1799:  rx data pt reply name-to-id ids: 5879 (36)
  583  1999-11-11 21:48:06.833100 IP 131.151.32.21 > 131.151.1.146: ICMP 131.151.32.21 udp port 1799 unreachable, length 72
  584  1999-11-11 21:48:08.131961 IP 131.151.1.59.7021 > 131.151.32.21.1799: UDP, length 1356
  585  1999-11-11 21:48:08.132033 IP 131.151.32.21 > 131.151.1.59: ICMP 131.151.32.21 udp port 1799 unreachable, length 556
  586  1999-11-11 21:48:09.492664 IP 131.151.1.146.7002 > 131.151.32.21.1799:  rx data pt reply name-to-id ids: 5879 (36)
  587  1999-11-11 21:48:09.492716 IP 131.151.32.21 > 131.151.1.146: ICMP 131.151.32.21 udp port 1799 unreachable, length 72
  588  1999-11-11 21:48:09.661704 IP 131.151.1.59.7003 > 131.151.32.21.1792:  rx data vldb reply get-entry-by-name "root.cell" numservers 6 servers 131.151.1.146 131.151.1.60 131.151.1.146 131.151.1.59 131.151.1.70 131.151.1.85 partitions a a a a a a rwvol 536870915 rovol 536870916 backup 536870917 (412)
  589  1999-11-11 21:48:09.661762 IP 131.151.32.21 > 131.151.1.59: ICMP 131.151.32.21 udp port 1792 unreachable, length 448
  590  1999-11-11 21:48:12.662982 IP 131.151.1.146.7002 > 131.151.32.21.1799:  rx data pt reply name-to-id ids: 5879 (36)
  591  1999-11-11 21:48:12.663034 IP 131.151.32.21 > 131.151.1.146: ICMP 131.151.32.21 udp port 1799 unreachable, length 72
  592  1999-11-11 21:48:16.863261 IP 131.151.1.146.7002 > 131.151.32.21.1799:  rx data pt reply name-to-id ids: 5879 (36)
  593  1999-11-11 21:48:16.863314 IP 131.151.32.21 > 131.151.1.146: ICMP 131.151.32.21 udp port 1799 unreachable, length 72
  594  1999-11-11 21:48:16.882406 IP 131.151.1.59.7021 > 131.151.32.21.1799: UDP, length 1356
  595  1999-11-11 21:48:16.882456 IP 131.151.32.21 > 131.151.1.59: ICMP 131.151.32.21 udp port 1799 unreachable, length 556
  596  1999-11-11 21:48:21.072280 IP 131.151.1.59.7003 > 131.151.32.21.1792:  rx data vldb reply get-entry-by-name "root.cell" numservers 6 servers 131.151.1.146 131.151.1.60 131.151.1.146 131.151.1.59 131.151.1.70 131.151.1.85 partitions a a a a a a rwvol 536870915 rovol 536870916 backup 536870917 (412)
  597  1999-11-11 21:48:21.072337 IP 131.151.32.21 > 131.151.1.59: ICMP 131.151.32.21 udp port 1792 unreachable, length 448
  598  1999-11-11 21:48:23.103590 IP 131.151.1.146.7002 > 131.151.32.21.1799:  rx data pt reply name-to-id ids: 5879 (36)
  599  1999-11-11 21:48:23.103644 IP 131.151.32.21 > 131.151.1.146: ICMP 131.151.32.21 udp port 1799 unreachable, length 72
  600  1999-11-11 21:48:25.892793 IP 131.151.1.59.7021 > 131.151.32.21.1799: UDP, length 1356
  601  1999-11-11 21:48:25.892866 IP 131.151.32.21 > 131.151.1.59: ICMP 131.151.32.21 udp port 1799 unreachable, length 556
