    1  00:13:30.597291 IP 15.184.1.76.40948 > 15.184.3.9.6343: sFlowv5, IPv4 agent 15.184.8.4, agent-id 2, length 1288
    2  00:13:30.675288 IP 15.184.1.195.4942 > 15.184.3.9.6343: sFlowv5, IPv4 agent 15.184.1.195, agent-id 1, length 1288
    3  00:13:30.676474 IP 15.184.1.195.4942 > 15.184.3.9.6343: sFlowv5, IPv4 agent 15.184.1.195, agent-id 1, length 1288
    4  00:13:30.677640 IP 15.184.1.195.4942 > 15.184.3.9.6343: sFlowv5, IPv4 agent 15.184.1.195, agent-id 1, length 1288
    5  00:13:30.678795 IP 15.184.1.195.4942 > 15.184.3.9.6343: sFlowv5, IPv4 agent 15.184.1.195, agent-id 1, length 1288
    6  00:13:30.815569 IP 15.184.1.195.4942 > 15.184.3.9.6343: sFlowv5, IPv4 agent 15.184.1.195, agent-id 1, length 1108
    7  00:13:30.898050 IP 15.184.1.76.40948 > 15.184.3.9.6343: sFlowv5, IPv4 agent 15.184.8.4, agent-id 2, length 208
    8  00:13:30.939511 IP 15.184.1.194.3099 > 15.184.3.9.6343: sFlowv5, IPv4 agent 15.184.1.194, agent-id 1, length 1288
    9  00:13:30.940681 IP 15.184.1.194.3099 > 15.184.3.9.6343: sFlowv5, IPv4 agent 15.184.1.194, agent-id 1, length 1288
   10  00:13:30.941851 IP 15.184.1.194.3099 > 15.184.3.9.6343: sFlowv5, IPv4 agent 15.184.1.194, agent-id 1, length 1288
   11  00:13:30.942980 IP 15.184.1.194.3099 > 15.184.3.9.6343: sFlowv5, IPv4 agent 15.184.1.194, agent-id 1, length 1288
   12  00:13:31.135140 IP 15.184.4.165.49408 > 15.184.3.9.6343: sFlowv5, IPv4 agent 15.184.4.165, agent-id 100, length 460
   13  00:13:31.467318 IP 168.87.240.2.40000 > 15.184.3.9.6343: sFlow version 327681 packet not supported
   14  00:13:31.475115 IP 15.184.3.1.41024 > 15.184.3.9.6343: sFlowv5, IPv4 agent 15.184.1.129, agent-id 2, length 1288
   15  00:13:31.635326 IP 15.184.3.1.41024 > 15.184.3.9.6343: sFlowv5, IPv4 agent 15.184.1.129, agent-id 2, length 568
   16  00:13:31.666518 IP 168.87.240.3.50340 > 15.184.3.9.6343: sFlowv5, IPv4 agent 15.184.1.129, agent-id 6, length 928
   17  00:13:31.850000 IP 15.184.1.194.3099 > 15.184.3.9.6343: sFlowv5, IPv4 agent 15.184.1.194, agent-id 1, length 1108
   18  00:13:32.153315 IP 15.184.13.248.50229 > 15.184.3.9.6343: sFlowv5, IPv4 agent 15.184.13.52, agent-id 100, length 424
   19  00:13:32.190770 IP 168.87.240.1.40000 > 15.184.3.9.6343: sFlow version 327681 packet not supported
   20  00:13:32.190783 IP 168.87.240.1.40000 > 15.184.3.9.6343: sFlow version 327682 packet not supported
   21  00:13:32.193594 IP 168.87.240.1.40000 > 15.184.3.9.6343: sFlow version 327681 packet not supported
   22  00:13:32.467378 IP 168.87.240.2.40000 > 15.184.3.9.6343: sFlow version 327682 packet not supported
   23  00:13:32.667301 IP 168.87.240.3.50340 > 15.184.3.9.6343: sFlowv5, IPv4 agent 15.184.1.129, agent-id 6, length 568
   24  00:13:32.675174 IP 15.184.1.195.4942 > 15.184.3.9.6343: sFlowv5, IPv4 agent 15.184.1.195, agent-id 1, length 1288
   25  00:13:32.676361 IP 15.184.1.195.4942 > 15.184.3.9.6343: sFlowv5, IPv4 agent 15.184.1.195, agent-id 1, length 1288
   26  00:13:32.677515 IP 15.184.1.195.4942 > 15.184.3.9.6343: sFlowv5, IPv4 agent 15.184.1.195, agent-id 1, length 1288
   27  00:13:32.678699 IP 15.184.1.195.4942 > 15.184.3.9.6343: sFlowv5, IPv4 agent 15.184.1.195, agent-id 1, length 1288
   28  00:13:32.815939 IP 15.184.1.195.4942 > 15.184.3.9.6343: sFlowv5, IPv4 agent 15.184.1.195, agent-id 1, length 1108
   29  00:13:32.939517 IP 15.184.1.194.3099 > 15.184.3.9.6343: sFlowv5, IPv4 agent 15.184.1.194, agent-id 1, length 1288
   30  00:13:32.940683 IP 15.184.1.194.3099 > 15.184.3.9.6343: sFlowv5, IPv4 agent 15.184.1.194, agent-id 1, length 1288
