    1  15:35:08.640523 IP (tos 0x0, ttl 128, id 376, offset 0, flags [DF], proto TCP (6), length 128)
    192.168.56.55.445 > 192.168.56.119.49199: Flags [P.], cksum 0x3e2f (incorrect -> 0x3d49), seq 4267808374:4267808462, ack 628292694, win 63102, length 88
    2  15:35:08.640906 IP (tos 0x0, ttl 128, id 632, offset 0, flags [DF], proto TCP (6), length 114)
    192.168.56.119.49199 > 192.168.56.55.445: Flags [P.], cksum 0x2437 (correct), seq 1:75, ack 88, win 254, length 74
    3  15:35:08.641033 IP (tos 0x0, ttl 128, id 377, offset 0, flags [DF], proto TCP (6), length 120)
    192.168.56.55.445 > 192.168.56.119.49199: Flags [P.], cksum 0xf1fb (incorrect -> 0x1559), seq 88:168, ack 75, win 63028, length 80
    4  [Error converting time] IP (tos 0x0, ttl 128, id 633, offset 0, flags [DF], proto TCP (6), length 116)
    192.168.56.119.49199 > 192.168.56.55.445: Flags [P.], cksum 0x2253 (incorrect -> 0x229b), seq 75:151, ack 168, win 253, length 76
