    1  17:47:06.889447 IP 192.168.88.8.30490 > 192.168.88.8.31490: SOMEIP, service 65535, event 256, len 64, client 0, session 0, pver 1, iver 1, msgtype NOTIFICATION, retcode E_OK

    2  17:47:08.944638 IP 192.168.88.8.31490 > 192.168.88.8.30490: SOMEIP, service 65535, event 256, len 48, client 0, session 0, pver 1, iver 1, msgtype NOTIFICATION, retcode E_OK

    3  17:47:10.935734 IP 192.168.88.8.30490 > 192.168.88.8.31490: SOMEIP, service 65535, event 256, len 48, client 0, session 0, pver 1, iver 1, msgtype NOTIFICATION, retcode E_OK

