    1  2018-12-23 10:50:09.891237 IP 202.108.87.165.62146 > 223.132.53.222.22: Flags [S], seq 4082233688, win 65535, options [mss 1460,nop,wscale 6,nop,nop,TS val 1948436430 ecr 0,sackOK,eol], length 0
    2  2018-12-23 10:50:09.916918 IP 223.132.53.222.22 > 202.108.87.165.62146: Flags [S.], seq 2455219014, ack 4082233689, win 28960, options [mss 1460,sackOK,nop,nop,nop,nop,nop,nop,nop,nop,nop,nop,nop,wscale 7], length 0
    3  2018-12-23 10:50:09.916972 IP 202.108.87.165.62146 > 223.132.53.222.22: Flags [.], ack 1, win 4096, length 0
    4  2018-12-23 10:50:09.917574 IP 202.108.87.165.62146 > 223.132.53.222.22: Flags [P.], seq 1:22, ack 1, win 4096, length 21: SSH: SSH-2.0-OpenSSH_7.8
    5  2018-12-23 10:50:09.944464 IP 223.132.53.222.22 > 202.108.87.165.62146: Flags [.], ack 22, win 227, options [nop,nop,nop,nop,nop,nop,nop,nop,nop,nop,nop,nop], length 0
    6  2018-12-23 10:50:09.945545 IP 223.132.53.222.22 > 202.108.87.165.62146: Flags [P.], seq 1:40, ack 22, win 227, options [nop,nop,nop,nop,nop,nop,nop,nop,nop,nop,nop,nop], length 39: SSH: SSH-2.0-OpenSSH_7.4p1 Debian-10+deb9u3
    7  2018-12-23 10:50:09.945615 IP 202.108.87.165.62146 > 223.132.53.222.22: Flags [.], ack 40, win 4095, length 0
    8  2018-12-23 10:50:09.946159 IP 202.108.87.165.62146 > 223.132.53.222.22: Flags [P.], seq 22:1414, ack 40, win 4096, length 1392
    9  2018-12-23 10:50:09.966036 IP 223.132.53.222.22 > 202.108.87.165.62146: Flags [P.], seq 40:536, ack 22, win 227, options [nop,nop,nop,nop,nop,nop,nop,nop,nop,nop,nop,nop], length 496
   10  2018-12-23 10:50:09.966200 IP 202.108.87.165.62146 > 223.132.53.222.22: Flags [.], ack 536, win 4088, length 0
   11  2018-12-23 10:50:10.004152 IP 223.132.53.222.22 > 202.108.87.165.62146: Flags [.], ack 1414, win 249, options [nop,nop,nop,nop,nop,nop,nop,nop,nop,nop,nop,nop], length 0
   12  2018-12-23 10:50:10.004222 IP 202.108.87.165.62146 > 223.132.53.222.22: Flags [P.], seq 1414:1462, ack 536, win 4096, length 48
   13  2018-12-23 10:50:10.093620 IP 223.132.53.222.22 > 202.108.87.165.62146: Flags [.], ack 1462, win 249, options [nop,nop,nop,nop,nop,nop,nop,nop,nop,nop,nop,nop], length 0
   14  2018-12-23 10:50:10.119320 IP 223.132.53.222.22 > 202.108.87.165.62146: Flags [P.], seq 536:1300, ack 1462, win 249, options [nop,nop,nop,nop,nop,nop,nop,nop,nop,nop,nop,nop], length 764
   15  2018-12-23 10:50:10.119391 IP 202.108.87.165.62146 > 223.132.53.222.22: Flags [.], ack 1300, win 4084, length 0
   16  2018-12-23 10:50:10.123330 IP 202.108.87.165.62146 > 223.132.53.222.22: Flags [P.], seq 1462:1478, ack 1300, win 4096, length 16
   17  2018-12-23 10:50:10.191751 IP 223.132.53.222.22 > 202.108.87.165.62146: Flags [.], ack 1478, win 249, options [nop,nop,nop,nop,nop,nop,nop,nop,nop,nop,nop,nop], length 0
   18  2018-12-23 10:50:10.191831 IP 202.108.87.165.62146 > 223.132.53.222.22: Flags [P.], seq 1478:1522, ack 1300, win 4096, length 44
   19  2018-12-23 10:50:10.206243 IP 223.132.53.222.22 > 202.108.87.165.62146: Flags [.], ack 1522, win 249, options [nop,nop,nop,nop,nop,nop,nop,nop,nop,nop,nop,nop], length 0
   20  2018-12-23 10:50:10.207499 IP 223.132.53.222.22 > 202.108.87.165.62146: Flags [P.], seq 1300:1344, ack 1522, win 249, options [nop,nop,nop,nop,nop,nop,nop,nop,nop,nop,nop,nop], length 44
   21  2018-12-23 10:50:10.207571 IP 202.108.87.165.62146 > 223.132.53.222.22: Flags [.], ack 1344, win 4095, length 0
   22  2018-12-23 10:50:10.207658 IP 202.108.87.165.62146 > 223.132.53.222.22: Flags [P.], seq 1522:1582, ack 1344, win 4096, length 60
   23  2018-12-23 10:50:10.222651 IP 223.132.53.222.22 > 202.108.87.165.62146: Flags [P.], seq 1344:1396, ack 1582, win 249, options [nop,nop,nop,nop,nop,nop,nop,nop,nop,nop,nop,nop], length 52
   24  2018-12-23 10:50:10.222724 IP 202.108.87.165.62146 > 223.132.53.222.22: Flags [.], ack 1396, win 4095, length 0
   25  2018-12-23 10:50:10.222884 IP 202.108.87.165.62146 > 223.132.53.222.22: Flags [P.], seq 1582:2714, ack 1396, win 4096, length 1132
   26  2018-12-23 10:50:10.240953 IP 223.132.53.222.22 > 202.108.87.165.62146: Flags [P.], seq 1396:2488, ack 2714, win 271, options [nop,nop,nop,nop,nop,nop,nop,nop,nop,nop,nop,nop], length 1092
   27  2018-12-23 10:50:10.241024 IP 202.108.87.165.62146 > 223.132.53.222.22: Flags [.], ack 2488, win 4078, length 0
   28  2018-12-23 10:50:10.319360 IP 202.108.87.165.62146 > 223.132.53.222.22: Flags [.], seq 2714:4174, ack 2488, win 4096, length 1460
   29  2018-12-23 10:50:10.319361 IP 202.108.87.165.62146 > 223.132.53.222.22: Flags [P.], seq 4174:4886, ack 2488, win 4096, length 712
   30  2018-12-23 10:50:10.335209 IP 223.132.53.222.22 > 202.108.87.165.62146: Flags [.], ack 4886, win 317, options [nop,nop,nop,nop,nop,nop,nop,nop,nop,nop,nop,nop], length 0
   31  2018-12-23 10:50:10.348975 IP 223.132.53.222.22 > 202.108.87.165.62146: Flags [P.], seq 2488:2516, ack 4886, win 317, options [nop,nop,nop,nop,nop,nop,nop,nop,nop,nop,nop,nop], length 28
   32  2018-12-23 10:50:10.349081 IP 202.108.87.165.62146 > 223.132.53.222.22: Flags [.], ack 2516, win 4095, length 0
   33  2018-12-23 10:50:10.349526 IP 202.108.87.165.62146 > 223.132.53.222.22: Flags [P.], seq 4886:4998, ack 2516, win 4096, length 112
   34  2018-12-23 10:50:10.363577 IP 223.132.53.222.22 > 202.108.87.165.62146: Flags [P.], seq 2516:2912, ack 4886, win 317, options [nop,nop,nop,nop,nop,nop,nop,nop,nop,nop,nop,nop], length 396
   35  2018-12-23 10:50:10.363713 IP 202.108.87.165.62146 > 223.132.53.222.22: Flags [.], ack 2912, win 4089, length 0
   36  2018-12-23 10:50:10.379854 IP 223.132.53.222.22 > 202.108.87.165.62146: Flags [P.], seq 2912:2956, ack 4998, win 317, options [nop,nop,nop,nop,nop,nop,nop,nop,nop,nop,nop,nop], length 44
   37  2018-12-23 10:50:10.379944 IP 202.108.87.165.62146 > 223.132.53.222.22: Flags [.], ack 2956, win 4095, length 0
   38  2018-12-23 10:50:10.380586 IP 202.108.87.165.62146 > 223.132.53.222.22: Flags [P.], seq 4998:5186, ack 2956, win 4096, length 188
   39  2018-12-23 10:50:10.397660 IP 223.132.53.222.22 > 202.108.87.165.62146: Flags [P.], seq 2956:3028, ack 5186, win 340, options [nop,nop,nop,nop,nop,nop,nop,nop,nop,nop,nop,nop], length 72
   40  2018-12-23 10:50:10.397833 IP 202.108.87.165.62146 > 223.132.53.222.22: Flags [.], ack 3028, win 4094, length 0
   41  2018-12-23 10:50:10.413471 IP 223.132.53.222.22 > 202.108.87.165.62146: Flags [P.], seq 3028:3136, ack 5186, win 340, options [nop,nop,nop,nop,nop,nop,nop,nop,nop,nop,nop,nop], length 108
   42  2018-12-23 10:50:10.413539 IP 202.108.87.165.62146 > 223.132.53.222.22: Flags [.], ack 3136, win 4094, length 0
   43  2018-12-23 10:50:10.416235 IP 223.132.53.222.22 > 202.108.87.165.62146: Flags [P.], seq 3136:3312, ack 5186, win 340, options [nop,nop,nop,nop,nop,nop,nop,nop,nop,nop,nop,nop], length 176
   44  2018-12-23 10:50:10.416295 IP 202.108.87.165.62146 > 223.132.53.222.22: Flags [.], ack 3312, win 4093, length 0
   45  2018-12-23 10:50:10.416417 IP 202.108.87.165.62146 > 223.132.53.222.22: Flags [P.], seq 5186:5222, ack 3312, win 4096, length 36
   46  2018-12-23 10:50:10.416417 IP 202.108.87.165.62146 > 223.132.53.222.22: Flags [P.], seq 5222:5282, ack 3312, win 4096, length 60
   47  2018-12-23 10:50:10.417744 IP 202.108.87.165.62146 > 223.132.53.222.22: Flags [F.], seq 5282, ack 3312, win 4096, length 0
   48  2018-12-23 10:50:10.446501 IP 223.132.53.222.22 > 202.108.87.165.62146: Flags [.], ack 5186, win 340, options [nop,nop,nop,nop,nop,nop,nop,nop,nop,nop,nop,nop,nop,nop,sack 1 {5282:5283}], length 0
   49  2018-12-23 10:50:10.446622 IP 202.108.87.165.62146 > 223.132.53.222.22: Flags [FP.], seq 5186:5282, ack 3312, win 4096, length 96
   50  2018-12-23 10:50:10.456121 IP 223.132.53.222.22 > 202.108.87.165.62146: Flags [.], ack 5222, win 340, options [nop,nop,nop,nop,nop,nop,nop,nop,nop,nop,nop,nop,nop,nop,sack 1 {5282:5283}], length 0
   51  2018-12-23 10:50:10.456127 IP 223.132.53.222.22 > 202.108.87.165.62146: Flags [.], ack 5283, win 340, options [nop,nop,nop,nop,nop,nop,nop,nop,nop,nop,nop,nop], length 0
   52  2018-12-23 10:50:10.456128 IP 223.132.53.222.22 > 202.108.87.165.62146: Flags [F.], seq 3312, ack 5283, win 340, options [nop,nop,nop,nop,nop,nop,nop,nop,nop,nop,nop,nop], length 0
   53  2018-12-23 10:50:10.456384 IP 202.108.87.165.62146 > 223.132.53.222.22: Flags [.], ack 3313, win 4096, length 0
   54  2018-12-23 10:50:10.466614 IP 223.132.53.222.22 > 202.108.87.165.62146: Flags [.], ack 5283, win 340, options [nop,nop,nop,nop,nop,nop,nop,nop,nop,nop,nop,nop,nop,nop,sack 1 {5186:5283}], length 0
