    1  16:26:20.467968 IP 192.168.0.100.13047 > 3.3.3.3.13054: Flags [S], seq 218476388, win 1400, options [exp-tfo cookiereq], length 0
    2  16:26:20.468329 IP 9.9.9.9.13047 > 3.3.3.3.13054: Flags [S], seq 218476388, win 1400, options [mss 1460,exp-tfo cookiereq], length 0
    3  16:26:20.475806 IP 3.3.3.3.13054 > 9.9.9.9.13047: Flags [S.], seq 4035392501, ack 218476389, win 1400, options [exp-tfo cookie 090909090000,nop,nop], length 0
    4  16:26:20.476005 IP 3.3.3.3.13054 > 192.168.0.100.13047: Flags [S.], seq 4035392501, ack 218476389, win 1400, options [mss 1500,exp-tfo cookie 090909090000,nop,nop], length 0
    5  16:26:20.479248 IP 192.168.0.100.13047 > 3.3.3.3.13054: Flags [.], ack 1, win 1400, length 0
    6  16:26:20.479407 IP 9.9.9.9.13047 > 3.3.3.3.13054: Flags [.], ack 1, win 1400, length 0
    7  16:26:20.482134 IP 192.168.0.100.13047 > 3.3.3.3.13054: Flags [F.], seq 1, ack 1, win 1400, length 0
    8  16:26:20.482303 IP 9.9.9.9.13047 > 3.3.3.3.13054: Flags [F.], seq 1, ack 1, win 1400, length 0
    9  16:26:20.488758 IP 3.3.3.3.13054 > 9.9.9.9.13047: Flags [F.], seq 1, ack 2, win 1400, length 0
   10  16:26:20.488887 IP 3.3.3.3.13054 > 192.168.0.100.13047: Flags [F.], seq 1, ack 2, win 1400, length 0
   11  16:26:20.491543 IP 192.168.0.100.13047 > 3.3.3.3.13054: Flags [.], ack 2, win 1400, length 0
   12  16:26:20.491685 IP 9.9.9.9.13047 > 3.3.3.3.13054: Flags [.], ack 2, win 1400, length 0
   13  16:26:20.586342 IP 192.168.0.100.13048 > 3.3.3.3.13054: Flags [S], seq 936732547:936732551, win 1400, options [exp-tfo cookie 090909090000,nop,nop], length 4
   14  16:26:30.591516 IP 192.168.0.100.13048 > 3.3.3.3.13054: Flags [F.], seq 936732552, ack 0, win 1400, length 0
