    1  2014-03-05 21:55:06.745865 IP 10.0.0.91 > 224.0.0.18: VRRPv2, Advertisement, vrid 42, prio 191, authtype simple, intvl 10s, length 28
    2  2014-03-05 21:55:06.749784 IP 10.0.0.91 > 224.0.0.18: VRRPv2, Advertisement, vrid 43, prio 191, authtype none, intvl 10s, length 20
    3  2014-03-05 21:55:09.074730 IP 10.0.0.91 > 224.0.0.18: VRRPv3, Advertisement, vrid 44, prio 191, intvl 1000cs, length 16
    4  2014-03-05 21:55:16.753372 IP 10.0.0.91 > 224.0.0.18: VRRPv2, Advertisement, vrid 42, prio 191, authtype simple, intvl 10s, length 28
    5  2014-03-05 21:55:16.753436 IP 10.0.0.91 > 224.0.0.18: VRRPv2, Advertisement, vrid 43, prio 191, authtype none, intvl 10s, length 20
    6  2014-03-05 21:55:19.064377 IP6 fe80::d6ca:6dff:fe66:cf60 > ff02::12: VRRPv3, Advertisement, vrid 45, prio 191, intvl 1000cs, length 40
    7  2014-03-05 21:55:19.064509 IP6 fe80::d6ca:6dff:fe66:cf60 > ff02::12: VRRPv3, Advertisement, vrid 46, prio 191, intvl 1000cs, length 88
    8  2014-03-05 21:55:19.074681 IP 10.0.0.91 > 224.0.0.18: VRRPv3, Advertisement, vrid 44, prio 191, intvl 1000cs, length 16
    9  2014-03-05 21:55:26.751857 IP 10.0.0.91 > 224.0.0.18: VRRPv2, Advertisement, vrid 42, prio 191, authtype simple, intvl 10s, length 28
   10  2014-03-05 21:55:26.751923 IP 10.0.0.91 > 224.0.0.18: VRRPv2, Advertisement, vrid 43, prio 191, authtype none, intvl 10s, length 20
   11  2014-03-05 21:55:29.068063 IP6 fe80::d6ca:6dff:fe66:cf60 > ff02::12: VRRPv3, Advertisement, vrid 46, prio 191, intvl 1000cs, length 88
   12  2014-03-05 21:55:29.068132 IP6 fe80::d6ca:6dff:fe66:cf60 > ff02::12: VRRPv3, Advertisement, vrid 45, prio 191, intvl 1000cs, length 40
   13  2014-03-05 21:55:29.078313 IP 10.0.0.91 > 224.0.0.18: VRRPv3, Advertisement, vrid 44, prio 191, intvl 1000cs, length 16
   14  2014-03-05 21:55:34.773565 IP 10.0.0.92 > 224.0.0.18: VRRPv2, Advertisement, vrid 42, prio 192, authtype simple, intvl 10s, length 28
   15  2014-03-05 21:55:34.783698 IP 10.0.0.92 > 224.0.0.18: VRRPv2, Advertisement, vrid 43, prio 192, authtype none, intvl 10s, length 20
   16  2014-03-05 21:55:37.044216 IP 10.0.0.92 > 224.0.0.18: VRRPv3, Advertisement, vrid 44, prio 192, intvl 1000cs, length 16
   17  2014-03-05 21:55:39.070934 IP6 fe80::d6ca:6dff:fe66:cf60 > ff02::12: VRRPv3, Advertisement, vrid 45, prio 191, intvl 1000cs, length 40
   18  2014-03-05 21:55:39.071010 IP6 fe80::d6ca:6dff:fe66:cf60 > ff02::12: VRRPv3, Advertisement, vrid 46, prio 191, intvl 1000cs, length 88
   19  2014-03-05 21:55:44.778957 IP 10.0.0.92 > 224.0.0.18: VRRPv2, Advertisement, vrid 42, prio 192, authtype simple, intvl 10s, length 28
   20  2014-03-05 21:55:44.789130 IP 10.0.0.92 > 224.0.0.18: VRRPv2, Advertisement, vrid 43, prio 192, authtype none, intvl 10s, length 20
   21  2014-03-05 21:55:47.046947 IP 10.0.0.92 > 224.0.0.18: VRRPv3, Advertisement, vrid 44, prio 192, intvl 1000cs, length 16
   22  2014-03-05 21:55:47.047012 IP6 fe80::d6ca:6dff:fe72:b1da > ff02::12: VRRPv3, Advertisement, vrid 46, prio 192, intvl 1000cs, length 88
   23  2014-03-05 21:55:47.047042 IP6 fe80::d6ca:6dff:fe72:b1da > ff02::12: VRRPv3, Advertisement, vrid 45, prio 192, intvl 1000cs, length 40
   24  2014-03-05 21:55:54.780328 IP 10.0.0.92 > 224.0.0.18: VRRPv2, Advertisement, vrid 42, prio 192, authtype simple, intvl 10s, length 28
   25  2014-03-05 21:55:54.780387 IP 10.0.0.92 > 224.0.0.18: VRRPv2, Advertisement, vrid 43, prio 192, authtype none, intvl 10s, length 20
   26  2014-03-05 21:55:57.042694 IP 10.0.0.92 > 224.0.0.18: VRRPv3, Advertisement, vrid 44, prio 192, intvl 1000cs, length 16
   27  2014-03-05 21:55:57.042754 IP6 fe80::d6ca:6dff:fe72:b1da > ff02::12: VRRPv3, Advertisement, vrid 45, prio 192, intvl 1000cs, length 40
   28  2014-03-05 21:55:57.042778 IP6 fe80::d6ca:6dff:fe72:b1da > ff02::12: VRRPv3, Advertisement, vrid 46, prio 192, intvl 1000cs, length 88
   29  2014-03-05 21:56:04.643506 IP 10.0.0.93 > 224.0.0.18: VRRPv2, Advertisement, vrid 42, prio 193, authtype simple, intvl 10s, length 28
   30  2014-03-05 21:56:04.649862 IP 10.0.0.93 > 224.0.0.18: VRRPv2, Advertisement, vrid 43, prio 193, authtype none, intvl 10s, length 20
   31  2014-03-05 21:56:06.862122 IP 10.0.0.93 > 224.0.0.18: VRRPv3, Advertisement, vrid 44, prio 193, intvl 1000cs, length 16
   32  2014-03-05 21:56:07.046980 IP6 fe80::d6ca:6dff:fe72:b1da > ff02::12: VRRPv3, Advertisement, vrid 46, prio 192, intvl 1000cs, length 88
   33  2014-03-05 21:56:07.047062 IP6 fe80::d6ca:6dff:fe72:b1da > ff02::12: VRRPv3, Advertisement, vrid 45, prio 192, intvl 1000cs, length 40
   34  2014-03-05 21:56:14.647902 IP 10.0.0.93 > 224.0.0.18: VRRPv2, Advertisement, vrid 42, prio 193, authtype simple, intvl 10s, length 28
   35  2014-03-05 21:56:14.647963 IP 10.0.0.93 > 224.0.0.18: VRRPv2, Advertisement, vrid 43, prio 193, authtype none, intvl 10s, length 20
   36  2014-03-05 21:56:16.860142 IP6 fe80::d6ca:6dff:fe66:cf65 > ff02::12: VRRPv3, Advertisement, vrid 46, prio 193, intvl 1000cs, length 88
   37  2014-03-05 21:56:16.860206 IP6 fe80::d6ca:6dff:fe66:cf65 > ff02::12: VRRPv3, Advertisement, vrid 45, prio 193, intvl 1000cs, length 40
   38  2014-03-05 21:56:16.860214 IP 10.0.0.93 > 224.0.0.18: VRRPv3, Advertisement, vrid 44, prio 193, intvl 1000cs, length 16
   39  2014-03-05 21:56:24.657679 IP 10.0.0.93 > 224.0.0.18: VRRPv2, Advertisement, vrid 42, prio 193, authtype simple, intvl 10s, length 28
   40  2014-03-05 21:56:24.657741 IP 10.0.0.93 > 224.0.0.18: VRRPv2, Advertisement, vrid 43, prio 193, authtype none, intvl 10s, length 20
   41  2014-03-05 21:56:26.859969 IP6 fe80::d6ca:6dff:fe66:cf65 > ff02::12: VRRPv3, Advertisement, vrid 46, prio 193, intvl 1000cs, length 88
   42  2014-03-05 21:56:26.860037 IP6 fe80::d6ca:6dff:fe66:cf65 > ff02::12: VRRPv3, Advertisement, vrid 45, prio 193, intvl 1000cs, length 40
   43  2014-03-05 21:56:26.860045 IP 10.0.0.93 > 224.0.0.18: VRRPv3, Advertisement, vrid 44, prio 193, intvl 1000cs, length 16
   44  2014-03-05 21:56:34.667398 IP 10.0.0.93 > 224.0.0.18: VRRPv2, Advertisement, vrid 43, prio 193, authtype none, intvl 10s, length 20
   45  2014-03-05 21:56:34.667454 IP 10.0.0.93 > 224.0.0.18: VRRPv2, Advertisement, vrid 42, prio 193, authtype simple, intvl 10s, length 28
   46  2014-03-05 21:56:36.859720 IP6 fe80::d6ca:6dff:fe66:cf65 > ff02::12: VRRPv3, Advertisement, vrid 46, prio 193, intvl 1000cs, length 88
   47  2014-03-05 21:56:36.859786 IP6 fe80::d6ca:6dff:fe66:cf65 > ff02::12: VRRPv3, Advertisement, vrid 45, prio 193, intvl 1000cs, length 40
   48  2014-03-05 21:56:36.859795 IP 10.0.0.93 > 224.0.0.18: VRRPv3, Advertisement, vrid 44, prio 193, intvl 1000cs, length 16
   49  2014-03-05 21:56:41.365005 IP 10.0.0.94 > 224.0.0.18: VRRPv2, Advertisement, vrid 42, prio 194, authtype simple, intvl 10s, length 28
   50  2014-03-05 21:56:41.367020 IP 10.0.0.94 > 224.0.0.18: VRRPv2, Advertisement, vrid 43, prio 194, authtype none, intvl 10s, length 20
   51  2014-03-05 21:56:43.571121 IP 10.0.0.94 > 224.0.0.18: VRRPv3, Advertisement, vrid 44, prio 194, intvl 1000cs, length 16
   52  2014-03-05 21:56:46.860576 IP6 fe80::d6ca:6dff:fe66:cf65 > ff02::12: VRRPv3, Advertisement, vrid 46, prio 193, intvl 1000cs, length 88
   53  2014-03-05 21:56:46.860627 IP6 fe80::d6ca:6dff:fe66:cf65 > ff02::12: VRRPv3, Advertisement, vrid 45, prio 193, intvl 1000cs, length 40
   54  2014-03-05 21:56:51.366475 IP 10.0.0.94 > 224.0.0.18: VRRPv2, Advertisement, vrid 42, prio 194, authtype simple, intvl 10s, length 28
   55  2014-03-05 21:56:51.366535 IP 10.0.0.94 > 224.0.0.18: VRRPv2, Advertisement, vrid 43, prio 194, authtype none, intvl 10s, length 20
   56  2014-03-05 21:56:53.568732 IP6 fe80::d6ca:6dff:fe65:d45c > ff02::12: VRRPv3, Advertisement, vrid 45, prio 194, intvl 1000cs, length 40
   57  2014-03-05 21:56:53.568785 IP 10.0.0.94 > 224.0.0.18: VRRPv3, Advertisement, vrid 44, prio 194, intvl 1000cs, length 16
   58  2014-03-05 21:56:53.589188 IP6 fe80::d6ca:6dff:fe65:d45c > ff02::12: VRRPv3, Advertisement, vrid 46, prio 194, intvl 1000cs, length 88
   59  2014-03-05 21:57:01.373895 IP 10.0.0.94 > 224.0.0.18: VRRPv2, Advertisement, vrid 42, prio 194, authtype simple, intvl 10s, length 28
   60  2014-03-05 21:57:01.373951 IP 10.0.0.94 > 224.0.0.18: VRRPv2, Advertisement, vrid 43, prio 194, authtype none, intvl 10s, length 20
   61  2014-03-05 21:57:03.566197 IP 10.0.0.94 > 224.0.0.18: VRRPv3, Advertisement, vrid 44, prio 194, intvl 1000cs, length 16
   62  2014-03-05 21:57:03.566241 IP6 fe80::d6ca:6dff:fe65:d45c > ff02::12: VRRPv3, Advertisement, vrid 45, prio 194, intvl 1000cs, length 40
   63  2014-03-05 21:57:03.586537 IP6 fe80::d6ca:6dff:fe65:d45c > ff02::12: VRRPv3, Advertisement, vrid 46, prio 194, intvl 1000cs, length 88
   64  2014-03-05 21:57:11.381178 IP 10.0.0.94 > 224.0.0.18: VRRPv2, Advertisement, vrid 42, prio 194, authtype simple, intvl 10s, length 28
   65  2014-03-05 21:57:11.381238 IP 10.0.0.94 > 224.0.0.18: VRRPv2, Advertisement, vrid 43, prio 194, authtype none, intvl 10s, length 20
   66  2014-03-05 21:57:13.563581 IP6 fe80::d6ca:6dff:fe65:d45c > ff02::12: VRRPv3, Advertisement, vrid 45, prio 194, intvl 1000cs, length 40
   67  2014-03-05 21:57:13.563652 IP 10.0.0.94 > 224.0.0.18: VRRPv3, Advertisement, vrid 44, prio 194, intvl 1000cs, length 16
   68  2014-03-05 21:57:13.583750 IP6 fe80::d6ca:6dff:fe65:d45c > ff02::12: VRRPv3, Advertisement, vrid 46, prio 194, intvl 1000cs, length 88
   69  2014-03-05 21:57:21.390823 IP 10.0.0.94 > 224.0.0.18: VRRPv2, Advertisement, vrid 42, prio 194, authtype simple, intvl 10s, length 28
   70  2014-03-05 21:57:21.390887 IP 10.0.0.94 > 224.0.0.18: VRRPv2, Advertisement, vrid 43, prio 194, authtype none, intvl 10s, length 20
   71  2014-03-05 21:57:23.563280 IP 10.0.0.94 > 224.0.0.18: VRRPv3, Advertisement, vrid 44, prio 194, intvl 1000cs, length 16
   72  2014-03-05 21:57:23.563341 IP6 fe80::d6ca:6dff:fe65:d45c > ff02::12: VRRPv3, Advertisement, vrid 45, prio 194, intvl 1000cs, length 40
   73  2014-03-05 21:57:23.583426 IP6 fe80::d6ca:6dff:fe65:d45c > ff02::12: VRRPv3, Advertisement, vrid 46, prio 194, intvl 1000cs, length 88
   74  2014-03-05 21:57:30.198637 IP 10.0.0.95 > 224.0.0.18: VRRPv2, Advertisement, vrid 42, prio 195, authtype simple, intvl 10s, length 28
   75  2014-03-05 21:57:30.202588 IP 10.0.0.95 > 224.0.0.18: VRRPv2, Advertisement, vrid 43, prio 195, authtype none, intvl 10s, length 20
   76  2014-03-05 21:57:32.373402 IP 10.0.0.95 > 224.0.0.18: VRRPv3, Advertisement, vrid 44, prio 195, intvl 1000cs, length 16
   77  2014-03-05 21:57:33.567816 IP6 fe80::d6ca:6dff:fe65:d45c > ff02::12: VRRPv3, Advertisement, vrid 45, prio 194, intvl 1000cs, length 40
   78  2014-03-05 21:57:33.588127 IP6 fe80::d6ca:6dff:fe65:d45c > ff02::12: VRRPv3, Advertisement, vrid 46, prio 194, intvl 1000cs, length 88
   79  2014-03-05 21:57:40.205279 IP 10.0.0.95 > 224.0.0.18: VRRPv2, Advertisement, vrid 42, prio 195, authtype simple, intvl 10s, length 28
   80  2014-03-05 21:57:40.205343 IP 10.0.0.95 > 224.0.0.18: VRRPv2, Advertisement, vrid 43, prio 195, authtype none, intvl 10s, length 20
   81  2014-03-05 21:57:42.367695 IP 10.0.0.95 > 224.0.0.18: VRRPv3, Advertisement, vrid 44, prio 195, intvl 1000cs, length 16
   82  2014-03-05 21:57:42.367760 IP6 fe80::d6ca:6dff:fe65:d46b > ff02::12: VRRPv3, Advertisement, vrid 45, prio 195, intvl 1000cs, length 40
   83  2014-03-05 21:57:42.377819 IP6 fe80::d6ca:6dff:fe65:d46b > ff02::12: VRRPv3, Advertisement, vrid 46, prio 195, intvl 1000cs, length 88
   84  2014-03-05 21:57:50.215046 IP 10.0.0.95 > 224.0.0.18: VRRPv2, Advertisement, vrid 42, prio 195, authtype simple, intvl 10s, length 28
   85  2014-03-05 21:57:50.215112 IP 10.0.0.95 > 224.0.0.18: VRRPv2, Advertisement, vrid 43, prio 195, authtype none, intvl 10s, length 20
   86  2014-03-05 21:57:52.367351 IP6 fe80::d6ca:6dff:fe65:d46b > ff02::12: VRRPv3, Advertisement, vrid 45, prio 195, intvl 1000cs, length 40
   87  2014-03-05 21:57:52.367427 IP 10.0.0.95 > 224.0.0.18: VRRPv3, Advertisement, vrid 44, prio 195, intvl 1000cs, length 16
   88  2014-03-05 21:57:52.377456 IP6 fe80::d6ca:6dff:fe65:d46b > ff02::12: VRRPv3, Advertisement, vrid 46, prio 195, intvl 1000cs, length 88
   89  2014-03-05 21:58:00.224875 IP 10.0.0.95 > 224.0.0.18: VRRPv2, Advertisement, vrid 42, prio 195, authtype simple, intvl 10s, length 28
   90  2014-03-05 21:58:00.224935 IP 10.0.0.95 > 224.0.0.18: VRRPv2, Advertisement, vrid 43, prio 195, authtype none, intvl 10s, length 20
   91  2014-03-05 21:58:02.367084 IP 10.0.0.95 > 224.0.0.18: VRRPv3, Advertisement, vrid 44, prio 195, intvl 1000cs, length 16
   92  2014-03-05 21:58:02.367144 IP6 fe80::d6ca:6dff:fe65:d46b > ff02::12: VRRPv3, Advertisement, vrid 45, prio 195, intvl 1000cs, length 40
   93  2014-03-05 21:58:02.377445 IP6 fe80::d6ca:6dff:fe65:d46b > ff02::12: VRRPv3, Advertisement, vrid 46, prio 195, intvl 1000cs, length 88
   94  2014-03-05 21:58:04.461974 IP 10.0.0.96 > 224.0.0.18: VRRPv2, Advertisement, vrid 42, prio 196, authtype simple, intvl 10s, length 28
   95  2014-03-05 21:58:04.466033 IP 10.0.0.96 > 224.0.0.18: VRRPv2, Advertisement, vrid 43, prio 196, authtype none, intvl 10s, length 20
   96  2014-03-05 21:58:06.599034 IP 10.0.0.96 > 224.0.0.18: VRRPv3, Advertisement, vrid 44, prio 196, intvl 1000cs, length 16
   97  2014-03-05 21:58:12.374622 IP6 fe80::d6ca:6dff:fe65:d46b > ff02::12: VRRPv3, Advertisement, vrid 45, prio 195, intvl 1000cs, length 40
   98  2014-03-05 21:58:12.374697 IP6 fe80::d6ca:6dff:fe65:d46b > ff02::12: VRRPv3, Advertisement, vrid 46, prio 195, intvl 1000cs, length 88
   99  2014-03-05 21:58:14.458404 IP 10.0.0.96 > 224.0.0.18: VRRPv2, Advertisement, vrid 42, prio 196, authtype simple, intvl 10s, length 28
  100  2014-03-05 21:58:14.468662 IP 10.0.0.96 > 224.0.0.18: VRRPv2, Advertisement, vrid 43, prio 196, authtype none, intvl 10s, length 20
  101  2014-03-05 21:58:16.590792 IP6 fe80::d6ca:6dff:fe72:b1e4 > ff02::12: VRRPv3, Advertisement, vrid 45, prio 196, intvl 1000cs, length 40
  102  2014-03-05 21:58:16.600962 IP 10.0.0.96 > 224.0.0.18: VRRPv3, Advertisement, vrid 44, prio 196, intvl 1000cs, length 16
  103  2014-03-05 21:58:16.611202 IP6 fe80::d6ca:6dff:fe72:b1e4 > ff02::12: VRRPv3, Advertisement, vrid 46, prio 196, intvl 1000cs, length 88
  104  2014-03-05 21:58:24.464854 IP 10.0.0.96 > 224.0.0.18: VRRPv2, Advertisement, vrid 42, prio 196, authtype simple, intvl 10s, length 28
  105  2014-03-05 21:58:24.464916 IP 10.0.0.96 > 224.0.0.18: VRRPv2, Advertisement, vrid 43, prio 196, authtype none, intvl 10s, length 20
  106  2014-03-05 21:58:26.587122 IP6 fe80::d6ca:6dff:fe72:b1e4 > ff02::12: VRRPv3, Advertisement, vrid 45, prio 196, intvl 1000cs, length 40
  107  2014-03-05 21:58:26.597278 IP 10.0.0.96 > 224.0.0.18: VRRPv3, Advertisement, vrid 44, prio 196, intvl 1000cs, length 16
  108  2014-03-05 21:58:26.607415 IP6 fe80::d6ca:6dff:fe72:b1e4 > ff02::12: VRRPv3, Advertisement, vrid 46, prio 196, intvl 1000cs, length 88
  109  2014-03-05 21:58:34.474628 IP 10.0.0.96 > 224.0.0.18: VRRPv2, Advertisement, vrid 43, prio 196, authtype none, intvl 10s, length 20
  110  2014-03-05 21:58:34.474688 IP 10.0.0.96 > 224.0.0.18: VRRPv2, Advertisement, vrid 42, prio 196, authtype simple, intvl 10s, length 28
  111  2014-03-05 21:58:36.586887 IP6 fe80::d6ca:6dff:fe72:b1e4 > ff02::12: VRRPv3, Advertisement, vrid 45, prio 196, intvl 1000cs, length 40
  112  2014-03-05 21:58:36.597038 IP 10.0.0.96 > 224.0.0.18: VRRPv3, Advertisement, vrid 44, prio 196, intvl 1000cs, length 16
  113  2014-03-05 21:58:36.607177 IP6 fe80::d6ca:6dff:fe72:b1e4 > ff02::12: VRRPv3, Advertisement, vrid 46, prio 196, intvl 1000cs, length 88
  114  2014-03-05 21:58:44.484468 IP 10.0.0.96 > 224.0.0.18: VRRPv2, Advertisement, vrid 42, prio 196, authtype simple, intvl 10s, length 28
  115  2014-03-05 21:58:44.484534 IP 10.0.0.96 > 224.0.0.18: VRRPv2, Advertisement, vrid 43, prio 196, authtype none, intvl 10s, length 20
  116  2014-03-05 21:58:46.585913 IP6 fe80::d6ca:6dff:fe72:b1e4 > ff02::12: VRRPv3, Advertisement, vrid 45, prio 196, intvl 1000cs, length 40
  117  2014-03-05 21:58:46.596106 IP 10.0.0.96 > 224.0.0.18: VRRPv3, Advertisement, vrid 44, prio 196, intvl 1000cs, length 16
  118  2014-03-05 21:58:46.606276 IP6 fe80::d6ca:6dff:fe72:b1e4 > ff02::12: VRRPv3, Advertisement, vrid 46, prio 196, intvl 1000cs, length 88
  119  2014-03-05 21:58:49.932515 IP 10.0.0.97 > 224.0.0.18: VRRPv2, Advertisement, vrid 42, prio 197, authtype simple, intvl 10s, length 28
  120  2014-03-05 21:58:49.935030 IP 10.0.0.97 > 224.0.0.18: VRRPv2, Advertisement, vrid 43, prio 197, authtype none, intvl 10s, length 20
  121  2014-03-05 21:58:52.025571 IP 10.0.0.97 > 224.0.0.18: VRRPv3, Advertisement, vrid 44, prio 197, intvl 1000cs, length 16
  122  2014-03-05 21:58:56.594126 IP6 fe80::d6ca:6dff:fe72:b1e4 > ff02::12: VRRPv3, Advertisement, vrid 45, prio 196, intvl 1000cs, length 40
  123  2014-03-05 21:58:56.604316 IP6 fe80::d6ca:6dff:fe72:b1e4 > ff02::12: VRRPv3, Advertisement, vrid 46, prio 196, intvl 1000cs, length 88
  124  2014-03-05 21:58:59.938046 IP 10.0.0.97 > 224.0.0.18: VRRPv2, Advertisement, vrid 42, prio 197, authtype simple, intvl 10s, length 28
  125  2014-03-05 21:58:59.938096 IP 10.0.0.97 > 224.0.0.18: VRRPv2, Advertisement, vrid 43, prio 197, authtype none, intvl 10s, length 20
  126  2014-03-05 21:59:02.020356 IP6 fe80::20c:42ff:fe5e:c2dc > ff02::12: VRRPv3, Advertisement, vrid 45, prio 197, intvl 1000cs, length 40
  127  2014-03-05 21:59:02.030572 IP 10.0.0.97 > 224.0.0.18: VRRPv3, Advertisement, vrid 44, prio 197, intvl 1000cs, length 16
  128  2014-03-05 21:59:02.040691 IP6 fe80::20c:42ff:fe5e:c2dc > ff02::12: VRRPv3, Advertisement, vrid 46, prio 197, intvl 1000cs, length 88
  129  2014-03-05 21:59:09.941288 IP 10.0.0.97 > 224.0.0.18: VRRPv2, Advertisement, vrid 43, prio 197, authtype none, intvl 10s, length 20
  130  2014-03-05 21:59:09.941346 IP 10.0.0.97 > 224.0.0.18: VRRPv2, Advertisement, vrid 42, prio 197, authtype simple, intvl 10s, length 28
  131  2014-03-05 21:59:12.013545 IP6 fe80::20c:42ff:fe5e:c2dc > ff02::12: VRRPv3, Advertisement, vrid 45, prio 197, intvl 1000cs, length 40
  132  2014-03-05 21:59:12.023710 IP 10.0.0.97 > 224.0.0.18: VRRPv3, Advertisement, vrid 44, prio 197, intvl 1000cs, length 16
  133  2014-03-05 21:59:12.033831 IP6 fe80::20c:42ff:fe5e:c2dc > ff02::12: VRRPv3, Advertisement, vrid 46, prio 197, intvl 1000cs, length 88
  134  2014-03-05 21:59:19.951291 IP 10.0.0.97 > 224.0.0.18: VRRPv2, Advertisement, vrid 42, prio 197, authtype simple, intvl 10s, length 28
  135  2014-03-05 21:59:19.951350 IP 10.0.0.97 > 224.0.0.18: VRRPv2, Advertisement, vrid 43, prio 197, authtype none, intvl 10s, length 20
  136  2014-03-05 21:59:22.013537 IP6 fe80::20c:42ff:fe5e:c2dc > ff02::12: VRRPv3, Advertisement, vrid 45, prio 197, intvl 1000cs, length 40
  137  2014-03-05 21:59:22.023644 IP 10.0.0.97 > 224.0.0.18: VRRPv3, Advertisement, vrid 44, prio 197, intvl 1000cs, length 16
  138  2014-03-05 21:59:22.033781 IP6 fe80::20c:42ff:fe5e:c2dc > ff02::12: VRRPv3, Advertisement, vrid 46, prio 197, intvl 1000cs, length 88
  139  2014-03-05 21:59:29.961257 IP 10.0.0.97 > 224.0.0.18: VRRPv2, Advertisement, vrid 43, prio 197, authtype none, intvl 10s, length 20
  140  2014-03-05 21:59:29.961318 IP 10.0.0.97 > 224.0.0.18: VRRPv2, Advertisement, vrid 42, prio 197, authtype simple, intvl 10s, length 28
  141  2014-03-05 21:59:32.013287 IP6 fe80::20c:42ff:fe5e:c2dc > ff02::12: VRRPv3, Advertisement, vrid 45, prio 197, intvl 1000cs, length 40
  142  2014-03-05 21:59:32.023734 IP 10.0.0.97 > 224.0.0.18: VRRPv3, Advertisement, vrid 44, prio 197, intvl 1000cs, length 16
  143  2014-03-05 21:59:32.033779 IP6 fe80::20c:42ff:fe5e:c2dc > ff02::12: VRRPv3, Advertisement, vrid 46, prio 197, intvl 1000cs, length 88
  144  2014-03-05 21:59:39.971275 IP 10.0.0.97 > 224.0.0.18: VRRPv2, Advertisement, vrid 42, prio 197, authtype simple, intvl 10s, length 28
  145  2014-03-05 21:59:39.971336 IP 10.0.0.97 > 224.0.0.18: VRRPv2, Advertisement, vrid 43, prio 197, authtype none, intvl 10s, length 20
  146  2014-03-05 21:59:42.013484 IP6 fe80::20c:42ff:fe5e:c2dc > ff02::12: VRRPv3, Advertisement, vrid 45, prio 197, intvl 1000cs, length 40
  147  2014-03-05 21:59:42.023603 IP 10.0.0.97 > 224.0.0.18: VRRPv3, Advertisement, vrid 44, prio 197, intvl 1000cs, length 16
  148  2014-03-05 21:59:42.033784 IP6 fe80::20c:42ff:fe5e:c2dc > ff02::12: VRRPv3, Advertisement, vrid 46, prio 197, intvl 1000cs, length 88
  149  2014-03-05 21:59:49.981283 IP 10.0.0.97 > 224.0.0.18: VRRPv2, Advertisement, vrid 43, prio 197, authtype none, intvl 10s, length 20
  150  2014-03-05 21:59:49.981343 IP 10.0.0.97 > 224.0.0.18: VRRPv2, Advertisement, vrid 42, prio 197, authtype simple, intvl 10s, length 28
  151  2014-03-05 21:59:52.013458 IP6 fe80::20c:42ff:fe5e:c2dc > ff02::12: VRRPv3, Advertisement, vrid 45, prio 197, intvl 1000cs, length 40
  152  2014-03-05 21:59:52.023620 IP 10.0.0.97 > 224.0.0.18: VRRPv3, Advertisement, vrid 44, prio 197, intvl 1000cs, length 16
  153  2014-03-05 21:59:52.033729 IP6 fe80::20c:42ff:fe5e:c2dc > ff02::12: VRRPv3, Advertisement, vrid 46, prio 197, intvl 1000cs, length 88
  154  2014-03-05 21:59:59.991224 IP 10.0.0.97 > 224.0.0.18: VRRPv2, Advertisement, vrid 42, prio 197, authtype simple, intvl 10s, length 28
  155  2014-03-05 21:59:59.991284 IP 10.0.0.97 > 224.0.0.18: VRRPv2, Advertisement, vrid 43, prio 197, authtype none, intvl 10s, length 20
  156  2014-03-05 22:00:02.013448 IP6 fe80::20c:42ff:fe5e:c2dc > ff02::12: VRRPv3, Advertisement, vrid 45, prio 197, intvl 1000cs, length 40
  157  2014-03-05 22:00:02.023620 IP 10.0.0.97 > 224.0.0.18: VRRPv3, Advertisement, vrid 44, prio 197, intvl 1000cs, length 16
  158  2014-03-05 22:00:02.033735 IP6 fe80::20c:42ff:fe5e:c2dc > ff02::12: VRRPv3, Advertisement, vrid 46, prio 197, intvl 1000cs, length 88
  159  2014-03-05 22:00:10.001302 IP 10.0.0.97 > 224.0.0.18: VRRPv2, Advertisement, vrid 43, prio 197, authtype none, intvl 10s, length 20
  160  2014-03-05 22:00:10.001364 IP 10.0.0.97 > 224.0.0.18: VRRPv2, Advertisement, vrid 42, prio 197, authtype simple, intvl 10s, length 28
  161  2014-03-05 22:00:12.013443 IP6 fe80::20c:42ff:fe5e:c2dc > ff02::12: VRRPv3, Advertisement, vrid 45, prio 197, intvl 1000cs, length 40
  162  2014-03-05 22:00:12.023585 IP 10.0.0.97 > 224.0.0.18: VRRPv3, Advertisement, vrid 44, prio 197, intvl 1000cs, length 16
  163  2014-03-05 22:00:12.033752 IP6 fe80::20c:42ff:fe5e:c2dc > ff02::12: VRRPv3, Advertisement, vrid 46, prio 197, intvl 1000cs, length 88
  164  2014-03-05 22:00:20.011269 IP 10.0.0.97 > 224.0.0.18: VRRPv2, Advertisement, vrid 42, prio 197, authtype simple, intvl 10s, length 28
  165  2014-03-05 22:00:20.011328 IP 10.0.0.97 > 224.0.0.18: VRRPv2, Advertisement, vrid 43, prio 197, authtype none, intvl 10s, length 20
