    1  2017-10-07 17:25:19.066204 IP (tos 0x0, ttl 64, id 32393, offset 0, flags [DF], proto TCP (6), length 60)
    10.0.2.15.44188 > 192.0.47.59.43: Flags [S], cksum 0xfb78 (incorrect -> 0xcc94), seq 2239453442, win 29200, options [mss 1460,sackOK,TS val 2943013729 ecr 0,nop,wscale 6], length 0
    2  2017-10-07 17:25:19.183009 IP (tos 0x0, ttl 64, id 18525, offset 0, flags [none], proto TCP (6), length 44)
    192.0.47.59.43 > 10.0.2.15.44188: Flags [S.], cksum 0xb2ed (correct), seq 9920001, ack 2239453443, win 65535, options [mss 1460], length 0
    3  2017-10-07 17:25:19.183243 IP (tos 0x0, ttl 64, id 32394, offset 0, flags [DF], proto TCP (6), length 40)
    10.0.2.15.44188 > 192.0.47.59.43: Flags [.], cksum 0xfb64 (incorrect -> 0x589a), ack 1, win 29200, length 0
    4  2017-10-07 17:25:19.183706 IP (tos 0x0, ttl 64, id 32395, offset 0, flags [DF], proto TCP (6), length 53)
    10.0.2.15.44188 > 192.0.47.59.43: Flags [P.], cksum 0xfb71 (incorrect -> 0xe187), seq 1:14, ack 1, win 29200, length 13: WHOIS, length: 13
	example.com
    5  2017-10-07 17:25:19.183927 IP (tos 0x0, ttl 64, id 18526, offset 0, flags [none], proto TCP (6), length 40)
    192.0.47.59.43 > 10.0.2.15.44188: Flags [.], cksum 0xca9d (correct), ack 14, win 65535, length 0
    6  2017-10-07 17:25:19.303926 IP (tos 0x0, ttl 64, id 18527, offset 0, flags [none], proto TCP (6), length 273)
    192.0.47.59.43 > 10.0.2.15.44188: Flags [P.], cksum 0x4a0c (correct), seq 1:234, ack 14, win 65535, length 233: WHOIS, length: 233
	% IANA WHOIS server
	% for more information on IANA, visit http://www.iana.org
	% This query returned 1 object
	
	domain:       EXAMPLE.COM
	
	organisation: Internet Assigned Numbers Authority
	
	created:      1992-01-01
	source:       IANA
	
    7  2017-10-07 17:25:19.304440 IP (tos 0x0, ttl 64, id 32396, offset 0, flags [DF], proto TCP (6), length 40)
    10.0.2.15.44188 > 192.0.47.59.43: Flags [.], cksum 0xfb64 (incorrect -> 0x5474), ack 234, win 30016, length 0
    8  2017-10-07 17:25:19.304752 IP (tos 0x0, ttl 64, id 18528, offset 0, flags [none], proto TCP (6), length 40)
    192.0.47.59.43 > 10.0.2.15.44188: Flags [F.], cksum 0xc9b3 (correct), seq 234, ack 14, win 65535, length 0
    9  2017-10-07 17:25:19.346962 IP (tos 0x0, ttl 64, id 32397, offset 0, flags [DF], proto TCP (6), length 40)
    10.0.2.15.44188 > 192.0.47.59.43: Flags [.], cksum 0xfb64 (incorrect -> 0x5473), ack 235, win 30016, length 0
   10  2017-10-07 17:25:19.368018 IP (tos 0x0, ttl 64, id 32398, offset 0, flags [DF], proto TCP (6), length 40)
    10.0.2.15.44188 > 192.0.47.59.43: Flags [F.], cksum 0xfb64 (incorrect -> 0x5472), seq 14, ack 235, win 30016, length 0
   11  2017-10-07 17:25:19.369269 IP (tos 0x0, ttl 64, id 18529, offset 0, flags [none], proto TCP (6), length 40)
    192.0.47.59.43 > 10.0.2.15.44188: Flags [.], cksum 0xc9b2 (correct), ack 15, win 65535, length 0
