    1  17:25:19.066204 IP 10.0.2.15.44188 > 192.0.47.59.43: Flags [S], seq 2239453442, win 29200, options [mss 1460,sackOK,TS val 2943013729 ecr 0,nop,wscale 6], length 0
    2  17:25:19.183009 IP 192.0.47.59.43 > 10.0.2.15.44188: Flags [S.], seq 9920001, ack 2239453443, win 65535, options [mss 1460], length 0
    3  17:25:19.183243 IP 10.0.2.15.44188 > 192.0.47.59.43: Flags [.], ack 1, win 29200, length 0
    4  17:25:19.183706 IP 10.0.2.15.44188 > 192.0.47.59.43: Flags [P.], seq 1:14, ack 1, win 29200, length 13: WHOIS: example.com
    5  17:25:19.183927 IP 192.0.47.59.43 > 10.0.2.15.44188: Flags [.], ack 14, win 65535, length 0
    6  17:25:19.303926 IP 192.0.47.59.43 > 10.0.2.15.44188: Flags [P.], seq 1:234, ack 14, win 65535, length 233: WHOIS: % IANA WHOIS server
    7  17:25:19.304440 IP 10.0.2.15.44188 > 192.0.47.59.43: Flags [.], ack 234, win 30016, length 0
    8  17:25:19.304752 IP 192.0.47.59.43 > 10.0.2.15.44188: Flags [F.], seq 234, ack 14, win 65535, length 0
    9  17:25:19.346962 IP 10.0.2.15.44188 > 192.0.47.59.43: Flags [.], ack 235, win 30016, length 0
   10  17:25:19.368018 IP 10.0.2.15.44188 > 192.0.47.59.43: Flags [F.], seq 14, ack 235, win 30016, length 0
   11  17:25:19.369269 IP 192.0.47.59.43 > 10.0.2.15.44188: Flags [.], ack 15, win 65535, length 0
